,tweet-id,timestamp,likes,replies,retweets,Bug_report,text
766,1.09755353455857e+18,2019-02-18 17:48:48,0,0,0,1,atuser hi i am having a problem with my whatsapi can not reply to anyone is message just get the circle going round and round then it stop it use to work fine i have installed it countless ti ames and have not been blocked any suggestion what is wrong with it
767,1.12788175055671e+18,2019-05-13 10:22:19,0,0,0,1,atuser atuser atuser my business whatsit unable to send message and status i am facing this issue since month i even tried to contact you over mail but could not receive satisfactory reply sharing video of my whatsit internet working fine url
768,1.09591937069645e+18,2019-02-14 05:35:13,4,0,1,0,can not wait to get the snapshot dm tomorrow
769,1.12225189761901e+18,2019-04-27 21:31:17,0,0,0,0,so i am on snapshot i see an article about how bad the camp w were for illegal i migrant i have only one thing to say the grass is not always greener on the other side maybe if you did not try to sneak over url
770,1.10592920659942e+18,2019-03-13 20:30:44,0,0,0,1,atuser is broken can not post like or comment
771,1.1001175586262e+18,2019-02-25 19:37:19,0,0,0,1,how to fix microsoft outlook exchange server error can not send email on phone i found the solution its a three step process first go to your own online account and check how many device you have authorized for url
772,1.109329566324e+18,2019-03-23 05:42:33,6257,113,450,0,show tonight at midnight and come get a dance atuser and make it rain on mead my private snapshot on url to see all the trouble i get into tonight url
773,1.09814091483132e+18,2019-02-20 08:42:51,1,0,0,1,atuser atuser atuser goole may want to check this out and fix it on their goole map
774,1.12001956335612e+18,2019-04-21 17:40:47,0,0,0,1,atuser i am unable to post anything on my face-on account i am also unable to share any post as well i am also unable to react on other is post please help to resolve my account issue
775,1.10739396927157e+18,2019-03-17 21:31:11,0,0,0,0,i am so mad with snapshot support they decline my request to get my snapshot streak back i do not know if i delete the application your live a bad score
776,1.09551896210278e+18,2019-02-13 03:04:08,0,0,0,1,atuser i am having trouble acting face-on on my why
778,1.10836445074947e+18,2019-03-20 13:47:32,0,1,0,0,i had the same problem until i discovered that outlook on android really really want to be in the sandboxed work profile
781,1.11481360922011e+18,2019-04-07 08:54:11,0,1,0,1,atuser there is a grammatical error in map in german before you have to turn left it will say in kiss meter der richter fahrstreifen bentsen when it is actually den somehow it is correct as you have to turn then it say den richter fahrstreifen bentsen
782,1.12449340087356e+18,2019-05-04 01:58:13,0,0,0,1,atuser have a problem with my account i have sent my code by mistake to a random person and they locked me out from my account by activating a two factor validation can you help me change the email that was randomly associated to my account
783,1.12844398500384e+18,2019-05-14 23:36:26,0,0,0,1,atuser hello therecryingmy phone started to hang on after a whatsit call exactly after second remembered the morning news and updated the application did not resolverestarted the phoneisue is resolvedbut is the data shared over it now safe or should i get new credit card
785,1.11742873664584e+18,2019-04-14 14:05:46,0,1,0,0,she always does this and its starting to piss me off because every are we make plan she cancel last minute like i already got ready for her and most of the ti are i am going to see on snapshot that she hanging out with her stupid girlfriend when she said she couldnt hang out
787,1.13225357211511e+18,2019-05-25 11:54:22,0,0,0,0,atuser you say one thing and do another was bad enough but now you will not remove an obviously doctored video i am done ti are for you to go the way of space url
790,1.09528363540043e+18,2019-02-12 11:29:02,9,0,1,0,i broke up with this girl because she has been sending me snapshot filtered picture the day i got to meet her she has tribal mark and a big scar on her face mean i got irritated i had to check out my phone to compare her picture with her real face
791,1.09301102376491e+18,2019-02-06 04:58:29,0,0,0,0,i swear if atuser brings bad barbie back on the rundown on snapshot one more ti are i am going to quit watching quit promoting a disgusting disrespectful piece of trash
793,1.12901154926222e+18,2019-05-16 13:11:44,0,0,0,1,atuser fix your application i am trying to show off my girl
794,1.1059318213202e+18,2019-03-13 20:41:08,0,0,0,1,atuser what the fuck is going on with instagram and whatsit not all my friend have an phone so we can use i average so please fix this fucking mess right now
795,1.12804245604026e+18,2019-05-13 21:00:54,0,0,0,1,atuser my messenger application say i have message face-on application say i have but i actually have please sort this kind basic problem out before merging whatsit or you know just do not merge them
796,1.1030560323167e+18,2019-03-05 22:13:46,1,2,0,1,snapshot is keeping beta tester stuck in the beta program with no way to leave meanwhile the beta application is straight up just broken
798,1.11489059471377e+18,2019-04-07 14:00:06,1,0,0,0,eh i can relate with the marginal outlook its misleading and seems somewhat distant to the general public but as far the change weather is fluid and change quickly i do not see a problem with outlook change throughout the day
799,1.11704753721776e+18,2019-04-13 12:51:01,2,0,0,0,whenever i am in a bad mood i delete snapshot for the day n then download after like hour n i do not know what it is i hope to achieve but it give me a sense of power and control
801,1.1330912202831e+18,2019-05-27 19:22:53,31,2,0,0,before all this lewis and i never had an issue with eachother we were friend on snapshot in which he face revealed to me and shown a clear gratitude when i dint show anyone
802,1.09879427291934e+18,2019-02-22 03:59:03,3,1,0,0,that is not even my problem my problem is that a lot of them are wasting the phone snapshot is their pri mary application there are few of them who really get to explore the photo and video recording prowess of the camera and much le people who get to max out the other spec
803,1.1219151984603e+18,2019-04-26 23:13:22,1,1,0,0,also what a ti are to be alive where i made myself feel bad for posting a video saying my skin is my greatest resort treasure and apologized on my own snapshot for sounding vain laugh out loud
805,1.13405336347188e+18,2019-05-30 11:06:06,0,0,0,1,hey whatsit my account has an issue that there is no option to save other people is profile picture
806,1.1279870444484e+18,2019-05-13 17:20:43,2,0,0,0,snapshot want me to care about random white people so bad
807,1.11041495250493e+18,2019-03-26 05:35:29,0,0,0,1,atuser atuser what is problem with you guy can not you restore an account of a person who is fighting against wrong happening if it delayed more and atuser appeal u to delete face-on account we will not even give a second thought before deleting our acountsfakebokurl
808,1.1055313837353e+18,2019-03-12 18:09:56,0,0,0,1,atuser atuser atuser i have been sweeting to atuser since day that i am not being able to unload any new post on my instal would atuser the post get deleted i immediately its affecting my work please help as soon as possible whats wrong
809,1.10342775276459e+18,2019-03-06 22:50:51,11,0,2,0,i thought sprayontaning bed tan look bad now there a trend to use snapshot lens to give you a tan and they look horrendous
814,1.09927848980541e+18,2019-02-23 12:03:10,0,1,0,1,atuser messenger team i have trouble sending message to people from yesterday please help me thanks messenger team
817,1.10589014297428e+18,2019-03-13 17:55:31,0,0,0,1,please fix it i havent access in hour there a big problem for everybody fix it as soon as possible
818,1.11383132527282e+18,2019-04-04 15:50:56,0,1,0,1,it might actually be deliberately bad to get people to buy an apple phone i know that is what happened with snapshot the meme of android phone taking bad picture came from android snapshot compressing photo more than the io version
821,1.09350391994952e+18,2019-02-07 13:37:05,1,1,0,1,the camera on snapshot is horrible super bad if you zoom at all i think the actual camera is fine though compared to the i dint have the kiss
822,1.1060330056997e+18,2019-03-14 03:23:12,2,0,1,1,this is snapshot ti are to fix their layout and shine
823,1.11752375627093e+18,2019-04-14 20:23:20,0,2,0,1,atuser atuser your update made sending multiple saved picture at once a pain you scroll down tap one and it autoscrols to the top then you have to scroll again to tap the others you can bypass this with one photo by tapping and holding to send it fix it maybe
825,1.12506317782016e+18,2019-05-05 15:42:18,155,3,36,1,snapshot you got to fix this shit i am so tired of seeing the same people story over n over again
826,1.09895004726432e+18,2019-02-22 14:18:03,0,0,0,0,pope francis is plan to deal with abuser in the clergy is shameful people have had high hope for a progressive outlook but this issue prof that his job is first and foremost to protect the church that mean url
830,1.12066695614588e+18,2019-04-23 12:33:17,1,0,0,1,i hate it when thing die then work for no reason outlook just refused to open past the processing screen safe start no error reported closed and reopened normally and it work fine great it work but why was it broken and is it going to be broken again tomorrow
832,1.09539450936458e+18,2019-02-12 18:49:37,10,1,0,1,wait is snapshot not working nobody is talking to me guess mine always broken then atuser
833,1.11572734227662e+18,2019-04-09 21:25:02,4,0,0,0,not even hour ago i was prattling on to myself about having a positive outlook on life and hows its really not that bad and now i am sitting sobbing listening to one direction sahara talk at moving backwards
835,1.11691316984941e+18,2019-04-13 03:57:05,0,0,1,1,atuser my account has been disabled without any issue and i were logged in by using my phone number but i can not get anything by using forgot password please do something that was my personal face-on account face-on acountdisabled
838,1.12876190942189e+18,2019-05-15 20:39:45,0,0,0,0,atuser you create the social medium mess and zuckerberg is not man enough to go answer for the issue and fake world you createdman up and quit being a coward to take the but not man enough to take the heathen a year since i dumped your sitesthank god
839,1.11609037706748e+18,2019-04-10 21:27:36,0,1,0,0,they are broke in the same sense that goglemaps is broke it doe generate its own revenue but it is used for data analysis for advertiser so if you goole using the same email you use on map they know where and what you are goggling and therefore what to sell you
841,1.09768874993938e+18,2019-02-19 02:46:06,0,0,0,1,hey face-on i am not use my face-on account locked and your factor team very bad pipit pit email code why help me
843,1.11390742544114e+18,2019-04-04 20:53:20,0,1,0,1,atuser if i use goole assistant in goole map to send my eta it will not respond to my answer to which messaging service to use it just keep asking tried on multiple phone bug goole
844,1.12806666574745e+18,2019-05-13 22:37:06,3,0,0,0,my snapshot memory from a year ago today was of my speeding ticket that i finally paid and now its a year later and i am fixing to pay for another one old habit die hard they say
846,1.09533856115752e+18,2019-02-12 15:07:18,1,0,0,0,as what is seen globally when one nation take on too many the citizen of said nation begin to suffer regardless of any ignorant outlook those whom are not affected by homelessness or poverty many fail to grasp or will never be able to comprehend until faced with the problem
847,1.1087465502582e+18,2019-03-21 15:05:51,0,1,0,1,atuser atuser you guy honestly have the shiite way of dealing with snapshot account its the most annoying thing so many user have the same ongoing issue and you guy choose not to help your user find alternative mean absolutely freaking ridiculous
850,1.10435838776308e+18,2019-03-09 12:28:52,2,0,0,0,madam panama my humble is request is that the govt statement regarding this issue has to be very measured one wrong word and it may completely change the outlook of this govt it would be like handing over the baton to the opposition
851,1.12552767130644e+18,2019-05-06 22:28:02,0,0,0,1,atuser fix it now please fix it i am tired i do not want to watch snap from the beginning no more
852,1.10591422437782e+18,2019-03-13 19:31:12,0,0,0,1,why does my snapshot freeze whenever i try to message daisy rude
854,1.12581164164649e+18,2019-05-07 17:16:26,0,0,0,1,they will not fix it they been saying the sane shit to everyone some people been waiting a dam week and no help
855,1.10771525828888e+18,2019-03-18 18:47:52,0,0,0,0,atuser i am grateful for your engineer who are working on my issue please send them love for me
858,1.09728505085535e+18,2019-02-18 00:01:57,1,0,0,0,the best feature for the new web outlook email environment is dark mode to eli laminate the horrible everlasting excessive whiteness of the standard layout url
859,1.10452970525923e+18,2019-03-09 23:49:37,1,1,0,0,oh i did on face-on instagram and snapshot i forgot to post it on here my bad
861,1.1170500087408e+18,2019-04-13 13:00:50,2,0,1,0,were on our way to albany for empire state comic con no thrashing this ti are around though were just coming to hang out and enjoy the convention if your there be sure to say hi to u if your not there follow our shenanigan on snapshot at stboficial stboficialurl
863,1.09207865349051e+18,2019-02-03 15:13:35,72,4,23,0,my little cousin got in trouble for saying shit to her friend on snapshot and the family gm turned into trial url
865,1.10533533215155e+18,2019-03-12 05:10:53,0,0,0,1,atuser my post in face-on marketplace is not getting view what is reason behind this if any mistake is done by me please let me know please solve my issue my account would is rahulydatuser
867,1.09303925571314e+18,2019-02-06 06:50:40,0,0,0,0,bad black need to commercialized her snapshot account
868,1.12787621480542e+18,2019-05-13 10:00:19,18,10,1,1,this filter is broken it does not know what to do with facial hair snapshot you can not handle the beard i have just realised that this is the first ti are any of you have seen me laugh out loud bask in the beauty of sexy the mighty dwarf warrior princess url
869,1.10590875116757e+18,2019-03-13 19:09:27,23,5,0,1,i have this problem too i am from romania
873,1.12874180147143e+18,2019-05-15 19:19:51,0,0,0,1,atuser is there anyone who can help me fix a problem with outlook on my phone having been passed around depts now and being told i can not actually speak to anyone starting to think you do not really care about the end user
877,1.12524336086279e+18,2019-05-06 03:38:17,1,1,0,1,having the same issue unloaded and would and you guy still havent helped
878,1.11802904428358e+18,2019-04-16 05:51:10,0,0,0,1,atuser was told my page was flagged for linking to some webster i have noi would what it is was given a link to appeal but your link doe work how do i correct this flag on my page pretty frustrating that your help center doe clearly help with this
879,1.09801780031098e+18,2019-02-20 00:33:38,0,0,0,0,i wish i was you are dog i saw in you are snapchatel hi am i am jealous he get to hang out with you are as all day
880,1.10516539965668e+18,2019-03-11 17:55:38,0,0,0,1,atuser prof everyday it is a broken platform pitiful how people still use it url
882,1.11279208648565e+18,2019-04-01 19:01:22,0,0,0,0,atuser so under the subscription page we have all those story for instance bad tattoo and oddly satisfying etc how do we send our own snap to those story like everyone else i am so confused
883,1.10516605704251e+18,2019-03-11 17:58:15,4,0,1,0,if your a snapshot snapchatquen or a instagramquen please do not bother me with your sex ad i am not up for grab i am married i am not looking for an easy sex fix in exchange for you trying to get me to give you money warning i will block you off my page url
884,1.10591042738764e+18,2019-03-13 19:16:07,0,0,0,1,atuser please fix it as soon as possible
885,1.09651743429353e+18,2019-02-15 21:11:43,1,0,0,0,goglemybusines new functionality and tip for responding to negative review not bad it was pretty frustrating to do everything only from the mobile perspective before now business can respond to review when viewing their listing in goglemaps on desktop too
886,1.10351871202659e+18,2019-03-07 04:52:17,4,0,0,1,same issue with outlook or my inability to fix it i print my conference schedule before leaving town for it url
888,1.10591282181916e+18,2019-03-13 19:25:38,0,0,0,1,my face-on has been down for hour now keep telling me working on the problem come on people i have stuff to do on my game and i am sure i will not get credit or extra ti are since i can not get into my family farm game for your problemjust fix it now already
890,1.11573305261163e+18,2019-04-09 21:47:43,0,0,0,0,i just have a bad feeling more bad shit is about to happen or going to continue to happen but i am gon na take my nigra blaise advice and keep my positive outlook i have to keep it together for my sanity sake
891,1.10593747321178e+18,2019-03-13 21:03:35,0,0,0,1,please fix it i miss my instagram
892,1.1059831288233e+18,2019-03-14 00:05:00,0,0,0,0,unless people business are affected i do not see why everybody is panicking social medium addiction is awful text or ring your friend instead
893,1.09632449713166e+18,2019-02-15 08:25:03,5,0,0,0,i often post about negative effect of social medium so for a change here is a positive story about family who rescued a mother and daughter from a car crash when satnav and emergency service failed to locate them they succeeded using snapshot map read url
894,1.10450284841761e+18,2019-03-09 22:02:54,1,0,0,0,i really hate this new era of technology since snapshot where people think they can film whoever they want without consent like its not funny at all even if its your friend on snap understand that some want privacy if you want to expose your life thats your problem
897,1.12873157519187e+18,2019-05-15 18:39:13,0,0,0,1,atuser hey my face-on group with k member got deleted and i believe we have not broke any community standard and i have filed complaint against this action looking forward
898,1.10591004262313e+18,2019-03-13 19:14:35,84,1,1,1,whats is not working fix it jez
899,1.11430418926013e+18,2019-04-05 23:09:56,1,0,0,1,can you fix your dual si am phone so they work with atuser again turning off mobile data on second si am make unable to connect work since the last android patch not the right hawes well i do not buy enterprise tesco equipment either but you wrote to me
900,1.11631760718601e+18,2019-04-11 12:30:32,0,5,0,1,help i use outlook for my work email and i used to be able to search for email at the top and it displayed everything related to that search now it only show email from march of last year its frustrating as heli have goggled and can not resolve anyone url
901,1.09394906346728e+18,2019-02-08 19:05:55,1,1,0,0,doll you are lovely i am here inventing new way to call my sense o humor bad and you just come and say it is special that is such a great outlook to have
902,1.10599974665157e+18,2019-03-14 01:11:02,0,0,0,1,atuser fix ya self i am bored
903,1.11908960757487e+18,2019-04-19 04:05:28,1,0,0,0,i feel so bad for people that go to the kop area and think they are served fine dining food then take instagram or snapshot picture thinking they are eating fresh you guy should see the walking dirty per addict cooking your food all fucked up
906,1.09798346841023e+18,2019-02-19 22:17:13,1,0,0,0,do not accept bad day you have the right to reject them accept his will for you with thanksgiving it will change your whole outlook url
907,1.11860826889132e+18,2019-04-17 20:12:48,2,0,0,0,snapshot story are better than reality tv i am addicted to watching people make bad decision you couldnt make up some of the stuff have seen lately
909,1.10838642718694e+18,2019-03-20 15:14:51,0,1,0,1,atuser why are you not allowing me to add admits to my page i have tried multiple way this is an issue may turn my hair gray and making it difficult to work in your platform atuser can you help me
912,1.10840022374597e+18,2019-03-20 16:09:41,0,0,0,1,atuser do they plan on fixing the front facing camera for s user or should we plan on this staying like it is there anyway for this to be fixed
913,1.12669741566946e+18,2019-05-10 03:56:11,1,0,0,0,atuser atuser atuser atuser and here the picture of the face-on employehackerterorist making death threat to people whose page he steal and their follower he target specifically minority group like the disabled fail notmybanerurl
914,1.13116739428456e+18,2019-05-22 11:58:17,4,0,0,0,laugh my as off i hate eating and having proper table manner bc i want to be able to lose my shit with my brother at the dinner table and not get in trouble while we use snapshot filter on my mom
916,1.1059971134129e+18,2019-03-14 01:00:34,0,0,0,1,atuser when are you guy going to resolve this problem
917,1.12448552550575e+18,2019-05-04 01:26:55,0,1,0,0,atuser hello i would like to log out of the application and log back in again if there is a problem with that
918,1.1141781508236e+18,2019-04-05 14:49:06,10,1,0,0,one of the volunteer here broke her phone and keep asking to use mine to keep her snap streak going and called me old when i told her i do not use snapshot
919,1.11577982927674e+18,2019-04-10 00:53:36,6,1,1,1,fix it let u use our account before we die url
920,1.12345370762516e+18,2019-05-01 05:06:51,0,0,0,0,the problem int ordering food its student using their phone during class if teacher are going to excuse textgoglefaceti amesnapchatinstagram you might as well let them order food
921,1.11284614163961e+18,2019-04-01 22:36:10,1,0,0,0,am the way you phrase thing can change your whole perspective on a situation i am only having a bad day i am only in this situation for a little while speaking positively to yourself will give you a more positive outlook bepositiveurl
922,1.12737549285482e+18,2019-05-12 00:50:37,7,0,7,0,yeah i jacked off to myself as a female on snapshot you got a problem with that library
924,1.12927472949024e+18,2019-05-17 06:37:31,1,1,0,0,at this point i am knowing whats going on but i had to dig a little deeper and thats when i came up on site she was on shanty wanted a picture of me bad and i paint send not one holmes no sir i am protected and i died a little deeper and found the snapshot url
925,1.13272013525973e+18,2019-05-26 18:48:19,1,0,0,0,not gon na lie feel this hard its good to look on one self though and adjust to see how bad it is not just for you but your outlook on thing
926,1.13304701429867e+18,2019-05-27 16:27:13,4,0,3,0,upcoming sahel rainy season outlook from atuser senegal slated for a late start could be trouble for herder as they return from seasonal migration to area with no pasture url
927,1.10325174091956e+18,2019-03-06 11:11:27,1,0,0,0,told this girl i am going to make a premium snapshot for people with deep rooted issue and therapeutic session she told me she do not need no man to fix her problem and blocked me shaking my head its only a one ti are fee of
928,1.11713365513723e+18,2019-04-13 18:33:13,0,1,0,0,that is happening to me too my friend moved and we have not really spoken i see hi am a lot with other friend on snapshot and when i ask hi am if he want is to hang out he say he bashir happens i guess
929,1.09281353133296e+18,2019-02-05 15:53:44,1,0,0,0,if a city elected official can not stay awake thru the first hour of an economic outlook session to help budget plus well ill give the benefit of doubt proxy had a bad night right
930,1.12106432265275e+18,2019-04-24 14:52:17,0,0,0,1,atuser your update has as usual made face-on more difficult to use glitch freezing and error message useless ad from place across the country political ad religious ad etc even if i hide them they still show up try fixing thing instead of ruining them
931,1.09168704723088e+18,2019-02-02 13:17:29,2,1,0,0,yup and both side need to be respected it feel like the general outlook nowadays is profesionalchoice good profesionalife bad but there is no good and bad in moral dilemma the answer lie solely with the individual
932,1.12393758991493e+18,2019-05-02 13:09:37,0,0,0,1,i could not log in to my account because the message was temporarily closed for your blocked week and i am going to have more than a week of trouble over day
934,1.10599159817575e+18,2019-03-14 00:38:39,0,0,0,1,why does snapshot make my camera have such bad quality compared to taking a normal picture
935,1.11365136663787e+18,2019-04-04 03:55:51,0,0,0,0,i legit just started cry after seeing a snapshot video of grayson dancing through a crowd at coach last year i i want to go to a music festival with the twin so bad
936,1.1109220941397e+18,2019-03-27 15:10:41,0,0,0,1,best eroroftheday award go to microsoft outlook url
937,1.10591971249877e+18,2019-03-13 19:53:01,0,0,0,1,hi i still can not post picture so please fix this as soon as possible thanks face-on
938,1.10487445313203e+18,2019-03-10 22:39:31,2,0,2,0,one of the best thing about snapshot is that when you send someone story to someone else it doe tell them bc if it didi would be in a lot of trouble
939,1.116469560948e+18,2019-04-11 22:34:20,8,1,1,1,ive been deleted close to ti ames over the year on ig alone i actually just started my latest ig not too long ago but my snapshot was just deleted i lost my twitter verification after they suspended me for a tweet i was rtd in so frustrating
940,1.10776639640095e+18,2019-03-18 22:11:04,1,0,0,0,just playing with snapshot filter i need friend to hang out with snapshot lonely bored whatiswrongwithme tired san clemente california url
