,tweet-id,timestamp,likes,replies,retweets,Bug_report,text
0,1.10593668411638e+18,2019-03-13 21:00:27,0,0,0,1,atuser error code are we hacked facebokdown facebokisdead
1,1.12401192071199e+18,2019-05-02 18:04:59,0,0,0,0,atuser would love to invite you atuser to attend their cup final this weekend they will present plenty of opportunity for photo with all playing staff drakecurse p advise avoiding any game on the english south coast this weekend the bank holiday weather outlook is bad url
2,1.10893965565368e+18,2019-03-22 03:53:11,27,0,2,0,bill bayne on his outlook for the second we got ta stay solid in what we do we just got to keep fighting the fight and hang in there pacersurl
3,1.11782604160557e+18,2019-04-15 16:24:31,0,0,0,1,it is funny how m outlook would not show you the number of task on the bottom bar i mean seriously that is why it get this bad i ended up selecting all pasting in vi am to find out the number
4,1.09306004454188e+18,2019-02-06 08:13:17,0,0,0,0,url the price of u crude continues to rise and the outlook is still constructive on tight supply and concern about venezuelan output how is this affecting the market find out url ot url
5,1.1101979550034e+18,2019-03-25 15:13:13,0,0,0,1,atuser keep making my phone crash does anyone know how to fix it
6,1.10589261117527e+18,2019-03-13 18:05:19,0,0,0,1,atuser just tried using the wouldentify page to get a code to reset my password got the code entered it got you do not have any valid code right now tried again got sorry there a problem whats going on
7,1.10593633286452e+18,2019-03-13 20:59:03,0,0,0,1,fix it been down all day i can not post
8,1.10933702165323e+18,2019-03-23 06:12:11,4,0,0,1,some guy on snapshot said he surpassed multitasking and moved on to tripletaskingand i just can not fix that level of stupid ya
9,1.09849450376847e+18,2019-02-21 08:07:53,0,0,0,1,also these photo show the error in my locationploted in red that i tried to correct like hundred of ti amend still the same sogeti ames the blue dot even move further url
10,1.13090909527858e+18,2019-05-21 18:51:54,0,0,0,1,breaking real news anonymous source close to mcgann are quoted as giving the former wh attorney outlook on the entire witchhunt obstruction issue unidentifiable source said mcgann defies subpoena for test among face contempt vote url
12,1.13136315417962e+18,2019-05-23 00:56:10,11,0,1,0,i am still frustrated he seemingly got away score from this did not he even say he would be taking a break but he is back up on twitter and snapshot something happened to prompt everything and now it is back under the bed
14,1.120951222071e+18,2019-04-24 07:22:52,0,1,0,1,i have access to my email and i have proof that i had disabled this dumb method so i really do not see a problem from my side definitely a dysfunction of your system
15,1.12730874298958e+18,2019-05-11 20:25:23,2,2,0,1,these new snapshot filter are going to get someone catfish so bad
16,1.10590478862823e+18,2019-03-13 18:53:42,0,0,0,1,atuser please fix instagram
18,1.10910388363538e+18,2019-03-22 14:45:46,1,1,0,1,atuser is it possible that their is a bug in the business manager to forecast a campaign when you enter specific audience help
19,1.12140537203043e+18,2019-04-25 13:27:30,1,1,0,1,atuser having issue w my association is face-on business page locked out due to factor authentication set up by former employee phone used is no longer in service reached out to multiple face-on support form no response now rd day of not being able to use our page please help
21,1.11016085995388e+18,2019-03-25 12:45:49,0,1,0,0,hi madeleine what seems to be the trouble
23,1.09176431187622e+18,2019-02-02 18:24:30,0,0,0,0,snapshot memory never fail to show me how hit i really was two year ago thankfulfortheglo
25,1.1218035746553e+18,2019-04-26 15:49:48,1,0,0,0,just a quick little reminder if youse ever known or want to know the power of prayer there an application called url and it has truly made a difference in my outlook on my good and bad day the community here help provide all the hope
26,1.10600503794222e+18,2019-03-14 01:32:04,0,1,0,1,i am still having trouble
27,1.11794410892707e+18,2019-04-16 00:13:40,1,0,0,0,saw someone snapshot story of a pizza and now i want one so bad i will not be able to sleep di
29,1.13012587127523e+18,2019-05-19 14:59:39,1,1,0,1,atuser atuser ya need to fix these fun server i got shit to do and people to contact thank you
30,1.12010109504756e+18,2019-04-21 23:04:46,2,1,0,0,i do not blame doctor for withdrawing into rent seeking life suck and is hard i do think poorly of those that pretend a huge of the profession is not like that though since that outlook int going to fix anything the quoted tweet make me eyebrow pretty hard
31,1.1098760658105e+18,2019-03-24 17:54:09,0,1,0,0,respectfully i disagree with this as a universal premise this depends on the chronic or acute emotional outlook of the individual at the ti are when the issue is being considered ie an opt mist would not tend to assume the worst the way a pest mist would
32,1.10270370397328e+18,2019-03-04 22:53:44,0,0,0,0,democratrun city always seem to have a problem despite city positive outlook on cri are number need report murder and rape soaring in url
33,1.13114829784084e+18,2019-05-22 10:42:24,0,0,0,0,my hairdo is whack bc i think haircut are overpriced if you would just buy my cd or join my premium snapshot we could work together to fix thing
34,1.11164627499291e+18,2019-03-29 15:08:20,13,0,1,0,i may be too broke to buy ariana grande tour ticket but i can afford to watch the concert through people snapshot story
35,1.11275211402607e+18,2019-04-01 16:22:32,0,0,0,0,close the border get real it is all about the wall no national emergency let create one got ta deliver that wall hang the collateral damage trump is outlook only extends to the end of his nose
36,1.1076918495763e+18,2019-03-18 17:14:51,10,0,3,0,hey atuser privateer family got a paper to write snapshot streak to continue or just want to hang out on campus you can do that and help raise money for student scholarship the atuser writeathon take place march atuser atuser url
38,1.10452348043386e+18,2019-03-09 23:24:53,0,0,0,1,it happens everywhere for me its really bad on twitter and snapshot but i do not post to instagram much its to do with the compression i believe as it make it easier on their end to compress the shit out of photo instead of present them the way they actually look
39,1.09319259815456e+18,2019-02-06 17:00:00,0,0,1,0,after losing her son in carla sturdy is working to pas legislation for a third-party tri met crash advisory committee url
41,1.11196796792998e+18,2019-03-30 12:26:37,6,0,0,0,fun game for you to try get really drunk and send out a mass snapshot then realize you have noi would what you sent and try to figure it out at am future james problem
42,1.10607718273932e+18,2019-03-14 06:18:44,0,0,0,0,at least now we know why confused zombie were walking around the street i knew it had to be bad when my neighbor came out and started raking his leaf from last year i was worried his wife died or killed
44,1.10596379865196e+18,2019-03-13 22:48:12,0,0,0,1,atuser fix this as soon as possible i can not log into my ig account anymore and my business page is very i important to me this is ridiculous
45,1.11599754446993e+18,2019-04-10 15:18:43,10,2,0,0,what i love most about the snapshot memory feature is that its an archive of purely my stupidest life moment for example today it reminded me two year ago i broke my foot but continued to run on it
46,1.10600556353473e+18,2019-03-14 01:34:09,0,0,0,1,does that affect the game i play should i log out or stay log in till the problem fixed who let you know when the problem fixed
47,1.1274902054752e+18,2019-05-12 08:26:27,6,0,0,0,to be happy is to be able to disregard bad thought and people from your outlook that life is and should be meaningful siargao island ph reflection travelphotography wanderlust siargao siargaoisland rexivities island-hopping travelgram island travelisloveurl
48,1.13181745807824e+18,2019-05-24 07:01:24,0,0,0,1,my account been hacked can ya reactivate my account please i want this issue resolve its was not me that violated the policy my account got hacked before why can not i get somebody from face-on to help me solve this
49,1.10590335993084e+18,2019-03-13 18:48:02,0,0,0,1,atuser fix what the fuck going on atuser fix what ya got going on too most of all atuser fix what the fuck ya got going on
50,1.10914076951914e+18,2019-03-22 17:12:20,19,5,2,0,i have to say the more forcefully british people react to being called out on this nation is continued colonial outlook even on the left the more determined i am that it is a problem especially for the left
53,1.1253890697883e+18,2019-05-06 13:17:17,2,0,0,1,hey snapshot fix ourself i do not want to see the same person story like ti ames atuser atuser
54,1.10768366385513e+18,2019-03-18 16:42:19,0,2,0,0,i need you to inject some positive outlook into my mention my dude nothing is as bad as we can make it seem
55,1.09389337097873e+18,2019-02-08 15:24:37,0,0,0,0,i know according to atuser the acre does not exist anymore fail url
56,1.12286627068319e+18,2019-04-29 14:12:35,0,0,0,0,i do not know how to console the standard way very well either i just try to change people mood or say something to change the outlook i just do not want people to hurt if there nothing we can fix about the situation we can only fix our attitude about it
57,1.09573473507734e+18,2019-02-13 17:21:33,0,1,0,1,atuser how can i get support help i tried the get help but none of them are regarding my issue and i can not find a contact page
58,1.11984722281893e+18,2019-04-21 06:15:58,3,0,0,0,a picture just popped up in my snapshot memory from year ago let just say it broke my heart because the person in that picture want nothing to do with me now and we will never have that connection again
59,1.1058941750343e+18,2019-03-13 18:11:32,0,0,0,1,wondering how many having this problem are not liberal
60,1.11290190804018e+18,2019-04-02 02:17:46,0,0,0,0,we are looking to i implement a fingerprint ti are card system in the company i was not invited to any of those discussion it is a data beach waiting to happen and it took the it department week to fix my outlook i do not have a lot of confidence right now
61,1.11610752455648e+18,2019-04-10 22:35:44,0,0,0,0,parent all aps are designed to suck u into them atuser streak are a real issue with teen it mi amiss addiction behavior game will constantly notify to play again even though we have not looked at our device for minute application engagement profit makeup
62,1.09125694312406e+18,2019-02-01 08:48:24,0,0,0,1,atuser why does not the auto play video in face-on in the phone while the mobile network is also good please update this problem
63,1.13094040291002e+18,2019-05-21 20:56:18,0,0,0,1,this is not a browser issue as my mobile and another computer with a different browser appear to be having the same problem and window diagnostics say my computer is configured correctly most other site load just fine
64,1.10713932011955e+18,2019-03-17 04:39:18,0,0,0,1,hey atuser who is fucking would was it to remove the select multiple button in memory because i will tell ya that was a bad would okay please put it back
66,1.09962062336875e+18,2019-02-24 10:42:41,0,0,0,1,atuser halo when i double tap on a friend to send them a snap i can not use bitmoij with the friend i am sending my snap too and the friend does have a bitmoij so thats not the problem i have this since the last update
67,1.10592833263655e+18,2019-03-13 20:27:16,0,0,0,1,fix it then your costing people money
68,1.12434123380195e+18,2019-05-03 15:53:34,0,0,0,1,okay atuser you better fix the issue of people having to rematch others story from the beginning before we all fight
71,1.11676543063326e+18,2019-04-12 18:10:01,1,0,0,0,what i want to know is how bad an obsession a celtic fan has when he is following ranger third choice goalkeeper on snapshot url
72,1.09205481350697e+18,2019-02-03 13:38:51,2,0,1,1,hi there i am having so much trouble signing in to my face-on account it keep telling me to enter the login code thats supposed to be generated by the code generator which i do not have access to and i never even get this code and the process has been really annoying
73,1.10559176775007e+18,2019-03-12 22:09:52,3,0,0,1,after over two hour both atuser and word for mac have finally finished downloading on my macbokpro i will never understand why the atuser aps take forever to update for bug fix yet other aps like atuser and atuser take le than two minute to update
74,1.13095850576503e+18,2019-05-21 22:08:14,1,0,0,0,seriously how do you get hired to do them snapshot make up tutorial on beauty wow there so bad
75,1.12996988294105e+18,2019-05-19 04:39:48,0,1,0,0,morning atuser i have a problem with one conversation for like week now one video i tried to send is still not send and it seems like it will not it say sending and the other part of it is waiting but nothing happens so there is a notification a the ti are hate it
76,1.13411168573481e+18,2019-05-30 14:57:51,0,0,0,1,problem has not been solved i use bluecoat for my personal email but it seems like i am not allowed to use outlook as my email client
77,1.12854114930668e+18,2019-05-15 06:02:31,2,0,0,0,i can already see good morning america and other morning show talking about these girl and boy snapshot filter and how some people are catfishing people with them and how its dangerous and horrible and that we need to stop using them old people ruining everything
78,1.10552029906232e+18,2019-03-12 17:25:53,6,1,0,0,so i sent a snapshot this morning to some people showing off my my chemical romance tank top and apparently you could see the outline of my hang down in my underwear for that i apologize i was just trying to prove that emo int dead
80,1.13395070557042e+18,2019-05-30 04:18:10,0,0,0,1,atuser i have deleted my face-on account year ago but yet i am receiving email from you why i do not want any kind of connection to face-on please look into this and fix it for your information email come at that mail would which i had not used to create face-on account
81,1.11808435321986e+18,2019-04-16 09:30:57,0,0,0,1,microsoft has notified affected outlook user of a security breach that allowed hacker access to email account from january to march trendmicro url
82,1.10609016315793e+18,2019-03-14 07:10:19,1,1,0,0,leap forward for themselves something to help them not end up just stagnant with the same habit and same outlook or whatnot that is what i resent we are failing these people who could be doing more with their life and it is frustrating it is not the giving money that irks
83,1.09539464292379e+18,2019-02-12 18:50:08,14,0,0,1,snapshot has to be the most broken application ever i stg
85,1.10693816779666e+18,2019-03-16 15:19:59,0,0,0,1,atuser atuser why is the camera on the phone kiss so bad when i try to use snapshot it look like i have an android i am mad
86,1.12931515716597e+18,2019-05-17 09:18:09,0,1,0,1,atuser aol once again outlook will not connect with aol even when you go into aol security and allow insecure connection this seems to be effecting thousand of aol customer why how am i supposed to pick up my email if outlook and aol keep arguing and not fixing this
87,1.10846296429688e+18,2019-03-20 20:18:59,0,0,0,0,i watch all these life hack on snapshot but no one show me how to hack into telling when an avocado is gon na go bad
88,1.09507850765328e+18,2019-02-11 21:53:56,0,1,0,1,the one thing that doe fail to make me laugh like this is using snapshot filter on my brother without them realisingand saving all the photo for ransom
89,1.10593138391304e+18,2019-03-13 20:39:23,0,0,0,1,atuser hey there an issue with face-on and messenger face-on keep closing and messenger get a server non reliable error when trying to send photo
90,1.10529231793256e+18,2019-03-12 02:19:58,18,1,0,0,please tell me why i voluntarily worked at cv tonight because someone called in sick and they needed help and i felt bad saying no even though i already worked only to see this sick girl posting on snapshot how she at the bar having a girl night out stupid me
91,1.09192516128313e+18,2019-02-03 05:03:40,0,0,0,0,ill never forget when my boyfriend and i had just started talking and hanging out i asked what his last name was and then asked if he wanted to know mine and he said he already knew plot twist he only had me on snapshot and instagram and my last name int on either
92,1.10806698815119e+18,2019-03-19 18:05:31,0,1,0,0,the problem with equity is the burden of knowing you decide who deserves what based usually on bias personal value and your general outlook on life the only way to be a true aquitanian is to get literally every single person involved in who deserves what based on what
93,1.10048748832441e+18,2019-02-26 20:07:17,0,2,0,1,my biggest issue is that the edit recipient list feature in word is so buggy that the only way to ensure you are not going to send email to horde of people you did not intend to is to go through and manually select
94,1.1059360476853e+18,2019-03-13 20:57:55,0,0,0,1,atuser unable to even log into face-on over hr fix it
95,1.12048920529199e+18,2019-04-23 00:46:58,0,0,0,1,atuser how can i get help face-on is blocking all my post to groupagemesages link from my webster i have contacted help kiss and posted in the community forum with response other people post si ahilar content without problem so why is my webster content blocked
96,1.09233584864369e+18,2019-02-04 08:15:35,0,0,0,1,atuser your new fake notification suck it is very depressing and make me want to quit already i have already using this application once a week and i think it is about ti are to throw in towel please fix this bug
97,1.11349889533671e+18,2019-04-03 17:49:59,0,1,0,1,strange i am having to jump through all these hoop for the zoom to not go bonkers placing the scroll wheel in click mode versus momentum scroll wheel mode help but the outlook problem persists
98,1.12092448701119e+18,2019-04-24 05:36:38,0,1,0,0,literally saw like ten people on my snapshot post that lemonade was finally on apple music likewise ya really that broke to buy it off tune
99,1.12252471595073e+18,2019-04-28 15:35:22,2,0,0,0,i mean my whole snapshot story right now is singing along to mr with various member of fail the enemy
100,1.10599419130855e+18,2019-03-14 00:48:58,3,2,0,0,yeah i get it just trying to discern the difference between bad year and bad outlook almost everyone will doubt the viking
101,1.09954779354945e+18,2019-02-24 05:53:17,0,1,0,0,i did not we were snapping and you said lena dint work so i thought ya were gon na do something according to snapshot you guy did hang out laugh out loud
102,1.12572416387492e+18,2019-05-07 11:28:50,0,0,0,1,atuser please know that if i block someone and have delete and deinstall whatsit using d same number ansaphone my feeling he not changed do not help me unblock d person why will not you fix d privacy issue i imagine receiving stupid message from someone you thought you take care of
103,1.12740120435352e+18,2019-05-12 02:32:47,6,0,0,1,yo that snapshot filter turned me to a bad bitch
104,1.10869270144736e+18,2019-03-21 11:31:53,2,0,0,0,and its not the outlook i have it just feel like thats the choice you have to make once you can not hang on to someone coat tail anymore having to choose between getting a job that you do not want to do and being poor is a fucked up choice hope and dream seem out of reach
105,1.10781743151741e+18,2019-03-19 01:33:52,0,0,0,1,atuser atuser rd tweet in day submitted help request no one want to fix this goole you are missing street and it is affecting how i use gps and drive i can not add the place with add a place as the road do not exist in your system but they do in apple map
106,1.10851816204629e+18,2019-03-20 23:58:19,2,1,0,0,result that cater towards that outlook that is si amply the way that opt amazed search engine work so if you tell someone to just goole an issue or a subject they are only going to find result that are related to their preconceived notion and search
107,1.09490761403777e+18,2019-02-11 10:34:52,0,0,0,0,recognizing a problem is the first step to solving it congratulation on coming out as a racist i wish you nothing but the best as you struggle to i improve your outlook on others and stop judging people by the color of their skin it will not be easy but i think you can do it
108,1.10265580664913e+18,2019-03-04 19:43:25,0,0,0,0,is there an outlook reminder on your calendar that tell you to tweet an absurd trans story why so angry ben bad experience in college show u on the doll where the bad female touched you ben
111,1.12601089459125e+18,2019-05-08 06:28:12,1,0,0,0,a digital mini racialist someone who drop low-quality activity like mindless phone swiping and halfhearted binge watching for activity and learning to fix or build something every week the goal is a permanent change of outlook and behavior url
113,1.13353269876355e+18,2019-05-29 00:37:10,0,0,0,1,sarah same problem seems to be happening to quite a few people
114,1.11740593421992e+18,2019-04-14 12:35:09,0,0,0,1,atuser why it broke url
116,1.12869332283321e+18,2019-05-15 16:07:12,0,0,0,1,atuser hi there i need help someone is logging in my whatsit web twice today at first i already logged out later pm it active again using moila i asked my friend and they said whatsit now has bug kindly check for me i afraid they might stolen my detail url
119,1.10595991591759e+18,2019-03-13 22:32:46,6,3,1,1,i am pissed this is my main form of communication and i can not even log into my account let alone messenger i hope you guy fix this
120,1.12447391599944e+18,2019-05-04 00:40:47,0,0,1,1,atuser fix the application please
121,1.10595291540611e+18,2019-03-13 22:04:57,1,0,1,1,atuser here are some bunny treat please fix yourself people are flipping out url
122,1.12291086289179e+18,2019-04-29 17:09:47,0,0,0,0,so after watching every play of daniel jones in the last year i have a very positive outlook on this kid funny what medium can do to paint a picture bad line no ti amend his receiver were horrendous he literally was the duke offense guy this kid can play
125,1.10633331903218e+18,2019-03-14 23:16:32,18,1,0,0,only recently was i truly informed with the real meaning of cli mate change this completely changed my outlook on it its a much bigger problem than we think and that the government let on wish i could make it to the protest tomorrow please make your voice heard in the right way
126,1.100440021621e+18,2019-02-26 16:58:40,2,0,0,0,you can call me pickle or by my name austin i am a new streamer on atuser been going strong for day straight while doing shift work i am a big fan of battle royale and have currently been playing apex bad game or good i try to keep a positive outlook
129,1.10848557326891e+18,2019-03-20 21:48:49,0,1,0,1,hi atuser i am having an issue trying to add a shared mailbox onto a user outlook on their mobile phone any suggestion
130,1.124256849447e+18,2019-05-03 10:18:15,0,0,0,1,atuser i need to be able to post on my account and like thing being banned from face-on for a meme is ridiculous please fix your issue
133,1.09180974473248e+18,2019-02-02 21:25:02,3,1,0,0,there are a lot of thing that clue u in that the writer does not agree with the character it is absolutely possible to tell a story where the protagonist have a bad outlook on life without supporting that bad outlook
137,1.11002409648468e+18,2019-03-25 03:42:22,0,0,0,1,atuser what is the problem with your selling group i have been trying to post legit mate item for sale and they keep getting flagged what is wrong with your algorithm that knitting yarn clearly not a prohibited item from being allowed
139,1.10600826309345e+18,2019-03-14 01:44:53,2,1,0,1,face-on should pay me compensation biggest trouble ever i faced
140,1.10595627231299e+18,2019-03-13 22:18:17,0,0,0,1,the reason you can still open your face-on and instagram aps and poke around a little is because of the caching face-on has saved certain thing and cached them to your device its still very much down try to interact with new content via search and you get an error
141,1.12111895462849e+18,2019-04-24 18:29:22,6,2,1,1,you took over in advertising from me then disabled my account due to a mistaken intellectual right report the company have even told you it was a mistake notice but you havent restored the account and ignore all contact whats the problem
143,1.10688756495757e+18,2019-03-16 11:58:55,4,0,0,0,i am genuinely fascinated by the outlook that doing irony is alienating the people and reaching out to fish but constant hyperliteral moralizing thats a style that is how you build a broad movement and keep out bad people
145,1.09180533262664e+18,2019-02-02 21:07:30,0,0,0,1,how to fix window outlook url
146,1.10284037426596e+18,2019-03-05 07:56:49,0,0,0,1,atuser i was not able to redeem offer given by map that was gb cloud storage when i tried to redeem it showed up error code and code not valid message
147,1.10600518602636e+18,2019-03-14 01:32:39,0,0,0,1,this not being able to post comment or access my face-on with an application to be able to play a game suck this issue need fixed and fast very very irritated
148,1.1267000290606e+18,2019-05-10 04:06:34,0,0,0,1,atuser after report a problem no such solution even no such response from your sideways this happening
149,1.09912177817202e+18,2019-02-23 01:40:27,0,0,0,0,brother i wanted to do that so bad too i was at school and working so i was just watching marianas snapshot story like url
150,1.09402778276022e+18,2019-02-09 00:18:44,20,2,0,0,i posted a tweet to my snapshot story about girl saying they go lesbian after being in a bad relationship w a man and i am waiting for people to angrily swipe up at me
