,tweet-id,timestamp,likes,replies,retweets,Bug_report,text
6509,1.12197225089745e+18,2019-04-27 03:00:04,6,0,0,0,broke my phone screen to where i can never view or delete my snapshot story ya will are in for a night
6510,1.13267920116789e+18,2019-05-26 16:05:40,0,0,0,1,atuser will someone solve my issue
6511,1.10598440384564e+18,2019-03-14 00:10:04,0,0,0,1,come on now fix it
6512,1.12767010282288e+18,2019-05-12 20:21:18,4,1,0,0,my mom tutor this boy for school and his brother who like always like to hang around me and yesterday i was showing hi am snapshot and he told me he liked the filter with lip-gloss because it made hi am pretty
6513,1.13055941335222e+18,2019-05-20 19:42:23,3,0,0,0,me see my best friend hanging out with another woman on snapshot me oh it is fine i am in another state now she should be making new friend also me that bitch has the nerve to cheat on me
6515,1.09825434829398e+18,2019-02-20 16:13:35,1,2,0,1,atuser jp road in adhere west is one way from metro pillar to jp road junction metro pillar however in goole map it show way request you to address this issue as its causing inconvenience to many especially cab service
6517,1.10817264711916e+18,2019-03-20 01:05:22,0,1,0,0,yet they stay posting on social medium and are hanging with this person and that and i am like can not event shoot me a text saying you hit me up later or you can not hang today its really not that hard if you can post to snapshot you can shoot a quick text
6520,1.10128493839612e+18,2019-03-01 00:56:04,2,0,0,0,atuser i got ta say youse given me a different outlook on the whole testing issue especially with a job like a mechanic your absolutely right still a bit sided on the issue which may in part due to my own experience but prop making me remember keep an open mind
6524,1.11841096271164e+18,2019-04-17 07:08:47,0,0,0,1,hello atuser why are you not solving my problem at least do reply to my dm
6525,1.11470883827855e+18,2019-04-07 01:57:51,3,0,0,0,for day now have been getting mad at aaron for not replying to my snapshot and i just found out have been sending them to the wrong snapshot so thats my bad
6526,1.10589117506253e+18,2019-03-13 17:59:37,0,0,0,1,its more like the whole world but okay please fix it soon
6527,1.12940528650098e+18,2019-05-17 15:16:18,0,0,0,1,we switched our email to outlook at work this week and let me tell ya this has been the most frustrating week since i started here microsoft blow
6528,1.12688532696065e+18,2019-05-10 16:22:53,1,1,0,0,purely off trait i am assuming once they study his all ive gotten it all from each year and see hi am live they change that outlook he horrible and i hate to say that about a kid but its bad
6530,1.12929861106032e+18,2019-05-17 08:12:24,0,2,0,1,hey atuser my friend and i can not access bitmoji from chat window using the emojisticker button on the right if you type a word no bitmoji sticker come up on the rare occasion they do come up its a few that are totally unrelated to the word type search fail url
6531,1.11314870219191e+18,2019-04-02 18:38:26,1,2,0,0,atuser atuser atuser they are called exception learn to catch them in your code and pas the relevant information up the chain i realize knowing what happened will not instantly fix it for me but it is useful info tagging atuser because usual
6532,1.10598516415127e+18,2019-03-14 00:13:06,0,0,0,1,atuser mine has been down since this morning any word yet on fixing this problem face-on downturn
6535,1.1002918308838e+18,2019-02-26 07:09:49,0,1,0,0,actually i m custom rom tester that is why so many device gone added anyway thanks for resolving my issue p that guy i was talkin to on phone was awesome and gentle say thanks hi am too for me much love to you all url
6536,1.13347045032177e+18,2019-05-28 20:29:48,0,0,0,0,i mean i get it if they paid to see your feed or if you were cry and just that on private snapshot or whatever but they are not paying and they do not care so anyways do not feel bad it is cool to take ti are for ourself at the end of the day it is literally your account and body
6537,1.10764336923121e+18,2019-03-18 14:02:12,0,0,0,1,atuser facebokdown face-on please help can not get logged into face-on because i am not getting the code please fix this
6538,1.12609179610956e+18,2019-05-08 11:49:40,5,2,3,1,its already bad enough i use snapshot camera to take picture but ya gone update and put a portrait mode on there its going of down
6540,1.12914815149399e+18,2019-05-16 22:14:32,0,0,0,1,atuser when are you going to fix the quality issue with the phone xr
6541,1.10325745344415e+18,2019-03-06 11:34:09,0,1,0,0,snapshot is in kind of big trouble why from talking to various people in various age group the following seems to be clear
6546,1.10042218177801e+18,2019-02-26 15:47:47,1,1,1,0,stupid annoying i literally see a girl post on snapshot every single ti are her nigra leave her and fuck up bad then they end up together again then she had the nerve to post on ig do not post every ti are you and your man break up laugh out loud
6549,1.11048700385708e+18,2019-03-26 10:21:48,0,0,0,1,atuser hello i need help with goole business application as i am having trouble changing my business address have tried getting support from goole business on twitter but no rest please help goole
6550,1.11187660473151e+18,2019-03-30 06:23:34,1,1,0,1,atuser when i go to my best friend list its very different from my friend i like how his look and even after deleting and re downloading the application it will not change how can i fix this
6551,1.1096502028337e+18,2019-03-24 02:56:39,0,1,0,1,does anyone know how to fix the snapshot zoom on the phone x max
6552,1.09516854826204e+18,2019-02-12 03:51:43,9,0,1,0,there are a lot of bad thing in the world but only few can top people posting a video to their snapshot story of them singing very out of tune
6553,1.10624034366452e+18,2019-03-14 17:07:05,1,0,1,1,atuser atuser did not get the code it look like you have not logged in from this browser before please enter the login code from hourcade generatorbelow need to fix this asp
6555,1.12072191985726e+18,2019-04-23 16:11:42,0,0,0,0,atuser there seems to be a widespread email problem today hot-air outlook and apple mail all have significant outrage apology to those i tried to email today
6556,1.12436342870393e+18,2019-05-03 17:21:45,0,0,0,1,i want to switch to chi camera but i really want to use this snapshot tweak from what i know the tweak doe work on chi camera fix
6557,1.10593082496732e+18,2019-03-13 20:37:10,0,0,0,1,it is been six hour fix yourself
6559,1.11449016159587e+18,2019-04-06 11:28:55,0,0,0,1,atuser hi team i am writing this on my team member behalf because he is unable to login in his face-on account email parventiwariatuser kindly sort this problem out as soon as possible and provide hi am the access of my account again with more security on your system
6560,1.10391946876003e+18,2019-03-08 07:24:45,1,1,0,0,buzzing i got to see atuser lastnight thanks to atuser snapshot feed your singing wasnt to bad either
6563,1.10154126183467e+18,2019-03-01 17:54:37,0,0,0,0,i am happy i have a new as snapshot because if i were to see the memory from this ti are last year i would probably fall back into the bad habit
6564,1.11892200568696e+18,2019-04-18 16:59:29,0,1,0,0,i missed you too i was so bored and sad not being able to talk to you my handwriting so bad on snapshot ops but i made another one url
6565,1.10593031639969e+18,2019-03-13 20:35:09,0,0,0,1,atuser is there a problem with face-on at the moment
6566,1.11738229104572e+18,2019-04-14 11:01:12,0,0,0,1,atuser facebokdown please fix
6567,1.11626289609753e+18,2019-04-11 08:53:08,0,1,0,1,atuser i do not receive any notification i need to open the aps and refresh for see i have some message that is a bit boring you should fix it in previous uptake
6568,1.11871987565074e+18,2019-04-18 03:36:17,1,0,0,0,i just saw a snapshot from a girl who said her dog is a schism but spelt it skit
6569,1.11136524308569e+18,2019-03-28 20:31:36,3,0,0,0,my heart hurt so fucking bad i just removed hi am from snapshot and i am a hot fucking mess and i immediately i am wanting to add hi am back
6570,1.12941250866874e+18,2019-05-17 15:45:00,0,0,0,0,atuser you are corrupt and hypocritical if you do not allow other view on your platform aka the view you deem as hate speech you are the problem atuser was stating her correct view on the matter and it was not hate speech
6572,1.0911797109633e+18,2019-02-01 03:41:30,0,1,0,1,atuser need to fix the direction around my house because i am real tired of having to explain to people why they have to ignore their gps and telling them to trust me that they will not get through that way
6573,1.09815438136973e+18,2019-02-20 09:36:21,0,0,1,1,atuser atuser i am using face-on since last year but this is the first ti are i am facing a issue which is not getting solvd i have never joined any group and it is showing pakistan zindabad in my face-on account and i have reported and inflow it still showing in my account url
6575,1.11379888917236e+18,2019-04-04 13:42:03,3,0,0,0,i am writing a thank you letter to snapchathey never fail to remind me how far i came along
6580,1.1287777802026e+18,2019-05-15 21:42:49,0,0,0,0,welcome to where all the guy are horrible here is what one man learned when he used his genderswaped snapshot photo on tinder url
6581,1.09537944824371e+18,2019-02-12 17:49:46,0,0,0,1,atuser has once again post blocked me for doing absolutely nothing and there is no way to get this appealed because they have absolutely no help line or direct contact to get an issue like this solved as soon as possible
6582,1.09539850518571e+18,2019-02-12 19:05:29,0,0,0,1,atuser broke so come straight to twitter to check it int just mine
6583,1.12585790619535e+18,2019-05-07 20:20:16,0,0,0,1,atuser fix yo application right now or i am moving to snapshot instagramdown instagram k
6585,1.11828742064509e+18,2019-04-16 22:57:52,21,1,0,1,this drive me nut i have to keep zooming in and scrolling just to see what damn street i am on been a problem for year
6586,1.11587574226346e+18,2019-04-10 07:14:43,9,0,3,0,i have a really bad habit of forgetting to message people back on snapchatops
6587,1.12948901556707e+18,2019-05-17 20:49:00,2,0,0,0,when you keep reaching for the right combination of co rule and placement to try to fix an outlook issue and you finally remember the humble nonbreaking space
6588,1.10774798682049e+18,2019-03-18 20:57:55,0,0,0,0,this girl on my snapshot just spelled gossip with gospel i taught it was just an error but no she wrote the same word three ti ames trying to explain her story
6589,1.11576560676529e+18,2019-04-09 23:57:05,0,0,1,1,atuser have disabled my account for more than a year that too for absolute no reason all my memory are on that account i want them back fix up
6590,1.09478896812476e+18,2019-02-11 02:43:24,0,0,0,1,how frustrating it is to have io outlook not being able to show category on the calendar color coded and all it is atuser
6591,1.11000499150942e+18,2019-03-25 02:26:27,10,2,0,0,so one of the first thing that happened in japan was my self stick was broke and my luggage so i am not sure how much losing i am going to be so probably better just to check my snapshot or instagram for video right now
6593,1.10612054417968e+18,2019-03-14 09:11:03,0,0,0,1,atuser same shit this dayswhats the problem url
6594,1.12294126339167e+18,2019-04-29 19:10:35,3,0,1,0,i remember this dude message me on snapshot asking to hang out and i dint reply mao and i put on my story someone do something w me today and i thought i blocked hi am from my story so he couldnt see it but the nigra swiped up talking about brush i j message you
6595,1.11133271347316e+18,2019-03-28 18:22:21,0,1,0,1,yes did that did not help i can link the problem to being online via wife when i am on mobile data everything work
6596,1.11843178061944e+18,2019-04-17 08:31:30,0,0,0,0,this is actually a really big problem the interest bill on this debt last year was about bill alone more than double the yet to be realised surplus of next year and the assumption the gov is making in its yr outlook are really unrealistically opt artistic
6599,1.12763102844358e+18,2019-05-12 17:46:02,0,0,0,0,snapshot coming thru w the mess today one year since my ex and i broke up two year since dona and i had to cook an egg together bc were useless high and low
6600,1.09323028470581e+18,2019-02-06 19:29:45,0,0,0,1,atuser so i can not get my account back my account was hacked stolen jennifer wright do not own the account the person hacked it the profile photo is not me at all please fix it
6601,1.13423630023048e+18,2019-05-30 23:13:01,87,4,2,1,snapshot int letting me add to my story anyone else having the same problem snapchatdown
6603,1.13080560901053e+18,2019-05-21 12:00:41,1,0,0,0,glad i made you laugh absolutely no issue with teenager using snapshot or the associated filter i do get bemused by adult adding dog face and filtering themselves in order to have the complexion of a dinner plate proper odd kiss
6604,1.10293874169242e+18,2019-03-05 14:27:42,0,0,0,0,atuser most group face a common problem of certain member spacing the group chat with unrelated post can you develop an option where the admits of group have authority to delete sam message for all member just the way a message can be deleted in a way conversation
6605,1.09709982524434e+18,2019-02-17 11:45:56,0,1,0,0,atuser hi my friend has a problem she has an old account from like a year and half to year ago and lost her password back in the day she haunt used that account since she can not get the password back cause she doe remember the email and
6606,1.10600807672377e+18,2019-03-14 01:44:08,0,0,0,1,ya better fix that shit as soon as possible
6610,1.10873289634346e+18,2019-03-21 14:11:36,0,0,0,0,happy birthday to the most i ampactful song in my life today my snapshot memory were filled with video of me cry while listening to it for the first ti are i can not thank shawn enough for putting this song out it has helped me so much throughout the last year url
6612,1.12702973149549e+18,2019-05-11 01:56:41,0,0,0,1,atuser hi please reply to my dm i can use my account on other device but on my phone it say it is temporarypermanently locked please help have noticed many people with the same issue
6615,1.13072617792299e+18,2019-05-21 06:45:03,0,1,0,0,no error message just the icon to show need backing up
6616,1.10254624426056e+18,2019-03-04 12:28:03,0,0,0,1,i did that before twice when i want to report it say go to bitmoji support when i go to bitmoji support it say go to snapshot support so how do i report that issue only on twitter i get answer back
6617,1.12288539094211e+18,2019-04-29 15:28:34,0,0,0,1,what is error code of in outlook and how to fix this unknown error url outlook error of solution how troubleshooting tip technics
6618,1.12910855093504e+18,2019-05-16 19:37:11,0,0,0,0,hahahaha sod off some man has added me on snapshot sent me a photo of hi am with his wedding ring on and his response when i asked if he was married if its a problem i can swap it to the other hand hun
6619,1.09877548010955e+18,2019-02-22 02:44:23,0,1,0,1,so i can get my other video to load on twitter but the video i recorded from snapshot will not unload like what the fuck am i the only person having this problem
6620,1.11724093110983e+18,2019-04-14 01:39:29,0,0,0,1,atuser anyone else having this problem url
6621,1.13268546442984e+18,2019-05-26 16:30:33,1,0,0,0,i remember when i used to fear making new friend my outlook changed when i figured out my boundary were the issue
6624,1.09162311471752e+18,2019-02-02 09:03:26,1,0,0,0,point taken and well made i subscribe to that outlook however when we talk about productivity considering that they consume and expect more to consume there they fail and continue to fail but they complain if they dint complain and pointfingers for their failure i wundt speak
6625,1.10598123080428e+18,2019-03-13 23:57:28,0,0,0,1,could you please hurry up and fix face-on
6626,1.1169847466875e+18,2019-04-13 08:41:30,0,0,0,1,atuser atuser atuser all bugging me more today and still wish was in chronological order but all as bad as each other
6627,1.13398312996902e+18,2019-05-30 06:27:01,0,0,0,0,atuser whats the point of emailinc support if ya do not even address or try to fix other people concern shaking my head
6628,1.1095808273718e+18,2019-03-23 22:20:58,0,0,0,1,atuser quit making my application crash when i am trying to play snap game
6629,1.10591625221455e+18,2019-03-13 19:39:16,0,0,0,1,while you are at it could you fix your ai to stop flagging content that we are posting that is not actually offensive in the least bit i have run into more issue these last few week than i ever have it is getting a little absurd
6630,1.11676309606701e+18,2019-04-12 18:00:45,0,0,0,1,atuser the quality of the i amazing in the android is bad we want a quick solution to this problem
6631,1.12437508050568e+18,2019-05-03 18:08:03,0,0,0,1,atuser atuser atuser atuser atuser my face-on page for this business has been unpublished please fix this we do not break rule we si amply post about flower url
6632,1.1218089772502e+18,2019-04-26 16:11:17,0,0,0,1,atuser i really need you to put post in chronological order again whats the point of the most recent tab when your seeing post from day ago can we fix this please itsneded
6633,1.10450153988688e+18,2019-03-09 21:57:42,2,0,0,0,happy birthday to my fairy god mother friend kindred spirit fellow collaborator songwriting legend and inspiration snapshot filter expert bad as female bo and wonder woman atuser i love you and am so grateful for you curl
6634,1.09829446594767e+18,2019-02-20 18:53:00,0,0,0,1,hey please fix the writing it make it look like i have an android phone even tho i have an phone its really annoying just put it back to the way it was it hurt my eye thanks oxo sj kiss
6636,1.11711809633719e+18,2019-04-13 17:31:23,1,1,0,0,atuser i feel bad i can not find frankie is twitter handle i thought it was fuckherionation i hope he doing better concentrating on his recovery tell hi am all clean ti are add up do not get overwhelmed outlook talk go to meeting spread the word to others suffering write
6639,1.12499066576141e+18,2019-05-05 10:54:10,0,1,0,1,hello i am still having trouble andi have requested to change my password via email and it say its sent a reset link but it haunt
6641,1.12454456991021e+18,2019-05-04 05:21:33,0,0,0,1,atuser you really need to stop updating the application its horrible
6642,1.12780893448231e+18,2019-05-13 05:32:58,1,0,2,0,my boy friend all turn out being a smoking hat bad bitch thanks to snapshot filter my career as a lady has been doubted its genuineness ill stop posting series on internet
6645,1.13077592430626e+18,2019-05-21 10:02:43,2,0,0,1,how to fix exchange mailbox quarantine issue mailbox quarantine issue map client such as outlook us multiple thread for store procedure while connecting to mailbox url
6646,1.09668271965892e+18,2019-02-16 08:08:30,0,0,0,0,the problem is not that people want thing that are not the best the problem is that people look at something like snapshot and think that there is some meritocratic reason why that is popular but something else is not and anyone who is not producing economically deserves to starve
6647,1.09698712135157e+18,2019-02-17 04:18:05,0,1,0,1,atuser phone x max horrible picture quality how do i fix this it make me not even want to use snapshot anymore
6649,1.09830327639788e+18,2019-02-20 19:28:01,4,0,1,1,snapshot man please fix my font its sore to look at this one
6652,1.10906615381981e+18,2019-03-22 12:15:51,0,0,0,1,atuser face-on getting very frustrated that you are not looking into my issue message you many ti ames and send load of form off
6654,1.10599307414729e+18,2019-03-14 00:44:31,1,0,0,0,wow i though my account been blocked by nothing then searched solution for hour then i tell me you got a problem
6658,1.11787389228077e+18,2019-04-15 19:34:39,0,0,0,1,yes we still got the problem esp on my bos is pc open outlook check mail close it after some hr go back try to open it and will not blue loading circle and nothing happens opening task manager and force ending the outlook task allows for a start of the application again
6659,1.10883825513336e+18,2019-03-21 21:10:15,0,0,0,1,hey atuser there is an issue in the online version with the category i impossible to attribute category to email for the past two day any would what is going on thanks outlook
6661,1.11703266053299e+18,2019-04-13 11:51:54,0,0,0,1,it is not a theme just a glitch in their new application probably but yeah on second thought maybe you sure can turn the white theme to a dark one if you can access the application data in a rooted phone and modify it if possible worked for me when i dug into goole dealer
6662,1.11738698690857e+18,2019-04-14 11:19:52,0,0,0,1,atuser please tell u why face-on instagram and whatsit downer
6664,1.10605662105714e+18,2019-03-14 04:57:02,0,0,0,0,atuser issue is resolved now
6665,1.10660276130143e+18,2019-03-15 17:07:12,0,0,0,0,to bad no body will answer mei have had a support case open since november and no one reply to me
6666,1.10594368983321e+18,2019-03-13 21:28:17,0,0,0,1,atuser and atuser are down must explain why instagram will not refresh for me and why i can not send screenshots on messenger please fix it as fast as possible i have meme to send
6667,1.09746925518294e+18,2019-02-18 12:13:55,0,0,0,1,atuser is there anyone real to please help me with an issue i have with my account
6670,1.10732209999419e+18,2019-03-17 16:45:36,0,0,0,0,i ama just shut the fuck up while recording anything on snapshot unless i am explaining some b such i am so sorry to everyone i know i sounded bad but damn bitch i live like this
6671,1.10258484076605e+18,2019-03-04 15:01:25,0,1,0,1,atuser also i do not want to see my snap in saved story on my memory list it make the list so long please fix or revert this as soon as possible
6672,1.12072232802606e+18,2019-04-23 16:13:19,0,1,0,1,yo atuser atuser you want to fix the spam i keep getting from random people adding me so close to deleting the stupid application please resolve this issue
6673,1.13089760471858e+18,2019-05-21 18:06:14,0,0,0,1,atuser hey goole what did you do to my ti amelie i have been using ti amelie for year looked back at something in and nearly all of my day look like this all place info i put in has seemingly been deleted what give fix for this coming or is my data lost for good url
6674,1.12359557518897e+18,2019-05-01 14:30:35,1,0,0,0,kiss as graham is going to rehash the clinton email issue again even though the wh continues to use snapshot and whatsit thats all the got hasclinton as a whipping girl get over it and stand up to russia and this disgraceful pot
6675,1.12182272778909e+18,2019-04-26 17:05:55,0,1,0,0,q snapshot incident regarding blackface a he joined protest met with protester create more inclusive behavior intervention team worked with student affected they told hi am nothing he could do to prosecute it he was told it was free speech
6676,1.10618678954972e+18,2019-03-14 13:34:17,0,0,0,0,i am having trouble accessing many feature today due to an unjust and totally unnecessary block from use it is equally ridiculous and insulting that you have removed any ability for user to contact you for assistance this is a total case of turning your back on your user
6677,1.10595880914981e+18,2019-03-13 22:28:22,1,1,0,1,atuser for some reason i am not able to make any post or comment i keep getting the ops something went wrong error
6680,1.09978389799755e+18,2019-02-24 21:31:28,6,0,0,0,why am i so bad at snapshot i swear i send a snap to the wrong person at least like once a day
6681,1.09802221292433e+18,2019-02-20 00:51:10,0,1,0,1,i know i am speaking on behalf of many android user and you have probably answered this elsewhere i just want to ask why can not android user update snapshot we are still on the update where we can only do second long snap please fix thank you
6682,1.10496001291956e+18,2019-03-11 04:19:30,9,0,0,0,i do not understand people who snapshot and drive i have enough trouble trying to turn off the radio while driving when melt city result from the weekend come on much le sending a sad puppy filter self about it in all seriousness please do not do it
6683,1.10594476209442e+18,2019-03-13 21:32:33,0,0,0,1,atuser and atuser are down who the damn hell broke the internet
6684,1.0958414791871e+18,2019-02-14 00:25:43,1,0,0,1,if outlook just stop working after a while look for adfsauth issue they will not tell you anything but its a problem the network and to disable sri on cisco fireball which was a hilarious six month for u they can not even tell you why their own software stop working
6689,1.1159599556712e+18,2019-04-10 12:49:21,0,0,0,1,atuser the latest update of whatsit is not working on io can you fix this mess
6690,1.09182403667658e+18,2019-02-02 22:21:50,0,0,0,0,i can not change my snapshot name ill be heart broken i like everything to match laugh out loud
6693,1.11673650398251e+18,2019-04-12 16:15:05,0,1,0,1,atuser my outlook for mac when i try and link the account it say it is all good to go and then it ask me to link them again i have reset everything so i do not know the problem
6694,1.10753414890491e+18,2019-03-18 06:48:12,0,0,0,1,atuser atuser when you will fix the log in problem are you blind or dump you are not showing the people are asking what is the actual problemgive u ti are to responding this please url
6696,1.12074024695253e+18,2019-04-23 17:24:31,3,0,0,0,i am in love with atuser being back on snapshot and now also hanging with atuser u i love when they are together the laughter and joy they bring to my life is amazing love these two woman so much
6697,1.12078092251586e+18,2019-04-23 20:06:09,2,0,0,0,oh sorry my reply was basically to those who think that they broke up over that one snapshot and that tank dumb when she not but its definitely clear he cheated laugh out loud we are on the same page
