,comment,label,id,margins
194,update 22113 new update problem installed update froze access open option dropbox app store page dropbox icon phone page deleted reinstalled thing operating latest ios iphone 4 please fix,Bug,286927,
195,good fav application bad thing fakes good,Bug,286928,
196,fix many times send crash report fix application fixed dislike application,Bug,286929,
197,seriously keep trying get one files application keeps crashing reason please fix youre average job,Bug,286930,
198,wtf happily pinning away got message tellingI would reached pin limit wtf look going limits pin going delete application account thats stupid plz fix love pinterest get quality serviceI used towellwhats point,Bug,286931,
199,dislike update news feed want see boards pins pinned prefer old feed,Bug,286932,
200,nice application evrythng good except tht red eye optn doesnt fnctn properly,Bug,286933,
201,charges made without request approval,Bug,286934,
202,service great application fails pressing upload freezes application crashes next open,Bug,286935,
203,application amazing recent update says offline mode even though connected wifi apps internet iphone working access anything application appear fix,Bug,286936,
204,un install reinstall works awesome love application probably best ever,Bug,286937,
205,ive application month everyday try use freezes upon 1st touch sad want work bad bring delete,Bug,286938,
206,sometime last month dropbox stopped syncing recent files phone 1 month old yet many current files loaded dropbox desktop folder syncing help,Bug,286939,
207,drop support earlier ioss apple make,Bug,286940,
208,needs little improvement overall application great would nice could pin posts page application otherwise mobile fix five stars,Bug,286941,
209,nonstarred files occupied 600 mb way reduce itit eats ipad space,Bug,286942,
210,giving nfl 12 v3 update three stars largely improvement previous version ingame display better organized scores page vastly superior prior version see games current week one screen instead scrolling list modest amount use application appears much stable however still needs work many respects scoring summary gone far tell often found helpful checking games wasnt following playbyplay team leaders appears limited 1 qb passing 1 player rushing 2 receivers apparent way scroll players pull full listing especially preseason games teams running multiple personnel packages frustratingtheres way example compare passing stats 2 3 qbs gotten playing time egregious problem least thursday games week 2 teams switch properly checking atlanta versus cincinnati game tap atlanta falcons button get passing stats dalton tap cincinnati button see passing stats ryan rushing receiving stats teams hoping operator error fixed shortly reflects poorly product apologize comments length hoping nfl monitoring feedback,Bug,286943,
211,love evernote use everywhere various devices ios desktop used love simplicity web interface new one seems cumbersome andI really weird issues overwritten notes overall would rate environment 45,Bug,286944,
212,tried get information ta see statement review removed gives rate ta use,Bug,286945,
213,longer add files directly phone completely loses point use see update,Bug,286946,
214,evernote mainstay life past years pains say theres major bug current ver get webview unable go back evernote done button working tried quoting application work either redownloading application cross fingers help,Bug,286947,
215,totally addicted application long ago one tiny problem freeze blue moon doesnt really bother 1 best application level 101 joke,Bug,286948,
216,one ever report problem ever since downloaded latest update application ipad continues show pop alert message click ok pops right back upI turned alerts application contact apple support reset complete default mode reloaded application still issue annoying else experiencing,Bug,286949,
217,loved soundhound last update view historyI tried several times 30 minutes waiting download give back using shazam hope gets fixed,Bug,286950,
218,please fix crashes bugs possible make app faster,Bug,286951,
219,last update please fix,Bug,286952,
220,good application improved option select default camera,Bug,286953,
221,every time try select seat never loads,Bug,286954,
222,one good thing last update ws ability make folders able make folders inside folders wish could bad things last update typing lag annoying see happened since crazy graphical interface anything animated major thing pretty much deal breaker people removal tab button always hated tab button ruler would prefer one shift key place tab keyboard wish back top least go complicated process menu use itI stopped using pages since pain tab unless using bluetooth keyboard,Bug,286955,
223,poor need updates android wa lame androids fix,Bug,286956,
224,although avid pinner application keeps knocking pinning time therefore making search start irritating also slows ton open another board besides please fix problems want pin,Bug,286957,
225,application doesnt work terrible goes show happens media companies lock content time warner able watch whenever choose provider nothing happens times crashes really poor job everyone involved garbage,Bug,286958,
226,white application icon atrocious hiding away new folder naming ugly apps joined photos ibooks apple bloatware apps like game center newsstand passbook could go theyll stay crap folder instead,Bug,286959,
227,little bit love pinterest addictive little slow though,Bug,286960,
228,review dropbox service great application use lot improvements single frustrating thing displays dozen characters file name since thousands files long descriptive names impossible find looking unless download files ipad one one way resize file list make files visible,Bug,286961,
229,love dropbox mac use time share files photography clients however find annoying email link clients iphone application makes hard onthego sharing whats point application share folders please change,Bug,286962,
230,happened used rely dropbox transfer files ipad computer camera upload still works thats need fix app,Bug,286963,
231,happened access program cancel problem fixed soon,Bug,286964,
232,since update open links pictures email please fix,Bug,286965,
233,latest update even get account either iphone ipad says incorrect password freakin joke update even test sending updates,Bug,286966,
234,mostly great best photo editing application meI ever used except one thing really wish could use one gallery photos background pic frame,Bug,286967,
235,disappointed application loved worked since new update even open last update end october beginning december one would think big company sure nicely paid tech team would figured bugs waste money application fix,Bug,286968,
236,like application suddenly open get notes,Bug,286969,
237,application misbehaving big time love one working right download features stuck know please try helping methanks sos please help get app work ty pam therese lukasz parkridgeil 60068 x gtltthankyou fixing problem far great like normal ty hugz,Bug,286970,
238,dropbox longer accepts files ipad since latest ios update issue application actually worked easy five star,Bug,286971,
239,latest version seems stopped playing videos sad,Bug,286972,
240,love application working,Bug,286973,
241,frequently crashes allow local storage personal notes automatically stored painfully slow evernote servers personal notes passwords compromised hackers already hope anything sensitive notes,Bug,286974,
242,attic synonym noggin vice versa way like wiktionary thing,Bug,286975,
243,gave error first time uploading check images app crashed second time uploading check images,Bug,286976,
244,argh crashes time service application would great application didnt crash reading pdfs great works,Bug,286977,
245,settings yet phone doesnt alert relevant info plugged ipad version keeping better updates,Bug,286978,
246,looks like would great application downloads grades 1 classhm pretty useless right extremely disappointed since website difficult use iphone application many connection problems slow ill use crappy designed website application gives something useful see ill try back later,Bug,286979,
247,best pic edit application great application jus find remove text pic,Bug,286980,
248,installed 12th vid application frozen access application pics help,Bug,286981,
249,2114 let share recipes friends,Bug,286982,
250,really need know far restaurant current location take cab hotel fight traffics would like know whats near bad makings great application back yelp,Bug,286983,
251,load 2 minutes video even fast forward video used love application youI wouldiots ruined anyone know get new flash video player,Bug,286984,
252,always use dropbox upad newest version open pdf files upad anymore please update soon possible,Bug,286985,
253,installed update unusable crashes 100 time upon startup,Bug,286986,
254,installed 3gs took forever load tap blank white screen pissed,Bug,286987,
255,application used work flawlessly event update however even open get logo screen application crashes completely update rendered useless,Bug,286988,
256,none photos load even tho uploaded dropbox months ever since update none photos show dropbox white boxes app use load photos,Bug,286989,
257,need update post new chapter story upload cover story 0 keeps crashing,Bug,286990,
258,search engine complete searched house rentals healdsburg ca friends know 16 bampbs also results house rentals valley love trip advisor use often computer application doesnt provide proper search options,Bug,286991,
259,edit pdf want note something pdf,Bug,286992,
260,ok gods sake need new icon interface seems outdated,Bug,286993,
261,good bt satisfied reply tagging please add features,Bug,286994,
262,doesnt save progress online great game except doesnt save progress online mode smashing fools still stuck rank 11,Bug,286995,
263,good camera application nice camera application many effects except video recording please put video recording real time effects good application though,Bug,286996,
264,love application using long time year works great started show wrong stars even adjust moon happen new update please fix,Bug,286997,
265,problems simple machines forum crashing posting installed tapatalk freezes almost daily finish post reason alone keep using unfortunately limits access parts forum useful search forum see started thread see auto signatures use emoticons browsing shortcuts available tapatalk offers nothing near full browsing experience works thats enough,Bug,286998,
266,bought application worked good first time opens home page anything else disappointed,Bug,286999,
267,nice going loved application could match face anyway want till downloaded update hue saturation messed perfect change back,Bug,287000,
268,use application traveling six countries europe period three weeks flawless offline option always worked great expect map give distances place place get city want get around beat,Bug,287001,
269,love crashing new update,Bug,287002,
270,times worked awesome application total frustration takes forever load crashes lame,Bug,287003,
271,interface works great mapping nice bugI seen facebook integration times,Bug,287004,
272,listen lot however disconnect apparent reason disconnects repeat previous transmissions would like apd less fire ambulance great application,Bug,287005,
273,went made playlist unselected group podcasts button would go list pod casts could create playlists like news tech etc worked first playlist created work others create allow select podcasts strange please fix group podcast button dead creating one playlist successfully uninstalled reinstalled rebooted iphone etc please help awesome program otherwise lot podcasts need able group iphones hard installed video application really want use program versus iphones application please advise,Bug,287006,
274,crashes get anymore please fix,Bug,287007,
275,good ap usage activity points work shown add button selected fix problem,Bug,287008,
276,glad didnt pay 10 application every time try load crashes theres 5050 chance get alerts got application would know warnings help keep family safe would recommend application unless fix issues want something work time half time,Bug,287009,
277,new update doesnt work even open believe paid application found better apps free,Bug,287010,
278,crashes update,Bug,287011,
279,app hasnt worked month shows effort trying fix failed,Bug,287012,
280,even install navigation worst hurry fix change 4 star,Bug,287013,
281,everything would need simple weather application radar slow load another application theres lot detail information particularly details upcoming days forecast specific high low temp picture representation weather entire day nevertheless isnt meant detailed provides plenty info current time biggest complaint application crashes startup often sometimes load second time sometimes requires restart ipad 3rd generation nice looking application kind would want ipad stability problem,Bug,287014,
282,edit photos ipad way move iphoto application mac update mac please fix,Bug,287015,
283,effects really cool nothing like instagram application crashes every time try save needs fixed,Bug,287016,
284,upgrade keeps crashing even get work,Bug,287017,
285,doesnt load properly 3gs latest ios used show picture relating current weather anymore radar map takes forever load,Bug,287018,
286,thing good starting documents try upload documents google documents document gray,Bug,287019,
287,great application useless every address enter fails faithful constant user update searching another application actually works,Bug,287020,
288,paid 2000 version worked great update seriously nothing works greens tee boxes swimming pools greens,Bug,287021,
289,definitely download rerate 5 stars fixed unusable want option give 1 star bother putting brown rice special secrion may missed great way order avoid miscommunication staff love food ton,Bug,287022,
290,downloaded application could load physical card take advantage 10 free offer application openI rebooted phone deleted reinstalled application luck quality control thing,Bug,287023,
291,application great recent update crashes time download problem hopefully fixed,Bug,287024,
292,best application ever,Bug,287025,
293,first let say looks greatif could get stay 5 secondsthen crashes concept wonderful application appears nicely done user interface standpoint unstable big disappointment since use doctoral studies major failure mobility convenience categories0 10 usefulness,Bug,287026,
294,using application seemed great noticed posting facebook page even though opted deleted application doesnt give option fact,Bug,287027,
295,every time use crashes use 25 days pinger says give away number terrible application,Bug,287028,
296,application fine one thing really thing need isnt working attempted pay bill using credit card already file several minutes beach ball froze application go website pay bill,Bug,287029,
297,frustrating solution delete download application freezes camera launch happened last month please fix gladly give five stars,Bug,287030,
298,fun server apparently big users application keeps getting errors try open play get games havent able play day,Bug,287031,
299,aggravating first game wouldnt load got loading spinner game load 1 play try play againblack screen loading spinner waste money please fix,Bug,287032,
300,ever since ios 7 update dropbox worked constantly crashes run extremely slow problems camera uploading please fix asap,Bug,287033,
301,since update backup dropbox,Bug,287034,
302,ipad 1st gen update anymore want install dropbox device dropbox installed hate support previous ios version use,Bug,287035,
303,ipad works fine open dropbox every time open iphone 4 either crashes continuously pulls messiah making hard close needs fixed fast even current update day ago still crashing iphone needs fixed,Bug,287036,
304,care functionality looks review say nothing updated look major bugsproblems update longer given option open means look numbers spreadsheets open numbers work spreadsheets enter info major issue makes dropbox completely useless please fix,Bug,287037,
305,update makes harder slower use icons different file types look similar makes slower scan find desired file old version used colors made much faster use,Bug,287038,
306,inverted colors icon induce retinal images inapplication whiteout hard eyes experience ipad air one huge expanses white badly contrasting offwhitelight blue stencilthin pale icons battling brightness spartan look works fine iphone proportionately less white assaulting eye ipad however keep trying reduce brightness display impacts contrast legibility also possible change names files folders,Bug,287039,
307,since new update almost jpeg take much time open even open need save file see photo iphone old version,Bug,287040,
308,maximize slide show disappeared bad update,Bug,287041,
309,open crashes ipad,Bug,287042,
310,crappy hotel wifi goes trying download 1gb file 2 days reason dropbox allowed favorited downloads ability resume instead restarts download beginning every time fails almost 2014 technology resume download whats problem,Bug,287043,
311,poor job retaining starred items memory wait long time mp3 buffer star wait next time next time often buffer,Bug,287044,
312,needs less crazy,Bug,287045,
313,music takes 15 seconds load selected song doesnt matter verizon lte wifi also doesnt play next song automatically instead open application go back pick next song folder even hit next button skip tracks please fix next update running ios7 issues ios 6,Bug,287046,
314,download videos phone like come know yahoo would making deal dropbox,Bug,287047,
315,typically leave support feedback seem get response application crashes every time try open ipad 3rd gen use often iph5 reason doesnt work please update asap works,Bug,287048,
316,works platforms love keep changing phones every couple weeks application universal platforms need release application platforms like newer windows phone 8 like lumia 1020 true 5 stars till sky drive wins,Bug,287049,
317,always loved dropbox reliable handy newest version menu problems upload please fix thanks,Bug,287050,
318,issues moving files,Bug,287051,
319,install dropbox yesterday start app dialog box application wants location appears endless loop,Bug,287052,
320,able use please fix,Bug,287053,
321,new update doesnt detail whats changed application doesnt work black screen gray bar bottom please fix soon,Bug,287054,
322,get pop push notifications push ok pops back making completely inoperable tried changing push notification options doesnt fix,Bug,287055,
323,application never installed correctly see icon nevertheless always show app store updates always says installing update delete use appI ever seen zero stars joke,Bug,287056,
324,spent many hours successfully transporting pictures site froze needed export pictures locked frozen keep trying access application site success,Bug,287057,
325,somethings wrong last update view pdfs opening first time view anymore latest update fixed issue crashes also view pdfs without problem thanks lot work however still problem try using open option ipad applications ask open dropbox filed opened shows ipad dropbox application dropbox server updated meaning file found dropbox folders access folders different devicecomputer etc,Bug,287058,
326,downloaded latest update application disappeared app store let download,Bug,287059,
327,open goddamn application,Bug,287060,
328,open ipad 3 help crash crash crash,Bug,287061,
329,thanks dropbox thinking dropbox one greatest inventions since sliced bread one update access files photos gen 3 ipad know presidents day weekend someone fix please maybe enjoying time familysure would nice share pics,Bug,287062,
330,open saved files,Bug,287063,
331,automatic upload feature ridiculous intuitive easy way stop also delete function confusing sort dialog box informing delete photo ipad dropbox interface ask confirm want wife tried stop automatic upload hit delete prompt thinking may stop lost photos newborn recover thank dropbox lost us photos never get back,Bug,287064,
332,latest revision 10 january 2013 loops endlessly trying upload 411kb file email move another device,Bug,287065,
333,update en performance improved considerably 2 3 stars since last review however application remains pretty buggy constantly reports failure synch freezes momentarily actions crashes thee search function sometimes fails find key words borderline thinking going premium also keeping eye alternatives note problems may related incompatibility ipad2 ios7 previous review several months daily use building 1k pretty intensive notes process put serious longterm commitment en butI seriously rethink problems last upgrade problemsI experienced severe others reporting mine mostly ipad 2 version desktop version w macbook air continued work ok ipad things actually improved quite bit past week terms less freezes trying search wait see see en get together searches also become less efficient clunky ipad amp mac desktop versions still working en also standby looking possible alternatives many concerns w new design others hope en programmers stay focused real issues,Bug,287066,
334,love evernote become reliant one apps without however without crashes open open iphone load dec 12 update evernote please fix,Bug,287067,
335,application unbelievably buggy since last update trust using iphone desktop ipad,Bug,287068,
336,brilliant application crashes ipad iphone,Bug,287069,
337,dislike latest version notes randomly disappear listed wrong name usually one actually loved version prior one version making lose confidence notes actually saved,Bug,287070,
338,evernote excellent indispensable service life happy premium subscriber mobile application however seems getting progressively worse latest version clunky buggy mention announcements essentially ads occupy applications prime real estate extrapremium subscription would let hide focus workI would subscribe love document photo feature use daily latest application iteration though feature causes crash arg evernote evangelist honestly could recommend mobile application original review thanks hard work happy premium subscriber suggestion add ability copy note links,Bug,287071,
339,really wanted note system could trust evernote lost notes upgrade,Bug,287072,
340,seems evernote understand spirit ios 7 design seems flat sake flatness usability thrown door confusing use application simple actions painfully slow,Bug,287073,
341,okay evernote hope listening greatI wouldea note name call eversomething text formatting makes virtually impossible create note form rich text bullets numbered lists indentation etc maybe underlying code base architecture makes difficult create rich text proper formatting know fixed useful manI really tried like evernote synching ability among many platforms great go back onenote knows read really wish would understand huge weakness product done good amount googling around know one around wanting better text capabilities please fix really want need proper evernote,Bug,287074,
342,search function isnt working sign every time open evernote needs fix love evernote,Bug,287075,
343,beginning trust application 7 update quit working practical purposes watch patches post updated review really wanting application effective silly new process sell post notes,Bug,287076,
344,highlighting words works menu pops copy cut paste etc stay open long enough used placing cursor text keyboard open makes text jump every want cursor,Bug,287077,
345,notes showing notebooks empty boo,Bug,287078,
346,seems like evernote religion passed perhaps handy tools missing trainings obvious really notes bullet points spacing numbering fail transfer word systems resulting formatting problems take longer starting retyping notes also find left column flickers program crashes every use 1 4 syncs give error message aside like calling notes phone ipad desktop almost whenever want problematic version intended induce go another version doesnt fact version solidI would tempted buy upgrade,Bug,287079,
347,application workedI would give 4 stars shortly got several errors inability sync couldnt open notes says trouble reaching evernote server btw solution 1 tried reinstalling rebooting log using user name instead email vice versa whatever youre problem w try annoying happens works pretty good application help keep notes scribble email 1 place,Bug,287080,
348,todays update dated march 1 2013 horrible every single time open app defaults updated view notes select either title really want organize notes alphabetical order select created app immediately crashes closes tried 50 times tried rebooting ipadno avail tried deleting app together reloaded still problem fixed asap please effectively use notesits much hassle try look month note created even month alphabetical order rythme reason update always one biggest advocates proponents bug isnt fixed pronto delete evernote permanently use different app arghhhhhh,Bug,287081,
349,looking longest time save favorites feature button noticed appears ipad hold vertical position upright weird usually hold ipad trip advisor horizontal position sideways button nowhere found hope tripadvisor fixes ux usability issue soon,Bug,287082,
350,excellent application crashes ipod touch since last update open please fix soon possible,Bug,287083,
