,comment,label,id,margins
539,application imagine got anywhere without experience approx 98 accurate spoken directions necessity youre driving alone one improvement would spoken directions little earlier especially busy highwayI would recommend application anyone looking reliable accurate directions,Feature,287272,
540,3 days need least 5 days seems user friendly easy follow perhaps added ingredientsnot multiple entries onion per se,Feature,287273,
541,decent application finally notifications please give us multi account login google,Feature,287274,
542,needs improvement,Feature,287275,
543,needs play next song one ends definetely get 5 stars,Feature,287276,
544,great application works great playlists wish worked pandora definitely worth paying pay version c25k date,Feature,287277,
545,love brave version better original graphics much better love phrases says objective hitting 100 stupid know howI done improved status targets hit given tally drop much like distance markers end target segment,Feature,287278,
546,convenient use however able switch accounts without unlinking phone would great also improvement media player would also help,Feature,287279,
547,one feature add able import multiple photos camera roll better,Feature,287280,
548,inverted colors icon induce retinal images inapplication whiteout hard eyes experience ipad air one huge expanses white badly contrasting offwhitelight blue stencilthin pale icons battling brightness spartan look works fine iphone proportionately less white assaulting eye ipad however keep trying reduce brightness display impacts contrast legibility also possible change names files folders,Feature,287281,
549,would nice grid view photos auto upload camera roll also would nice rename files last review still fixed application doesnt support mobi file uploads would nice save mobi files,Feature,287282,
550,dropbox design ios 7 still less air drop new thing update iphone think 4 5 still rename files,Feature,287283,
551,wish could edit word documents great,Feature,287284,
552,thanks applicationbut add offline modfor exmple want save one video iphoneand play vlc,Feature,287285,
553,able text documents,Feature,287286,
554,could create docs inside application would great,Feature,287287,
555,still gallery camera upload mode,Feature,287288,
556,amazing thing make better ability export videos camara roll,Feature,287289,
557,hey dropbox team please add ability rename files well ability gifs play know,Feature,287290,
558,super easy copy pictures clipboard even save phone download videos,Feature,287291,
559,beautiful application needs ability share folders people go need able email links people sending tons individual links people feasible,Feature,287292,
560,please include option view thumbnail larger viewing photo folder,Feature,287293,
561,would love able print right application instead go browser open another application otherwise convenient,Feature,287294,
562,ive using dropbox quite sometime earned fair amount space love able access files iphone ipad macbook internet via anyone elses computer last 2 updates disabled save camera roll feature use time come across several times since new update please please add feature back know screen shot prefer clean cut copy receive without boarders saving images camera roll,Feature,287295,
563,love application wish could highlight words pdfs create bookmarks would possible piont,Feature,287296,
564,sign separate drop box accounts,Feature,287297,
565,put folders first files would put folder favorite thus putting files inside favorite,Feature,287298,
566,get push notifications things shared besides folders boyfriend photographer often sticks photos shared folder would like notification things arrive turned never get,Feature,287299,
567,fact search within folders extremely useful makes accessing files go far convenient also think latest style refresh big positive right direction use dropbox devices would like see sorting within application improved eg date good otherwise,Feature,287300,
568,please add support animated gifs,Feature,287301,
569,love application allowing keep notes organized synchrd across devices also love feature sharing stuff mates thing long collaboration notes,Feature,287302,
570,original ipad mini maybe thats part deal seems like still little thins need work example spell check doesnt work right search slow times neither others keep giving application great rating also think improvements hope see future one full screen mode maybe missing time get full screen start new noteI would like options reading editing keep good work,Feature,287303,
571,premium account use evernote business personal items day long frustrated new advertisement sectionI graced despite paying advertisements also logic behind new tag section really like tag section want organize pops find master list reminders application desktop version maybe havent looked hard enough seems gaping oversight calandra would nifty well,Feature,287304,
572,outstanding would nice pc application features available ios application,Feature,287305,
573,application present good features lot bugs missing hotkeys make writing easier,Feature,287306,
574,love pasting notes ever note paste passwords paste copies receipts anything need locate later easily find one location search option handy well wish instructions clearer,Feature,287307,
575,useful helpful application opinion thing missing video handling add pictures audio notes think able add videos,Feature,287308,
576,almost everything except allowing make quick diagram hand allow take pic record voice helps,Feature,287309,
577,become main notes program wish could handwriting love put outlook emails using note apps ipad,Feature,287310,
578,really great application tool manage multiple projects scattered notes wish calendar integration sub folders within stacks also evernote hello categorizing make mistake swear program,Feature,287311,
579,thanks evernote great application use daily keep glutenfree dairyfree recipes organized tip please allow search notebooks helpful locate ingredient rather searching within notebook individually also would love pay flat fee able access notes offline thanks,Feature,287312,
580,would give 5 stars two additional features ability use scroll bar ipad iphone rather swipe swipe swipe swipe get bottom note ability keyword search go keyword like laptop version search feature word good search within note find word two things ios please,Feature,287313,
581,user friendly easy use easy directed wished better gps function,Feature,287314,
582,great information available wish maps locations newer hotels updated also would love individual resort map resorts available view would great age property renovation dates included hotels,Feature,287315,
583,tend provide reviews fly wish could edit application also wished way respond replies one hotel accurately described tripadvisor misleading website point,Feature,287316,
584,application helpful honeymoon search would nice able enlarge photos though perfect,Feature,287317,
585,great application beautiful layout wish saved items could viewed offline,Feature,287318,
586,still landscape weird every application ability go either direction bad,Feature,287319,
587,need show bampb small inns,Feature,287320,
588,please add landscape support fatfingered users,Feature,287321,
589,great application one great application chat please increase upload limit useful,Feature,287322,
590,increase participants group increase participants group update,Feature,287323,
591,awesome bt please increase size videos send,Feature,287324,
592,galaxy gear support please create application galaxy gear read notifications gear would love option reply directly gear thanks,Feature,287325,
593,hope whatsapp sms though,Feature,287326,
594,one thing needed able subboards example would board food board food could sub board dessert healthy brunch,Feature,287327,
595,love great application way multi check pins editing deleting moving another board rather one time,Feature,287328,
596,ive addicted forever thing would change time want organized make another board wish move pin button place another board current technique repin delete old board,Feature,287329,
597,great complaint able change picture represents boards user friendlier way change settings customizeadd pictures boards,Feature,287330,
598,best great like nice good job please add frame free pack,Feature,287331,
599,perfect vry good application editingplz add interesting frame,Feature,287332,
600,wonderful could better tools builtin depending upon network connection,Feature,287333,
601,dropbox great service however use camera upload option ios 7 uploads original photo edited one otherwiseI would rate dropbox 5 stars,Feature,287334,
602,love service annotations pdfs disappeared dropbox since ios 7 update need back please,Feature,287335,
603,still ability change file names basic function hard believe amount time error messages simply trying move files response dropbox,Feature,287336,
604,hoped update would bring back open option didnt importing files apps major pain option removed please bring back,Feature,287337,
605,slow uploading poor background uploading really need 3h upload several megabyte video 10 mbit internet,Feature,287338,
606,share folders reason made dropbox first place ugh,Feature,287339,
607,add voice memo iphone,Feature,287340,
608,would easily 5 star application bestI wouldea ever loses 2 stars download one photo time huge inconvenience,Feature,287341,
609,even google drive refresh folders simple suggestions increase usability 1 currently leave folder come back wish refresh folder let refresh folder refresh button view changes files streamlined manner constantly compiling document computer using ipad check looks okay constantly editing photo want high quality true color representation thenrefresh 2 refresh button 3 button refreshes current folders contents 4 air smells bit refresh 5 stupidly simple add refresh button 6 mentos refresh button maker 7 theres space top left application header add refresh button nothing moment lonely 8 give r give e give f give r give e give give h spell easily implementable refresh button high utility even people know need yet yay,Feature,287342,
610,update would step could actually see pdfs,Feature,287343,
611,put things dropbox folder desktop find files date modified name etc application incomprehensible unmodifyable sorting function almost impossible find files within application find phone believe favorite challenge find,Feature,287344,
612,good cent updates notes vanish randomly keep getting sync error application needs added features,Feature,287345,
613,places menus old version missing new one application extremely helpful easy use much improved navigation,Feature,287346,
614,new update loads slower closes press back viewing photos update glitches like search method wish guys would make easier find resorts hotels similar ones previously looked like viewed months ago 5 star resort lazy river show similar resorts would like stay another place statecountry,Feature,287347,
615,impossible refine hotel search specific criteria beyond location price quality well done quality reviews coverage reasons use ta especially peak seasonal flows many us travel pets terrible time finding clean reliable hotels sites pet travel woefully inadequate hard would include additional search filter would bring helpful reviews would enhance site experience also improve field,Feature,287348,
616,get enough brilliant application switched samsung galaxy note 2 iphone noticed option switch timestamps unavailable samsung devices could included next update 5 star rating sorted,Feature,287349,
617,useful improved happy progress application many updates seem make change see names many boards needs wrapped text function board names long board names seen indexing slow many pins take weeks come search,Feature,287350,
618,video playback sucks wonderful application minus videos play one takes internet browser youtube please allow inapplication playback bypass nonsense,Feature,287351,
