index,Unnamed: 0,Bug_report,appTitle,bug_report,comment,date,id,original_text,score,text,userName,Unnamed: 12,Unnamed: 13
18243,651,1,Amazon,,"['late', 'update', 'really', 'ruin', 'application']",2019-03-22,519405,latest updates really ruined app,3,latest update really ruined application,Eva iversen,,
18246,654,1,Amazon,,"['not', 'load', 'product', 'review']",2019-03-19,519409,won't load the product or reviews.,2,will not load the product or review,Ari Jas,,
18262,670,1,Amazon,,"['shopping', 'list', 'not', 'load', 'give', 'error', 'message', 'say', 'try', 'later']",2019-03-22,519430,shopping list won't load. gives error message and says try again later.,3,shopping list will not load give error message and say try again later,Ashley Eilers,,
18277,685,1,Amazon,,"['application', 'keep', 'reset', 'poor', 'performance', 'new', 'novo', 'tablet']",2019-03-16,519448,the app keeps resetting. poor performance on new Lenovo tablet.,1,the application keep resetting poor performance on new novo tablet,Adam Collins,,
18292,700,1,Amazon,,"['not', 'really', 'thing']",2019-03-22,519501,not really my thing,1,not really my thing,Christine Dyson,,
18305,713,1,Amazon,,"['good', 'efficient', 'application', 'update', 'update', 'doe', 'not', 'work', 'not', 'open', 'application', 'soon', 'click', 'update', 'update', 'say', 'application', 'crash', 'reason', 'open', 'amazon', 'music', 'first', 'message', 'pop', 'be', 'amazon', 'shopping', 'application', 'crash', 'even_though', 'have', 'not', 'even', 'open', 'amazon', 'shopping', 'application', 'make', 'sure', 'amazon', 'shopping', 'application', 'not', 'run', 'background', 'need', 'fix', 'amazon', 'shopping', 'application', 'be', 'useless', 'waste', 'space']",2019-03-11,519523,"Was a good and efficient app, but since the update it does not work at all. Cannot open this app...as soon as I click on it it says that app has crashed for some reason. Then when I open amazon music, the first message that pops up is ""amazon shopping app has crashed"" even though I haven't even opened the amazon shopping app and made sure it wasn't running in the background. Needs to be fixed, but as of now it is a useless waste of space.",1,was a good and efficient application but since the update the update doe not work at all can not open this application soon a i click on the update the update say that application has crashed for some reason then when i open amazon music the first message that pop up is amazon shopping application has crashed even though i have not even opened the amazon shopping application and made sure amazon shopping application was not running in the background need to be fixed but a of now amazon shopping application is a useless waste of space,Dina Austin,,
18310,718,1,Amazon,,"['late', 'update', 'annoying', 'option', 'filter', 'deal', 'rather', 'endlessly', 'scroll', 'next', 'previous', 'button', 'appear', 'problem', 'be', 'take', 'back', 'top', 'list', 'time', 'go', 'next', 'page', 'totally', 'put', 'look', 'prime', 'today', 'be', 'deal']",2019-03-18,519530,"Latest update very annoying! No option to filter deals any more. Rather than endlessly scrolling through, next and previous buttons appeared. an only problem with this is that it takes me back to the top of the list every time I go to next page. Totally puts me off looking at Prime and Today's Deals.",1,latest update very annoying no option to filter deal any more rather than endlessly scrolling through next and previous button appeared an only problem with this is that it take me back to the top of the list every time i go to next page totally put me off looking at prime and today is deal,A Google User,,
18312,720,1,Amazon,,"['frustrating', 'use', 'show', 'product', 'not', 'navigate', 'touchscreen', 'stop', 'work', 'productive', 'use', 'phone', 'be', 'browser', 'visit', 'site', 'instead', 'use', 'application', 'feel', 'beta', 'release', 'maybe', 'even', 'alpha', 'use', 'site', 'instead', 'application', 'be', 'properly', 'functional', 'disappointing']",2019-03-10,519532,frustrating to use - shows you products that you can't navigate to because touchscreen stops working! It was more productive to use my phone's browser and visit the site instead of using the app. Feels like a beta release... maybe even alpha. Use the site instead till the app is properly functional. Disappointing.,2,frustrating to use show you product that you can not navigate to because touchscreen stop working it was more productive to use my phone is browser and visit the site instead of using the application feel like a beta release maybe even alpha use the site instead till the application is properly functional disappointing,Advocatus Leonibus,,
18314,722,1,Amazon,,"['horrible', 'lag', 'slow', 'application', 'click', 'photo', 'take', 'second', 'load', 'get', 'keep', 'tape', 'click', 'add', 'list', 'take', 'amount', 'time', 'application', 'need', 'optimize', 'speed']",2019-03-20,519534,"Horrible lag very slow app! When clicking a photo it takes about 40 seconds for it to load you got to keep taping it! Or when clicking ""add to list"" it takes the same amount of time... App needs to be optimized for speed",2,horrible lag very slow application when clicking a photo it take about second for it to load you got to keep taping it or when clicking add to list it take the same amount of time application need to be optimized for speed,TIMOTHY B,,
18315,723,1,Amazon,,"['sponsor', 'ad', 'unrelated', 'product', 'make', 'search_result', 'unreliable', 'clutter', 'be', 'frustrating', 'prefer', 'focus', 'search', 'quickly', 'find', 'specific', 'product', 'purchase', 'give', 'go', 'source', 'find', 'something', 'previously', 'easy', 'amazon', 'shame']",2019-03-19,519535,sponsored ads and unrelated products make search results unreliable. This clutter is frustrating to us that preferred a focused search to quickly find specific products for purchase. I now give up and go to another source to find something that previously was so easy on Anazon. Shame!,1,sponsored ad and unrelated product make search result unreliable this clutter is frustrating to u that preferred a focused search to quickly find specific product for purchase i now give up and go to another source to find something that previously was so easy on amazon shame,John Anon,,
18316,724,1,Amazon,,"['be', 'interesting', 'find', 'update', 'correctly', 'open', 'still', 'thing', 'month_ago', 'list', 'say', 'update', 'daily', 'right', 'topic', 'problem', 'vendor', 'application', 'have', 'try', 'update', 'application', 'itselfnothe', 'change']",2019-03-09,519536,"Is the intresting finds being updated correctly? When I open it, it still has things from over a month ago listed, and it says ""updated daily"" right at the top.Is there a problem on my end,or with the app? (I've tried updating the app itself,nothing changes)",2,is the interesting find being updated correctly when i open it it still has thing from over a month ago listed and it say updated daily right at the topic there a problem on my vendor with the application i have tried updating the application itselfnothing change,Juliana Stockton,,
18317,725,1,Amazon,,"['love', 'application', 'switch', 'samsung', 'not', 'sign', 'account', 'click', 'sign', 'get', 'suspect', 'look', 'page', 'say', 'problem', 'sign', 'send', 'code', 'still', 'not', 'let', 'access', 'account', 'be', 'fix', 'give', 'star', 'update', 'issue', 'resolve', 'thank']",2019-03-09,519537,I love this app but I just switched to the Samsung S10 and I can't sign in to my account. I click sign in and I get this suspect looking page saying there was a problem it sends me a code and still won't let me access my account. Once this is fixes I'll give more stars UPDATE: Issue resolved thank you!,5,i love this application but i just switched to the samsung s and i can not sign in to my account i click sign in and i get this suspect looking page saying there was a problem sign in sends me a code and still will not let me access my account once this is fix i will give more star update issue resolved thank you,Krystal Washington,,
18319,727,1,Amazon,,"['lately', 'application', 'not', 'auto', 'focus', 'scan', 'barcode', 'work', 'around', 'be', 'minimize', 'work', 'open', 'phone', 'integrate', 'camera', 'application', 'wait', 'work', 'around', 'auto', 'focus', 'switch', 'application', 'take', 'advantage', 'lens', 'be', 'focus', 'be', 'way', 'get', 'scan', 'barcode']",2019-03-11,519539,"Lately the app won't auto focus when scanning a barcode. My work around is to minimize it, open my phones integrated camera app. Wait for it to auto focus, switch to the Amazon app so it can take advantage of how the lens is focused. This is the only way can get it to scan a barcode.",2,lately the application will not auto focus when scanning a barcode my work around is to minimize my work around open my phone integrated camera application wait for my work around to auto focus switch to the application so it can take advantage of how the lens is focused this is the only way can get this to scan a barcode,Patrick Zweygardt,,
18320,728,1,Amazon,,"['application', 'be', 'buggy', 'heck', 'galaxy_note', 'buy', 'application', 'add', 'list', 'button', 'rarely', 'function', 'close', 'application', 'reopen', 'application', 'application', 'often', 'freeze', 'phone', 'be', 'not', 'new', 'version', 'however', 's', 'excuse', 'amazon', 'be', 'application', 'be', 'buggy', 'application', 'have', 'ever', 'download', 'phone', 'unacceptable', 'come', 'company', 'amazon', 'standard', 'extremely', 'high', 'everything', 'else', 'amazon', 'however', 'be', 'everything', 'else', 'amazon', 'application', 'be', 'horrible']",2019-03-17,519540,"The app itself is buggy as heck on my Galaxy Note 4. The buy it now and add to list buttons rarely function without closing the app and reopening it. It often freezes up. My phone is not the newest version, no. However, thats no excuse. Amazon's app is the most buggy app I've ever downloaded on this phone. Unacceptable, for this to come from such a company as Amazon, whose standards should be extremely high. Everything else about Amazon, however, is top notch. Its just this app is horrible.",2,the application itself is buggy a heck on my galaxy note the buy the application itself now and add to list button rarely function without closing the application itself and reopening the application itself the application itself often freeze up my phone is not the newest version no however thats no excuse amazon is application is the most buggy application i have ever downloaded on this phone unacceptable for this to come from such a company a amazon whose standard should be extremely high everything else about amazon however is top notch everything else about amazon just this application is horrible,Cory Phillips,,
18322,730,1,Amazon,,"['many', 'ad', 'see', 'sponsor', 'item', 'ad', 'relevant', 'item', 'be', 'get', 'annoy', 'use', 'application', 'application', 'be', 'slow', 'application', 'lot', 'application', 'be', 'get', 'overrun', 'ad', 'sponsor', 'item', 'even_though', 'product', 'match', 'search', 'criterion', 'exactly', 'show', 'irrelevant', 'item', 'see', 'have', 'search', 'have', 'search', 'need', 'make', 'easy', 'clear', 'search', 'history', 'go', 'set', 'different', 'screen', 'delete', 'time']",2019-03-16,519543,"Too. Many. Ads. You'll see 5 ""sponsored"" items (ads) to 1 relevant item. It is getting annoying to use this app now. The app is very slow. The app stutters a lot. The app is getting overrun by ads and ""sponsored"" items. Even though a product matches my search criteria exactly, you will be shown irrelevant items before you see what you've searched for. They need to make it easier to clear all searched history - without going through settings and different screens, or deleting one at a time.",1,too many ad you will see sponsored item ad to relevant item it is getting annoying to use this application now this application is very slow this application shutter a lot this application is getting overrun by ad and sponsored item even though a product match my search criterion exactly you will be shown irrelevant item before you see what you have searched for what you have searched need to make it easier to clear all searched history without going through setting and different screen or deleting one at a time,Mitchell Brown,,
18323,731,1,Amazon,,"['unreliable', 'not', 'fan', 'cluttered', 'interface', 'lose', 'connection', 'slow', 'freeze', 'crash', 'everytime', 'use', 'not', 'fan', 'cluttered', 'interface', 'went_wrong', 'desktop', 'version', 'be', 'much', 'smooth', 'application', 'need', 'serious', 'makeover', 'sorry', 'application', 'be', 'way', 'better']",2019-03-12,519544,"Very unreliable. Not a fan of the cluttered interface. Loses connection, slow, freezes, and crashes everytime I use it. ""oops. something went wrong."" The desktop version is much smoother. App needs a serious makeover. Sorry but the Ebay app is way better.",1,very unreliable not a fan of the cluttered interface loses connection slow freeze and crash everytime i use not a fan of the cluttered interface ops something went wrong the desktop version is much smoother application need a serious makeover sorry but application is way better,Air Jewel,,
18339,747,1,Amazon,,"['constantly', 'get', 'something', 'wrong', 'end']",2019-03-15,519562,constantly get something wrong on our end,1,constantly get something wrong on our end,Reece Felton,,
18341,749,1,Amazon,,"['page', 'option', 'never', 'load', 'disappointed']",2019-03-10,519564,"pages and option just never load, very disappointed",1,page and option just never load very disappointed,Michael licwinko,,
18346,754,1,Amazon,,"['application', 'keep', 'crash', 'even', 'be', 'not', 'open']",2019-03-17,519570,"App keeps crashing, even when it isn't open.",1,application keep crashing even when it is not open,A Google User,,
18350,758,1,Amazon,,"['bad', 'application', 'ever', 'not', 'log', 'not', 'shop', 'deleting']",2019-03-11,519574,Worst app ever! Can't log in so can't shop. Deleting!!!,1,worst application ever can not log in so can not shop deleting,Lisa Sanford,,
18353,761,1,Amazon,,"['having_trouble', 'opening', 'application', 'use', 'application']",2019-03-16,519580,having trouble opening the app and using it.,1,having trouble opening the application and using the application,kissarmychick,,
18383,791,1,Amazon,,"['not', 'work', 'update', 'disgust']",2019-03-19,519637,not working since update.. ugh.,1,not working since update disgusted,Krissi K,,
18392,800,1,Amazon,,"['be', 'shiite', 'application', 'ever', 'point', 'shiite', 'application', 'ever', 'be', 'suppose', 'ease', 'use', 'convenience', 'shiite', 'application', 'ever', 'make', 'log', 'card', 'info', 'have', 'yet', 'return', 'single', 'item', 'also', 'old', 'amazon', 'application', 'not', 'instal', 'have', 'version', 'take', 'valuable', 'space', 'phone', 'take', 'search', 'show', 'do', 'not', 'want', 'hate', 'old', 'amazon', 'application', 'useless', 'make', 'business', 'ababa']",2019-03-22,519698,This is the shittiest app ever. The point of this app is supposed to be ease of use and convenience. Except that it makes me log in my card info again when I have yet to return a single item. Also the old amazon app wont uninstall so I have two versions taking up valuable space on my phone. It takes you out of your search to show you bs you dont want. I hate this mfing app. Just useless. Im taking my business to Alibaba.,1,this is the shiite application ever the point of the shiite application ever is supposed to be ease of use and convenience except that the shiite application ever make me log in my card info again when i have yet to return a single item also the old amazon application will not instal so i have two version taking up valuable space on my phone it take you out of your search to show you b you do not want i hate the old amazon application just useless i making my business to ababa,camille416 colon,,
18394,802,1,Amazon,,"['application', 'keep_stopping', 'update', 'be', 'nerve', 'crack', 'have', 'go', 'search', 'search', 'crash', 'try', 'shop', 'fine', 'update', 'put', 'even', 'uninstale', 'instal', 'be', 'still', 'do', 'fix', 'rate', 'star']",2019-03-23,519701,App keeps stopping since update! It's nerve wracking when I have gone through a 1000+ SEARCH only for it to crash when I am trying to shop! It was fine before the update. Put it back. I even uninstalled and reinstalled and it's still doing it. Fix it and I'll rate 5 stars.,1,application keep stopping since update it is nerve cracking when i have gone through a search only for a search to crash when i am trying to shop it was fine before the update put it back i even uninstaled and installed and it is still doing it fix it and i will rate star,Cindy Muniz,,
18404,812,1,Amazon,,"['mostly', 'good', 'couple', 'huge', 'problem', 'check', 'inventory', 'click', 'size', 'color', 'clothing', 'useless', 'thing', 'webster', 'doe', 'not', 'do', 'webster', 'sometimes', 'fail', 'load', 'not', 'see', 'order', 'detail', 'clicking', 'order', 'go', 'straight', 'shipping', 'tracking', 'must', 'go', 'webster', 'purpose', 'application', 'be', 'create', 'form', 'work', 'vertical', 'display', 'purpose', 'application', 'function', 'exact', 'way', 'webster', 'application', 'fail', 'basic', 'requirement']",2019-03-23,519712,"Mostly good, but a couple huge problems. 1 - it has to ""check inventory"" when you click size or color on clothing, a useless thing the website doesn't do, and it sometimes fails to load after. 2 - you can't see order details, clicking on an order goes straight to the shipping tracking, you must go to the website. The purpose of an app is to create a form that works on a vertical display. It should function the exact same way as the website. This app fails that basic requirement.",2,mostly good but a couple huge problem it has to check inventory when you click size or color on clothing a useless thing the webster doe not do and the webster sometimes fails to load after you can not see order detail clicking on an order go straight to the shipping tracking you must go to the webster the purpose of an application is to create a form that work on a vertical display the purpose of an application should function the exact same way a the webster an application fails that basic requirement,A Google User,,
18408,816,1,Amazon,,"['unreliable', 'rarely', 'load', 'work', 'lot', 'white_screen', 'device', 'be', 'onerous', 'current', 'android', 'application', 'be', 'update']",2019-03-21,519716,"unreliable, rarely loads and works, a lot of white screens and unresponsiveness. device is OnePlus 6, most current Android OS. App is updated",1,unreliable rarely load and work a lot of white screen and unresponsiveness device is onerous most current android o application is updated,Nick T,,
18418,826,1,Amazon,,"['slow', 'unresponsive', 'application', 'phone', 'wish', 'list', 'order', 'load', 'slowly', 'cat', 'walk', 'room', 'item', 'detail', 'tap', 'option', 'color', 'size', 'prepare', 'wait', 'cat', 'give', 'someone', 'affection', 'happen', 'eventually', 'not', 'have', 'tap', 'begin', 'delivery', 'notification', 'sometimes', 'arrive', 'hour', 'late']",2019-03-23,519729,"The slowest and most unresponsive app on my phone. Wish List and Orders load as slowly as my cat walks across the room. In item detail, tap an option like color or size, and prepare to wait for my cat to give someone affection. It'll happen. Eventually. Or not. Then you'll have to tap again. And since the beginning of 2019 delivery notifications sometimes arrive up to 18 hours late.",2,the slowest and most unresponsive application on my phone wish list and order load a slowly a my cat walk across the room in item detail tap an option like color or size and prepare to wait for my cat to give someone affection it will happen eventually or not then you will have to tap again and since the beginning of delivery notification sometimes arrive up to hour late,NJ E,,
18419,827,1,Amazon,,"['lose', 'package', 'application', 'work', 'fine', 'notification', 'say', 'need', 'check', 'date', 'package', 'be', 'mark', 'address', 'address', 'be', 'right', 'try', 'deliver', 'wrong', 'city', 'many', 'time', 'issue', 'may', 'cancel', 'prime', 'keep', 'have', 'issue', 'lose', 'package', 'late']",2019-03-20,519730,[3.20.19 more lost packages. app works fine but my notification says I need to check my addtess. My package is marked undeliverable/wrong address. My address is right. They are trying to deliver to the wrong city. After so many times these the issues again? May CANCEL MY PRIME if this keeps up.] [8.18 Having issues with lost packages as of late.],2,more lost package application work fine but my notification say i need to check my date my package is marked undeliverablewrong address undeliverablewrong address is right they are trying to deliver to the wrong city after so many time these the issue again may cancel my prime if this keep up having issue with lost package a of late,T G,,
18422,830,1,Amazon,,"['crash', 'everytime', 'try', 'search']",2019-03-13,519735,crashes everytime I try to search,2,crash everytime i try to search,K Shaw,,
18451,859,1,Amazon,,"['month_ago', 'application', 'become', 'unbearably', 'lie', 'start', 'crash', 'lot', 'update', 'application', 'be', 'bad', 'ever', 'thankfully', 'mobile', 'site', 'work', 'wonderfully', 'chrome', 'browser', 'reason', 'keep', 'instal', 'be', 'delivery', 'notification', 'come', 'late', 'application', 'serf', 'purpose', 'shame']",2019-03-23,519788,"About a month ago this app became unbearably laggy and started crashing a lot. Update: The app is as bad as ever. Thankfully the mobile site works wonderfully with the Chrome browser. The only reason I keep this installed is for the delivery notifications, but now those are coming late and so the app serves zero purpose. Such a shame.",1,about a month ago this application became unbearably lay and started crashing a lot update this application is a bad a ever thankfully the mobile site work wonderfully with the chrome browser the only reason i keep this installed is for the delivery notification but now those are coming late and so this application serf zero purpose such a shame,Travis Holte,,
18471,879,1,Amazon,,"['application', 'would', 'not', 'work', 'version', 'doe', 'not', 'support', 'mobile', 'phone', 'aps', 'normally', 'use']",2019-03-22,519838,this app wouldn't work for me because the version doesn't support the mobile phone apps I normally use.,1,this application would not work for me because the version doe not support the mobile phone aps i normally use,A Google User,,
18473,881,1,Amazon,,"['have', 'idea', 'application', 'get', 'instal', 'phone', 'have', 'problem', 'instal', 'application', 'hate', 'kind', 'add', 'sure', 'hate', 'spend', 'time', 'dig']",2019-03-22,519840,Have no idea how this app got installed on my phone and I now have problems to uninstall it. I just hate these kind of adds and I sure hate to spend time to dig.,1,have no idea how this application got installed on my phone and i now have problem to instal this application i just hate these kind of add and i sure hate to spend time to dig,A Google User,,
18480,888,1,Amazon,,"['last', 'month', 'application', 'be', 'crash', 'regularly', 'fix', 'problem']",2019-03-23,519866,Since last month the app is crashing regularly. Please fix the problem.,2,since last month the application is crashing regularly please fix the problem,Tarique Asad,,
18482,890,1,Amazon,,"['not', 'able', 'install']",2019-03-23,519869,not able to install,1,not able to install,Prabhu Selva,,
18503,911,1,Amazon,,"['always', 'give', 'dog', 'error', 'say', 'op', 'must', 'something', 'end', 'return', 'home', 'error', 'still', 'occur', 'application', 'always', 'freeze', 'page', 'reload', 'lose', 'progress', 'be', 'not', 'fluid', 'application', 'surprise', 'give', 'amazon', 'be', 'resource']",2019-03-23,519919,"always gives me the dog error saying ""oops! it must be something from our end"" RETURN TO HOME but the error still occurs and the app always freezes or the page reloads and i lose progress, it is not a fluid app and im surprised given Amazon's resources",1,always give me the dog error saying ops it must be something from our end return to home but the error still occurs and the application always freeze or the page reload and i lose progress it is not a fluid application and i surprised given amazon is resource,William Wasser,,
18510,918,1,Amazon,,"['application', 'restart', 'need', 'fix']",2019-03-23,519939,app restart again and again need to fix,2,application restart again and again need to fix,Aziz Shaikh,,
18564,972,1,Amazon,,"['rubbish', 'application', 'always', 'get', 'blank_white', 'screen', 'refresh', 'get', 'blank_white', 'screen', 'not', 'stand', 'rubbish', 'application', 'never']",2019-03-22,520062,rubbish app. always get blank white screens and refresh just to get another blank white screen. can't stand it. never again.,1,rubbish application always get blank white screen and refresh just to get another blank white screen can not stand rubbish application never again,Jeramy Joyce,,
18566,974,1,Amazon,,"['application', 'not', 'load', 'product', 'order', 'past', 'month', 'uninstale', 'use', 'desktop', 'browser', 'go', 'forward']",2019-03-20,520067,"App hasn't loaded products or orders for me in the past ~8 months. Uninstalled now, will use desktop browser going forward.",1,application has not loaded product or order for me in the past month uninstaled now will use desktop browser going forward,David Sopkin,,
18569,977,1,Amazon,,"['be', 'terrible', 'amazon']",2019-03-20,520075,This is terrible for Amazon.,1,this is terrible for amazon,A Google User,,
