index,Unnamed: 0,Bug_report,appTitle,bug_report,comment,date,id,original_text,score,text,userName,Unnamed: 12,Unnamed: 13
17970,378,1,Amazon,,"['new', 'redesign', 'application', 'break', 'warehouse', 'deal', 'section', 'new', 'redesign', 'application', 'show', 'full', 'price', 'brand', 'new', 'item', 'need', 'open', 'item', 'select', 'use', 'price', 'even', 'weird', 'way', 'navigate', 'warehouse', 'deal', 'need', 'use', 'desktop', 'version', 'webster', 'get', 'option', 'available', 'outlet', 'section', 'be', 'not', 'available', 'application', 'star', 'be', 'handy', 'track', 'shopping', 'update', 'shopping', 'do', 'ne', 'webster', 'unfortunately', 'application', 'be', 'unusable']",2019-03-10,518951,"New re-design of app broke Warehouse Deals section. It shows only full price of brand new items. Need to open item to select ""used price"". Even before it was weird way to navigate through Warehouse Deals, but now I need to use desktop version of website to get all options available. Outlet section is not available in app either. *Two stars is only because it handy to track shopping updates. Shopping will be do ne through website, unfortunately app is unusable.",2,new redesign of application broke warehouse deal section new redesign of application show only full price of brand new item need to open item to select used price even before it was weird way to navigate through warehouse deal but now i need to use desktop version of webster to get all option available outlet section is not available in application either two star is only because it handy to track shopping update shopping will be do ne through webster unfortunately application is unusable,Lev Concrete,,
17973,381,1,Amazon,,"['frustrate', 'application', 'keep', 'give', 'error', 'time', 'view', 'particular', 'item', 'dog', 'picture', 'cute', 'do', 'not', 'make', 'total', 'lack', 'functionality']",2019-03-20,518955,"grr, its so frustrating that this app keeps giving an error every time you are viewing a particular item. the dog pictures are cute, but do not make up for the total lack of functionality.",1,gr its so frustrating that this application keep giving an error every time you are viewing a particular item the dog picture are cute but do not make up for the total lack of functionality,Toghrul Shukurlu,,
17977,385,1,Amazon,,"['application', 'be', 'horrible', 'application', 'doe', 'not', 'work', 'new', 'pixel', 'phone', 'amazon', 'not', 'work', 'connect', 'internet', 'soon', 'turn', 'amazon', 'disconnect', 'internet', 'amazon', 'work', 'fine', 'frustrated', 'do', 'not', 'know', 'problem', 'be', 'fix', 'problem']",2019-03-10,518963,"This app is horrible and it doesn't work on my new pixel phone. Amazon won't work when i am connected to the internet, but as soon as i turn it off and disconnect from the internet, it works fine. i am beyond frustrated ðŸ˜ ðŸ˜  and i don't know what the problem is or how to fix it!!!!!",2,this application is horrible and this application doe not work on my new pixel phone amazon will not work when i am connected to the internet but a soon a i turn amazon off and disconnect from the internet amazon work fine i am beyond frustrated and i do not know what the problem is or how to fix the problem,Lori Duel,,
17978,386,1,Amazon,,"['great', 'last', 'update', 'not', 'remove', 'item', 'cart', 'save', 'later', 'switch', 'cart', 'be', 'empty', 'message', 'even', 'int', 'have', 'go', 'home', 'click', 'cart', 'try', 'frustrate']",2019-03-17,518966,"was great until last update. cannot remove items from cart or save for later withiut it switching to a ""your cart is empty"" message even when it isnt. have to go to home and then click cart again to try again. very frustrating.",2,was great until last update can not remove item from cart or save for later without it switching to a your cart is empty message even when it int have to go to home and then click cart again to try again very frustrating,Randa Veazie,,
17980,388,1,Amazon,,"['not', 'impress', 'recent', 'update', 'have', 'ad', 'blocker', 'nothing', 'application', 'workscanot', 'search', 'mostly', 'nothing', 'load', 'take', 'while', 'figure', 'super', 'annoyed']",2019-03-16,518970,"Not impressed that with a recent update because if I have my ad blocker on, nothing in the app works...Can't search and mostly nothing loads. Took me a while to figure that out so super annoyed.",1,not impressed that with a recent update because if i have my ad blocker on nothing in the application workscanot search and mostly nothing load took me a while to figure that out so super annoyed,Brandon Martin,,
17983,391,1,Amazon,,"['application', 'be', 'okay', 'application', 'be', 'sluggish', 'slow', 'application', 'be', 'slow', 'application', 'phone', 'also', 'try', 'add', 'stuff', 'cart', 'tape', 'anything', 'slow', 'application', 'phone', 'really', 'slow', 'application', 'phone', 'not', 'add', 'first', 'tap', 'slow', 'application', 'phone', 'take', 'many', 'time', 'get', 'slow', 'application', 'phone', 'work', 'intend', 'go', 'tap', 'thing', 'add', 'something', 'list', 'expect', 'amazon']",2019-03-17,518973,"The app is okay, Except! It's very sluggish and slow. It's the slowest app on my phone also when trying to add stuff to my cart, (or taping on anything in the app really) it won't add on the first tap, it takes many times to get it to work as intended, same goes for tapping on other things, such as adding somthing to a list I expect more from Amazon",2,the application is okay except the application is very sluggish and slow the application is the slowest application on my phone also when trying to add stuff to my cart or taping on anything in the slowest application on my phone really the slowest application on my phone will not add on the first tap the slowest application on my phone take many time to get the slowest application on my phone to work a intended same go for tapping on other thing such a adding something to a list i expect more from amazon,Travis,,
17984,392,1,Amazon,,"['always', 'terrible', 'experience', 'nothing', 'ever', 'show', 'time', 'package', 'send', 'random', 'house', 'send', 'picture', 'random', 'doorstep', 'package', 'sit', 'package', 'well', 'service', 'do', 'not', 'limit', 'one']",2019-03-10,518974,Always a terrible experience. Nothing ever shows up on time. Packages are sent to random houses and I'm sent a picture of some random doorstep with my package sitting on it. Theres a million better services out there. Don't limit yourself to this one.,1,always a terrible experience nothing ever show up on time package are sent to random house and i am sent a picture of some random doorstep with my package sitting on my package there a million better service out there do not limit yourself to this one,George Ragen,,
17997,405,1,Amazon,,"['link', 'do', 'not', 'open', 'application', 'link', 'open', 'default', 'browser', 'instead']",2019-03-18,519023,"links do not open the app, they open the default browser instead.",1,link do not open the application link open the default browser instead,Henry Lantigua,,
18002,410,1,Amazon,,"['hard', 'get', 'toit', 'dint', 'put', 'shortcut', 'phone', 'have', 'go', 'stuff', 'get', 'stuflike', 'dint', 'ask', 'page', 's', 'star']",2019-03-18,519030,Hard to get to...it didnt put a shortcut on my phone so i have to go through all this stuff to get through all this stuff...like i didnt ask for this page. thats why only 2 stars!,2,hard to get toit dint put a shortcut on my phone so i have to go through all this stuff to get through all this stuflike i dint ask for this page thats why only star,A Google User,,
18003,411,1,Amazon,,"['constantly', 'run', 'slow', 'crash']",2019-03-17,519031,constantly runs slow and crashes,1,constantly run slow and crash,James Denisar-Green,,
18007,415,1,Amazon,,"['stop', 'work', 'freeze']",2019-03-12,519036,stops working. freezes,1,stop working freeze,morne marx,,
18012,420,1,Amazon,,"['crash', 'new', 'android', 'update']",2019-03-09,519042,Crashing since new android update,1,crashing since new android update,Ciaran Coghlan,,
18016,424,1,Amazon,,"['doe', 'not', 'love', 'amazon']",2019-03-22,519047,Who Doesn't love Amazon?,5,who doe not love amazon,A Google User,,
18043,451,1,Amazon,,"['not', 'ever', 'get', 'minute', 'take', 'ever', 'try', 'buy', 'something', 'buy', 'else']",2019-03-23,519130,can't ever get on under 20 minutes takes for ever to try and buy something I just buy else where!,2,can not ever get on under minute take for ever to try and buy something i just buy else where,Doug Kime,,
18056,464,1,Amazon,,"['terrible', 'horrible', 'bad', 'could', 'not', 'actually', 'log', 'be', 'many', 'security', 'prompt', 'could', 'not', 'get', 'pas', 'sign', 'have', 'verify', 'log', 'would', 'password', 'digit_code', 'verify', 'copy', 'code', 'send', 'copy', 'code', 'email', 'not', 'code', 'key', 'application', 'doe', 'not', 'let', 'toggle', 'aps', 'minimize', 'amazing', 'application', 'hit', 'send', 'code', 'access', 'act', 'email', 'come', 'back', 'sign', 'function', 'start', 'literally', 'keep', 'send', 'code']",2019-03-23,519144,"Terrible! Horrible! The worse! Couldn't actually log on. There's so many security prompts I couldn't get pass the sign in. You have to verify your log on id and password with a 5 digit code after you verify a copy code but they send it to you in an email not a code key. The app doesn't let you toggle between apps. If you minimize the AMZ app after you hit ""send code"" to access your acct email, when you come back to it the sign in function starts over again. It literally just keeps sending codes.",1,terrible horrible the worse could not actually log on there is so many security prompt i could not get pas the sign in you have to verify your log on id and password with a digit code after you verify a copy code but they send a copy code to you in an email not a code key the application doe not let you toggle between aps if you minimize the amazing application after you hit send code to access your act email when you come back to it the sign in function start over again it literally just keep sending code,Debby Spencer,,
18059,467,1,Amazon,,"['application', 'suck', 'crash', 'time', 'amazon', 'hate', 'application']",2019-03-20,519148,"app sucks, crashes all the time. i like amazon, but hate the app.",1,application suck crash all the time i like amazon but hate the application,A Google User,,
18068,476,1,Amazon,,"['application', 'doe', 'want', 'load', 'try', 'purchase', 'something', 'application', 'always', 'stay', 'load', 'forever', 'congratulation', 'amazon', 'lose', 'customer', 'application', 'could', 'not', 'process', 'simple', 'payment']",2019-03-19,519161,"The app doesnt want to load when I try to purchase something, it always just stays loading forever. Congratulations Amazon you just lost a customer because your app couldn't process a simple payment.",1,the application doe want to load when i try to purchase something the application always just stay loading forever congratulation amazon you just lost a customer because your application could not process a simple payment,joaquin cervantes,,
18069,477,1,Amazon,,"['last', 'week', 'application', 'doe', 'not', 'work', 'application', 'keep', 'crash', 'grin', 'home', 'page', 'have', 'instal', 'application', 'reset', 'phone', 'setting', 'instal', 'application', 'issue', 'persist', 'unable', 'use', 'amazon', 'application', 'show', 'uh_oh', 'something_went', 'wrong']",2019-03-18,519162,as of last week this app does not work it keeps crashing g on the home page so I have uninstall the app and reset the phone settings and reinstalled the app. The issue persist and I am unable to use amazon. The app shows uh-oh something went wrong.,1,a of last week this application doe not work this application keep crashing grin on the home page so i have instal this application and reset the phone setting and installed this application the issue persist and i am unable to use amazon this application show uh-oh something went wrong,Hector Santiago,,
18070,478,1,Amazon,,"['not', 'able', 'filter', 'deal', 'day', 'find', 'lightning', 'deal']",2019-03-17,519163,Not able to filter deal of the day and find the lightning deals,1,not able to filter deal of the day and find the lightning deal,William Stewart,,
18074,482,1,Amazon,,"['twice', 'miss', 'order', 'sense', 'not', 'contact', 'arrive', 'get', 'really', 'annoying']",2019-03-10,519168,twice i missed my order sense they wont contact me when they're arriving its getting really annoying,2,twice i missed my order sense they will not contact me when they are arriving its getting really annoying,Flame of Heaven,,
18077,485,1,Amazon,,"['keep', 'close', 'try', 'minimize']",2019-03-10,519171,it keeps closing down on me when I try to minimize it,1,it keep closing down on me when i try to minimize it,Alex William,,
18078,486,1,Amazon,,"['lock', 'sometimes', 'not', 'load', 'picture', 'option']",2019-03-13,519172,locks up. sometimes will not load pictures or options.,1,lock up sometimes will not load picture or option,Brandon Russell,,
18079,487,1,Amazon,,"['delete', 'function', 'save', 'item', 'list', 'doe', 'not', 'work']",2019-03-18,519173,the delete function on saved items in lists doesn't work,4,the delete function on saved item in list doe not work,Shelley R.,,
18081,489,1,Amazon,,"['unusable', 'crash', 'hit', 'search_bar']",2019-03-10,519175,Unusable as it just crashes when I hit the search bar.,1,unusable a it just crash when i hit the search bar,Ashley Velebit,,
18085,493,1,Amazon,,"['last', 'update', 'have', 'be', 'terrible', 'everything', 'load', 'slowly']",2019-03-22,519179,The last few updates have been terrible. Everything loads very slowly.,1,the last few update have been terrible everything load very slowly,Scott Greenwood,,
18088,496,1,Amazon,,"['everytime', 'pre', 'order', 'anything', 'keep', 'cancel', 'delay', 'way', 'long', 'even', 'have', 'pre', 'order', 'not', 'go', 'fulfil', 'not', 'use', 'application', 'anymore']",2019-03-19,519183,everytime i pre order anything they keep canceling it or delaying for way to long why even have pre orders if your not going to fullfill them not using this app anymore,1,everytime i pre order anything they keep cancelling it or delaying for way to long why even have pre order if your not going to fulfil they not using this application anymore,A Google User,,
18089,497,1,Amazon,,"['problem', 'crash', 'sometimes', 'deinstall', 'application', 'couple', 'time']",2019-03-10,519184,has a problem with crashing sometimes. Had to reinstall app a couple of times now.,3,has a problem with crashing sometimes had to deinstall application a couple of time now,Heidi Martins,,
18090,498,1,Amazon,,"['be', 'log', 'do', 'not', 'want', 'stay', 'log', 'log', 'bottom', 'page', 'uninstaling', 'go', 'back', 'log', 'internet']",2019-03-18,519185,where is the log out? I do not want to stay logged in. The log out was at the bottom of the page. I'm uninstalling and will go back to logging in through the internet.,1,where is the log out i do not want to stay logged in the log out was at the bottom of the page i am uninstaling and will go back to logging in through the internet,A Google User,,
18101,509,1,Amazon,,"['not', 'watch', 'deal', 'anymore']",2019-03-17,519202,cant watch deals anymore,1,can not watch deal anymore,A Google User,,
18107,515,1,Amazon,,"['application', 'be', 'slow']",2019-03-21,519208,app is too slow,1,application is too slow,chauncey white,,
18115,523,1,Amazon,,"['much', 'datum', 'open', 'application']",2019-03-23,519218,to much data to open this app,1,to much data to open this application,eliseo pimentel,,
18117,525,1,Amazon,,"['crash', 'lot', 'note']",2019-03-19,519220,crashes a lot for Note9,1,crash a lot for note,Royce Woodroffe,,
18124,532,1,Amazon,,"['not', 'open', 'setting']",2019-03-09,519230,won't open settings,2,will not open setting,Lori ODell,,
18131,539,1,Amazon,,"['application', 'not', 'load', 'old', 'long', 'work', 'do', 'instal', 'old', 'retry']",2019-03-09,519239,this app won't load and the old one no longer works do I uninstall the old one and retry ?,1,this application will not load and the old one no longer work do i instal the old one and retry,Robert Carter,,
18137,545,1,Amazon,,"['new', 'update', 'not', 'load', 'picture', 'zoom', 'product']",2019-03-11,519245,newest update won't load pictures to zoom in on products,4,newest update will not load picture to zoom in on product,Ethan St.Jean,,
18147,555,1,Amazon,,"['application', 'not', 'install', 'galaxy']",2019-03-19,519257,This app won't install on a galaxy S10.,1,this application will not install on a galaxy s,Mike Elliott,,
18163,571,1,Amazon,,"['keep', 'recommend', 'stuff', 'notification', 'click', 'consistently', 'say', 'uh_oh', 'something_went', 'wrong', 'end']",2019-03-19,519279,It keeps recommending stuff to me in my notifications then when I click it consistently says uh-oh something went wrong our end.,3,it keep recommending stuff to me in my notification then when i click it consistently say uh-oh something went wrong our end,Albert Cofie,,
18165,573,1,Amazon,,"['bad', 'online', 'shopping', 'experience', 'have', 'ever', 'even', 'bad', 'customer_service', 'cancel', 'membership', 'first', 'purchase', 'application', 'day']",2019-03-19,519281,Worst online shopping experience I've EVER had with even worse customer service! Cancelled my membership after first purchase and only had this app for 4 days!,1,worst online shopping experience i have ever had with even worse customer service cancelled my membership after first purchase and only had this application for day,Kacey Golden,,
18166,574,1,Amazon,,"['love', 'application', 'application', 'stopped_working', 'give', 'dog', 'error', 'everytime', 'load', 'application', 'weird', 'thing', 'be', 'check', 'set', 'stuff']",2019-03-13,519282,Loved this app until it stopped working and gives me the dog error everytime I load it. the weird thing is I can check my settings and stuff.,1,loved this application until this application stopped working and give me the dog error everytime i load this application the weird thing is i can check my setting and stuff,Nick W,,
18167,575,1,Amazon,,"['slow', 'load', 'load', 'time', 'crash', 'begin', 'not', 'use', 'update', 'fix', 'silly', 'part', 'be', 'use', 'blue', 'amazonready', 'phone']",2019-03-12,519283,"Slow to load, if it loads, most of the time it crashes at the beginning. Can't use it at all, no update fix it, and the silly part, is that I'm using a BLU Amazon-ready phone.",1,slow to load if it load most of the time it crash at the beginning can not use it at all no update fix it and the silly part is that i am using a blue amazonready phone,Gabriel X S.,,
18168,576,1,Amazon,,"['ever', 'update', 'constant', 'uh_oh', 'something_went', 'wrong', 'update', 'yet', 'update', 'still', 'something_went', 'wrong', 'issue', 'still', 'issue', 'update', 'later', 'still', 'issue', 'yet', 'update', 'be', 'gotten_worse']",2019-03-13,519284,"Ever since update.... Constant ""uh oh something went wrong"" *update* yet another update.... And still ""something went wrong"" all the same issues. Still issues 2/13/19 - Two updates later... still same issues. Yet another update 3/11/19, it's only gotten worse!...",1,ever since update constant uh oh something went wrong update yet another update and still something went wrong all the same issue still issue two update later still same issue yet another update it is only gotten worse,AleX V.,,
18172,580,1,Amazon,,"['update', 'application', 'be', 'awful', 'constantly', 'get', 'log', 'time', 'open', 'application', 'need', 'login', 'log', 'need', 'get', 'test', 'pascoe', 'order', 'sign', 'do', 'not', 'know', 'happen', 'update', 'application', 'be', 'awful', 'fix', 'update', 'application', 'amazon']",2019-03-17,519289,"The update to this app is awful. I constantly get logged out. Every time I open the app I need to login and then when I log in I need to get texted a passcode in order to sign in. I don't know what happened but this update is awful, fix it amazon!",1,the update to this application is awful i constantly get logged out every time i open the application i need to login and then when i log in i need to get tested a pascoe in order to sign in i do not know what happened but the update to this application is awful fix the update to this application amazon,Rees O'Donnell,,
18173,581,1,Amazon,,"['image', 'not', 'load', 'have', 'scroll', 'way', 'bottom', 'past', 'suggest', 'product', 'trash', 'clutter', 'screen', 'see', 'product', 'information']",2019-03-14,519292,"images won't load. I have to scroll all the way to the bottom, past the other suggested products and other trash cluttering the screen, just to see product information.",3,image will not load i have to scroll all the way to the bottom past the other suggested product and other trash cluttering the screen just to see product information,Johnny Rodriguez,,
18174,582,1,Amazon,,"['item', 'order', 'show', 'time', 'sometimes', 'actually', 'show', 'early', 'however', 'track', 'information', 'be', 'not', 'date', 'tracking', 'information', 'sometimes', 'post', 'update', 'morning', 'nothing', 'afterwards']",2019-03-11,519293,"Most of the items I ordered show up on time, but sometimes they actually show up early. However, the tracking information isn't as up to date as it should be. Sometimes they post an update in the morning and nothing afterwards.",4,most of the item i ordered show up on time but sometimes they actually show up early however the tracking information is not a up to date a the tracking information should be sometimes they post an update in the morning and nothing afterwards,Lawrence Seibert Jr,,
18180,588,1,Amazon,,"['update', 'open', 'application', 'application', 'be', 'blank', 'crash', 'have', 'go', 'amazon', 'chrome', 'amazon', 'defeat', 'purpose', 'application', 'be', 'not', 'improve', 'soon', 'uninstaling']",2019-03-16,519299,"Since the update, I open the app and it's just blank/or crashes. I've had to go to Amazon on Chrome so it defeats the purpose of the app. If this isn't improved soon, I'm uninstalling.",2,since the update i open the application and the application is just blank crash i have had to go to amazon on chrome so amazon defeat the purpose of the application if this is not improved soon i am uninstaling,Jai V,,
18182,590,1,Amazon,,"['something', 'change', 'recent', 'update', 'cart', 'icon', 'consistently', 'display', 'wrong', 'number', 'item', 'everything', 'cart', 'randomly', 'disappear', 'terrible']",2019-03-17,519304,"Something changed with a recent update. The cart icon consistently displays the wrong number of items, and everything in my cart randomly disappears. Terrible.",1,something changed with a recent update the cart icon consistently display the wrong number of item and everything in my cart randomly disappears terrible,Jason Wayne,,
18185,593,1,Amazon,,"['open', 'application', 'application', 'open', 'purchase', 'prime', 'page', 'payment', 'info', 'already', 'impute', 'basically', 'try', 'trick', 'purchase', 'prime_membership', 'not', 'pay', 'attention']",2019-03-14,519307,"When you open the app, it opens to the ""purchase prime"" page with my payment info already inputed. Basically tries to trick you into purchasing a Prime membership if you're not paying attention.",1,when you open the application the application open to the purchase prime page with my payment info already imputed basically try to trick you into purchasing a prime membership if you are not paying attention,Natalie G,,
18186,594,1,Amazon,,"['click', 'image', 'see', 'large', 'picture', 'doe', 'not', 'work', 'large', 'picture', 'show', 'blank_screen', 'never', 'load', 'search', 'not', 'specific', 'enough', 'show', 'unrelated', 'item', 'also', 'filter', 'show', 'prime', 'item', 'do', 'not', 'qualify', 'frustrating', 'application']",2019-03-17,519308,"Clicking on an image to see a larger picture doesn't work, it just shows a blank screen that never loads. Searches are not specific enough showing unrelated items, also when you filter to show prime only some items do not qualify. A frustrating app.",1,clicking on an image to see a larger picture doe not work a larger picture just show a blank screen that never load search are not specific enough showing unrelated item also when you filter to show prime only some item do not qualify a frustrating application,Alex Daley,,
18192,600,1,Amazon,,"['bad', 'slave', 'drive', 'organization', 'planet', 'not', 'begin', 'say', 'much', 'hate', 'bad', 'slave', 'drive', 'organization', 'planet', 'good', 'luck', 'deal', 'bad', 'slave', 'drive', 'organization', 'planet', 'way']",2019-03-18,519315,Worst slave driving organization on this planet. I can't begin to say how much I hate them. Good luck dealng with them in any way.,1,worst slave driving organization on this planet i can not begin to say how much i hate worst slave driving organization on this planet good luck dealing with worst slave driving organization on this planet in any way,Timothy Duerr,,
18193,601,1,Amazon,,"['filter', 'option', 'have', 'disappear', 'deal', 'section', 'not', 'good', 'user', 'experience', 'try', 'view', 'current', 'upcoming', 'deal']",2019-03-15,519316,Filter options have disappeared from the deals section. Not a good user experience when trying to view current and upcoming deals.,1,filter option have disappeared from the deal section not a good user experience when trying to view current and upcoming deal,A Google User,,
18213,621,1,Amazon,,"['application', 'longer', 'open', 'nothing', 'white_screen']",2019-03-09,519364,App no longer opens. Nothing but white screen.,1,application no longer open nothing but white screen,A Google User,,
18240,648,1,Amazon,,"['application', 'doe', 'not', 'work', 'update']",2019-03-20,519402,App does not work since update on the 18/03/2019,1,application doe not work since update on the,Tammie Polls,,
