,tweet-id,timestamp,likes,replies,retweets,text
3433,1105934398174711808,2019-03-13 20:51:22,2,0,1,atuser building such a big empire and let such a big empire get down that way what a cruelty fix such a big empire fix such a big empire fix such a big empire fix such a big empire fix such a big empire fix such a big empire fix such a big empire fix such a big empire fix such a big empire fix such a big empire fix such a big empire fix such a big empire fix such a big empire fix such a big empire fix such a big empire quickly url
3434,1105934368642646022,2019-03-13 20:51:15,0,0,0,atuser you should bloody do something face-on paint working on my phone my phone keep saying error code whatever of that is i have updated my phone uninstaled my phone reset my phone s five time and my phone will not work i can not comment on my bloody post and my phone doing the same on my laptop
3435,1105934367476641798,2019-03-13 20:51:15,0,0,0,atuser please fix the outage i need to send pic to a friend
3436,1105934352980992000,2019-03-13 20:51:11,1,0,0,atuser and atuser this is horrible for small business please get this fixed businesowners entrepreneurlife smalbusines
3437,1105934303505121285,2019-03-13 20:50:59,0,0,0,atuser fix your platform
3438,1105934107870138368,2019-03-13 20:50:13,0,0,0,atuser just a head up both face-on and messenger are malfunctioning this is also affecting instagram url
3439,1105934062311489536,2019-03-13 20:50:02,0,0,0,what the hell is actually wrong with you people you run a social medium platform not a video platform or an intense online game platform is a bunch of text and you guy can not keep a social medium platform not a video platform or an intense online game platform stable for the life of you coming from a developer and a social medium platform not a video platform or an intense online game platform professional you guy are really bad
3440,1105934036977897473,2019-03-13 20:49:56,0,0,0,i swear hurry up and fix this shit
3441,1105933977318318080,2019-03-13 20:49:42,0,0,0,atuser so i logged in got a message about content update and policy change and then every post give me an error image below are you telling me to leave url
3442,1105933976559120385,2019-03-13 20:49:41,0,0,0,it will not let me log into my account ah it say network error i am doing all the right contact info
3443,1105933974415855617,2019-03-13 20:49:41,0,0,0,oh shit thats so bad fuck bug
3444,1105933918572732416,2019-03-13 20:49:28,0,0,0,atuser can you guy please fix your issue url
3445,1105933850209865728,2019-03-13 20:49:11,0,0,0,atuser entire relation to your thing is broken can not access anything that requires face-on just started about an hour ago i need to access coin master please fix the issue before my village is destroyed and my coin are stolen and i have to return before my spin fill
3446,1105933806924644354,2019-03-13 20:49:01,0,0,0,atuser need to fix the problem everyone having wwf
3447,1105933776528519168,2019-03-13 20:48:54,0,0,0,atuser atuser atuser atuser atuser atuser atuser face-on and instagram both down twitter do not fail u now facebokdown face-on instagramdown instagram twiterurl
3448,1105933686908899329,2019-03-13 20:48:32,2,0,0,are you fixing it
3449,1105933644194111490,2019-03-13 20:48:22,1,0,0,atuser face-on whatsit instagram down or not working properly the only day i need to share a document any update on the issue and the solution
3450,1105933615517614092,2019-03-13 20:48:15,0,0,0,i am able to log on using firebox but not chrome keep getting error
3451,1105933569057280001,2019-03-13 20:48:04,0,0,0,atuser any luck with a fix yet
3452,1105933501034102784,2019-03-13 20:47:48,0,0,0,atuser and atuser please work fast and fix yo bug i need you instagramdown facebokdown
3453,1105933460923920384,2019-03-13 20:47:38,0,0,0,then wa the issue
3454,1105933435699380236,2019-03-13 20:47:32,0,0,0,atuser i can not post anything on my tideline is there a problem
3455,1105933365021208579,2019-03-13 20:47:16,0,0,0,well hurry i need my coin master fix
3456,1105933271802757121,2019-03-13 20:46:53,0,0,0,please fucking fix this already
3457,1105933249090596865,2019-03-13 20:46:48,0,0,0,is face-on working am still having trouble
3458,1105933117704073218,2019-03-13 20:46:17,1,0,0,atuser atuser you better hurry up and fix this url
3459,1105933071860277248,2019-03-13 20:46:06,0,0,0,atuser atuser i need to send some file please in the name of all god fix the f problem thanks best regard
3460,1105933045457174528,2019-03-13 20:45:59,0,0,0,atuser hurry ya as up and fix this shit
3461,1105933033314676736,2019-03-13 20:45:57,0,0,0,i can not access to my instal please fix my instal social medium is the only way that i can communicate to my family or knowing what is happening in my mother country venezuela blackoutvenezuela
3462,1105932998019608577,2019-03-13 20:45:48,0,0,0,atuser fix your shit
3463,1105932961336225792,2019-03-13 20:45:39,0,0,0,atuser help me trying to use the application on my phone and my phone keep saying error my phone letting me log in on my pad and on safari atuser may you might be able to help
3464,1105932856742813696,2019-03-13 20:45:14,0,0,0,you better be fucking quick to fix it url
3465,1105932849897721856,2019-03-13 20:45:13,0,0,0,please solve this problem
3466,1105932749783756800,2019-03-13 20:44:49,0,0,0,atuser atuser and whatever else you control fix this shit i adding at work its been hour today will go down in social medium history that you suck right now facebokdown instagramblackout
3467,1105932749637070848,2019-03-13 20:44:49,0,0,0,atuser error url
3469,1105932626567839744,2019-03-13 20:44:20,0,0,0,please fix the problem thank you
3470,1105932537203953664,2019-03-13 20:43:58,1,0,0,atuser atuser what the heck all day you can not fix your stupid problem let go fix your problem
3471,1105932444677607425,2019-03-13 20:43:36,0,0,0,dear mark zuckerberg really i do not know if you will read this message from me my name is intel charmouth i am c ing from algeria you know the situation in what our land is facing please our do not have any power to face the bad strategy
3472,1105932372883767309,2019-03-13 20:43:19,1,1,0,atuser hour of this issue can not access this issue from any new phone or computer device somehow can access this issue through an old sealink phone but nothing else confused what is going on url
3473,1105932256567267328,2019-03-13 20:42:51,0,1,0,dear mark zuckerberg really i do not know if you will read this message from me my name is intel charmouth i am c ing from algeria you know the situation in what our land is facing please our do not have any power to face the bad strategy from our ruler except by passing t
3474,1105932226376724483,2019-03-13 20:42:44,0,0,0,hurry up face-on i adding without ig ya need to fix this immediately
3475,1105932144705187840,2019-03-13 20:42:25,0,0,0,still no fix huh
3476,1105932089147514880,2019-03-13 20:42:11,0,0,0,atuser there is an issue with sending photo on messenger
3477,1105932052514394113,2019-03-13 20:42:03,0,1,0,its now been down for most of the day now whats the problem so is instagram how much longer
3478,1105931999615827970,2019-03-13 20:41:50,0,0,0,atuser down for required maintenance and should be back up in a few minute that is your problem you can not tell time it is been hour thank you for making me miss my live chat meeting might a well be march
3479,1105931934885183488,2019-03-13 20:41:35,0,0,0,atuser atuser fix yo bullshit rn bitch i bored
3480,1105931921719070720,2019-03-13 20:41:32,0,0,0,atuser you have broken many heart with your neglectful nature i myself can not even play gun of glory or homescapes laugh out loud what am i suppose to do now read a book laugh my as off
3481,1105931846817329154,2019-03-13 20:41:14,0,0,1,atuser talk about their issue facebokdown facebokurl
3482,1105931821320204289,2019-03-13 20:41:08,0,0,0,atuser what the fuck is going on with instagram and whatsit not all my friend have an phone so we can use image so please fix this fucking mess right now
3483,1105931796942868480,2019-03-13 20:41:02,0,0,0,good and atuser we are having the same problem i hope you guy are on it a well
3485,1105931763023413248,2019-03-13 20:40:54,0,0,0,atuser just want to report a minor bug your error page still say facebokdownurl
3487,1105931703019864067,2019-03-13 20:40:39,4,0,0,fix it this it been hour like what the fuck is going on
3488,1105931693746282496,2019-03-13 20:40:37,0,0,0,you need to fix this
3489,1105931687656083456,2019-03-13 20:40:36,0,0,0,it would be nice to know this before i spend minute on writing something long on face-on just to get an error and all the writing data lost at least save the text or warn people on your site its by the way already acting out in belgium since day ago instagram too
3490,1105931668215554053,2019-03-13 20:40:31,0,0,0,any idea when you will have the issue fixed
3491,1105931623768444928,2019-03-13 20:40:20,0,0,0,atuser yo messenger application broke fam
3492,1105931506118201344,2019-03-13 20:39:52,0,0,0,atuser fail laugh out loud
3493,1105931418256003074,2019-03-13 20:39:31,0,0,0,atuser i can not connect to my instagram either is this part of the problem
3494,1105931414728597504,2019-03-13 20:39:31,0,0,0,atuser this was hour ago and the issue is still not resolved update url
3495,1105931407296204800,2019-03-13 20:39:29,0,0,0,please fix soon i have a business ran through face-on that i can not access
3496,1105931383913041920,2019-03-13 20:39:23,0,0,0,atuser hey there an issue with face-on and messenger face-on keep closing and messenger get a server non reliable error when trying to send photo
3497,1105931334487298048,2019-03-13 20:39:12,0,0,0,atuser atuser you need some fixing facebokdown instagramdown
3498,1105931331496751104,2019-03-13 20:39:11,0,0,0,hour later still broken
3499,1105931241860284421,2019-03-13 20:38:49,0,0,0,fix your shit
3500,1105931236873244673,2019-03-13 20:38:48,0,1,0,atuser seems to randomly not be allowing me to post or reply i wonder if it is my account or a bigger issue anyone anyone can anybeuler tell me
3501,1105931148629299200,2019-03-13 20:38:27,0,0,0,i can not add or log in to my instagram other account can you please fix it a i meeting mail from the application of fixing it but it doe help
3502,1105931051384401920,2019-03-13 20:38:04,0,0,0,atuser can you please fix whatever is wrong
3503,1105931044354752514,2019-03-13 20:38:02,0,0,0,yo while your on it you want to fix you video quality ya always making my edits look like my edits went through a potato while my camera roll show hd
3504,1105931029225697280,2019-03-13 20:37:59,0,0,0,atuser look guy i tried hitting login again it supposedly let me in no error message but then i get a blank page i am logged in i guess but i can not see tutin could you pretty please get your act together
3505,1105931007104966656,2019-03-13 20:37:53,0,0,0,face-on failure can not leave a message and press please quick fix to
3506,1105930999542829056,2019-03-13 20:37:52,0,0,0,i also faced same problem
3507,1105930981943332864,2019-03-13 20:37:47,0,0,0,please fix this immediately
3508,1105930941279686656,2019-03-13 20:37:38,0,0,0,i just think it is super crappy how long it is taking for you to fix it hour is ridiculous url
3509,1105930912246710272,2019-03-13 20:37:31,0,0,0,get off of twitter fix yo shit
3510,1105930892311228419,2019-03-13 20:37:26,0,0,0,i deleted and installed and can not login is there still a problem
3511,1105930824967319552,2019-03-13 20:37:10,0,0,0,it is been six hour fix yourself
3512,1105930815412862976,2019-03-13 20:37:08,0,0,0,error code i mean what the fuck
3513,1105930814968221696,2019-03-13 20:37:08,0,0,0,i am in canada and when i use my usual goole chrome browser a i always do i have no face-on page at all when logged in so i can not see my stuff or anyone elseshas this been a problem a well with other issue you havethe page is blank and look like you havethe page will not stop loading
3514,1105930794760093697,2019-03-13 20:37:03,0,0,0,can you fix it fast algerian people can not wait more to screw up the algerian govt this nonauememandat
3515,1105930744344596481,2019-03-13 20:36:51,0,0,0,my face-on game time clock are ticking away laugh out loud hope problem is resolved soon
3516,1105930718910177280,2019-03-13 20:36:45,0,0,0,i am never layout from on my face-on account when i try open then getting error can not posting anything and comment on face-on now come on twitter congratulation face-on happy birthday but can not login
3517,1105930680322555904,2019-03-13 20:36:36,0,0,0,i am so frustrated can not even log into my face-on due to error message how long till its gon na be fixed
3518,1105930597178986498,2019-03-13 20:36:16,0,0,0,atuser fix your commenting feature please i can not comment on anything
3519,1105930529780699136,2019-03-13 20:36:00,0,0,0,atuser any update about the currently issue
3520,1105930487636254721,2019-03-13 20:35:50,30,2,1,eta on this whole fixing a multi million dollar application thing just saying
3521,1105930454333620225,2019-03-13 20:35:42,0,0,0,atuser well someone screwed up did not they how can it take a company a rich a face-on with a many server platform and suchlike setup to resolve an issue where basically they entire site and other platform do not work what a shamble of a technical team
3522,1105930415444017154,2019-03-13 20:35:32,0,0,0,atuser i thing problem will be solved
3523,1105930358397247489,2019-03-13 20:35:19,0,0,0,what is the problem
3524,1105930316399685633,2019-03-13 20:35:09,0,0,0,atuser is there a problem with face-on at the moment
3525,1105930297592274944,2019-03-13 20:35:04,0,0,0,my error message say i should be able to log back in in a few minute face-on has a strange sense of what a minute is
3526,1105930278848081927,2019-03-13 20:35:00,0,0,0,first it was government shutdown which was horrible for many now it face-on shutdown i need to work face-on my business is on my business page of face-on
3527,1105930263736012801,2019-03-13 20:34:56,0,0,0,enter in the server and do restart will resolve the problem
3528,1105930261420740609,2019-03-13 20:34:56,0,0,0,atuser its also like this on laptop and computer not just phone fix its
3529,1105930256249167872,2019-03-13 20:34:54,0,0,0,old lady can live without face-on for a while fix instagram
3530,1105930245469810688,2019-03-13 20:34:52,0,0,0,atuser and atuser and also fbmesenger is also affected by the issue that prevent posting globally
3531,1105930221868539907,2019-03-13 20:34:46,0,0,0,fix the problem i was trying to reset my password too and my password fucked up
3532,1105930212469080066,2019-03-13 20:34:44,0,0,0,atuser brother fix this shit
3533,1105930139182026752,2019-03-13 20:34:27,0,0,0,atuser please resolve this issue my work is internet and face-on based and i can not meet client deadline if i can not get on face-on or instagram facebokdown
3534,1105930031593857024,2019-03-13 20:34:01,0,0,0,yup i am definitely having a problem with face-on not happening a of pm wed
3535,1105930027953258499,2019-03-13 20:34:00,0,0,0,this is really bad can not login in face-on now and before can not login the game this is really bad
3536,1105930022219628544,2019-03-13 20:33:59,1,0,0,who broke the api and why do you not have a golden image or backup of everything so the turn around time for remediation is quicker
3537,1105930012027318272,2019-03-13 20:33:56,0,0,0,fix it please i amarna wish someone a happy birthday shush
3538,1105929889834622976,2019-03-13 20:33:27,0,0,0,i have been getting atuser error message since last night
3539,1105929750390816768,2019-03-13 20:32:54,0,0,0,in the meantime i adjust read fabric while you guy are working on fixing fabric url
3540,1105929626344255488,2019-03-13 20:32:24,0,0,0,i run a small business on my face-on if you promote my business for free i will not talk bad about you worthashot
3541,1105929594950033410,2019-03-13 20:32:17,0,0,0,someone got their feeling hurt really bad and broke face-on over it
3542,1105929573168963585,2019-03-13 20:32:12,0,0,0,when will you resolve the issue
3543,1105929566059675654,2019-03-13 20:32:10,0,0,0,please fix it
3544,1105929510036353025,2019-03-13 20:31:57,0,0,0,atuser can you help me i have a problem with my account i send a dm take a look a soon a possible please
3545,1105929465631334402,2019-03-13 20:31:46,0,0,0,i having issue logging in getting an error code
3546,1105929220499267584,2019-03-13 20:30:47,0,0,0,atuser trying to post new event and edit them getting image error getting all kind of error with it too can not add cover photo either
3547,1105929206599421954,2019-03-13 20:30:44,0,0,0,atuser is broken can not post like or comment
3548,1105929186533928961,2019-03-13 20:30:39,0,0,0,its been down way to long how many face-on worker doe it take to fix these problem con with all those brain it should have been fixed by now get it up already face-on ceo
3549,1105929179856551937,2019-03-13 20:30:38,0,0,0,atuser would you please fix this issue a soon a possible wth is going on
3550,1105929175158919169,2019-03-13 20:30:37,0,0,0,atuser atuser get the problem sorted facebokdown instagramnotworking
3551,1105929080271101952,2019-03-13 20:30:14,0,0,0,thank godplease fix godplease a soon a possible
3552,1105929075321913348,2019-03-13 20:30:13,0,0,0,the first time i have the bravery and want to do st to save myself from the hopeless secret love but you crash what the fuck
3553,1105929068732706816,2019-03-13 20:30:11,0,0,0,for the love of bob just take a hammer to the damn thing and fix a hammer already it is been hour and counting now url
3554,1105928937056669697,2019-03-13 20:29:40,0,0,0,atuser atuser instagramdown instagram it has been hour since my instagram has been broke why int it fixed you said you would fix it and we are still all waiting seriously
3555,1105928935471235072,2019-03-13 20:29:40,0,0,0,atuser and atuser why so glitch today
3556,1105928922305191936,2019-03-13 20:29:36,0,0,0,when you have to go twitter to find out there is an issue with face-on
3557,1105928861542420482,2019-03-13 20:29:22,0,0,0,atuser come the fuck what are ya doing are you fucking sucking each other off this is bullshit always making excuse to fix shit that not even broken
3558,1105928839786647553,2019-03-13 20:29:17,0,0,0,can someone tell me when face-on will back sorry my bad english
3559,1105928794844680192,2019-03-13 20:29:06,0,0,0,atuser face-on fix your application atuser face-on is force quitting and atuser face-on is getting annoying
3560,1105928790545297408,2019-03-13 20:29:05,4,1,0,right now the domestic violence on the rise a we speak because candy crush is out of order stats if your addiction to pretend gamble or word with friend made spouse look at each other today will your addiction to pretend gamble or word with friend get along if anger of being away from wife is bad this kiss a bad url
3561,1105928784841269249,2019-03-13 20:29:04,13,0,0,please fix this a soon a possible oh and there is a made up video going on of mark luck telling people he is shutting down face-on just to let you know yo url
3562,1105928744424927232,2019-03-13 20:28:54,0,0,0,face-on using twitter to tell people at people problem nice
3563,1105928466543886336,2019-03-13 20:27:48,0,0,0,atuser would be broke the day i trying to unload these picture to the marketplace slightly bothered url
3564,1105928411858509824,2019-03-13 20:27:35,5,0,0,waiting on face-on to resolve the issue in the network of family url
3565,1105928385530859520,2019-03-13 20:27:28,0,0,0,dear face-on founder markzuckerberg we have the hindustan brother of id from post comment like and share nothing happening please id safe guaranteed to be given and the earliest solution to this problem all hindu from the side of thank you jai jai sri ram
3566,1105928367684104192,2019-03-13 20:27:24,0,0,0,atuser confirmed that the issue is being worked on facebokdownurl
3567,1105928335060697088,2019-03-13 20:27:16,2,0,0,yes when i go to tag people in post ok face-on tag people coming up with network error please be fixed soon thanks face-on
3568,1105928332988870657,2019-03-13 20:27:16,0,0,0,we hope that it is not a do attack but it is not a do attack could rather be a schedule maintenance activity we can wait for it is not a do attack resolve the issue good luck
3569,1105928332636549121,2019-03-13 20:27:16,0,0,0,fix it then your costing people money
3570,1105928214965248000,2019-03-13 20:26:48,0,0,0,atuser face-on id is not working right now last to minute i have been trying a lot of time but the id is not being open why such a problem coming soon you reply me a soon a possible
3571,1105928158996508672,2019-03-13 20:26:34,0,0,0,we are focused on working to resolve the issue a soon a possible but can confirm that the issue is not related to a do attack url
3572,1105928104067899392,2019-03-13 20:26:21,0,0,0,atuser your broke url
3573,1105928033091895301,2019-03-13 20:26:04,0,0,0,can you fix this please i trying to make a face-on to play coin master
3574,1105927924719464449,2019-03-13 20:25:39,0,0,0,for those of u who manage page this is a real problem
3575,1105927924195213313,2019-03-13 20:25:38,0,0,0,atuser to be fair day a week without social stuff would not be all that bad
3576,1105927882604462081,2019-03-13 20:25:29,0,0,0,oh my god i thought that issue is only in our country but since that issue is a worldwide issue i feel better
3577,1105927871481024512,2019-03-13 20:25:26,0,0,0,please fix atuser too surprised you do not have separate server face-on
3578,1105927818620354562,2019-03-13 20:25:13,0,0,0,ya need to hurry up and fix it
3579,1105927760525045760,2019-03-13 20:24:59,0,0,0,atuser messenger int sending photo and your help request do not actually help please fix this problem of the recent update
3580,1105927655927500800,2019-03-13 20:24:34,0,0,1,so fix it please
3581,1105927651129262081,2019-03-13 20:24:33,0,0,0,atuser atuser whats going on with the site i can not tell if i was reported hacked or if ya have some issue that need fixing but i can not post anything on either one of ya site
3582,1105927630455480322,2019-03-13 20:24:28,0,0,0,atuser are you close to fixing atuser i attacked up six post for my company
3583,1105927557290041344,2019-03-13 20:24:11,0,0,0,i can get on face-on now but still get error everytime i try to share a status write a comment etc it is getting frustrating
3584,1105927556925001728,2019-03-13 20:24:11,0,0,0,can you guy please fix the algorithm too
3585,1105927527023955969,2019-03-13 20:24:04,0,0,0,fix it slicker i got picture of my dog that need to be posted to my pet group
3586,1105927498955657216,2019-03-13 20:23:57,0,0,0,atuser i am trying to log into my account and getting this error also i can not reset my password saying i amateur url
3587,1105927447856340992,2019-03-13 20:23:45,42,0,1,so if its required maintenance then why is there an issue to be resolved laugh out loud from one techie who know they agent the same thing
3588,1105927395658350598,2019-03-13 20:23:32,0,0,0,atuser is broken laugh out loud
3589,1105927388561575937,2019-03-13 20:23:31,0,0,0,oh face-on a glitch in a long string of problem
3590,1105927377937408005,2019-03-13 20:23:28,0,0,0,facing the same issue with instal
3591,1105927373621551110,2019-03-13 20:23:27,0,0,0,also there is trouble in whatsit
3592,1105927365656567809,2019-03-13 20:23:25,0,0,0,atuser is broke nothing is posting at the moment
3593,1105927329338048514,2019-03-13 20:23:17,0,0,0,i having problem going live is that happening to anyone else
3594,1105927284245123072,2019-03-13 20:23:06,0,0,0,deleted and installed my application thinking that would fix it and couldnt log back in url
3595,1105927235469496320,2019-03-13 20:22:54,0,0,0,not just aps commenting and posting is a problem too
3596,1105927190259093504,2019-03-13 20:22:43,0,0,0,please fix this this costing me time and money
3597,1105927176371736581,2019-03-13 20:22:40,0,0,0,yeah its been over hour what the fuck let go great update you guy had broke mesengerfacebok
3599,1105927148068655104,2019-03-13 20:22:33,15,1,1,the issue are not being able to use story post pic and trouble posting regular status a for atuser i can not even log in its been over hr and nothing has changed what are you guy doin we need real update
3600,1105927074483703809,2019-03-13 20:22:16,51,1,0,try censoring more people maybe that will fix it
3601,1105927046348398598,2019-03-13 20:22:09,0,0,0,eta to a fix it is been hour
3603,1105926986462052352,2019-03-13 20:21:55,0,0,0,hurry up i m troubling
3604,1105926832522739712,2019-03-13 20:21:18,0,0,0,this is frustrating i can not get into my family account my family killing me how long could it be before you resolve this issue
3605,1105926811081416704,2019-03-13 20:21:13,0,0,0,what is the issue
3606,1105926784082534400,2019-03-13 20:21:07,0,0,0,i thought there might be a problem
3607,1105926670651920385,2019-03-13 20:20:40,0,0,0,atuser atuser any chance of sorting the issue out been a few hour now normally when there a glitch you have it sorted by now can not post on personal profile or my business page
3608,1105926605321453573,2019-03-13 20:20:24,0,0,0,hurry up and fix it
3609,1105926584903585793,2019-03-13 20:20:19,0,0,0,its a glitch in the matrix url
3610,1105926499117391872,2019-03-13 20:19:59,0,0,0,you have people in cali seattle austin and new york and your telling me not one of people in cali seattle austin and new york and your telling me can fix it i guess allied universal security will just have to play video game on allied universal security phone laugh out loud
3611,1105926418792366081,2019-03-13 20:19:40,2,0,1,follow me i am not interesting or funny or handsome or intelligent and i am broke but if i was not i would buy you taco
3612,1105926414182830080,2019-03-13 20:19:38,0,0,0,atuser atuser fix your server error are you on a atuser plan or something
