,tweet-id,timestamp,likes,replies,retweets,text
495,1104110284317196288,2019-03-08 20:02:59,0,0,0,atuser please solved my problem i will wait last day replay me
496,1104108585414324224,2019-03-08 19:56:14,0,0,0,atuser hi i want to disable factor authentication because i am unable to login now please suggest me a way to approach face-on support or security people by email or phone call to resolve this issue
497,1104073187707502592,2019-03-08 17:35:35,0,0,0,atuser apparently i can only share international woman is day post when trying to share post atuser post showcasing the woman that work on halo i got this error your algorithm need some work sigh url
498,1104068614259462144,2019-03-08 17:17:24,0,0,0,atuser how can we speak to someone at face-on about a safetyprivacy issue tick box are not helpful
499,1104063996850651136,2019-03-08 16:59:04,3,2,4,atuser my account has been disabled without my performing any activity outside the guideline of face-on please resolve the issue
500,1104059851267805184,2019-03-08 16:42:35,0,0,0,atuser i trying to run an ad from my business page and an ad the first time i have been blocked from linking my webster can i use your help in resolving this issue
501,1104055710025945089,2019-03-08 16:26:08,0,0,0,atuser how insane can not have video or pic with gun but meanwhile hollywood etc has no problem making movie and tv show with gun in them by the ton what is the difference please tell me
502,1104052179877482498,2019-03-08 16:12:06,0,0,1,atuser i have tried setting up a new business face-on page and have now had that disabled along with my personal face-on i have tried to contact face-on with no luck and have even sent a scanned copy of my passport come on face-on sort my issue out
503,1104023263737536512,2019-03-08 14:17:12,0,0,0,atuser must really be going under i recently started to get notification of friend suggestion each time a girl i have no friend in common but with a hot profile pic great strategy to gain user back face-on fail whatsnext
504,1104019338636468224,2019-03-08 14:01:36,0,0,0,atuser blocked me to post for hour because of the attached picture which is a shared post saying friend my year old sister has been kidnapped please call this number in turkish strange broken algorithmsurl
505,1104010661548515328,2019-03-08 13:27:07,1,1,0,atuser is it me or are you really glitch today facebokap
506,1103993274954588160,2019-03-08 12:18:02,0,0,0,atuser why are you showing me a video of someone shooting and apparently killing a driver in a truck from a helicopter this popped up after i viewed a news release about disney and star war fix this if i can see this so can my kid url
507,1103992128357699590,2019-03-08 12:13:29,2,0,2,atuser you need to fix this atuser is being hurt by your inability to act on spam face-on fixed atuser
508,1103977817757401088,2019-03-08 11:16:37,0,0,0,atuser hi when i am trying to like any page i am getting the below error why where a i am not sharing any post url
509,1103976023131996160,2019-03-08 11:09:29,0,0,0,atuser i tried to find this at url but none of the suggestion fit my problem i moved to japan and did not update my phone number so now when i want to log in my problem sends a text to my old phone number that i do not have access to how can i log in
510,1103975351514890240,2019-03-08 11:06:49,0,0,0,atuser is not working properly on pc and in mobile application atuser is very slow from quite some time please resolve the issue a soon a possible
511,1103951103983443968,2019-03-08 09:30:28,0,1,2,atuser i have a problem sir my profile name human da email add sumanatuser when i was log in error message your account is disabled please enable my account your account is important for me this is genuine account waiting for your positive response
512,1103920598101549057,2019-03-08 07:29:15,0,0,0,atuser do you actually care about customer support you make it virtually impossible to get support id love to hear from some regarding an issue
513,1103910344907321344,2019-03-08 06:48:30,1,0,0,i am having issue with my business account atuser and can not get help by reporting the problem whatever i post get deleted why is this happening please help atuser my account is atuser on instagram can not post since saturday
514,1103882698655817729,2019-03-08 04:58:39,0,0,0,can you please be glad to look into my issue i tagged you with day ago
515,1103862902958678016,2019-03-08 03:39:59,0,0,0,atuser the dark mode on the phone is fantastic also love the colour choice but am devon about choosing an emosi for messenger there is no cat if it was not for cat the internet would fail please add a cat emosi
516,1103854066508144641,2019-03-08 03:04:52,0,0,0,atuser stop auto playing video fix audio control autismawarenes
517,1103827113738530817,2019-03-08 01:17:46,0,1,0,atuser why my account blocking to post and share todayjust face-on start minute and then blockley please fix it india url
518,1103810871413755904,2019-03-08 00:13:14,0,0,0,atuser fix your application i starting to only see spam like this url
520,1112121913835307008,2019-03-30 22:38:21,1,0,0,atuser atuser how much longer will we have to wait for face-on to take we into account i do not get any sm i have not been able to enter my account for day my account is frustrating help traquair tweet
521,1112074632948080640,2019-03-30 19:30:28,3,1,2,atuser oh my god your platform is so frustrating reading a post switched out of the application to take a pic and when i switched back a pic decided to refresh a pic and lose the post i was about to comment on arch fail ux design
522,1112072423061385216,2019-03-30 19:21:41,1,1,0,yo in case you dint realize i have been attempting to get hold of you idiot you have a bot problem banning people for no reason i have sent numerous email and work order attempting to resolve the issue do you people only have three people actually working over there
523,1112067575368900609,2019-03-30 19:02:25,1,0,0,atuser none of your account recovery option help i follow all of your step and still nothing it is been like this since march th help fix it this is infuriating
524,1112066742736572416,2019-03-30 18:59:07,0,0,0,atuser your application keep crashing today anyone report issue if so is there is fix
525,1112066233522769920,2019-03-30 18:57:05,0,0,0,atuser is capping how many people i can invite to my show how many people dropped atuser from to people max how many people are affecting my ability to promote my show please regret and tag how many people looking to problem solve here and find a solution help pleaseretwet face-on
526,1112059859837566977,2019-03-30 18:31:46,0,0,0,atuser for the last couple of day when i click on a message in my notification center atuser for the last couple of day when i click on a message in my notification center say content not available is there a problem
527,1112055000497184768,2019-03-30 18:12:27,0,0,0,atuser still trying frustrated url
528,1112054126127374337,2019-03-30 18:08:59,0,0,0,atuser i can not promote my page is something broken
529,1112050220903399424,2019-03-30 17:53:28,0,0,0,atuser i must say response from face-on is nonexistent and there is no way to contact anyone regarding this issue is there any way to get help or a review of this issue
530,1112011015745613826,2019-03-30 15:17:40,1,0,0,atuser what is wrong with image and video video stop and restart and image will not load half the time every few minute since last night you should fix that instead of fussing with ad
531,1112000504999993344,2019-03-30 14:35:55,0,0,0,atuser atuser atuser atuser atuser atuser please bring this menu tab at bottom instead at top of pagetic problem for big screen mobile url
532,1111995865558929412,2019-03-30 14:17:28,0,0,0,atuser is there not a way we can chat with a real person i have an issue that your help center is not resolving
533,1111991358607290368,2019-03-30 13:59:34,0,0,0,atuser can you justify why atuser and tomy robinson are banned from your platform for pledged hate speech yet islamic terror organisation based in palestine are permitted to issue call to commit violent act url
534,1111987899879305218,2019-03-30 13:45:49,0,0,0,atuser f i got to use your product for a week and today you again announced for dayan for the same update i posted in jan and you have deleted and for which i have already had and day ban fix the effing bug please check dm user since
535,1111979752695443456,2019-03-30 13:13:27,0,0,0,atuser if your gon na make me unable to post to face-on for day for no reason at least let me post again after the day seat fix your shit
536,1111933492215070720,2019-03-30 10:09:37,0,0,0,atuser please help me this issue has not been fixed yet people who have rsvp to my event do not get notified when i post on the event page i have already submitted broken feature report on face-on twice but no action taken url
537,1111910417398415360,2019-03-30 08:37:56,0,0,0,atuser since one year ago i am deactivate my account due to some personal problem today i want to reactive my account but not access because after email confirmation ask about friend last two year i am not touch in any friend and i have no any contact of your given friend url
538,1111909797694181377,2019-03-30 08:35:28,0,0,0,this issue have been in my mobile since month ago is there face-on still happy to provide world a thing url
559,1111873637542330368,2019-03-30 06:11:47,0,0,0,atuser i have been using face-on for many year and so on till now living in a country in nepal where face-on have not even seen u and our country i myself is facing problem relating to picture below url
560,1111861736737431553,2019-03-30 05:24:30,0,0,0,atuser i have paid rupee for my face-on page advertisement but a i can see here only rupee in my face-on account please resolve this issue url
561,1111846512210792451,2019-03-30 04:24:00,0,0,0,atuser brazen lie now reaching sovietorwelian peak a if face-on just deaf re subpoena total erasure of luck is potentially incriminating post are yet another technical error url if post can not archive the ceo is post why let post do it w yours
562,1111846345520775169,2019-03-30 04:23:20,0,0,0,atuser please please tell me how to kill this welcome to face-on message that block me off my nested this has to be a glitch right this is literally making face-on unusable
563,1111821858977009664,2019-03-30 02:46:02,0,0,0,atuser the market place disappeared on my face-on and i do not know how to fix it i have deleted the application and got the application again but still no fix what do i do url
564,1111796296585613313,2019-03-30 01:04:27,0,0,0,atuser what the hell it almost day nostril not fixed no top is coming and i have unloaded my id for time still not fixed i have the number and email of the account please look into thousand fix this a soon a possible url
565,1111744851643527168,2019-03-29 21:40:02,0,0,0,atuser how about instead of deleting and banning everyone with a different view than the leftwing why do not you have two version of face-on for the normal people and a pg for all you leftwing son who do not know how to scroll past or block problem solved
566,1111744647443947521,2019-03-29 21:39:13,0,0,0,atuser when you fix the problem ill delete all my sweet and issue my praise for the respect you have showed
567,1111740429295325191,2019-03-29 21:22:28,0,0,0,atuser i do not have an if my face-on is papa kell i do not understand why you are asking for my is there not letting me log in and i thinking of killing myself because of this can you fix this problem thank you i do not want to die but i will kill myself if you do not fix it now
568,1111731329304018945,2019-03-29 20:46:18,0,0,0,atuser all msm like atuser atuser atuser atuser even atuser have no problem here no complaint even atuser okay for black to be racist no complaint from dems or the southern poverty law centerurl
569,1111720232899543043,2019-03-29 20:02:12,0,2,0,instagram error system account atuser hi i write this way because i have tried for a few day to try to recover my account i have sent the necessary information with all my data that validates that i am the owner of the necessary information i have not received any answer
570,1111713405742788608,2019-03-29 19:35:05,0,0,0,atuser i can not log into my account i changed my pw and have to verify my identity but am not receiving the necessary text message to do so please help i can not log in to report the issue because i am locked out of my account so this is the only thing i could think to do
571,1111687676418113536,2019-03-29 17:52:50,0,0,0,atuser atuser are you clueless this is horrible url
572,1111681486594424834,2019-03-29 17:28:15,0,0,0,atuser i am noticing something on face-on video are having issue when video are played is like some kind of ragbag or something i have been having this issue since the most recent update
573,1111674763473240064,2019-03-29 17:01:32,0,0,0,atuser having a real problem trying to log in can not find any advice online related to my problem need help a soon a possible
574,1111632880818634755,2019-03-29 14:15:06,0,1,0,atuser facing this issue several time my attendee do not get notified when i post in my event it keep happening can you help i have many upcoming event my face-on page url
575,1111619460828483584,2019-03-29 13:21:47,0,1,0,atuser how come you manage to block my account when all i was doing was following a link in your help section i then had to send a photo to verify my account that was hour ago and i still do not have access to my profile or my page bad service
576,1111611815954399234,2019-03-29 12:51:24,0,0,0,after the initial response they do not help i was having similar prob but with ig same c and they told me what to do via email i did everything and havent heard anything back sent several email and i get nothing horrible horrible service
577,1111611571535515651,2019-03-29 12:50:26,0,0,0,atuser atuser atuser face-on why not ban and cleanse all separatist content affecting our country a well much more blood shed and ethnic cleansing has happened in and url via atuser
578,1111608543965339648,2019-03-29 12:38:24,0,0,0,atuser hi having an issue with my face-on account which has given me a temporary ban of face-on messenger it is been like this for a few day i have always used this and never had this issue url
579,1111600913561600001,2019-03-29 12:08:04,0,0,0,atuser atuser so when people have a problem submit to the help center yeah and when you do receive no reply nor response can not email can not phone and help center useless so face-on only care when your paying them i amusing facebokisletingusdown
580,1111585851908214784,2019-03-29 11:08:14,0,1,0,what about this problem please url
581,1111577977773613056,2019-03-29 10:36:56,0,1,0,atuser you have a security issue mypasword log me in a mypasword doe password should not be case insensitive
582,1111498030157647872,2019-03-29 05:19:15,1,0,0,you took over in advertising from me then disabled my account due to a mistaken intellectual right report the company have even told you it was a mistake notice but you havent restored my account and ignore all contact whats the problem
583,1111490235567792128,2019-03-29 04:48:17,1,0,1,atuser my account with name prana raj talreja has been disabled how i can enable my account with name prana raj talreja i go to help center and give the detail and my account with name prana raj talreja show we will email you but no email received help me to fix that problem
584,1111485079073816577,2019-03-29 04:27:47,5,5,1,i was deleted from face-on without a reason i was a faithful loyal user for year i trying to understand why i was deleted without a reason i arnot a bad person i do not think i did anything wrong please help me i arnot a bad guy i feel like you algorithm failed me
585,1111480640946556928,2019-03-29 04:10:09,0,0,0,i have reset my password and i still can not log in how do i get help to solve this issue
586,1111480182458613760,2019-03-29 04:08:20,0,0,1,atuser face-on security check problem top is not getting to my phone password reset cord is getting but security check top is not getting please help me my important data are linked with face-on account please help
587,1111479886294638597,2019-03-29 04:07:09,0,0,0,atuser i constantly get this error message when i try to turn off notification from a group url
588,1111459068101775360,2019-03-29 02:44:26,0,0,0,atuser atuser url what ia this am facing this problem since last dayswhy are you not fix this problem url
589,1111448419388796928,2019-03-29 02:02:07,0,0,0,atuser atuser has no problem using censorship on any race or racist they do not agree with in clownworldurl
590,1111436573155848193,2019-03-29 01:15:03,4,0,0,the problem is now i am seeing ad on me feed and give me fatigue scrolling through the home page to find any update from friend literally take minute of scrolling you need to do something about this
591,1111434349948227584,2019-03-29 01:06:13,0,0,0,atuser market place is not working like when i click on a car to look at is say this product no longer exists what can i do to fix this product
592,1111420643721961473,2019-03-29 00:11:45,0,0,0,atuser sir my account was photo yourself issue problem i unloaded my real face but do not open my account please sir unlocked my account
593,1105618072080134148,2019-03-12 23:54:24,0,0,0,atuser help recently updated face-on application on phone now new post option in friend disappeared only all friend and recent face-on help doe not help many others complain a well face-on simply do not help respondasist sort out please frustrating p i inflow most
594,1105616148891123717,2019-03-12 23:46:45,0,0,0,atuser after year a a user i have just deleted my instagram account and am preparing to delete my face-on account because you can not be bothered to fix my wife is account or even respond professionally to my wife support request my wife is leaving too well done
595,1105603030756589571,2019-03-12 22:54:38,1,1,0,can i be contacted for help recovering an account and no your help section doe solve the problem atuser
596,1105576325836926976,2019-03-12 21:08:31,0,0,0,atuser i open another account still having the same issue what is wrong
597,1105575029666922502,2019-03-12 21:03:22,0,0,0,atuser you wrongly suspended a legitimate foundation page that provides critical information to nonprofit in our region your appeal process is opaque how do we fix this
598,1105564178121674752,2019-03-12 20:20:15,0,1,0,atuser there is a poison seeping through your ad this is being advertised under every single page it is the only ad being shown almost and none of the page that are being named have any idea why this is a huge problem this guy had no idea this was being associated with this guy url
599,1105555653995581440,2019-03-12 19:46:22,0,0,0,atuser face-on will not let me insert a link to my blow about scrapboking which prevents me from running ad that link to my blow i just keep getting the error ops something went wrong how do i submit a bug report
600,1105531383735300096,2019-03-12 18:09:56,0,0,0,atuser atuser atuser i have been sweeting to atuser since day that i am not being able to unload any new post on my instal id atuser the post get deleted immediately d atuser the post get deleted immediately affecting my work please help a soon a possible whats wrong
601,1105527220108513281,2019-03-12 17:53:23,1,0,0,atuser come on five people in these picture are verifying that this is falsenothing to do with standard just false identity plea fix immediately thanks url
602,1105526529944100871,2019-03-12 17:50:39,0,0,0,face-on is a willing source for russian intelligence i wonder when the luck knowingly committed treason face-on is s monopoly and need to be broken up
603,1105525816685969409,2019-03-12 17:47:49,0,0,0,you guy should be broken up you should pay people since you treat people a ip
604,1105512049667436550,2019-03-12 16:53:06,0,0,0,atuser and atuser you need to do better with the kink associated in trying to establish shopable post have done everything right and still it will not work your too both big for this guess thats the problem face-on instagram suck letmebegreat please
605,1105506737971515392,2019-03-12 16:32:00,0,0,0,atuser just so you know i am experiencing a bug where it tell me i have a new message when i do not
606,1105505016381612032,2019-03-12 16:25:09,0,0,0,atuser so that secret dark mode in messenger has some trouble when smart invert accessibility option is turn on in io could we get a fix please
607,1105477189900881920,2019-03-12 14:34:35,0,0,0,atuser atuser fix this stop censoring conservative url
608,1105455446276616198,2019-03-12 13:08:11,0,0,0,please fix this problem of my country account is very important to me please url
609,1105436240118276096,2019-03-12 11:51:52,0,0,0,atuser has no problem allowing russia china and middle east country to run china and middle east country add unimpeded but the moment a democratic candidate put up their add face-on remove china and middle east country yet china and middle east country want u to believe china and middle east country are bipartisan unbiased and worthy of the power china and middle east country hold url
610,1105428144645906432,2019-03-12 11:19:42,0,0,0,atuser hi unable to resolve an issue with our school face-on account used help form but no reply unable to log in a account was set up by an ex member of staff rob leigh swalclife park school
611,1105352262916890625,2019-03-12 06:18:10,3,1,0,face-on aja bikini akin twitter fix elektabilitias twitter meninga menai
612,1105335332151549954,2019-03-12 05:10:53,0,0,0,atuser my post in face-on marketplace is not getting view what is reason behind this if any mistake is done by me please let me know please solve my issue my account id is rahulydatuser
633,1105305012781998080,2019-03-12 03:10:25,2,0,0,none of that was helpful one bit why can not a real person take time to talk to me i have been trying to set this up for two week now and every time this get an error face-on you really suck
634,1105292331132047361,2019-03-12 02:20:01,0,0,0,atuser i m unable to log in my account from last day please fix my account is very important to me for my music sharingsuporting and motivating please fix this problem atuser atuser atuser atuser
635,1105290624037724161,2019-03-12 02:13:14,0,0,0,atuser i m unable to log in my account from last day please fix my account is very important to me for my music sharingsuporting and motivating please fix this problem atuser atuser atuser atuser
636,1105286414277726211,2019-03-12 01:56:31,0,0,0,atuser this is why you should be regulated and why you should be broken up and i am conservative which mean i do not know why i am bothering with this tweet because atuser atuser shadow ban and censor me again because i am a conservative oh and mama karl
637,1105279278038614016,2019-03-12 01:28:09,0,0,0,atuser has deemed atuser self lord and master of all atuser surveyspocahontas warren stated pocahontas warren would like to see the big tech company like face-on broken today pocahontas warren found pocahontas warren face-on pagebroken up
638,1105271014257250304,2019-03-12 00:55:19,0,0,0,atuser is there a problem with the market place on face-on i can not seem to be able to open the market place on face-on if keep saying try again
639,1105261211485200390,2019-03-12 00:16:22,1,0,1,atuser need to deal with atuser russian problem a well a atuser racism problem on a well social medium platform url
640,1105250643118239744,2019-03-11 23:34:22,0,0,0,atuser is out of control and need to be broken up url
641,1105244419568160770,2019-03-11 23:09:38,0,0,0,atuser i do not like that now on the memory we can not comment on the original post we have to share the original post a a new post again that is just utter bullshit and a waste of space on my page bc now my memory will have the same post for year and year and year fix it please
642,1105220785822666752,2019-03-11 21:35:44,1,0,2,atuser atuser un bug permetait de savour avec qui le utilisateurs discutaient url
643,1105217381285195776,2019-03-11 21:22:12,0,0,0,atuser when are you going to fix the nested most recent doe work and i only seeing ad and biz page and friend post from day ago its now only a marketing tool
644,1105206986642255872,2019-03-11 20:40:54,0,0,0,atuser my face-on is currently being hacked and nothing i try to do is fixing this the hacker keep kicking me out
645,1105202603309387777,2019-03-11 20:23:28,0,0,0,atuser if your a millennial and do a sloppy job in all you do then you can be a face-on developer and damage user device and also issue mb update daily because your too lazy to add the medium file url
646,1105192574115930117,2019-03-11 19:43:37,0,1,0,atuser hey i have a problem can you help
647,1105165399656677376,2019-03-11 17:55:38,0,0,0,atuser prof everyday atuser is a broken platform pitiful how people still use atuserurl
648,1105160659069734913,2019-03-11 17:36:48,0,0,0,fascism from face-on deleting any politics you do not agree with when you are not even living the type of life affected by the politics you are trying to stop shame on you in your ivory tower
649,1105153535287717890,2019-03-11 17:08:30,0,0,0,atuser i gave you a try and you let me down another problem with the failing site who even us face-on anymore faceboksucks
650,1105128968749891584,2019-03-11 15:30:53,1,0,0,atuser just did this to me for speaking the truth yet i get punished n i really said nothing bad or malicious face-on fix your issue cause face-on not me i said nothing wrong or malicious atuser atuser atuser i want my account back now atuser atuser
651,1105122803991437313,2019-03-11 15:06:23,0,0,0,atuser this is very real please fix yo shit your main money maker is ui is wildly intuitive also half the time my ad result do not show up till a week after they have completed brush url
652,1105121809043619840,2019-03-11 15:02:26,0,1,0,atuser someone hacked my father is face-on account please close face-on account by doing so please solve this problem face-on id singhbhanupratapatuser url
