,tweet-id,timestamp,likes,replies,retweets,text
1789,1106008139596525568,2019-03-14 01:44:23,0,0,0,atuser ya taking to dam long to fix this shit i trying to reach my man and family come on man
1790,1106008112287436800,2019-03-14 01:44:17,0,0,0,wheal need to fix it and fix instagram a well
1791,1106008076723773441,2019-03-14 01:44:08,0,0,0,ya better fix that shit a soon a possible
1792,1106008045895798784,2019-03-14 01:44:01,0,0,0,atuser what the hell fix the problem
1793,1106008042775162886,2019-03-14 01:44:00,0,0,0,please i am begging you fix it please i love face-on instagram and messenger i can not live without please fix it please i am begging you please
1794,1106008001993953282,2019-03-14 01:43:50,0,0,0,i have noticed face-on cameron has been having issue all week
1795,1106007946088062976,2019-03-14 01:43:37,0,1,0,space never had this problem
1796,1106007913980719104,2019-03-14 01:43:29,0,0,0,atuser fix yo shit
1797,1106007907064123392,2019-03-14 01:43:28,0,0,0,please help to fix login bug what is the point if someone add their email address but can not be used in verification yeah that is what i mean some user miss some user phone and cane login in
1798,1106007865754447873,2019-03-14 01:43:18,0,0,0,atuser atuser fix yo shit it still int working
1799,1106007858519302144,2019-03-14 01:43:16,0,0,0,this is so frustrating
1800,1106007844938309635,2019-03-14 01:43:13,0,0,0,are you still working on the problem
1801,1106007818602057729,2019-03-14 01:43:07,0,0,0,atuser atuser resolve your crash problem
1802,1106007611856572417,2019-03-14 01:42:17,1,0,0,atuser no update in hour how about you move fast and fix thing
1803,1106007579572891653,2019-03-14 01:42:10,0,0,0,atuser and atuser something error today why and atuser too error i am sending picture for my friend its retry again
1804,1106007558551150597,2019-03-14 01:42:05,0,0,0,solve it fast are affecting u game cordata i speak spanish hola
1805,1106007428347412480,2019-03-14 01:41:34,0,0,0,face-on down instagram down whatsit voice and image messaging what a pity a face-on fails to adhere to minimum standard of courteousnes by playing it right and notifying it client what happened at least shame big shame face-on you are so bad at this
1806,1106007410613907456,2019-03-14 01:41:29,0,0,0,why it is off for hour so far fix it please
1807,1106007271845191680,2019-03-14 01:40:56,0,0,0,atuser fix dis shit now
1808,1106007201347297280,2019-03-14 01:40:40,1,0,0,atuser locked out of the application and keep getting error code no reset work is this a problem with you
1809,1106007187132960768,2019-03-14 01:40:36,0,0,0,atuser are you guy even doing anything to fix face-on it is been all day and it is still happening what are you guy doing why is it taking so long
1810,1106007169630195712,2019-03-14 01:40:32,0,0,0,atuser fix your shit it is getting seriously annoying
1811,1106007129599737856,2019-03-14 01:40:22,0,0,0,i arnot really worried about it a it only a minor inconvenience in the long run i mostly curious what caused the issue why it only effected certain part of face-on instagram etc and is there any reason to be concerned about data leak
1812,1106007129192845312,2019-03-14 01:40:22,0,0,0,fix it already
1813,1106007123274678273,2019-03-14 01:40:21,0,0,0,i can not even log in anymore its like its doe recognize my account i have tried getting the code to reset my account and i get this error message url
1814,1106007083177132034,2019-03-14 01:40:11,0,0,0,facebokdown instagramdown outlokdown its very frustrating
1815,1106007074025230336,2019-03-14 01:40:09,0,0,0,atuser can you hurry up and fix your crap
1816,1106007056765673473,2019-03-14 01:40:05,0,0,0,atuser hi yes i have been trying to unload a photo for hour and i know it is not my internet please fix this
1817,1106007053242429442,2019-03-14 01:40:04,3,0,0,only problem i am having is not being able to send picture on the comment or on messenger i can send regular message though
1818,1106006981192478720,2019-03-14 01:39:47,1,1,0,me n my mom in whatsit my mom where are you me in my friend is house my mom in whatsit my mom where are you me in my friend really send me a pic a soon a possible me clicking a pic with my friend in my friend room whatsit retry sending pic my mom where is the pic me damn face-on family aps are down and i amin trouble
1819,1106006949177499648,2019-03-14 01:39:39,0,0,0,well being that atuser and atuser are major social medium platform couldnt you think that atuser and atuser have backup couldnt you just use a backup to bring the site back up you know the one that was taken before the issue happened then go in and fix the issue properly
1820,1106006941065723905,2019-03-14 01:39:38,0,0,0,atuser problem still int solved
1822,1106006898065768449,2019-03-14 01:39:27,0,0,0,been waiting a long time and it just get worse get out of the break room and get to fixing the problem
1824,1106006846316396545,2019-03-14 01:39:15,0,0,0,mine is back up and running however i can not comment to my own poststil an issue
1825,1106006794273476608,2019-03-14 01:39:03,0,0,0,atuser come on no update no reassurance in your product i am from detroit take a hint from the car company you are not too big to fail consumer faith is waning url
1826,1106006766385577985,2019-03-14 01:38:56,0,0,0,yet you will not tell u what the real problem is ok
1827,1106006715303112704,2019-03-14 01:38:44,0,0,0,for a company based on communication your not very good at keeping people updated on whats going on with this issue
1828,1106006674895187970,2019-03-14 01:38:34,0,0,0,dang what the actual fuck happened i wonder if cert on the application store is slowing cert on the application store down or if this is a more critical server side error
1829,1106006624139968513,2019-03-14 01:38:22,0,0,0,i can not use any account since h pm can not not send or receive any email with outlook h pm very bad facebokdown instagramdown outlokdown
1830,1106006622084784130,2019-03-14 01:38:21,2,0,0,me waiting withdraw int to bad believe me url
1831,1106006617697464326,2019-03-14 01:38:20,0,1,0,please we need answer i can not log into my instagram account atuser since this morning our life is in there whats going on whats the problem whats broken wenedanswers
1832,1106006561569173504,2019-03-14 01:38:07,0,0,0,atuser have the russian you hired to hack server finished w fixing you are site
1833,1106006494980513792,2019-03-14 01:37:51,1,0,0,is it resolved yet i do not think so i can not run any add it is giving me error message they ruined my business today
1834,1106006450072154114,2019-03-14 01:37:40,0,0,0,oil why is everyone so pissed everyone is probably just a problem with the server that basically run face-on this could be anything like a broken server
1835,1106006439833694210,2019-03-14 01:37:38,0,0,0,atuser what is wrong with your marketplace service my post was taken down because my post stated that i broke policy on your marketplace service nothing in my post is against your policy i submitted a ticket and a ticket is back to stating that i broke policy this is ridiculous
1836,1106006383160373248,2019-03-14 01:37:25,0,0,0,hard to run my small business when instal and face-on is broken i can not even let my client know luckily i got a single post with an email for my client to contact on the mean time how annoying its been down since i got up at am
1837,1106006372854964224,2019-03-14 01:37:22,0,0,0,trouble is an understatement it is more like face-on is possessed
1838,1106006341058027522,2019-03-14 01:37:14,0,0,0,these show that the issue facebokdown and instagramdown is becoming a major problem for the world most of the usersdaily username mentally down sometimes its a good chance to experience a day without face-on and instagram
1839,1106006234317103112,2019-03-14 01:36:49,0,0,0,disgusted fix me please been down for over hour
1840,1106006114552950785,2019-03-14 01:36:20,0,0,0,ethel is going on atuser this is terrible outrage hire me if you need an expert to resolve the issue your network and it guy are useless
1841,1106005835468152833,2019-03-14 01:35:14,0,0,0,atuser please fix my face-on
1842,1106005802878488577,2019-03-14 01:35:06,0,0,0,a an infrequent user i only logged in to face-on today because i read this i imagine many of u are driven by outraged content on competing platform just to see if it was broken touch
1843,1106005794581970944,2019-03-14 01:35:04,0,0,0,oh my god my account seems to be the only one in oregon my friend living right down the street have no problem and all my friend on face-on that have been messaging me my message let me talk and i can not get logged in to my account i logged out now cnt log in
1844,1106005711618744320,2019-03-14 01:34:44,0,0,0,this is very frustrating for those of u losing revenue because u use face-on for our business not impressed
1845,1106005697664294913,2019-03-14 01:34:41,0,0,0,we are focused on working to resolve the issue can not be doing much a still mostly down laugh my as off
1846,1106005668304244737,2019-03-14 01:34:34,0,0,0,its been hour now come on guy i have seen microsoft fix actually do attack faster than this
1847,1106005563534729216,2019-03-14 01:34:09,0,0,0,doe that affect the game i play should i log out or stay log in till the problem fixed who let you know when the problem fixed
1848,1106005464549130248,2019-03-14 01:33:45,0,0,0,atuser fix this i was trying to log back into my face-on and i thought changing my password would help and ya blocked me url
1849,1106005415534489601,2019-03-14 01:33:34,0,0,0,atuser it is broke again
1850,1106005399000408064,2019-03-14 01:33:30,4,0,0,hey you acknowledged a problem for once good for you guy thats the first step to acceptable customer service
1851,1106005318973177861,2019-03-14 01:33:11,0,0,0,every time thing work right ya try to make thing nobody want like you show people to add but hey you all make it to where you can only see people o stop making new junk fix the problem nothing but facejunk
1852,1106005308944670722,2019-03-14 01:33:08,0,0,0,so many photo have been erased those are picture we can never get back if ya do not fix this
1853,1106005219937140736,2019-03-14 01:32:47,0,0,0,was the last time someone can get on face-on fix this fucking outage
1854,1106005186026356736,2019-03-14 01:32:39,0,0,0,this not being able to post comment or access my face-on with an application to be able to play a game suck this issue need fixed and fast very very irritated
1855,1106005097560133633,2019-03-14 01:32:18,0,0,0,i got a new phone and thought that was the issue verification code later had the sense to goole whats up with face-on in the meantime my kid enjoying new phone url
1856,1106005037942222848,2019-03-14 01:32:04,0,1,0,i austin having trouble
1857,1106005007936221190,2019-03-14 01:31:57,0,0,0,still have not figured out the problem i thought you billed yourselves a genius
1858,1106004974134353920,2019-03-14 01:31:49,0,0,0,atuser is this still a problem i can not even log in getting error code message
1859,1106004944178417664,2019-03-14 01:31:41,0,0,0,why did not you solve the problem for hour
1860,1106004857218043904,2019-03-14 01:31:21,0,0,0,atuser are you all going to fix this been down for hour
1861,1106004794878164992,2019-03-14 01:31:06,0,0,0,you guy stop complaining about face-on and instagram if you guy survived without face-on and instal year ago you guy can survive a freaking glitch
1862,1106004666360492033,2019-03-14 01:30:35,0,0,0,atuser this outage is crazy a hell hurry up and fix this
1863,1106004639835578370,2019-03-14 01:30:29,0,0,0,common fix it fast havent got all day
1864,1106004624585211905,2019-03-14 01:30:25,0,0,0,mine kicked me out and i have not been able to get back on to it or instagram all day frustrating af
1865,1106004478317260801,2019-03-14 01:29:50,0,0,0,atuser when are you going to fix your application
1866,1106004355357003782,2019-03-14 01:29:21,0,0,0,the baby boomer finally broke the faceboks
1867,1106004286385913859,2019-03-14 01:29:05,0,0,0,atuser i want a solution and i want one now all day i have been told error one or two when trying to log into my account now messager and face-on are my mean of communication to people including work now i can not contact anyone and i have two kid so fix it
1868,1106004281365282817,2019-03-14 01:29:03,0,0,0,hope you fix the problem where we can not unload photo and video because i updated my face-on album i created for my favorite band atuser because my favorite band atuser day of their tour and their post on instagram and i report to face-on in suspendingravitytour album
1869,1106004265254965248,2019-03-14 01:29:00,0,0,0,fix it already url
1870,1106004190722228232,2019-03-14 01:28:42,0,0,0,fix it come on
1872,1106004139862036481,2019-03-14 01:28:30,0,0,0,atuser please fix you are site so i can show this blessed image to all my friend url
1873,1106004028494774272,2019-03-14 01:28:03,0,0,0,i love how they said some people are having trouble accessing the aps pretty sure its the whole world hury fixit firstworldproblems
1874,1106003967073488896,2019-03-14 01:27:48,0,0,0,atuser people a been having trouble with face-on i tried longing in and longing in said my account was temporarily unavailable url
1875,1106003880981086208,2019-03-14 01:27:28,0,0,0,if we could get going on fixing this that would be great i have food photo i took today and no one to show them too url
1876,1106003845623283713,2019-03-14 01:27:20,0,0,0,atuser fix this shit
1877,1106003836844601346,2019-03-14 01:27:17,1,0,0,atuser and atuser if you love me please can i have my instagram account back and can i post my severe weather stuff please fix this issue soon
1878,1106003711988359168,2019-03-14 01:26:48,1,0,0,is anyone else getting an error code when trying to login to instal and face-on from your phone
1879,1106003645940678656,2019-03-14 01:26:32,0,0,0,i do not know about you guy but i feel like its a snow day for me no face-on no work no problem facebokoutage
1880,1106003579163283458,2019-03-14 01:26:16,0,0,0,atuser i am having issue with my account and i do not know why what can i do to fix this problem please
1881,1106003575380021248,2019-03-14 01:26:15,19,0,1,my instagram is still broken
1882,1106003508308967424,2019-03-14 01:25:59,0,0,0,atuser me da error al intent subic foot why video esa capture de panama e el resulted de lo que sucked alien me lo suede traquair atuser
1883,1106003507327483913,2019-03-14 01:25:59,0,0,0,atuser i have to get back to posting meme please fix your server
1884,1106003475236864000,2019-03-14 01:25:51,0,0,0,it is bad enough the face-on application actually suck but now instagram is down and i have never felt happier lifeform once i do not have to accidentally see the cancer that is the explore page on instal
1885,1106003449467097095,2019-03-14 01:25:45,0,0,0,atuser fix your server atuser will not let user log in or share post
1886,1106003432765382664,2019-03-14 01:25:41,1,0,0,atuser fix yo problem face-on
1887,1106003412171350022,2019-03-14 01:25:36,2,0,0,atuser it is pretty bad when you have to use the competition to update your user facebokoutage insagramdown
1888,1106003294483349504,2019-03-14 01:25:08,0,0,0,why do they delay in solving the problem
1889,1106003230763507713,2019-03-14 01:24:53,0,0,0,atuser can we get an estimated time for you to fix your shit facebokdown
1890,1106003202372182016,2019-03-14 01:24:46,0,0,0,atuser i hate ya atuser i hate ya mf too fix my mf account for i get mad
1891,1106003140850184193,2019-03-14 01:24:31,0,0,0,atuser can wheal not fix the dam problem
1892,1106002972385923073,2019-03-14 01:23:51,0,0,0,fix this outage where will the old people get the old people fake news facebokoutage facebokdown facebokhack rusiancolusion
1893,1106002934087798784,2019-03-14 01:23:42,0,0,0,good evening i am having trouble posting on my face-on tideline i already know that you are facing technical problem but please correct this problem facebokdown
1895,1106002887388348416,2019-03-14 01:23:31,0,0,0,why say it was regularly scheduled maintenance when it clearly was not sound like someone is trying to cover something up also still can not use the webster this doe not make me feel very safe that i am one of the few account affected still
1896,1106002812838780929,2019-03-14 01:23:13,3,1,0,you guy do not know how to fix your own application
1897,1106002801249808384,2019-03-14 01:23:11,0,0,0,what taking you so long it is been almost a day since you have tried fixing thing
1898,1106002783076077569,2019-03-14 01:23:06,0,0,0,atuser atuser plea work hard to resolve this issue si can not access si account
1899,1106002781729636352,2019-03-14 01:23:06,12,2,0,while you are awake could you fix the back end of your business manager so that it is clear who owns and who all has access to a page could you do at least the basic to add some spam filter against the million spam account offering illuminate membership
1900,1106002694760775685,2019-03-14 01:22:45,0,0,0,dear face-on if your going to have to fix thing which i can under stand but for god sake please do not say in a couple of hour just say it will be fixed when we get it fixed sorry for the delay
1901,1106002513487187969,2019-03-14 01:22:02,6,0,0,bringing the world closer together through the power of a crash and twitter
1902,1106002484546494464,2019-03-14 01:21:55,0,0,0,hey face-on how the heck do you let something like this happen you need to fix this i attired of face-on breaking down get this i attired of face-on breaking down fixed
1903,1106002481920655360,2019-03-14 01:21:54,0,0,0,brush my account full got hacked today of all day and i can not even log in and do shot to fix it cause faceboks shit itself
1904,1106002440472719360,2019-03-14 01:21:44,0,0,0,atuser hello please fix your shit someone at school gave me someone at school face-on messenger and i can not mean someone at school what the fuck why me why on this day face-on kind of tucked me thanks facebokdown instagramblackout
1905,1106002385888034816,2019-03-14 01:21:31,0,0,0,atuser today is my friend birthday and atuser cat post anything on face-on or whats application you need it it fix on time have never experienced this before ever since the day have joined face-on
1906,1106002338358140929,2019-03-14 01:21:20,0,0,0,atuser is not working for user like me who use this tool to promote user like me who use this tool to promote their work paying money to face-on for it work paying money to face-on for this tool this tool is extremely frustrating once again
1907,1106002266660708364,2019-03-14 01:21:03,0,0,0,yo fix your shit out man
1908,1106002255843610624,2019-03-14 01:21:00,0,0,0,we are focused on working to resolve the issue a soon a possible mhm url
1909,1106002215028830210,2019-03-14 01:20:51,0,0,0,atuser whats going on where did the failure start where is the blockade thats preventing you from fixing the failure
1910,1106002201695027201,2019-03-14 01:20:48,0,0,0,atuser has been so broken today i can not share anything facebokdown so here i am on twitter
1911,1106002168748740608,2019-03-14 01:20:40,0,0,0,atuser hey whats the problem url
1912,1106002140894359553,2019-03-14 01:20:33,0,0,0,emi face-on wa ama ig guy error ini semangat thanks where is furry ops sorry where is mark zuckerberg
1913,1106002004969705473,2019-03-14 01:20:01,0,0,0,atuser i know thatbut do not you think is quite a while and the network is still not working let is hope you fix the issue right away
1914,1106001966440820736,2019-03-14 01:19:51,0,0,0,perhaps your crash is the cost of your unconstitutional censorship sliperyslopeshameonyou
1915,1106001935944089600,2019-03-14 01:19:44,0,0,0,space never had this problem
1916,1106001819355041792,2019-03-14 01:19:16,0,0,0,ya play too much and i paint got time for thisfix the mf application a soon a possible
1917,1106001791408369671,2019-03-14 01:19:10,0,0,0,may be you should ask twitter support team how to handle this issue url
1919,1106001588932567041,2019-03-14 01:18:21,0,0,0,your recent change today broke auth
1920,1106001527884271616,2019-03-14 01:18:07,0,0,0,we are getting problem in messenger and privacy setting of face-on
1921,1106001466505003011,2019-03-14 01:17:52,0,0,0,atuser they said y exposing pls into ion want no smoke br so fix eat a soon a possible
1922,1106001399127527425,2019-03-14 01:17:36,0,0,0,atuser when are you going to resolve this problem
1923,1106001208165191681,2019-03-14 01:16:51,0,0,0,i can not get into face-on hope you can fix the problem soon
1924,1106001173180502016,2019-03-14 01:16:42,0,0,0,atuser resolve your issue already
1925,1106001157875531776,2019-03-14 01:16:39,3,0,0,still facing the issue has the issue escalated to the tech team yet
1926,1106001024400134146,2019-03-14 01:16:07,0,0,0,it is working on edge but not on chrome is not a technical issue it is flat out blocking user from using whatever browser user want and the only way to fix it is to allow face-on to spy on you via chrome am not changing my setingstop being fascist and take down the block
1927,1106000923430711301,2019-03-14 01:15:43,10,0,0,people waiting for a new update on the issue url
1928,1106000907395784704,2019-03-14 01:15:39,0,0,0,atuser dude you so broken
1929,1106000881122795520,2019-03-14 01:15:33,0,0,0,atuser this is bulshitfix it already
1930,1106000849338359810,2019-03-14 01:15:25,45,4,0,when will this issue be fixed i feel you should take responsibility for this incident honestly my instagram and face-on account have not been working for hour fix this tell your user what happened and make sure it doe not happen again facebokdown
1931,1106000816413044736,2019-03-14 01:15:17,0,0,0,sending all my prayer and condolence to my fellow victim who are deeply affected by the instagram and face-on breakdown i feel your pain url
1932,1106000808376705024,2019-03-14 01:15:15,0,0,0,if you can confirm it is not related to a do attack then you would know what the issue is do tell
1933,1106000789267320832,2019-03-14 01:15:11,0,0,0,i post one female nipple and i am suspended face-on has an issue face-on are working on it let is all ban the book for day
1934,1106000779142258689,2019-03-14 01:15:08,0,0,0,ya lying fix this shit its been all day
1935,1106000756551766016,2019-03-14 01:15:03,0,0,0,ok but facebokwhen you leave million of user without useful status update for hour and counting ya think maybe the entire planet repeatedly hitting your server in frustration could maybe be an issue maybe we are the do facebokdown instagramblackout
1936,1106000685949173761,2019-03-14 01:14:46,0,1,0,atuser is this formal this message is to inform all our user that our server have been very busy lately so our ask you to help solve this problem our ask active user to forward this message to everyone on active user contact list to confirm active face-on user if active user do not
1938,1106000603350749191,2019-03-14 01:14:26,0,0,0,i can not be a day without an application and just fall the only aps i have zuckerberg fix this fast please
1939,1106000599588499459,2019-03-14 01:14:26,0,0,0,please fix the great face-on outage of
1940,1106000578314993665,2019-03-14 01:14:21,0,0,0,atuser atuser this problem that going on with the aps should i be worried about my account being hacked
1941,1106000534144716806,2019-03-14 01:14:10,0,0,0,atuser any chance of fixing the problem really getting on my nerve now hurry up and bloody fix
1942,1106000510493093889,2019-03-14 01:14:04,0,0,0,atuser atuser atuser i continue having problem with all three aps has the problem been dsd the problem been almost a full day
1943,1106000506747580418,2019-03-14 01:14:03,0,0,0,still having trouble with face-on and instagramdisgusted
1944,1106000493766164480,2019-03-14 01:14:00,0,0,0,what is the problem i know netneutrality that is what the problem is stop changing everything i pay good money to advertise on face-on and this is what you give u yeah um fix the problem
1945,1106000488011624448,2019-03-14 01:13:59,0,0,0,atuser hello i am trying to access face-on but it only appears the name of the webster is this an issue url
1946,1106000478108815360,2019-03-14 01:13:57,0,0,0,some people more like lot of people fix more like lot of people
1947,1106000444810240000,2019-03-14 01:13:49,0,0,0,atuser hurry up and fix the issue i need the meme and funny stuff people share in my life rn
1948,1106000304523431936,2019-03-14 01:13:15,0,0,0,that is fantastic that you are aware of the problem now tell zuckerberg to pony up for new server and make u aware that you fixed the problem
1949,1106000178958368771,2019-03-14 01:12:45,0,0,0,atuser i have to post a comment twice for a comment to post is this a glitch or something
1950,1106000092014612480,2019-03-14 01:12:25,0,0,0,i can not even login my acc and some of the game that i am playing have to connect to face-on acc and some of the game that i am playing are being affected too
1952,1106000036675178504,2019-03-14 01:12:11,0,0,0,fix this mark or i swear i am going to call up tom
1953,1106000035228069893,2019-03-14 01:12:11,0,0,0,atuser why am i not able to get on any of my business account on instagram i am in north carolina it is been an issue all day
1954,1105999945419681792,2019-03-14 01:11:50,0,0,0,when is this be done with being fix
1955,1105999926864023553,2019-03-14 01:11:45,0,0,0,you guy had to inform the issue via twitter
1956,1105999809574506496,2019-03-14 01:11:17,0,0,0,glad to see that it was not just me having trouble with face-on
1957,1105999799516651520,2019-03-14 01:11:15,0,0,0,face-on fix my account
1958,1105999746651574272,2019-03-14 01:11:02,0,0,0,atuser fix ya self i bored
1959,1105999746584449024,2019-03-14 01:11:02,0,0,0,atuser fix your stuff so i can do my work
1960,1105999727705886722,2019-03-14 01:10:58,0,0,0,this is so completely messed up for cry out loud zuckerberg get your shit together and fix this it is been over hour already
1961,1105999723234803712,2019-03-14 01:10:57,0,0,0,me six hour fix this
