tweet-id,timestamp,text,app_name,comment,bug_report
1110411495966416896,2019-03-26 05:21:45,"Also, the spelling on some of the South African songs is horrible which makes searching for them difficult. 
For example: Macecilia a St Paul- Jerusalema and Malabulabu by Trompies",google_play,"['also', 'spell', 'south', 'african', 'song', 'be', 'horrible', 'make', 'search', 'difficult', 'example', 'macecilia', 'paul', 'jerusalema', 'malabulabu', 'trompie']",1
1107923740325605377,2019-03-19 08:36:18,@GooglePlayMusic hi I have an issue where the player refused to update some MP3 tags after multiple reboots and data wipes. Now not only is it refusing to show correct metadata it's playing songs that no longer exist on my SD card. The files are not there but it's playing them.,google_play,"['have', 'issue', 'player', 'refuse', 'update', 'tag', 'multiple', 'reboot', 'datum', 'wipe', 'not', 'be', 'refuse', 'show', 'correct', 'metadata', 'playing', 'song', 'longer', 'exist', 'card', 'file', 'not', 'play']",1
1105966864960798723,2019-03-13 23:00:23,"I understand the points on that site, but given you have some of their music and not all of it seems to be a problem between Google and Universal Music Group @UMG",google_play,"['understand', 'point', 'site', 'give', 'have', 'music', 'not', 'seem', 'problem', 'universal', 'music', 'group']",1
1105903027838304256,2019-03-13 18:46:43,@GooglePlayMusic so it was working for like ten minutes and now it’s broken again saying can’t play right now again........,google_play,"['work', 'minute', 'break', 'say', 'play', 'right']",1
1105729178979057666,2019-03-13 07:15:54,"Thanks! Since a while ago, it works well. Now I can play music without any problem.",google_play,"['thank', 'ago', 'work', 'well', 'play_music', 'problem']",1
1105665535000211457,2019-03-13 03:03:00,@GooglePlayMusic Hi there! I can’t play any music on Google Play Music. Is there any trouble with GPM app?,google_play,"['play_music', 'google_play', 'music', 'be', 'trouble', 'gpm', 'app']",1
1105664466111225856,2019-03-13 02:58:45,@GooglePlayMusic why are you broken? I can't play my music right now :(,google_play,"['break', 'can', 'not', 'play_music', 'right']",1
1112017334162604034,2019-03-30 15:42:47,"@GooglePlayMusic fix your new releases category, it's an Unorganized mess and jew stuff is already gone whole old albums are still there. It really makes the platform look horrible.",google_play,"['fix', 'new', 'release', 'category', 'unorganize', 'mess', 'jew', 'stuff', 'be', 'already', 'go', 'whole', 'old', 'album', 'still', 'really', 'make', 'platform', 'look', 'horrible']",1
1112016539908227074,2019-03-30 15:39:38,@GooglePlayMusic I am quitting this service because I can't play songs on my playlists. It won't play the song I select. Instead plays one that's 10 down the list. Fix it because you are going to lose lots of customers.,google_play,"['quit', 'service', 'can', 'not', 'play', 'song', 'playlist', 'will', 'not', 'play', 'song', 'select', 'instead', 'play', 'one', 's', 'list', 'fix', 'go', 'lose', 'lot', 'customer']",1
1111688497377800192,2019-03-29 17:56:06,"@GooglePlayMusic i just bought an album and it wont sync, how do i fix it.?",google_play,"['buy', 'album', 'will', 'not', 'sync', 'do', 'fix']",1
1111550822113075201,2019-03-29 08:49:02,"@GooglePlayMusic  for better understanding:
1) Google Music store
2) Google music player with unlimited plan. 
Bug or normal? pic.twitter.com/5ApDXg4ORn",google_play,"['well', 'understand', 'music', 'store', 'google', 'music', 'player', 'unlimited', 'plan', 'bug', 'normal', 'pic_twitter', 'com', 'apdxg', 'orn']",1
1111418844067684352,2019-03-29 00:04:36,@GooglePlayMusic hello I am having some serious glitches with your app and it's so frustrating. Please tell me there is an update coming soon!!,google_play,"['have', 'serious', 'glitch', 'app', 'frustrating', 'tell', 'be', 'update', 'come', 'soon']",1
1107442201372643328,2019-03-18 00:42:50,@GooglePlayMusic I upgraded my Google Play Music account today to a family plan and I think it messed up my YouTube red :( I've tried logging out and back in and it didn't fix it. Is there a fix for this?,google_play,"['upgrade', 'google_play', 'music', 'account', 'today', 'family', 'plan', 'think', 'mess', 'youtube', 'red', 'have', 'try', 'log', 'back', 'in', 'do', 'not', 'fix', 'be', 'fix']",1
1107435837875204097,2019-03-18 00:17:33,I just uninstalled the app and reinstalled it. It fixed the error. It never came up with a error code or crash code,google_play,"['uninstalled', 'app', 'reinstall', 'fix', 'error', 'never', 'come', 'error', 'code', 'crash', 'code']",1
1107434787021692928,2019-03-18 00:13:23,I would be playing my music then within approximately 15 seconds of the song it would crash. No code given,google_play,"['would', 'play', 'music', 'approximately', 'second', 'song', 'would', 'crash', 'code', 'give']",1
1107268647595192326,2019-03-17 13:13:12,"@GooglePlayMusic I’m experience some really annoying and constant issue with google play music on my phone but cannot find a customer service to help, any chances?",google_play,"['experience', 'really', 'annoying', 'constant', 'issue', 'google_play', 'music', 'phone', 'can', 'not', 'find', 'customer_service', 'help', 'chance']",1
1104587514441097216,2019-03-10 03:39:20,I have this same issue. Happened last night where the podcasts I've downloaded just disappeared and now there's nothing past the 5th on any of my podcasts even though I downloaded a bunch yesterday,google_play,"['have', 'issue', 'happen', 'last_night', 'podcast', 'have', 'download', 'disappear', 'there', 's', 'nothing', 'podcast', 'even_though', 'download', 'bunch', 'yesterday']",1
1104552765404139520,2019-03-10 01:21:15,"@GooglePlayMusic On going issue. My app shows music I have not downloaded, when I have only show downloads selected. Also I can not find my downloaded music in my Files folder on my Pixel.",google_play,"['go', 'issue', 'app', 'show', 'music', 'have', 'not', 'download', 'have', 'show', 'download', 'select', 'also', 'not', 'find', 'download', 'music', 'file', 'folder', 'pixel']",1
1104398122728472577,2019-03-09 15:06:45,"What account? It's an open app on my android. And yes, it's still having the same issue.",google_play,"['account', 'open', 'app', 'android', 'still', 'have', 'issue']",1
1104213591866073088,2019-03-09 02:53:30,Same thing over here!! Bummer! Please fix! Yes restarted already & zip!,google_play,"['thing', 'bummer', 'fix', 'restart', 'already']",1
1103688576359976963,2019-03-07 16:07:16,"I use Google Play Music to listen to my playlists (Download Only) in my car. Looking at YT Music, I'm not seeing such a setting. This is a horrible decision to drop Play Music to go with a lesser featured service that people don't want. What exactly is this solving for?",google_play,"['use', 'google_play', 'music', 'listen', 'playlist', 'download', 'car', 'look', 'music', 'be', 'not', 'see', 'set', 'be', 'horrible', 'decision', 'drop', 'play_music', 'go', 'lesser', 'featured', 'service', 'people', 'do', 'not', 'want', 'exactly', 'be', 'solving']",1
1106905200642740226,2019-03-16 13:08:59,"@GooglePlayMusic: After the last update, the app prompted me to renew my subscription to a plan similar to the one I already had; following which - ALL MY DOWNLOADED MUSIC GOT ERASED. This is not why I pay for the service. Request you to investigate this issue. Thanks!",google_play,"['last', 'update', 'app', 'prompt', 'renew', 'subscription', 'plan', 'similar', 'already', 'follow', 'download', 'music', 'get', 'erase', 'be', 'not', 'pay', 'service', 'request', 'investigate', 'issue', 'thank']",1
1110983040497537024,2019-03-27 19:12:52,I'm using a Google pixel 2 and I haven't received an error message.,google_play,"['be', 'use', 'pixel', 'have', 'not', 'receive', 'error_message']",1
1110973050793664514,2019-03-27 18:33:10,"Tried resetting library per instructions and no help. I can load other sites and apps no problem: YouTube, Netflix, speedtests",google_play,"['try', 'reset', 'library', 'instruction', 'help', 'load', 'site', 'app', 'problem', 'youtube', 'netflix', 'speedtest']",1
1110972892995563528,2019-03-27 18:32:33,"No error message, it just spins trying to load the song and eventually goes to the next and repeats. For playlists where some music is local, it plays those songs normally (with a lot of silence while it tries to load other songs).",google_play,"['error_message', 'spin', 'try', 'load', 'song', 'eventually', 'go', 'next', 'repeat', 'playlist', 'music', 'be', 'local', 'play', 'song', 'normally', 'lot', 'silence', 'try', 'load', 'song']",1
1110726499924099072,2019-03-27 02:13:28,no error message just the progress bar goes away also this is the only computer i have,google_play,"['error_message', 'progress', 'bar', 'go', 'away', 'also', 'be', 'computer', 'have']",1
1105559574839521282,2019-03-12 20:01:57,@GooglePlayMusic why is my favorite podcast's lastest episode gone? Please help solve this issue. Nerd Poker deserves better treatment!,google_play,"['be', 'favorite', 'podcast', 'last', 'episode', 'go', 'help', 'solve', 'issue', 'nerd', 'poker', 'deserve', 'well', 'treatment']",1
1105152779335667716,2019-03-11 17:05:29,"@GooglePlayMusic how come certain songs glitch out after years of owning it? On the song Someone to Hate by Demon Hunter at 1:10 it glitches out and skips part of the song, then goes back to where it was at every single time.",google_play,"['come', 'certain', 'song', 'glitch', 'year', 'own', 'song', 'someone', 'hate', 'demon', 'hunter', 'glitch', 'skip', 'part', 'song', 'go', 'back', 'every_single', 'time']",1
1108710601142890496,2019-03-21 12:43:00,"@GooglePlayMusic I keep getting this ""cant play music on this device"" error. I followed all of the troubleshooting online with no solution. Anyway I can get some help or answers?",google_play,"['keep_gette', 'can', 'not', 'play_music', 'device', 'error', 'follow', 'troubleshoot', 'online', 'solution', 'anyway', 'get', 'help', 'answer']",1
1106118654440034305,2019-03-14 09:03:32,"@GooglePlayMusic Hello I have a bug where the app is showing cover art that shouldn't exist. The image shown does not exist in the directory and the audio files have all been scrubbed. The metadata points to the correct image, not the one shown. Any idea?",google_play,"['have', 'bug', 'app', 'be', 'show', 'cover', 'art', 'should', 'not', 'exist', 'image', 'show', 'do', 'not', 'exist', 'directory', 'audio', 'file', 'have', 'be', 'scrub', 'metadata', 'point', 'correct', 'image', 'not', 'show', 'idea']",1
1109823852270575617,2019-03-24 14:26:40,"@GooglePlayMusic The 'account is closed' and 'card unavailable' issue might just be the push I need to use @spotifyindia Those cards a very much functional, I use them everyday. I'm a loyalist but I just can't help it.pic.twitter.com/TdlhAiO1Uc",google_play,"['account', 'be', 'closed', 'card', 'unavailable', 'issue', 'may', 'push', 'need', 'use', 'card', 'much', 'functional', 'use', 'everyday', 'be', 'loyalist', 'can', 'not', 'help', 'com', 'tdlhaio']",1
1109814509667934209,2019-03-24 13:49:33,@GooglePlayMusic we got a problem. I need help. DM so I can tell you what's up with the app and my attempts to play music. Thx guys.,google_play,"['get', 'problem', 'need', 'help', 'tell', 's', 'app', 'attempt', 'play_music', 'thx', 'guy']",1
1104062004422197249,2019-03-08 16:51:08,"@GooglePlayMusic The Daily podcast by NYT hasn't updated in Google Play music for several days...numerous others having the same problem. We know new episodes have been released. Tried clearing cache, restarting, unsubbing/resubbing. No luck.",google_play,"['daily', 'podcast', 'nyt', 'have', 'not', 'update', 'google_play', 'music', 'several', 'day', 'numerous', 'other', 'have', 'problem', 'know', 'new', 'episode', 'have', 'be', 'release', 'try', 'clearing', 'cache', 'restart', 'unsubbe', 'resubbe', 'luck']",1
1103856364198285312,2019-03-08 03:14:00,"The documents and options there are of no help. I have written in multiple times reporting non-updating podcasts, with no response and no change. Reading yet more advice to reset my browsers or devices or accounts *are not the problem*.",google_play,"['document', 'option', 'help', 'have', 'write', 'multiple_time', 'report', 'non', 'update', 'podcast', 'response', 'change', 'read', 'advice', 'reset', 'browser', 'device', 'account', 'not', 'problem']",1
1115673512289734659,2019-04-09 17:51:08,"Sorry forgot to tag you in my response above. It fixed itself in about 10 min or so and refreshing a few times. Tried Signing into incognito right away, but that didn't fix it. Thank you for the response. Have a good one.",google_play,"['sorry', 'forget', 'tag', 'response', 'fix', 'min', 'refreshing', 'time', 'try', 'sign', 'incognito', 'right', 'away', 'do', 'not', 'fix', 'thank', 'response', 'have', 'good']",1
1112825604133404674,2019-04-01 21:14:33,"@GooglePlayMusic Umm, unexpected error are doing me a concern! 

I can't buy new music! :( Halp!!!",google_play,"['umm', 'unexpected', 'error', 'do', 'concern', 'can', 'not', 'buy', 'new', 'music', 'halp']",1
1115958835800309761,2019-04-10 12:44:54,@GooglePlayMusic this thing happens all the time (+ sometimes some downloaded songs don't work without internet connection) is it something you can fix or is it my phone's fault?? pic.twitter.com/QmxqcrRI53,google_play,"['thing', 'happen', 'time', 'sometimes', 'download', 'song', 'do', 'not', 'work', 'internet_connection', 'be', 'something', 'fix', 'be', 'phone', 'fault', 'pic_twitter', 'com', 'qmxqcrri']",1
1113755307149279232,2019-04-04 10:48:52,"I googled in the interim. It looks like other people have experienced this issue, and the question on this part of the installer is asking if you want to auto-upload songs added to the selected folders.",google_play,"['google', 'interim', 'looks_like', 'people', 'have', 'experience', 'issue', 'question', 'part', 'installer', 'be', 'ask', 'want', 'auto', 'upload', 'song', 'add', 'select', 'folder']",1
1113745131079966720,2019-04-04 10:08:26,@GooglePlayMusic @youtubemusic I've seen an issue in YTM. A lot of people upload music and have their standard intro for their channel at the beginning. Some even roll credits afterwards and talk about their lives. This will be a bad thing as a music service. Anyways around this?,google_play,"['have', 'see', 'issue', 'ytm', 'lot', 'people', 'upload', 'music', 'have', 'standard', 'intro', 'channel', 'begin', 'even', 'roll', 'credit', 'afterwards', 'talk', 'live', 'bad', 'thing', 'music', 'service', 'anyways']",1
1115328093655326721,2019-04-08 18:58:33,@GooglePlayMusic Can you fix the action ellipses dropdown bounds in the Android app? It's very difficult to bring up the dropdown. Often times you end up scrolling to some position in the music list. It's been terrible UX for years now.,google_play,"['fix', 'action', 'ellipsis', 'dropdown', 'bound', 'android', 'app', 'difficult', 'bring', 'dropdown', 'often', 'time', 'end', 'scroll', 'position', 'music', 'list', 'be', 'terrible', 'year']",1
1115162442106068992,2019-04-08 08:00:19,@GooglePlayMusic what is the best way I can reach out to you? I've been waiting two days to talk to someone about a problem.,google_play,"['be', 'good', 'way', 'reach', 'have', 'be', 'wait', 'two_day', 'talk', 'someone', 'problem']",1
1112896548260597760,2019-04-02 01:56:28,"It just says ""unexpected error"".",google_play,"['say', 'unexpected', 'error']",1
1114221371666718724,2019-04-05 17:40:50,@GooglePlayMusic Nasty Girl is a The Notorious B.I.G. record not Nelly. You need to fix that.,google_play,"['nasty', 'girl', 'be', 'notorious', 'record', 'not', 'nelly', 'need', 'fix']",1
1116418149811986438,2019-04-11 19:10:03,@GooglePlayMusic your songs doesn't finish in the @SonosSupport(speakers) sometimes they do sometimes don't (the don't part is more often). Please fix that pic.twitter.com/rUtr4Dgsvm,google_play,"['song', 'do', 'not', 'finish', 'sometimes', 'do', 'sometimes', 'do', 'not', 'do', 'not', 'part', 'be', 'often', 'fix', 'pic_twitter', 'com', 'rutr', 'dgsvm']",1
1116250188639641600,2019-04-11 08:02:38,Just realized it only happens with certain songs...is it a license issue?,google_play,"['realize', 'happen', 'certain', 'song', 'be', 'license', 'issue']",1
1116249939892260864,2019-04-11 08:01:39,"Hi there it's the iOS app. Using a 7 plus. There is no error message. After I press the share button...nothing happens! It should bring up options to share like text, etc",google_play,"['io', 'app', 'use', 'be', 'error_message', 'press', 'share', 'button', 'nothing', 'happen', 'bring', 'option', 'share', 'text']",1
1113498714117693441,2019-04-03 17:49:15,Did the refresh and then restarted. Same problem. Note9. Here's the album and then the queue after I hit play on the album pic.twitter.com/A4H8IzLOjE,google_play,"['do', 'refresh', 'restart', 'problem', 'note', 'here', 'album', 'queue', 'hit', 'play', 'album', 'pic_twitter', 'com', 'izloje']",1
1116779818903797762,2019-04-12 19:07:12,Why do I pay for @GooglePlayMusic when my Android Auto will now only work with @YouTubeMusic? Do I need to cancel one and subscribe to the other? This is frustrating and irritating.,google_play,"['do', 'pay', 'android', 'auto', 'work', 'do', 'need', 'cancel', 'subscribe', 'be', 'frustrating', 'irritate']",1
