id,appTitle,userName,date,score,text,original_text,bug_report
502101,Amazon Shopping,Nick Ghantous,"February 18, 2019",4.0,we will see trying to order look up or order something tight now,"We'll see, trying to order look up or order something tight now...",
502102,Amazon Shopping,Ted Brewer,"February 18, 2019",5.0,love amazon shopping you can find anything that you are looking for,"Love Amazon shopping, you can find anything that you are looking for.",
502103,Amazon Shopping,,"February 18, 2019",5.0,it a good application,it a good app.,
502105,Amazon Shopping,Sarabeth Reinker,"February 3, 2019",4.0,i love shopping on amazon and the application is pretty good only problem is that occasionally when i try to add something to my cart or buy my cart now on the application my cart doe neither no mater how hard i press on my phone also sometimes have problem when trying to see a picture larger after clicking on my cart i suddenly get a message that image is not available other than that i am really happy with amazon i especially love amazon smile i wish they would incorporate amazon smile into an application thank you,I love shopping on Amazon & the app is pretty good. Only problem is that occasionally when I try to add something to my cart or buy it now on the mobile app it does neither no mater how hard I press on my phone. Also sometimes have problems when trying to see a picture larger. After clicking on it I suddenly get a message that image isn't available. Other than that I'm really happy with Amazon. I especially love Amazon Smile. I wish they would incorporate it into an app. Thank you.,
502106,Amazon Shopping,Jon D,"February 3, 2019",2.0,i only allow notification for call text and shipingpayment alert across all aps notification mean my attention is truly needed notification apparently can not afford to donate to smile if i do not allow notification recommending stuff i do not plan to buy i will keep checking out from my pc for now give me time to think and decide not to buy thing anyway,"I only allow notifications for calls, texts, and shipping/payment alerts across all apps. notifications mean my attention is truly needed. They apparently can't afford to donate to smile if i don't allow notifications recommending stuff I don't plan to buy. I'll keep checking out from my PC for now. Gives me time to think and decide not to buy things anyway.",
502107,Amazon Shopping,PyroKimmi,"February 3, 2019",5.0,love it i would like to add some request for helpful update an option of moving multiple item at once to other list permitting kept wish-list item imagedetails visible from total disappearance if listing disappears it reminds me of what was desired until it appears again an option to keep our default wish-list from accidentally being deleted it happened once and i forgot everything i added to it please and thank you,"LOVE IT!!! I would like to add some requests for helpful updates. - An option of moving multiple items at once, to other lists. - Permitting kept wishlist items [image/details] visible from total disappearance if listing disappears; it reminds me of what was desired until it appears again. - An option to keep our default wishlist from accidentally being deleted. It happened once and I forgot everything I added to it. Please and thank you!!!",
502108,Amazon Shopping,Fermin Peregrin,"February 14, 2019",5.0,excellent easy to use application it has the right tool to allow to find exactly what are you looking for they help you if you have any problem with an order and you can apply for the amazon store card that allows you to purchase expensive item and pay it off a little bit every month i love it and i am so happy with this application and amazon,"Excellent, easy to use app. It has the right tools to allow to find exactly what are you looking for. They help you if you have any problem with an order and yoy can apply for the amazon store card that allows you to purchase expensive items and pay it off a little bit every month. I love it and I am so happy with this app and amazon.",
502109,Amazon Shopping,Kerry's Glam Bag,"February 2, 2019",5.0,oh my god why have not i been using this sooner if i need anything not only doe amazon have this but you get this so quick this make my head spin laugh out loud in a good way obviously,"OMG WHY HAVEN'T I BEEN USING THIS SOONER! if I need anything not only does Amazon have it, but you get it so quick it makes my head spin. (lol in a good way obviously)",
502110,Amazon Shopping,,"February 12, 2019",1.0,i loved this application and spent a lot on amazon over the year and have had prime membership all along but for the past while thing have got bad delivery are never on time and delivery do not respond to mail so i cancelled prime now i went to buy an item and the price is but delivery offer free delivery for order over that is an absolute con there is nothing i can buy for penny so i am deleting this application now and will spend my valuable money elsewhere will not be back,"I loved this app and spent A LOT on Amazon over the years and have had Prime membership all along, but for the past while things have got bad. Deliveries are never on time and they don't respond to emails. So I cancelled Prime. Now I went to buy an item and the price is 19.97, but they offer free delivery for orders over 20.00. That's an absolute con! There is nothing I can buy for 3 pence. So I am deleting the app now and will spend my valuable money elsewhere. Won't be back.",
502111,Amazon Shopping,,"February 18, 2019",1.0,i tried this application and was confused after i signed up i tried chat and customer service called but the individual was not knowledgeable first and definitely the last time horrible since updated i can not see size detail on plus size woman coat i am removing but before i remove from my device i am reactivating this amazon account then remove this application,I tried this app and was confused after I signed up. I tried Chat and customer service called but the individual was not knowledgeable. First and DEFINITELY THE LAST TIME! HORRIBLE SINCE UPDATED I CANNOT SEE SIZE DETAILS ON 2 PLUS SIZE WOMEN COATS. I AM REMOVING BUT BEFORE I REMOVE FROM MY DEVICE I AM DEACTIVATING THIS AMAZON ACCOUNT! THEN REMOVE THIS 🐂💩 APP!,
502112,Amazon Shopping,Mark Seidel,"February 6, 2019",1.0,still hate this application and using the browser to access amazon is way more comprehensive and detailed this application is just useless at time their day shipping is now just a bad joke ad claim day shipping but take day to receive prime shipping is becoming pointless and that is why i have prime doubtful i will have prime shipping next year,"Still hate this app and using the browser to access Amazon is way more comprehensive and detailed. This app is just useless at times. Their 2 day shipping is now just a bad joke. Ads claim 2 day shipping but takes 6 days to receive. Prime shipping is becoming pointless and that's why I have prime, doubtful I'll have it next year.",
502114,Amazon Shopping,Mariann Balcar,"February 8, 2019",3.0,i ordered headlight to be shipped to me in day and the payment method went through the day they were supposed to arrive i checked the application to see when they were supposed to arrive and the application said the payment method was declined the payment method would have been fine if your system said that from the beginning or sent me a notification on my phone if something changed,I ordered headlights to be shipped to me in 2 days and the payment method went through. the day they were supposed to arrive I checked the app to see when they were supposed to arrive and it said the payment method was declined? It would have been fine if your system said that from the beginning or sent me a notification on my phone if something changed!,
502113,Amazon Shopping,Jose Santiago,"February 17, 2019",2.0,it is pretty ridiculous how slow and unresponsive this application is any time i look at an item that has multiple option it take forever to get those option to load actually loading time in general here are bad playing product video is always a hit or miss the underground application was far superior but that is being discontinued so here we are,"It's pretty ridiculous how slow and unresponsive this app is. Any time I look at an item that has multiple options, it takes forever to get those options to load. Actually loading times in general here are bad. Playing product videos is always a hit or miss. The Underground app was far superior but that's being discontinued, so here we are.",
502115,Amazon Shopping,ZeGlowingMushroom,"February 15, 2019",1.0,second time ordering something from here wanted a refund because my item was late for a few week got my money back then my item arrived randomly and i must go place to repackaged everything to get to keep my money worst experience get something online so far,"Second time ordering something from here. Wanted a refund beacuse my item was late for a few weeks, got my money back. Then the item arrived randomly and I must go places to repackage everything to get to keep my money. Worst experience gettng something online so far.",
502116,Amazon Shopping,Eraldo Frost,"February 17, 2019",3.0,the market is okay but i still feel like bay is better a bay doe feel like the customer are split in two different segment like prime and normal user are here also your application icon doe stand out your application icon very plain and unnoticeable i often go right past your application icon when looking for the application in my installed application,The market is okay but i still feel like ebay is better as it doesnt feel like the customers are split in two different segments like prime and normal users are here. Also your app icon doesnt stand out its very plain and unnoticeable i often go right past it when looking for the app in my installed applications.,
502117,Amazon Shopping,Michael Linhart,"February 13, 2019",2.0,application is much better than it use to be when it ate up my battery running in the background application still has major issue when i try to order some thing that are close to sold out application will say application has placed application in my cart but application has not seems like only sunny day scenario are tested,App is much better than it use to be when it ate up my battery running in the background. App still has major issues when I try to order some things that are close to sold out. It will say it has placed it in my cart but it hasn't. Seems like only sunny day scenerios are tested.,
502118,Amazon Shopping,Jaren3311,"February 12, 2019",4.0,the latest update seems to have caused a few lock-ups and a bit of lag it also seems to be more bandwidthungry now overall it work however it still has issue with the button next to item on list and adding item to list phone onerous,"The latest update seems to have caused a few lockups and a bit of lag. It also seems to be more bandwidth-hungry now. Overall, it works. However, it still has issues with the ... button next to items on lists and adding items to lists. Phone: OnePlus 2.",
502119,Amazon Shopping,Kai Williams,"February 15, 2019",2.0,this is significantly worse than the old amazon application it is slow and lay and keep randomly switching around my default setting i never had this problem with the old amazon application but after i got a new phone i couldnt download the old one star because amazon itself is great but the old amazon application run terribly and there was nothing wrong with the old one,"This is significanlty worse than the old Amazon app. It's slow and laggy and keeps ramdomly switching around my default settings. I never had this problem with the old app, but after I got a new phone I couldnt download the old one. 2 stars because Amazon itself is great, but this app runs terribly and there was nothing wrong with the old one.",
502120,Amazon Shopping,Joel Armendariz,"February 18, 2019",4.0,i love amazon but there is just one thing that is making me give a star just one thing that is making me give a star is that sometimes the application bug out and i can not even open up the application at time i have to restart my phone to make the application work please fix this,"I love amazon, but there's just one thing that's making me give a 5 star. The thing is that sometimes the app bugs out and I can't even open up the app at times. I have to restart my phone to make the app work.. please fix this 😊",
502121,Amazon Shopping,Emily Chambers,"February 11, 2019",3.0,the old application used to work better this new one doe not let you do thing the old one did this new one freeze and i am not able to scan any of my gift qr code to send a thank you note the barcode scanner doe not work i really wish i never deleted the old one the barcode scanner worked flawlessly,The old app used to work better. This new one doesn't let u do things the old one did. It freezes and I'm not able to scan any of my gift QR codes to send a thank you note the barcode scanner doesn't work I really wish I never deleted the old one it worked flawlessly,
502122,Amazon Shopping,Naveen Thomas Joseph Stephen Manohar,"February 16, 2019",1.0,why doe amazon india process your review if you give a low rating for a product while if you give a higher rating it doe not say it is processing is this to support the seller for some monetary reason while customer are ok to suffer with low quality product from seller i have not noticed this type of thing in amazon u and i see a big difference in return policy too between the country,"Why does Amazon India process your review if you give a low rating for a product while if you give a higher rating, it doesn't say it's processing. Is this to support the sellers for some monetary reasons while customers are ok to suffer with low quality products from sellers? I haven't noticed this type of thing in Amazon US. And I see a big difference in return policies too between the countries",
502123,Amazon Shopping,John L,"February 10, 2019",1.0,totally worthless in australia i have not been able to find a single thing on amazon australia that is actually cheaper than bay or retail store it became even worse when amazon decided to collude with the australian government and decided to ban australian from purchasing from the overseas amazon site this result in higher price showing on amazon australia more often than not and is basically a price gouging platform for seller to continue to rip off australian,"Totally worthless in Australia. I haven't been able to find a single thing on Amazon Australia that is actually cheaper than eBay or retail stores. It became even worse when Amazon decided to collude with the Australian Government and decided to ban Australians from purchasing from the overseas Amazon sites. This results in higher prices showing on Amazon Australia more often than not, and is basically a price gouging platform for sellers to continue to rip off Australians.",
502124,Amazon Shopping,romie seng,"February 13, 2019",1.0,never using amazon again someone tried purchasing thing with my card a soon a i put my info on there my info dint happen once but twice fraud prevention called me time for purchase i never made,"never using Amazon again , someone tried purchasing things with my card as soon as I put my info on there , it didnt happen once , but twice. fraud prevention called me 2 times for purchases I never made.",
502125,Amazon Shopping,,"February 10, 2019",5.0,have purchased lot of product only had one item damaged amazon sent the replacement the very next day now that is great service i am a big fan of amazon price comparison and the ease of navigating their site thanks amazon you put em all to shame in customer service clay,"Have purchased lots of products, only had one item damaged. Amazon sent the replacement the very next day, now that is Great Service! I'm a big Fan of Amazons price comparisons, and the ease of navigating their site. Thanks Amazon you put em' all to shame in customer service. clay",
502127,Amazon Shopping,chris nervi,"February 7, 2019",3.0,since the android application update whenever i go to buy something via one click i am prompted to enter my password and then my password just loop between hitting buy item and enter password if i add something to my cart and then proceed to checkout and buy my cart everything is fine this issue seems to have appeared after the android application update,"Since the Android app update, whenever I go to buy something via one click, I am prompted to enter my password, and then it just loops between hitting 'buy item' and 'enter password.' If I add something to my cart, and then proceed to checkout and buy it everything's fine. This issue seems to have appeared after the latest update.",
502128,Amazon Shopping,Dave Slender,"February 14, 2019",1.0,my one and only complaint is that the application almost always run so bad that the application completely unusable and even when the application doe run the application is so slow to use i do not bother for more than a couple minute something is seriously wrong with the application and i do not recommend the application at all i am on a galaxy s so it should not be a device issue,"My one and only complaint is that the app almost always runs so bad that its completely unusable, and even when it does run it's so slow to use I dont bother for more than a couple minutes. Something is seriously wrong with this app and I dont recommend it at all. I'm on a galaxy s9 so it shouldn't be a device issue.",
502129,Amazon Shopping,Dahn Alan,"February 15, 2019",1.0,just pic of dog saying something went wrong at our side i called amazon and amazon have acknowledged a technical fault and told me a technical fault will be solved in two day a amazon team know anyway two week later and all i get are bloody pic of dog everytime i use the application to make matter worse amazon asked me for the dog name then were shocked when i told them that there is no name just the error and a dog feel like amazon are taking the piss out of me here,"just pics of dogs saying 'something went wrong at our side'. i called amazon and they have acknowledged a technical fault and told me it will be solved in two days as their teams know. anyway two weeks later and all i get are bloody pics of dogs everytime i use the app. to make matters worse, amazon asked me for the dogs name then were shocked when i told them that there is no name, just the error and a dog. feel like Amazon are taking the piss out of me here...",
502130,Amazon Shopping,Danny Keo,"February 9, 2019",1.0,starting to become frustrated with my prime what is the point of having day shipping if my purchase started getting delayed or not left at my location on time they will make it inconvenient by taking it back to they facility amd i would have to wait day over the weekend or until amd make amd back getting over this and we are over charged same time listed for cheaper on bay and now they have they own version of prime,"starting to become frustrated with my prime. what's the point of having 2 day shipping if my purchases started getting delayed, or not left at my location on time. They will make it inconvenient by taking it back to their facilities, amd I would have to wait days over the weekend, or until it makes it back!!! getting over this, and we are over charged. same itmes listed for cheaper on ebay, and now they have their own version of prime.",
502131,Amazon Shopping,Magdalen C,"February 3, 2019",4.0,i like the more like this and the customer also buy this feature so i can compare product and/or consider associated product i am irritated that i could never find information a to whether the product are brand new or refurbished or open box in any ad generally it is an ok application aliexpres application is slightly better in term of usability,"I like the ""more like this"" and the ""customers also buy this"" features so I can compare products and/or consider associated products. I'm irritated that I could NEVER find information as to whether the products are brand new, or refurblished, or open box in any ads. Generally it is an OK app. AliExpress app is slightly better in terms of userbility.",
502132,Amazon Shopping,Good Bye,"February 3, 2019",1.0,this application suck i can not even write a review on a product because i do not meet the requirement are you fokin serious i have had something i ordered not come and i can not even write a fokin review how retarded apparently i have to have a debit card purchase for that and i think it is retarded and shipping is too damn expensive,"This app SUCKS I can't even write a review on a product because I don't ""meet the requirements"" are you fookin serious? I have had something I ordered not come and I can't even write a fookin review? How retarded. Apparently I have to have a debit card purchase for that and I think it is retarded. And shipping is too damn expensive",
502133,Amazon Shopping,Scott Wiggins,"February 8, 2019",4.0,i love the free two day shipping with prime and being able to watch movie and tv show for free on our tel rok tv application the only thing i hate is the application being unresponsive not loading the home page or an item when i click on it which is becoming too often everyone saying there is no difference between prime and paying for two day shipping is wrong a subscription by month or yearly pay for itself with free shipping if you use itself somewhat often but some people do not comprehend that,I love the free two day shipping with Prime and being able to watch movies and TV shows for free on our TCL Roku TV app. The only thing I hate is the app being unresponsive/ not loading the home page or an item when I click on it which is becoming too often. Everyone saying there's no difference between Prime and paying for two day shipping is wrong. A subscription by month or yearly pays for itself with free shipping if you use it somewhat often but some people don't comprehend that.,
502134,Amazon Shopping,Amy Mertz,"February 6, 2019",3.0,i would give it star but since there is no option to use amazon smile i am only giving it i would love to support my selected organization using a convenient application but that is still not an option so disappointed,I would give it 5 stars but since there's no option to use amazon smile I'm only giving it 3. I would love to support my selected organization using a convenient app but that's still not an option. So disappointed.,
502135,Amazon Shopping,Andy Best,"February 14, 2019",2.0,i used to use underground which ran fine but had to upgrade to shopping this is so slow in comparison you would think the current offering would be better but i would switch back in a heartbeat if i could why doe this application have to be so slow i use my pc where possible,"I used to use underground which ran fine but had to upgrade to shopping. This is soooooooo slooooow in comparison. You would think the current offering would be better, but I would switch back in a heartbeat if I could. Why does this app have to be so slow. I use my pc where possible.",
502137,Amazon Shopping,Wes C,"February 2, 2019",4.0,amazon is the standard when it come to ordering anything it list product that other company just do not have and with that tech it very user friendly most used to compare price even at the brick and mortar store,Amazon is the standard when it comes to ordering anything. It list products that other companies just dont have and with that tech its very user friendly. Most used to compare prices even at the brick and mortar stores.,
502138,Amazon Shopping,John Gutkind,"February 9, 2019",1.0,worst application ever doe recognize beaverton or kawara lake postal code try to contact custom service and need to log in but i can not because trying to make an account and i need a postal code my star stand firm until this changed,worst app ever. doesnt recognize beaverton or kawartha lakes postal codes. try to contact customs service. and need to log in. but I cant because trying to make an account and I need a postal code. my 1 star stand firm until this changed,
502139,Amazon Shopping,Sam,"February 6, 2019",1.0,shingle of a company never again will i buy from shingle of a company and do everything in my power to deter others from using others the customer service level seem to be getting horrible like bay too big and talking to rep in foreign country that have no authority other than look at a tracking number for you well played my amazon management,shi*hole of a company never again will i buy from them and do everything in my power to deter others from using them. the customer service level seem to be getting horrible like ebay. too big and talking to reps in foriegn countries that have no authority other than look at a tracking number for you. well played my amazon management.,
502140,Amazon Shopping,kathy jo morris,"February 10, 2019",5.0,wonderful fast service and delivery we lost we dog had lb bag of dog food they had delivered they took off credit card said do not worry about returning and they gave condolence pretty nice for a big company and they replied immediately they have my business i hate shopping my business wonderful shopping at home,wonderful fast service and delivery. we lost our dog had 30lb bag of dog food they had delivered they took off credit card said dont worry about returning and they gave condolences. pretty nice for a big company and they replied immediately they have my business. i hate shopping its wonderful shopping at home,
