id,appTitle,userName,date,score,text,original_text,bug_report
504469,Amazon Shopping,A Google User,"February 24, 2019",2.0,i think amazon should get rid of the rigged giveaway stuff doe anyone honestly win at that thing amazon should be ashamed of amazon for rigging something like that and tricking the public into wasting time on something so useless,I think Amazon should get rid of the rigged giveaway stuff. Does anyone honestly win at that thing? Amazon should be ashamed of themselves for rigging something like that and tricking the public into wasting time on something so useless,
504470,Amazon Shopping,Jes7er,"February 28, 2019",1.0,op something went wrong every second,"""Oop, something went wrong"" every 5 seconds.",
504471,Amazon Shopping,Abdullah Al Harthy,"February 20, 2019",1.0,amazon can not ship material to sultanate of oman we feel difficult to deal with amazon,"Amazon cannot ship materials to Sultanate of Oman , we feel difficult to deal with them.",
504472,Amazon Shopping,Christopher Dewhurst,"February 21, 2019",1.0,bad they are trying to take over the world with a no and agenda population control,bad they are trying to take over the world with a nwo and agenda 21 population control,
504473,Amazon Shopping,Alex Vanicarlo Overmann,"February 19, 2019",5.0,class a customer service and speedy secured delivery with package tracking class a customer service and speedy secured delivery with package tracking deliver when last notification is received and i wait to the door,CLASS A CUSTOMER SERVICE & SPEEDY SECURED DELIVERY WITH PACKAGE TRACKING. THEY DELIVER WHEN LAST NOTIFICATION IS RECEIVED AND I WAIT TO THE DOOR.,
504474,Amazon Shopping,Bob Davis,"February 27, 2019",5.0,they just need to ring door bell or knock on door when dropping off package,They just need to ring door bell or knock on door when dropping off package.,
504475,Amazon Shopping,Aaron Putman,"February 20, 2019",5.0,great application have not used great application to much but i amway from home till saturday and make purchase way easier to manage thanks amazon,Great app. Haven't used it to much but im away from home till Saturday and makes purchases way easier to manage! Thanks Amazon....,
504476,Amazon Shopping,Joe Pool,"February 25, 2019",4.0,pretty good alternative to the browser version but there is stuff obviously missing like selecting the top item in the phone application,"Pretty good alternative to the browser version, but there's stuff obviously missing - like selecting the Top 100 items in the phone app.",
504477,Amazon Shopping,Antanise L Davis,"February 20, 2019",5.0,i love that this a very good application too do all of my shopping need off of and a whole lot of other thing,i love that this a very good app too do all of my shopping needs off of and a whole lot of other things,
504479,Amazon Shopping,Sicely Mccants,"February 19, 2019",5.0,awesome for those around the house thing or quick pick of blessing for the right dollar thanks for gift and holiday thing yay,Awesome for those around the house things or quick picks of blessing for the right dollar. Thanks for gifts and holiday things. Yay,
504480,Amazon Shopping,Ken Elvin,"February 24, 2019",5.0,i can not get amon or e bay its been like this for about a were,i cannot get amon or e bay its been like this for about a weekebb,
504481,Amazon Shopping,Joe Bell,"February 24, 2019",3.0,the application is very useful and so easy to use when will the application get amazon smile support,The app is very useful and so easy to use. When will it get Amazon smile support?,
504482,Amazon Shopping,T T,"February 24, 2019",2.0,very slow have to restart a lot and sometimes that do not help,Very Slow have to restart a lot and sometimes that don't help ...,
504483,Amazon Shopping,A Google User,"February 22, 2019",5.0,love the tracking of shipment but my delivery was not delivered when my delivery said my delivery was even earlier than expected super happy with that,"love the tracking of shipments but my delivery was not delivered when it said, it was even earlier than expected SUPER HAPPY WITH THAT!!!",
504484,Amazon Shopping,Lino Puente,"February 21, 2019",5.0,i been using the amazon application with almost no issue but what application doe not have issue once in a while i am able to do all my shopping and amazon keep improving the amazon application and making the amazon application better,I been using the Amazon app with almost no issues but what app doesn't have issues once in a while. I'm able to do all my shopping and Amazon keeps improving the app and making it better.,
504485,Amazon Shopping,A Google User,"February 20, 2019",1.0,odd how its the largest online store amazon was a huge disappointment i ordered item and received only one,"Odd how its the largest online store, Amazon was a huge disappointment. I ordered 5 items and received only one.",
504486,Amazon Shopping,Max S,"February 25, 2019",5.0,i got amazon prime but amazon always show is me that i do not have amazon if i open amazon in the browser my prime work but not in the application had to change my country now my country work,"I got Amazon Prime, but it always show's me that I don't have it. If I open amazon in the Browser, my prime works, but not in the App..... Had to change my country, now it works.",
504487,Amazon Shopping,A Google User,"February 22, 2019",5.0,work very good in all aspect of shopping for what you need thanks for a fast way to get your item to your door,works very good in all aspects of shopping for what you need. Thanks for a fast way to get your items to your door.,
504488,Amazon Shopping,A Google User,"February 21, 2019",5.0,love shopping on line since i do not have a car i always get great item and wonderful customer service when i call i am a prime member too,Love shopping on line since I don't have a car!! I always get great items & wonderful customer service when I call. I am a Prime member too!!,
504489,Amazon Shopping,Andy Knapp,"February 23, 2019",2.0,continually crash on pie not sure if this is intentional on goole is part,Continually crashes on Pie. Not sure if this is intentional on Google's part.,
504490,Amazon Shopping,Chelsea Johnson,"February 24, 2019",2.0,keep crashing when i am scrolling freeze on cart screen,keeps crashing when I'm scrolling. freezes on cart screen.,
504491,Amazon Shopping,Nathan Hall,"February 28, 2019",1.0,tried logging into amazon after not using it for quite some time when i finally got to login it asked a security question about a card that i have not used in year now i can not login screw amazon go to wish,tried logging into Amazon after not using it for quite some time. When I finally got to login it asked a security question about a card that I have not used in years now I can't login screw Amazon go to wish,
504492,Amazon Shopping,Em Wal,"February 25, 2019",3.0,its annoying that amazon smile not a application,its annoying that Amazon smile not a app.,
504493,Amazon Shopping,Titan Clark,"February 23, 2019",2.0,i going to give you a its slow to pull up item ta view before buying anything,Im going to give you a 2/½ its slow to pull up items ta view before buying anything!!,
504494,Amazon Shopping,Myra Gamble,"February 27, 2019",3.0,it seems to periodically stop working and keep popping notice up that it stopped working and interferes with what ever i am trying to do,It seems to periodically stop working and keeps popping notices up that it stopped working and interferes with what ever I am trying to do.,
504495,Amazon Shopping,A Google User,"February 22, 2019",5.0,everything you used to have to pay triple the price for you can buy at cost love amazon maybe a little too much laugh out loud,everything you used to have to pay triple the price for you can buy at cost. love Amazon maybe a little too much lol.,
504496,Amazon Shopping,Antonio Rial,"February 20, 2019",5.0,can not beat amazon on you are phone amazon is the best,"Can't beat amazon on ur phone, it's the best.",
504497,Amazon Shopping,Pauline Roberts,"February 22, 2019",5.0,i love amazon amazon are always reliable i have purchased a lot of quality thing through amazon,I love Amazon. They're always reliable. I've purchased a lot of quality things through them.,
504498,Amazon Shopping,Ashley Allen,"February 25, 2019",5.0,it is okay you got ta be careful because sizing is really difficult to trust for woman is clothing,"It's okay, you gotta be careful because sizing is really difficult to trust for women's clothing",
504499,Amazon Shopping,A Google User,"February 22, 2019",5.0,love it better than the bay application that doe not have a wish list anymore just need a dark mode option and a way to save pic,Love it! Better than the eBay app that doesn't have a wish list anymore. Just needs a dark mode option and a way to save pics.,
504500,Amazon Shopping,A Google User,"February 23, 2019",3.0,freeze and close out since last update also it is not giving me search result of item i am looking up,freezes and closes out since last update. also it isn't giving me search results of items I am looking up.,
504501,Amazon Shopping,A Google User,"February 20, 2019",1.0,i find this application very difficult to use and the item and department almost impossible the previous version had the previous version is limitation but was far better than this latest one in,I find this app very difficult to use and the items and departments almost impossible. The previous version had it's limitations but was far better than this latest one. in,
504502,Amazon Shopping,Catherine Edwards,"February 23, 2019",1.0,uh-oh something went wrong amazon what is up with the constant oh something went wrong message on this new version of your application it is darn near impossible to find or view product with the version i just downloaded this morning i thought it was something wrong with my phone but no this morning is download is just a bad a the one i downloaded last week,"UH-OH. Something went wrong... Amazon, what is up with the constant oh something went wrong messages on this new version of your app? It is darn near impossible to find or view products with the version I just downloaded this morning. I thought it was something wrong with my phone, but no - this morning's download is just as bad as the one I downloaded last week!",
504503,Amazon Shopping,Christopher Digby,"February 23, 2019",1.0,who in the created the wish-list tab at the bottom where do they reside it has ruined my shopping experience on the application i can not scroll without it taking over completely a if i holding every single item when i just want to scroll down,Who in the #### created the wishlist tab at the bottom? Where do they reside? It has ruined my shopping experience on the app. I cant scroll without it taking over conpletely! As if im holding every single item when I just want to scroll down!,
504504,Amazon Shopping,Sylvain Lecours,"February 26, 2019",3.0,there is a bug that make the application hard to use whenever we have to chose color or size for an item when tapping the done word just above nothing happens the colonize selection stay on screen and am stuck there have to go on web version instead to be able to complete my selection,"there is a bug that makes the app hard to use, whenever we have to chose color or size for an item, when tapping the done word just above, nothing happens. the color/size selectopn stays on screen and am stuck there. have to go on web version instead to be able to complete my selection",
504505,Amazon Shopping,Benjamin Aguilar,"February 23, 2019",5.0,so far i have been completely satisfied with amazon any item i was dissatisfied with i was able to return any item i was dissatisfied with i and get my refund and everything i have kept i am happy with i am always looking here for more good deal keep my refund up amazon i have been recommending you to all of my friend both of my friend just kidding,"So far I've been completely satisfied with Amazon, any items I was dissatisfied with I was able to return them and get my refund. And everything I've kept I'm happy with. I'm always looking here for more good deals. Keep it up Amazon, I've been recommending you to all of my friends. ( both of them (j/k))",
504506,Amazon Shopping,des des dance,"February 25, 2019",1.0,this application has been switching like made lately this application will not even be running and i will get error message popping up on my phone saying this application is not workingshesh frustrating,this app has been glitching like made lately. it won't even be running and i will get error messages popping up on my phone. saying the Amazon app is not working...sheesh frustrating.,
504507,Amazon Shopping,A Google User,"February 23, 2019",3.0,good but flawed search option is useless and the filter are terrible also amazon know that i am in ireland and insists on returning option that do not deliver to ireland this is so annoying because you think you have found something only to be told in bold red letter that they will not deliver to ireland,"Good but flawed. Search option is useless and the filters are terrible. Also, Amazon knows that I'm in Ireland and insists on returning options that don't deliver to Ireland. This is so annoying because you think you've found something only to be told in bold red letters that they won't deliver to Ireland.",
504508,Amazon Shopping,Shalee Michelle,"February 20, 2019",3.0,my interesting like are not refreshing at their usual rate despite all of my effort to bear-like different thing in an attempt to jog the algorithm it is been showing me the exact same suggestion for at least wa now so needle to say i would definitely appreciate a fix for this issue i would happily adjust my rating to if my rating is fixed thanks update i wrote this review on february th and there is still been no improvement this review is still showing the same suggestion after roughly wa fix,"My ""interesting likes"" aren't refreshing at their usual rate, despite all of my efforts to heart/like different things in an attempt to jog the algorithim. It's been showing me the exact same suggestions for at LEAST 2wks now, so needless to say, I'd definitely appreciate a fix for this issue. I'd happily adjust my rating to 5 if it's fixed. Thanks. UPDATE I wrote this review on February 9th and there's still been no improvement. It's still showing the same suggestions after roughly 4+wks. FIX.",
504509,Amazon Shopping,Tish Roberts Guel,"February 22, 2019",2.0,application worked beautifully until week ago now when i try to check out it give me password incorrect error where the browser work just fine with the same login i need both to function a i use my family account in one and my private personal account in the other rather than constantly switch login info i have just started using outside retailer when i need something and will continue to do so until this issue is resolved note uninstalreinstal and pw reset did not work,"App worked beautifully until 2 weeks ago. Now, when I try to check out it gives me password incorrect errors where the browser works just fine with the same login. I need both to function as I use my family account in one and my private personal account in the other. Rather than constantly switch login info, I have just started using outside retailers when I need something and will continue to do so until this issue is resolved. *Note: Uninstall/reinstall and PW reset did not work .",
504510,Amazon Shopping,Love Child,"February 28, 2019",1.0,only work for me of the time freeze often its hard to shop and enjoy this application its becomes very stressful this is the only application i have issue with refreshing and update do not help i almost hate its happens more when i amon wife,"Only works for me 50% of the time. Freezes often. Its hard to shop and enjoy this app, it becomes very stressful. This is the only app I have issues with. Refreshing and updates dont help! I almost hate it. Happens more when Im on wifi.",
504511,Amazon Shopping,lee boyd,"February 24, 2019",3.0,the old one was a lot better new application feel like you have to tap multiple time hang up slow slow slow make me want to go to wal-mart i hate wal-mart please fix so i can buy stuff again,the old one was a lot better new app feels like you have to tap multiple times hangs up slow slow slow. makes me want to go to Walmart. I hate walmart!!! please fix so i can buy stuff again,
504512,Amazon Shopping,Alec McLaughlin,"February 23, 2019",1.0,very glitch on note it will not let me add thing to my cart frequently and certain butonslinks are unclimbable,Very glitchy on note 9. It wont let me add things to my cart frequently and certain buttons/links are unclickable.,
504513,Amazon Shopping,Christopher Bennett,"February 19, 2019",3.0,great application that i use almost every day would be better if there was an option to use amazon smile annoying to add thing to my basket then far around with the browser to smile checkout,"Great app that I use almost every day, would be better if there was an option to use Amazon Smile. annoying to add things to my basket then faf around with the browser to Smile checkout.",
504514,Amazon Shopping,Karin Wilcox,"February 27, 2019",3.0,the new application update has made this application completely useless on my home wife the new application update the only application that has done this and i have had a tech here to check my service after the most recent update the new application update will no longer work on my home wife at all but work fine on verizone lte,the new app update has made this app conpletely useless on my home wifi. its the only app that has done this and ive had a tech here to check my service. afger the most recent update it will no longer work on my home wifi at all. but works fine on verizone lte.,
504515,Amazon Shopping,T Sherwood,"February 27, 2019",2.0,i am a longtime amazon customer but i must call out amazon is awful android application there simply is no excuse for amazon business and uselessness in certain product search i will focus on two problem product search for example how is it i can search for a book titled simply macklin and said book which is sold by amazon come up nowhere on the first few page of result try it and see the content and device page is utterly useless try it yourself it simply hang full stop,"I am a long-time Amazon customer, but I must call out Amazon's awful Android app. There simply is no excuse for its bugginess and uselessness in certain product searches. I will focus on two problems: 1) Product searches. For example: How is it I can search for a book titled simply ""Macklin"" and said book, which IS sold by Amazon, comes up nowhere on the first few pages of results? Try it and see. 2) The ""Content and Devices"" page IS UTTERLY useless. Try it yourself. It simply hangs, full stop.",
504516,Amazon Shopping,Jessie Tin,"February 25, 2019",5.0,i buy for everyone at home and the pet i buy on my lunch break before bed in pyjama or right then and there if i see something is low at home within a couple of day it is dropped off at my front door i have not had any problem with product product are exactly like store bought there are also way more option and discount on here than at store this has really freed up my time and money i do not have to spend half of my day off going from crowded store to crowded store,"I buy for everyone at home and the pets. I buy on my lunch break, before bed (in pajamas), or right then and there if I see something is low at home. Within a couple of days it's dropped off at my front door. I haven't had any problems with products. Products are exactly like store bought. There are also way more options and discounts, on here, than at stores. This has really freed up my time and money. I don't have to spend half of my day off, going from crowded store to crowded store.",
504517,Amazon Shopping,Bonny Kadimo,"February 24, 2019",3.0,quite dissatisfied with the lack of choice for my region can not fault the application though the application work a the application should just wish amazon could expand amazon global store,Quite dissatisfied with the lack of choice for my region. Can't fault the app though. It works as it should. Just wish Amazon could expand its global store.,
504518,Amazon Shopping,Amitabh Suman,"February 27, 2019",1.0,amazon india is the waste i order my product and trying to contact the customer care no response only few option to choose from no direct resolution amazon you are escaping from your responsibility poor service no more amazon,"Amazon India is the waste. I order my products and trying to contact the customer care, no response. Only few option to choose from. No direct resolution. Amazon you are escaping from your responsibility. Poor service. No more Amazon.",
504519,Amazon Shopping,A Google User,"February 24, 2019",1.0,slow often unresponsive crash every other time i try to use it complete and utter garbage go back to the old application that was clunky but functional,"Slow, often non-responsive, crashes every other time I try to use it. Complete and utyer garbage, go back to the old app that was clunky but functional.",
504520,Amazon Shopping,Steele-Wool,"February 20, 2019",4.0,update after some update this application is much easier and more pleasant to use it is not perfect and it still has hiccup but overall a good improvement old review amazon a a site is great but this application is very unresponsive and slow at time and make browsingshoping very frustrating it is easier just to go to the site on my computer or using the web browser on my phone rather than using this application,"Update: After some updates, this app is much easier and more pleasant to use. It's not perfect and it still has hiccups, but overall a good improvement. *Old Review*: Amazon as a site is great, but this app is very unresponsive and slow at times and makes browsing/shopping very frustrating. It's easier just to go to the site on my computer or using the web browser on my phone rather than using this app.",
504521,Amazon Shopping,D H,"February 22, 2019",1.0,it keep showing me price for the item i search and but after i click the item the price jump up by several dollar stop the bait and switch and dishonesty because all it is going to do is cost you a prime member i also can not stand the unwanted notification for suggestion on stuff i do not use i might search for stuff for others for their birthday but it doe not mean i want a dozen suggestion for it either,"It keeps showing me prices for the items I search, and but after I click the item, the price jumps up by several dollars. Stop the bait and switch and dishonesty, because all it's going to do is cost you a Prime member. I also can't stand the unwanted notifications for suggestions on stuff I don't use. I might search for stuff for orhers for their birthdays, but it doesn't mean I want a dozen suggestions for it either.",
504522,Amazon Shopping,Kaden DoesStuff,"February 25, 2019",1.0,new update is terrible quality and resolution just went out the window,new update is terrible quality and resloution just went out the window,
504523,Amazon Shopping,A Google User,"February 27, 2019",5.0,amazon is my alltime favorite way to shop without the hassle of fighting traffic and people,Amazon is my all-time favorite way to shop without the hassle of fighting traffic & people,
504524,Amazon Shopping,Sammi Van Hoy,"February 25, 2019",1.0,once again application doe work after an update,"Once again, app doesnt work after an update.",
504525,Amazon Shopping,Olivia Cappuzxo,"February 21, 2019",1.0,i love shopping amazon but the application is extremely slow and always lagging,I LOVE shopping Amazon but the app is extremely slow and always lagging.,
504526,Amazon Shopping,Erin LaDue,"February 20, 2019",5.0,always has what i need amazing price and high quality item amazon is the first place i look for anything if you can not find amazon on amazon your looking at the wrong place,"Always has what I need! Amazing prices, and high quality items. Amazon is the first place I look for anything. If you can't find it on amazon your looking at the wrong place!!! 😉",
504528,Amazon Shopping,A Google User,"February 23, 2019",2.0,i am glad they are finally adding amazon smile to the application however the application constantly give uh-oh error when browsing and viewing item these crash make using the application quite frustrating a i have to keep reopening it i have tried everything from reboot clearing data and even installing the application,"I am glad they are finally adding Amazon Smile to the app however the app constantly gives ""Uh-oh"" errors when browsing and viewing items. These crashes make using the app quite frustrating as i have to keep re-opening it. I have tried everything, from reboots, clearing data, and even reinstalling the app.",
504529,Amazon Shopping,A Google User,"February 25, 2019",1.0,why doe it continues to have me update application or loss service i have done this time,why does it continues to have me update app or loss service ??? I have done this 15 times!!,
504530,Amazon Shopping,Jonah Strouse,"February 21, 2019",2.0,was a decent application tell it started auto correcting my search making it impossible to find what i am actually looking for,was a decent app tell it started auto correcting my searches making it impossible to find what I'm actually looking for,
504531,Amazon Shopping,Christy Luberger,"February 25, 2019",1.0,can not add item to cart since recent update please fix also freeze on me year amazon buyer never had this problem,can't add items to cart since recent update. please fix. also freezes on me. 7 year Amazon buyer never had this problem,
