id,appTitle,userName,date,score,text,original_text,bug_report
502505,Amazon Shopping,David Hartlebury,"February 3, 2019",1.0,it take too long to download it doe not download or install correctly and tie up my tablet while doing so,It takes too long to download. It does not download or install correctly and ties up my tablet while doing so.,
502508,Amazon Shopping,,"February 6, 2019",5.0,good value for money,good value for money,
502509,Amazon Shopping,,"February 12, 2019",5.0,good to buy bj,good to buy BJ,
502510,Amazon Shopping,Suzette Shipman,"February 6, 2019",5.0,they are great,they are great!!,
502522,Amazon Shopping,,"February 18, 2019",5.0,i love shopping with amazon my screen protector is the greatest also bought a child is dress an eagle jersey and hair accessory,"I love shopping with Amazon my screen protector is the greatest. Also bought a children's dress, an eagles jersey and hair accessories.",
502523,Amazon Shopping,Chris Lackey,"February 16, 2019",1.0,mac sleeping was a a,Zac Zzz was a a,
502524,Amazon Shopping,,"February 9, 2019",5.0,am new at amazon no experience yet,"am new at Amazon, no experience yet.",
502525,Amazon Shopping,Kade Donohue,"February 10, 2019",4.0,this application would take forever to load and this application never worked,this app would take forever to load and it never worked,
502526,Amazon Shopping,Michael Jackson,"February 11, 2019",4.0,the only shopping application i really use,The only shopping app I really use,
502529,Amazon Shopping,,"February 18, 2019",5.0,sometimes it get on my nerve but i just like it,"sometimes it get on my nerves, but i just like it.😀😀😀😀",
502530,Amazon Shopping,kirsten hillis,"February 18, 2019",1.0,application will not load i have tried uninstaling and installing and keep doing the same thing,app wont load! ive tried uninstalling and installing and keeps doing the same thing!!!!,
502531,Amazon Shopping,KiWi,"February 6, 2019",4.0,if possible can you add papal or venom a payment method,If possible can you add PayPal or Venmo as payment method,
502532,Amazon Shopping,,"February 5, 2019",1.0,very bad ad problem,very bad ads problem,
502533,Amazon Shopping,Jose Cuellar,"February 10, 2019",5.0,too easy to use browsing so simple you will go broke,"Too easy to use. Browsing so simple, you'll go broke!",
502534,Amazon Shopping,just vlog'n,"February 8, 2019",5.0,great i love this application easy,great i love this app easy 👍,
502535,Amazon Shopping,,"February 9, 2019",5.0,very good like the application a lot of help finding the right thing i was looking for thank you very much,very good like the app alot of help finding the right things I was looking for thank you very much,
502536,Amazon Shopping,L Simons,"February 15, 2019",5.0,love this application when ever something pop in my head that i need it is just a click away quick and easy to use work like a dream,love this app when ever something pops in my head that i need it is just a click away quick and easy to use works like a dream,
502537,Amazon Shopping,,"February 15, 2019",5.0,i can not say enough good thing about my amazon shopping experience i have been very pleased,I cannot say enough good things about my Amazon shopping experience. I have been very pleased.,
502538,Amazon Shopping,,"February 9, 2019",5.0,love couple of tap it is ordered one more from the postman and you have got your item what could be easier,"love it,Couple of taps it's ordered one more from the postman and you have got your item wot could be easier.",
502539,Amazon Shopping,,"February 10, 2019",1.0,aaa ada dada damask a a s a adazasasa mac sasasasadadasasasasasasasasasatuser,aaaassss Ada dada dasasaaa as as s as aaaaadazaaaaaaaasasa Zac ssasasasaaaaaaaaaadaaaaaadaaaasaaassasaasaaasaaaaaasaaaaasaaaaaaaaaaaaaaaasaaaaaaaaaaaaaaaaaaaaaasaaaaaaaaaaaaaaaaaaaaaaaaaaaaaaaaaaaaaaaaaaaaaaaaaaaaaaaaaaaaaaaaaa@aaaaaaaaaaaaaaaaaaaaaaaaaaaaaasaaaasaaaaaaaaaaaaaaaaaaaaaaaaaaaaaaaaaaaaaaaaaasaaaaaasaaaaaa,
502541,Amazon Shopping,,"February 7, 2019",1.0,keep jumping off application closing it,keeps jumping off app closing it.,
502542,Amazon Shopping,James Stahl,"February 13, 2019",2.0,every single time i push the amazon application on my home page i have to download the same application over and over and over it doe not stay in my phone,every single time I push the Amazon app on my home page. I have to download the same app over and over and over it doesn't stay in my phone,
502543,Amazon Shopping,Robert Saunders,"February 3, 2019",5.0,almost always what i need at great price,almost always what i need at great prices,
502544,Amazon Shopping,,"February 8, 2019",2.0,electricheater received notice about receiving but not item has yet been or information given why no item have been received,electric-heater received notice about receiving but not item has yet been or information given why no item have been received.,
502545,Amazon Shopping,cody collette,"February 6, 2019",3.0,use to love this application but since the update i keep being prompt to install or cancel the new update even though i updated the update week ago,use to love this app but since the update I keep being prompt to install or cancel the new update even though I updated it weeks ago.,
502546,Amazon Shopping,Justin Morgan,"February 12, 2019",5.0,am los message a este chat why la lambda agora est. protegidos con corrado de extreme a extreme coca para oftener m information am justin morgan docwapdf archive adjust wbewmsinfografa am justin morgan docwapdf archive adjust principle de date de site multiple am justin morgan docwahtm archive adjust translatehtml,"4/4/19, 1:01 AM - Los mensajes a este chat y las llamadas ahora están protegidos con cifrado de extremo a extremo. Toca para obtener más información. 4/4/19, 1:01 AM - Justin Morgan: DOC-20190204-WA0000.pdf (archivo adjunto) 215726-WWBE_WMS-Infografía 4/4/19, 1:33 AM - Justin Morgan: DOC-20190204-WA0001.pdf (archivo adjunto) Principios de datos de sitios múltiples 4/4/19, 7:59 AM - Justin Morgan: DOC-20190204-WA0003.htm (archivo adjunto) translate.html",
502547,Amazon Shopping,Romeo Poza,"February 11, 2019",1.0,uhuh something went wrong on our end,"uh-uh, something went wrong on our end",
502548,Amazon Shopping,Randy Chen,"February 11, 2019",1.0,it will not generate amazonsmile revenue if i turn off recommendation notification i do not see why the two have to be related,It won't generate AmazonSmile revenue if i turn off recommendation notification. I don't see why the two have to be related.,
502550,Amazon Shopping,,"February 3, 2019",5.0,this amazon shopping is amazing this amazon shopping should have been in existence at least year ago,this Amazon shopping is amazing it should have been in existence at least 15 years ago,
502551,Amazon Shopping,Rachel Albrecht,"February 2, 2019",1.0,the last update has the last update so i can not even open the application anymore,the last update has it so I can't even open the app anymore,
502552,Amazon Shopping,Oliver Jones,"February 2, 2019",3.0,was not able to keep my purchase from prime video,wasn't able to keep my purchase from prime video😐,
502554,Amazon Shopping,Amber McDonald,"February 4, 2019",3.0,currently not letting me open application,currently not letting me open app,
502556,Amazon Shopping,Mary Collard,"February 4, 2019",5.0,excellent i received my panasonic twin landmine phone today my panasonic twin landmine phone today they are now up and running great thankyou amazon are now up and running great thankyou amazon,excelent i recieved my panasonic twin landline phones today they are now up and running great thankyou Amazon.,
502558,Amazon Shopping,Mavis Vermillion,"February 6, 2019",2.0,great application but the problem is the shipping fee are too expensive than the item,Great app but the problem is the shipping fees are too expensive than the item. :(,
502559,Amazon Shopping,Michael Cooper,"February 9, 2019",2.0,i have updated and everytime i open the application it has that same update message i should not keep seeing that same update message after already updating that same update message,I've updated and everytime I open the app it has that same update message. I shouldn't keep seeing that dang message after already updating it,
502560,Amazon Shopping,Jenny Haswell,"February 6, 2019",5.0,a bit muddled but now i have got it,A bit muddled but now I've got it,
502561,Amazon Shopping,Debbie Jeffers,"February 2, 2019",1.0,i was suppose to get off for my first order but it was not taken off false advertisement is not good for amazon disappointed,I was suppose to get $10 off for my first order but it wasn't taken off . False advertisement is not good for amazon disappointed,
502562,Amazon Shopping,RealTalk Media,"February 4, 2019",1.0,amazon just started a new way of stealing people is money prime pantry where you pay wether you buy something or not otherwise if you do not pay you can not buy item marked prime pantry am really disappointed with amazon you just lost one customer bye bye thief,"Amazon just started a new way of stealing people's money. ""PRIME PANTRY"" where you pay $10 wether you buy something or not. Otherwise if you don't pay, you can't buy items marked ""PRIME PANTRY"". am really disappointed with Amazon. YOU JUST LOST ONE CUSTOMER. Bye bye thieves",
502563,Amazon Shopping,Amer Al Omari,"February 11, 2019",5.0,my recommendation recommended my experience the user interface the shopping experience and the way amazon customer service is amazing make sure you write fair review for the seller some item can be bought much cheaper on aliexpres same item,"My Recommendation: [Recommended] My Experience: The user interface, the shopping experience and the way Amazon customer service is amazing! Make sure you write fair reviews for the sellers. Some items can be bought much cheaper on Aliexpress (same items)",
502564,Amazon Shopping,Lizz,"February 13, 2019",1.0,i do not dislike amazon but i am sick of being pressured to download the application bloatware,"I don't dislike Amazon, but I'm sick of being pressured to download the app. Bloatware",
502587,Amazon Shopping,,"February 16, 2019",5.0,cc cc c kl,cc 6 cxc6 c kl,
502588,Amazon Shopping,Nick Julia,"February 5, 2019",5.0,they delivered my package a day early yes yes and yes mr bozo,"They delivered my package a day early. Yes, yes, and yes, Mr. Bezos.",
502589,Amazon Shopping,Janet Miller,"February 12, 2019",5.0,i love amazon shopping it is convenient it is reliable except for some overseas vendor the packaging is quality and return are easy,"I love Amazon shopping. It's convenient, it's reliable, except for some overseas vendors, the packaging is quality and returns are easy.",
502590,Amazon Shopping,James K,"February 18, 2019",3.0,price are high and he doe not sell everything,prices are high and he doesn't sell everything,
502591,Amazon Shopping,mrs harris,"February 10, 2019",3.0,i am not interested in new feature,I'm not interested in new feature,
502592,Amazon Shopping,Jane Doe,"February 4, 2019",1.0,open up randomly and hick link,opens up randomly and hijaks links,
502593,Amazon Shopping,,"February 11, 2019",5.0,i order quite a lot from amazon,I order quite a lot from Amazon.,
502594,Amazon Shopping,Jeff Moorman,"February 16, 2019",1.0,keep restarting can not get the info i want,"keeps restarting, can't get the info I want.",
502595,Amazon Shopping,Adrian Nurse,"February 15, 2019",5.0,i absolutely love this application this application is my number one source for online shopping,I absolutely love this app. It is my number one source for online shopping.,
502596,Amazon Shopping,E Haber,"February 16, 2019",5.0,great customer service sometimes get delivery same day,great customer service... sometimes get delivery same day,
502597,Amazon Shopping,Gloria Bermingham,"February 18, 2019",5.0,wonderful eay to shop and buy all your stuff you will love this site,Wonderful eay to shop & buy all your stuff. you will love this site.,
502598,Amazon Shopping,Carla M,"February 14, 2019",5.0,i love amazon i just wish i did not get an update twice a week,"I love Amazon, I just wish I didn't get an update twice a week!",
502599,Amazon Shopping,,"February 18, 2019",5.0,this application is easy to use from search description pricing suggestion reminder to purchase item again to checkout,"This app is easy to use from search, descriptions, pricing, suggestions, reminders to purchase items again, to checkout!",
502600,Amazon Shopping,,"February 14, 2019",5.0,i love amazon because amazon has a lot of thing that you nead,i love amazon because it has a lot of things that you nead,
502601,Amazon Shopping,Kalvin Hobbs,"February 9, 2019",1.0,doe not allow leaving review for item purchased,Doesn't allow leaving reviews for items purchased.,
502602,Amazon Shopping,Roy Boisvert,"February 9, 2019",2.0,can not sign out application,cannot sign out app !,
502604,Amazon Shopping,Dustin Voss,"February 17, 2019",5.0,after deleting and installing deleting and installing work again,after deleting and reinstalling it works again,
502605,Amazon Shopping,,"February 12, 2019",1.0,it made me get remove instigram,it made me get ridove instigram,
502606,Amazon Shopping,darcey dezutter,"February 12, 2019",1.0,will not even let me open the application,won't even let me open the app,
502607,Amazon Shopping,Amber Barrett,"February 12, 2019",5.0,everything you could need and more,everything you could need and more!!!,
502608,Amazon Shopping,Anthony Williams,"February 7, 2019",5.0,i use it almost every day,I use it almost every day.,
502609,Amazon Shopping,Rip Steele,"February 8, 2019",1.0,it keep asking me to i stall the update done already,it keeps asking me to i stall the update ...done already!,
502610,Amazon Shopping,Friday Schofield,"February 8, 2019",5.0,my experience has been devine,My experience has been Devine.,
502611,Amazon Shopping,Myrna Dominick,"February 12, 2019",2.0,can not find the shoe i want,can't find the shoes I want,
502612,Amazon Shopping,Clinton Wai,"February 13, 2019",2.0,can not proceed to checkout the button is not responsive,Can't proceed to checkout the button is not responsive,
502613,Amazon Shopping,,"February 7, 2019",2.0,brian shaver pk cleaning cartridge,.Bruan shaver 4pk cleaning CARTRIDGS,
502614,Amazon Shopping,Mary Hannum,"February 5, 2019",5.0,i like amazon and use amazon quite often,I like Amazon and use it quite often.,
502615,Amazon Shopping,Dave Timmick,"February 11, 2019",5.0,east to shop n real good on returned,easr to shop n real goid on returnes,
502616,Amazon Shopping,joco brat,"February 6, 2019",5.0,they are beta testing with amazon smile in application,they are beta testing with Amazon Smile IN APP!!!!,
502617,Amazon Shopping,Monroe Rice III,"February 11, 2019",5.0,this application work fine on my phone and i enjoy using this application daily,This app works fine on my phone and I enjoy using it daily.,
502618,Amazon Shopping,leshaundra Muhammad,"February 5, 2019",5.0,i have never had a problem,I have never had a problem.,
502619,Amazon Shopping,Scott Barton,"February 3, 2019",5.0,amazon always meet my expectation,amazon always meets my expectations,
502620,Amazon Shopping,,"February 4, 2019",5.0,none yet want to order please how to order,none yet want to order please how to order,
502622,Amazon Shopping,Sree Thiruvananthapuram,"February 1, 2019",5.0,excellent no word more than that,Excellent. No words more than that.,
502623,Amazon Shopping,Rod Joseph,"February 3, 2019",5.0,outstanding and convenient i love this application,"Outstanding and convenient, I love this app",
502624,Amazon Shopping,,"February 17, 2019",5.0,very useful and price are low for internet purchase,very useful & prices are low for internet purchases...,
502625,Amazon Shopping,Letisha Huff,"February 17, 2019",5.0,very convenient to have on main screen,Very Convenient to have on main screen,
502626,Amazon Shopping,kathleen stevens,"February 10, 2019",5.0,always delivery on time very happy,always delivery on time very happy,
502627,Amazon Shopping,lionel jules,"February 10, 2019",5.0,very good application work a very good application should,"Very good app, work as it should",
502628,Amazon Shopping,Kevin Burrell,"February 15, 2019",5.0,great application super easy to use,great app super easy to use,
502630,Amazon Shopping,kelly merk,"February 10, 2019",5.0,calling it best application in the world,"CALLING IT, #1 BEST APP IN THE WORLD!!!!!!",
502631,Amazon Shopping,Adrianna Hickman,"February 6, 2019",2.0,will not open just crash nd instal and deinstall,won't open just crashes 2nd uninstall and reinstall,
502632,Amazon Shopping,Deb Mccormick,"February 17, 2019",5.0,i like amazon easy to use,I like Amazon. easy to use,
502633,Amazon Shopping,Ron Nicholl,"February 18, 2019",5.0,i use regularly and no problem,I use regularly and no problems,
502634,Amazon Shopping,Chris Davenport,"February 18, 2019",5.0,rally easy shopping quick shipping,rally easy shopping quick shipping,
502635,Amazon Shopping,Daryl Claybrooks,"February 8, 2019",5.0,what is expected from amazon,what is expected from Amazon,
502636,Amazon Shopping,Joy Barry,"February 8, 2019",5.0,i love the application easy to use and convenient,i love the app. easy to use and convenient.,
502637,Amazon Shopping,,"February 15, 2019",5.0,always satisfied with what i order and the fast delivery,allways satisfied with what i order and the fast delivery,
502638,Amazon Shopping,Chauntelle LeSure Turner,"February 15, 2019",5.0,i love ordering it is so fast,I love ordering it's so fast!❤❤,
502639,Amazon Shopping,,"February 14, 2019",5.0,love it when the sale on plus easy to shop,love it when the sales on plus easy to shop,
502640,Amazon Shopping,Ferry Triana,"February 15, 2019",5.0,cool much better than bukalapak,"cool, much better than bukalapak",
502643,Amazon Shopping,Janice Sneed,"February 6, 2019",5.0,i love amazon prime,I Love Amazon Prime!,
502644,Amazon Shopping,TekHed-Gamez,"February 8, 2019",5.0,great easy to use site,great easy to use site!,
502645,Amazon Shopping,Melissa Collins,"February 6, 2019",5.0,great application love shopping on amazon,great app love shopping on amazon,
502646,Amazon Shopping,,"February 7, 2019",5.0,use this all the time brill application,use this all the time Brill app,
502647,Amazon Shopping,Teresa Evans,"February 7, 2019",5.0,love me some amazon,love me some Amazon!,
502648,Amazon Shopping,Patty Feeney,"February 6, 2019",5.0,excellent shopping and shipping experience,Excellent shopping and shipping experience!,
502650,Amazon Shopping,Mikayla Austin,"February 12, 2019",5.0,great only place i shop,Great only place I shop,
502651,Amazon Shopping,Michael Bryant,"February 11, 2019",5.0,great application doe all you need,Great app. does all you need.,
502653,Amazon Shopping,Patricia Kearney,"February 1, 2019",5.0,easy to see and use i love it,easy to see and use I love it,
502655,Amazon Shopping,Robin Podwojski,"February 1, 2019",5.0,super consistent application love it,super consistent app! love it.,
502692,Amazon Shopping,,"February 7, 2019",5.0,excellent deal and search what my family and child like from my family and child price,excellent deals and search what my family and children like from their prices,
502693,Amazon Shopping,Abed Al,"February 2, 2019",3.0,slow and the add to cart button hang most of the time,"slow and the ""Add to Cart"" button hangs most of the time.",
502694,Amazon Shopping,Christine Tuell,"February 10, 2019",5.0,work great for me,Works great for me!,
502697,Amazon Shopping,,"February 9, 2019",5.0,love love love it,love love love it!,
502711,Amazon Shopping,Buffe Wik,"February 15, 2019",5.0,love it,Love it!....,
502728,Amazon Shopping,Frank Crisci,"February 10, 2019",5.0,thanks for your time and consideration,thanks for your time and consideration.,
502730,Amazon Shopping,Yesenia Alvarez,"February 9, 2019",1.0,this application is horrible,this application is horrible,
502731,Amazon Shopping,Leo Marvin Panganiban,"February 9, 2019",4.0,this application is clutch,this app is clutch,
502732,Amazon Shopping,,"February 6, 2019",5.0,brilliant for the thing i need,brilliant for the things i need,
502734,Amazon Shopping,mike mcdonald,"February 4, 2019",5.0,best site for anything you want or need,best site for anything you want or need....,
502737,Amazon Shopping,JJW,"February 12, 2019",5.0,new update hang frequently instead of completing search we apologize for the inconvenience an error occurred when we tried to process your request what it was just a simple search graphic design also not near a cool a it was galaxy s,"New update hangs frequently instead of completing search. ""We apologize for the inconvenience. An error occurred when we tried to process your request."" What?? It was just a simple search. Graphics design also not near as cool as it was. galaxy s7",
502738,Amazon Shopping,Brandon Shelters,"February 13, 2019",2.0,so i am giving amazon application i star rating because i upgraded to amazon prime a few week ago and i have made several purchase since the upgrade and only once did an order ever get delivered within day i reached out to an amazon agent name pagan an amazon agent name pagan told me that it has to do with the item being readily available i find that not to be true because a friend of mine ordered the same exact item i ordered and it was at their house very next day my stuff was delivered a week after ordering,so I'm giving Amazon app I 2 star rating because I upgraded to Amazon Prime a few weeks ago and I have made several purchases since the upgrade and only once did an order ever get delivered within 2 days. I reached out to an Amazon agent name Pavan. he told me that it has to do with the items being readily available I find that not to be true because a friend of mine ordered the same exact item I ordered and it was at their house very next day my stuff was delivered a week after ordering.,
502739,Amazon Shopping,Patricia Barrigher,"February 6, 2019",4.0,this application is fun and quick but the buy in one click button is entirely too close to the put in cart button and one caution once you load your cart your cart will nag you to buy if you are like me that will drive you crazy i like to load your cart to the brim and then think about for your cart awhile before i weed your cart out and make my actual purchase,"This app is fun and quick, but the buy in one click button is entirely too close to the put in cart button! And one caution, once you load your cart it will nag you to buy! If you are like me that will drive you crazy! I like to load my cart to the brim and then think about for it awhile before I weed it out and make my actual purchases.",
502740,Amazon Shopping,Donna B.,"February 1, 2019",1.0,this company block negative review that are positively written i reviewed a product that this company sent me that was labeled new but was visually used when i opened this company i reviewed my finding and was told the couldnt post my finding i amusing cause it was amazon recommended and had a positive of which was a new product i really miss bay but this company are iffy and slow lately also a someone stated below the two day shipping is mainly untrue sometimes longer and you can find most cheaper elsewhere,"This company blocks negative reviews that are positively written. I reviewed a product that they sent me that was labeled new but was visually used when I opened it. I reviewed my findings and was told theu couldnt post it. Im guessing cause it was ""Amazon"" recommended and had a positive of 7 which was a new product. I really miss Ebay but they are iffy and slow lately. Also as someone stated below the two day shipping is mainly untrue. Sumtimes longer and you can find most cheaper elsewhere.",
502742,Amazon Shopping,Sade Warren Helping MOM's STRESS LESS,"February 5, 2019",5.0,i enjoy the application,i enjoy the app,
502757,Amazon Shopping,Carla,"February 10, 2019",5.0,great of course,"great, of course.",
502758,Amazon Shopping,,"February 18, 2019",5.0,convenience convenience convenience,"Convenience, convenience convenience!!!!",
502764,Amazon Shopping,,"February 15, 2019",5.0,i love it,I love it!,
502765,Amazon Shopping,Lillian Boretti,"February 8, 2019",5.0,love this application,Love this app!!,
502767,Amazon Shopping,Cristina Bedolla,"February 6, 2019",5.0,they are great,They are great!,
502768,Amazon Shopping,,"February 7, 2019",5.0,easy to make purchase,easy to make purchases,
502769,Amazon Shopping,Lorie Matz,"February 7, 2019",5.0,love this application love the convenience,love this app. love the convenience.,
502773,Amazon Shopping,Jeff Turner,"February 5, 2019",5.0,best way to shop,best way to shop,
502774,Amazon Shopping,Michelle P.,"February 11, 2019",5.0,simple to use,Simple to use!,
502776,Amazon Shopping,Finlay Foster,"February 3, 2019",5.0,very easy to use,very easy to use,
502777,Amazon Shopping,Donna Jones,"February 4, 2019",5.0,everything in one click,Everything in one click,
502778,Amazon Shopping,Leslie Palmer,"February 5, 2019",5.0,excellent and professional application,excellent and professional app,
502779,Amazon Shopping,Ginger Gabbard George,"February 2, 2019",5.0,just love it,just love it!,
502781,Amazon Shopping,Lois Mohs,"February 2, 2019",4.0,so far so good,so far so good.,
502783,Amazon Shopping,,"February 3, 2019",5.0,very easy to navigate,very easy to navigate,
502784,Amazon Shopping,,"February 1, 2019",5.0,great and quick service,Great and quick services,
502785,Amazon Shopping,Gil Parayno,"February 2, 2019",5.0,easy and worry free,easy and worry free,
502786,Amazon Shopping,Colleen Bierbaum,"February 1, 2019",5.0,easy to use,Easy to use!,
502787,Amazon Shopping,G-MAC Johnson,"February 9, 2019",5.0,amazon prime is amazing,Amazon prime is amazing,
502826,Amazon Shopping,Leslie Talty,"February 17, 2019",3.0,it keep telling support will end soon even how i have already updated,it keeps telling support will end soon even thow I've already updated,
