id,appTitle,userName,date,score,text,original_text,bug_report
505459,Amazon Shopping,A Google User,"February 28, 2019",5.0,well working application great customer service its not perfect but the good service and straight forward layout outweighs the glitch that happen to your order history if you excessively order thing in a short period of time,"well workin app, great customer service, its not perfect but the good service and straight forward layout outweighs the glitches that happen to your order history if you excessively order things in a short period of time.",
505462,Amazon Shopping,Renata Hill,"February 28, 2019",5.0,i love this application,I love this app,
505469,Amazon Shopping,A Google User,"February 28, 2019",5.0,where would i be without it,Where would i be without iT,
505470,Amazon Shopping,Derrick Williams,"February 28, 2019",5.0,great one day shipping,great one day shipping,
505472,Amazon Shopping,lara salako,"February 28, 2019",5.0,e holy wm in b p pm b,e loly wm vn b pp000 PM b .,
505477,Amazon Shopping,John Carver,"February 27, 2019",5.0,great application love to shop on here,great app. love to shop on here,
505478,Amazon Shopping,Andrea Dandridge,"February 27, 2019",5.0,i love amazon i always get my package on time thanks amazon,"I luv Amazon I always get my packages on time, thanks Amazon 😀",
505481,Amazon Shopping,Leticia A Fuentes,"February 27, 2019",5.0,great for making purchase customer service is great a well,great for making puchases customer service is great as well,
505482,Amazon Shopping,Straw Hat Luffy,"February 27, 2019",5.0,it is simply amazing,It's simply amazing,
505486,Amazon Shopping,Karen Ward,"February 27, 2019",4.0,i amtryin to get the amazon application on my android and can not do the amazon application on my android,im tryin to get the Amazon app on my andriod and cant do it.,
505491,Amazon Shopping,Michelle Mclaren,"February 27, 2019",4.0,i freaking love amazon,I freakin love Amazon,
505492,Amazon Shopping,A Google User,"February 27, 2019",1.0,not sure a yet just trying it out,"not sure as yet, just trying it out",
505494,Amazon Shopping,A Google User,"February 27, 2019",3.0,sometimes a link can force the application to open and can get very irritating even if you try to close a link sometimes the webster is easier to use making the application kind of useless,"Sometimes a link can force the app to open and can get very irritating, even if you try to close it. Sometimes the website is easier to use, making this app kinda useless.",
505495,Amazon Shopping,Judith Thomas,"February 27, 2019",5.0,godson shop shopped more shop,"GOOD....shop, shop, shop....and more shop!",
505496,Amazon Shopping,IG Richmond,"February 27, 2019",5.0,easy user friendly once you set easy user up correctly,Ez User Friendly. Once you Set it up correctly.,
505497,Amazon Shopping,Brittany Slabaugh,"February 27, 2019",5.0,love it they got anything you can think of for reasonable price,Love it they got anything u can think of for reasonable prices,
505498,Amazon Shopping,Lezah Revots,"February 27, 2019",5.0,i love amazon it is amazing,i love Amazon!! it's amazing!!,
505504,Amazon Shopping,Barbara Barnard,"February 27, 2019",5.0,i rate amazon star purchase to delivery on top quality,I rate Amazon 10 stars!!! Purchase to Delivery on top. Quality #1,
505505,Amazon Shopping,Debbie Elmore,"February 27, 2019",5.0,i just love to shop on amazon they have a great variety of anything i shop for,I just love to shop on Amazon. They have a great variety of anything I shop for.,
505506,Amazon Shopping,A Google User,"February 27, 2019",5.0,very easy to navigate prime is benefit outweigh the small monthly fee,Very easy to navigate. Prime's benefits outweigh the small monthly fee.,
505507,Amazon Shopping,Mikey Caban,"February 27, 2019",5.0,fast and satisfying,fast and satisfying.,
505509,Amazon Shopping,J P,"February 27, 2019",1.0,um you can not install it,um you cant install it.,
505510,Amazon Shopping,YAH BOY,"February 27, 2019",5.0,subscribe to pewdiepie to defeat series,SUBSCRIBE TO PEWDIEPIE TO DEFEAT T-SERIES,
505511,Amazon Shopping,notsimple AJ,"February 27, 2019",2.0,i ordered two thing and they both could not be shipped for some reason then i tried to log in to my account to fix my account but then my account was locked so,"i ordered two things and they both could not be shipped for some reason, then i tried to log in to my account to fix it but then my account was locked sooo",
505517,Amazon Shopping,Bailey Allen,"February 28, 2019",1.0,awful i made a transaction and amazon locked me out froze my account and refused to give my money back and my purchase did not go through never using again stick to bay everyone,awful. I made a $600 transaction and amazon locked me out froze my account and refused to give my money back and my purcheses did not go through. never using again. stick to ebay everyone,
505518,Amazon Shopping,dream gaming,"February 28, 2019",5.0,amazing application and amazing application and its useful useful,amazing app and its useful,
505522,Amazon Shopping,Jonathan Dutcher,"February 27, 2019",5.0,great price on everything you can think of,great price on everything you can think of.,
505523,Amazon Shopping,David Kew,"February 27, 2019",1.0,would give it star if i could totally immoral company,Would give it 0 stars if I could. Totally immoral company!!!!,
505524,Amazon Shopping,nick favre,"February 27, 2019",5.0,i enjoy buying stuff this site sell a lot of stuff,I enjoy buying stuff. this site sells alot of stuff.,
505527,Amazon Shopping,Mitz,"February 27, 2019",1.0,it came reinstated on my phone and i can not instal it utter b,It came preinstalled on my phone and I can't uninstall it. Utter bs,
505530,Amazon Shopping,Carlos The Animation Eagle,"February 27, 2019",5.0,this application saved my life when i tried looking for a present for christmas in store i could not find the right thing to get i looked everywhere until my friend told me go on amazon my friend told me go on amazon almost has everything you need also i dint even know this application exist so i got the right present for christmas this application helped me with other thing too i recommend you downloading this application amazon might save your life too,"THIS APP SAVED MY LIFE!!! When I tryed looking for a present for Christmas in stores I couldn't find the right thing to get. I looked everywhere until my friend told me ""Go on Amazon it almost has everything you need!"". ALSO I DIDNT EVEN KNOW THIS APP EXIST!! So i got the right present for Christmas. This app helped me with other things too! (I recommend you downloading this app😉). Amazon might save your life too!",
505535,Amazon Shopping,Jenny Gray,"February 28, 2019",5.0,can not live without it,can't live without it!!!,
505537,Amazon Shopping,Crypto King,"February 28, 2019",5.0,great shopping and saving money on shipping with prime,great shopping & saving money on shipping with prime,
505542,Amazon Shopping,A Google User,"February 28, 2019",5.0,good application love good application,good app love it,
505543,Amazon Shopping,Maliha Norin,"February 28, 2019",4.0,i love but always when i have more then item in the basket it start to bug like i have all pc part and a monitor it say at the up right that ok then i put in a usb stick and it say now like what the hell,"i love it,but allways when i have more then 7 items in the baskit it starts to bug. Like i have all 7 pc parts and a monitor it sayes at the up rigth that 958.00 ok then i put in a usb stick and it says now 578.00 like what the hell.",
505545,Amazon Shopping,Dave Schmied,"February 28, 2019",5.0,w sa f ft fez wade area we a hd rd wayward elli wa to sa saw a asks feed,w sa f Ft. fez wad1e1q area we as HD 3 rd waywary Ellis waa to sa saw a as2as feedqd,
505546,Amazon Shopping,Anaz Larh,"February 28, 2019",1.0,i do not know why every month amazon take my money i do not made any payment before and buy anything,I dont know why every month amazon take my money. I dont made any payment before. And buy anything,
505548,Amazon Shopping,stuart spencer,"February 28, 2019",3.0,a good a bay,As good as ebay,
505551,Amazon Shopping,A Google User,"February 28, 2019",4.0,excellent only problem is when you leave direction for specific shipping instruction they do not follow,Excellent ! Only problem is when you leave directions for SPECIFIC SHIPPING INSTRUCTIONS** THEY DO NOT FOLLOW !,
505553,Amazon Shopping,A Google User,"February 28, 2019",5.0,a a a mn h just kidding j jm ok look kkk,as a a MN h jk j JM ooooooooo.k look kkk,
505559,Amazon Shopping,Fatima Kanouni,"February 28, 2019",5.0,i love this application this application make my shopping and life easy,I love this app it makes my shopping and life easy.,
505561,Amazon Shopping,Peter jr. Bautista,"February 28, 2019",5.0,averagweokay,"averagwe,okay.",
505565,Amazon Shopping,Sandra Healey,"February 28, 2019",5.0,really good never had any problem,really good never had any problems,
505566,Amazon Shopping,LaDy Jones,"February 28, 2019",1.0,i uninstaled because they can not close one of my account and keep logging me out of the account that i order weekly from it took several phone call to get absolutely nowhere hard to understand the people who answer the phone so due the people who answer the phone not understanding the people who answer the phone training amazon you grew too fast and the consumer who supported and got you to this point are now too small for you to see or take care of perfect example of growing out of control my business int important enough goodbye,I uninstalled because they CANNOT close one of my accounts and keep logging me out of the account that I order weekly from. It took several phone calls to get absolutely nowhere. Hard to understand the people who answer the phones so duh theyre not understanding their training. Amazon you grew too fast and the consumers who supported and got you to this point are now too small for you to see or take care of. Perfect example of growing out of control. My business isnt important enough. Goodbye.,
505568,Amazon Shopping,Louise Baugus,"February 28, 2019",1.0,i do not want this application on my phone unable to instal take up memory get this application on my phone unable to instal off my phone,i don't want yhis app on my phone unable to uninstall. takes up memory. get it off my phone,
505569,Amazon Shopping,Gloria Rivas,"February 28, 2019",5.0,shopping on amazon is easy cheaper and product come quick i love that i can find everything i need on amazon thank you,"Shopping on Amazon is easy, cheaper and products come quick. I love that I can find everything I need on amazon Thank you.",
505571,Amazon Shopping,A Google User,"February 28, 2019",5.0,the best sitealways on time and perfect,"The best site,always on time and perfect",
505573,Amazon Shopping,Michael Derouen,"February 13, 2019",5.0,great price in quality product,great prices in qualitie products,
505574,Amazon Shopping,A Google User,"February 14, 2019",5.0,always been exceptional over the many year that i have used amazon,always been exceptional over the many years that I've used Amazon,
505575,Amazon Shopping,A Google User,"February 15, 2019",5.0,i love it,I love it!,
505576,Amazon Shopping,モエネスアレン,"February 24, 2019",1.0,update every week,updates every week...,
505577,Amazon Shopping,Manuel del rio,"February 25, 2019",5.0,keep the good service brilliant organization,"Keep the good service, brilliant organization.",
505578,Amazon Shopping,A Google User,"February 9, 2019",5.0,the best if you have prime,THE BEST if you have prime,
505579,Amazon Shopping,A Google User,"February 16, 2019",5.0,yes you can,yes. you. can,
505580,Amazon Shopping,A Google User,"February 19, 2019",5.0,awesome man alive i am back always,awesome man alive I'm back Always,
505581,Amazon Shopping,A Google User,"February 7, 2019",5.0,great help finding exactly what i need,Great help finding exactly what I need!,
505582,Amazon Shopping,A Google User,"February 6, 2019",5.0,really good reliable service thank you,"Really good ,reliable service Thank you.",
505583,Amazon Shopping,A Google User,"February 7, 2019",5.0,they have everything you want great,THEY HAVE EVERYTHING YOU WANT GREAT,
505584,Amazon Shopping,Diane Barnes,"February 23, 2019",5.0,love the ease of finding what i want and the quick delivery,love the ease of finding what I want and the quick delivery,
505585,Amazon Shopping,A Google User,"February 26, 2019",5.0,i love amazon prime and getting amazon back is fandamntastic,I love Amazon Prime and getting it back is fandamntastic!!!,
505586,Amazon Shopping,Gene Havens,"February 23, 2019",5.0,real good service and great people to talk to,real good service and great people to talk to,
505587,Amazon Shopping,A Google User,"February 19, 2019",5.0,excellent simple process and very easy to use,"excellent, simple process and very easy to use",
505588,Amazon Shopping,I feel some type of way about my genetics,"February 24, 2019",5.0,its a good application for real to find what you need,its a good app for real to find what you need,
505591,Amazon Shopping,A Google User,"February 9, 2019",5.0,am new at amazon no experience yet,"am new at Amazon, no experience yet.",
505592,Amazon Shopping,A Google User,"February 19, 2019",1.0,installed kiss yet keep getting a mag to i mainstay,installed 3x. yet keep getting a mag to im install,
505593,Amazon Shopping,A Google User,"February 2, 2019",1.0,can not install the application,can't install the app.,
505594,Amazon Shopping,A Google User,"February 12, 2019",5.0,love the convenience of ordering,love the convenience of ordering,
505596,Amazon Shopping,maximillian martinez III,"February 9, 2019",4.0,well made and helpful,well made and helpful,
505598,Amazon Shopping,A Google User,"February 5, 2019",4.0,seems like every day the application update,Seems like every day the app updates.,
505599,Amazon Shopping,A Google User,"February 12, 2019",1.0,continually getting message to update application when application is already updated,Continually getting message to update app when app is already updated.,
505600,Amazon Shopping,Silviano Gaona,"February 19, 2019",5.0,i get all my and stuff here,I get all my dnd stuff here,
505602,Amazon Shopping,A Google User,"February 6, 2019",5.0,very informative and played out in layman understanding a lot of thought went into this application,very informative and layed out in laymans understanding. A lot of thought went into this app.,
505603,Amazon Shopping,Cheerful,"February 20, 2019",3.0,i can not log into my account i had dollar on my account,i can't log into my account i had 20 dollars on my account,
505605,Amazon Shopping,A Google User,"February 7, 2019",5.0,excellent customer service delivery on time-out few that was late they made up for it,excellent customer service ..90%.deliveries on time.but few that was late they made up for it.,
505606,Amazon Shopping,Noman Alate,"February 20, 2019",1.0,the cod cash on delivery option is not available please fix the cod cash on delivery option,the COD cash on delivery option is not available please fix it,
505608,Amazon Shopping,A Google User,"February 6, 2019",5.0,everything in one place,Everything in one place!,
505609,Amazon Shopping,A Google User,"February 11, 2019",5.0,amazon is the way to go,Amazon is the way to go!,
505610,Amazon Shopping,Luke Bernier,"February 12, 2019",1.0,slow take minute to load,"sloooooow, takes minutes to load",
505611,Amazon Shopping,A Google User,"February 19, 2019",3.0,can not seem download,cant seem 2 download,
505612,Amazon Shopping,A Google User,"February 15, 2019",5.0,ever think i have on time and good service very nice people,ever think I have on time and good services very nice people,
505614,Amazon Shopping,Judi Monroe,"February 12, 2019",5.0,best application for any shopping need fat delivery great product great customer service,"best app for any shopping needs, fat delivery, great products, great Cstomer Service",
505615,Amazon Shopping,SHANNON NAYLOR,"February 10, 2019",5.0,the complete season did,THE COMPLETE 2 SEASON DVD,
505616,Amazon Shopping,A Google User,"February 9, 2019",5.0,always delivery and notification,always 100 % delivery and notifications,
505617,Amazon Shopping,A Google User,"February 13, 2019",5.0,i like it very much,I like it very much,
505618,Amazon Shopping,Sally Yip,"February 8, 2019",1.0,aps stopped working,Apps stopped working :(,
505619,Amazon Shopping,A Google User,"February 15, 2019",5.0,excellent place to shop for just about anything great service,excellent place to shop for just about anything. great service,
505620,Amazon Shopping,A Google User,"February 13, 2019",1.0,it keep cancelling my order do not download i adjust about done with amazon,it keeps canceling my orders! do not download! im just about done with amazon!,
505621,Amazon Shopping,A Google User,"February 7, 2019",1.0,keep jumping off application closing it,keeps jumping off app closing it.,
505622,Amazon Shopping,A Google User,"February 18, 2019",1.0,i never received anything i ordered from the seller on the application and i have waited for the item for month,i never recived anything i ordered from the sellers on the app and i have waited for the item for monthes,
505623,Amazon Shopping,Melissa Lawrence,"February 18, 2019",1.0,quit asking me to install this application every time i open amazon,quit asking me to install this app every time I open amazon.,
505624,Amazon Shopping,Mrs Coulter,"February 19, 2019",5.0,love prime some product can be a bit pricey but most are fairly priced,"love prime, some products can be a bit pricey, but most are fairly priced",
505625,Amazon Shopping,Mike James,"February 19, 2019",1.0,application not opening since last update onerous android,app not opening since last update. OnePlus 3 andriod 8.0,
505626,Amazon Shopping,ranjith paul,"February 9, 2019",4.0,i am happy with it but it took h to download,I am happy with it but it took 1h to download,
505627,Amazon Shopping,A Google User,"February 22, 2019",5.0,great application never glitch and always convenient and useful,Great app. Never glitchy and always convenient and useful.,
505628,Amazon Shopping,Justin Stafford,"February 20, 2019",1.0,amazon gave me a free prime trial when i ordered the shipping was not free,Amazon gave me a free prime trial when I ordered the shipping was not free,
505629,Amazon Shopping,A Google User,"February 14, 2019",5.0,my brother love it and i learned to love it too,my brother loves it and I learned to love it too,
505630,Amazon Shopping,beautiful weirdo,"February 7, 2019",5.0,amazing application i love having amazon prime amazon fast and for the most part reliable,Amazing app! I love having amazon prime. Its fast and for the most part reliable,
505631,Amazon Shopping,Maddyyy McDonald,"February 22, 2019",5.0,i love amazon i get so many great thing and quality item i totally recommend,I love Amazon! I get so many great things and quality items I totally recommend!!!,
505633,Amazon Shopping,A Google User,"February 17, 2019",1.0,amazon is generally ok but i have had a bad experience and have gotten nowhere with a seller and amazon customer service i bought a refurbished phone a seller and amazon customer service had issue i contacted seller then i had to pay to ship a seller and amazon customer service back to seller before the day parent ended after month i haunt received a replacement so i contacted amazon and twice i was told amazon would be credited to a gift card i still hav not received amazon at this point i am out and i arnot happy amazon is a guarantee was not honoured here,"Amazon is generally ok but Ive had a bad experience & have gotten nowhere with a seller & Amazons customer service. I bought a refurbished phone it had issues, I contacted seller, then I had to pay to ship it back to the seller before the 90 day warrenty ended. After 2 months I havnt received a replacement so I contacted Amazon & twice I was told it would be credited to a gift card. I still havn't recieved it. At this point I'm out $190 & Im not happy. Amazon's A-Z Guarantee was not honored here",
505634,Amazon Shopping,A Google User,"February 21, 2019",5.0,easy to use great service,"Easy to use, great service.",
505635,Amazon Shopping,Austin Garrison Free,"February 6, 2019",5.0,pleasure is new definition,Pleasure's new definition.,
505636,Amazon Shopping,Muhammad Kashif Zeeshan,"February 20, 2019",5.0,seller filter is back,Seller filter is back,
505637,Amazon Shopping,Big Daddy,"February 20, 2019",5.0,can not live without it,can't live without it,
505638,Amazon Shopping,Hollen Lledera,"February 4, 2019",3.0,who install this on me phone,who install yhis on. me phone..ANS,
505639,Amazon Shopping,Lisa Downes,"February 19, 2019",4.0,support their customer,support their customers.,
505640,Amazon Shopping,A Google User,"February 12, 2019",5.0,too early to tell,too early to tell.,
505641,Amazon Shopping,Brian Harper,"February 20, 2019",1.0,prime is a ripon,prime is a ripoff.,
505642,Amazon Shopping,Justin Hope,"February 10, 2019",5.0,if only i thought of it first,if only i thought of it first..,
505643,Amazon Shopping,Ramin J. Qaderi,"February 13, 2019",1.0,amazon never post my item review online amazon is a cheating and telling lie to the customer,"Amazon never posts my item reviews online, it's a cheating and telling lie to the customers",
505644,Amazon Shopping,Natasha Krementz,"February 14, 2019",4.0,a filter for don item would be nice otherwise it is great,A filter for add-on items would be nice. Otherwise it's great.,
505645,Amazon Shopping,dee kenyon,"February 20, 2019",5.0,so easy and stand behind their merchandise i love amazon,so easy and stands behind their merchandise I love amazon,
505646,Amazon Shopping,irene castillo,"February 6, 2019",5.0,always a pleasant experience i love that i find almost everything i search for everytime delivery is amazing,Always a pleasant experience. I love that I find almost everything I search for everytime. Delivery is amazing!!,
505647,Amazon Shopping,Renee James,"February 12, 2019",5.0,gold gmt hnv v uynhnhuewtgrinhyw,gooloo gmi .hnvv vvv uy.nnhhnhueewwwt.g.hyw,
505648,Amazon Shopping,Cami Jensen,"February 20, 2019",5.0,use it often too often,use it often! too often🖒🏻,
505649,Amazon Shopping,Kirk Westmoreland,"February 20, 2019",1.0,i do not care about amazon,i don't care about Amazon!!!,
505650,Amazon Shopping,Calvin Pittser,"February 19, 2019",4.0,i like it but i prefer to use the webster,I like it but I prefer to use the website,
505651,Amazon Shopping,A Google User,"February 16, 2019",5.0,i love amazon can not live without amazon,I love Amazon. Cant live without it.,
505652,Amazon Shopping,A Google User,"February 12, 2019",5.0,i have never had any probsgod service,I've never had any probs.good service,
505653,Amazon Shopping,A Google User,"February 18, 2019",5.0,i love it co you can buy anything and it come in a flash,i love it cos you can buy anything and it comes in a flash,
505654,Amazon Shopping,A Google User,"February 1, 2019",5.0,sock hop was the best thanks amazon,sock hop was the best thanks amozon 😍,
505655,Amazon Shopping,Grant Cook,"February 21, 2019",5.0,love it you can anything you want,"love it, you can anything you want.",
505657,Amazon Shopping,A Google User,"February 5, 2019",5.0,love it best thing ever,love it best thing ever,
505659,Amazon Shopping,Jordan Feldman,"February 21, 2019",5.0,the best modern shopping experience,The best modern shopping experience!,
505660,Amazon Shopping,faratina100,"February 24, 2019",1.0,you keep on asking me to update,you keep on asking me to update!!!!????,
505661,Amazon Shopping,A Google User,"February 14, 2019",5.0,excellent shipping and handling service perfect transaction,Excellent shipping and handling service! PERFECT TRANSACTION!!!,
505662,Amazon Shopping,A Google User,"February 14, 2019",5.0,new phone unloading best resource,"new ph0ne, uploading best resources.",
505663,Amazon Shopping,A Google User,"February 10, 2019",4.0,this application is very helpful at all time,This app is very helpful at all times,
505665,Amazon Shopping,A Google User,"February 17, 2019",5.0,love the easy shopping,Love the easy shopping!,
505666,Amazon Shopping,Victor Huerta,"February 19, 2019",5.0,i love amazon fun to shop examine service,I love Amazon fun to shop exalint services,
505667,Amazon Shopping,Nina King,"February 24, 2019",5.0,i like the application,I like the app,
505668,Amazon Shopping,A Google User,"February 22, 2019",3.0,i am k my,I'm k MIy,
505669,Amazon Shopping,A Google User,"February 9, 2019",5.0,so amazing usually come within day,So amazing! Usually comes within 5 days,
505670,Amazon Shopping,John W Starks Jr,"February 20, 2019",5.0,love this site they have everything all the time,Love this site they have everything all the time,
505671,Amazon Shopping,A Google User,"February 18, 2019",5.0,this application is easy to use from search description pricing suggestion reminder to purchase item again to checkout,"This app is easy to use from search, descriptions, pricing, suggestions, reminders to purchase items again, to checkout!",
505672,Amazon Shopping,Ali Adus,"February 19, 2019",5.0,ya bat hai ski,Kya baat hai iski ***,
505673,Amazon Shopping,Howard Bennett,"February 22, 2019",5.0,i believe that it is totally awesome,I BELIEVE THAT IT IS TOTALLY AWSOME.,
505674,Amazon Shopping,Kim Wilson,"February 19, 2019",5.0,amazing they always have everything that i need,Amazing they always have everything that I need !,
505675,Amazon Shopping,Holly Thompson,"February 25, 2019",5.0,fantastic site for the savvy shopper prime rock,fantastic site for the savvy shopper. Prime rocks!,
505676,Amazon Shopping,Ebony Mcneil,"February 19, 2019",5.0,everything is well priced and has great quality of everything that is sold,everything is well priced and has great quality of everything that's sold,
