id,appTitle,userName,date,score,text,original_text,bug_report
625770,Google,,"February 27, 2019",5,good thing i love it,good thing i love it,
625771,Google,Tomas Carranza,"February 26, 2019",5,i am very happy withgogle except for th,i am very happy withgoogle. except for th,
625773,Google,,"February 25, 2019",5,goole fun rock,google fkn rocks!,
625774,Google,Sunder Mehra,"February 25, 2019",5,a friendly search engine,a friendly search engine,
625775,Google,SonjaLeah Graham,"February 27, 2019",1,sorry goole you had your five minute of fame,sorry google you had your five minutes of fame.,
625781,Google,Abhijeet Mukherji,"February 27, 2019",3,it was good but with the recent update ok goole has stopped responding and access with voice match is not switching on,it was good but with the recent updates 'ok google' has stopped responding and access with voice match is not switching on.,
625782,Google,Cynthia Sanchez,"February 27, 2019",3,why would the new update allow for goole to record and take video without your approval i do not think i am up dating it doe not sound right,"why would the new update allow for google to record and take video without your approval?! i do not think i am up datting, it does not sound right.",
625783,Google,,"February 28, 2019",3,there is too much useless junk and way too many menu and sub-menu a person has to go through in searching to change a setting,"there is too much useless junk, and way too many menus and submenus a person has to go through in searching to change a setting.",
625784,Google,,"February 28, 2019",1,access with voice match option is prayed out access with voice match option was working on monday and today access with voice match option suddenly stopped,"access with voice match option is grayed out, access with voice match option was working on monday and today access with voice match option suddenly stopped.",
625785,Google,,"February 27, 2019",5,thanks for letting me know about the end of the month so i can get the money to you in the morning if they can get the money from the bank and i will get back to you on that day so i can do it at the end of the month and i will send it to you when i get back home to you when i can do the first one is the next step to get it done,thanks for letting me know about the end of the month so i can get the money to you in the morning if they can get the money from the bank and i will get back to you on that day so i can do it at the end of the month and i will send it to you when i get back home to you when i can do the first one is the next step to get it done.,
625787,Google,CHX HUIXIN,"February 27, 2019",1,i do not want the goole assistant to appear when i long press the home screen very regret to update the aps,i do not want the google assistant to appear when i long press the home screen very regret to update the apps,
625789,Google,Charlie Dunham,"February 26, 2019",4,i love this application but give this application a and a half score because this application do not know the answer to some question this application should know the answer too,"i love this application, but give this application a  and a half score because this application do not know the answer to some questions this application should know the answer too.",
625790,Google,sumit bansal,"February 26, 2019",1,hate bcs of setting i selected language a english india but getting local language update even in couture,hate .bcs of settings . i selected language as english (india) but getting local language updates. even in youtube,
625791,Google,Mustafa Bharmal,"February 25, 2019",1,worst in voice search till the update version up to the date and the error always occurs saying please try again later,"worst in voice searches till the update version up to the date. and the error always occurs saying ""please try again later !""",
625792,Google,Benjamin Padilla,"February 27, 2019",3,just recently the search image has been freezing please fix otherwise great application,just recently the search images has been freezing. please fix. otherwise great application!,
625793,Google,Jeff L,"February 28, 2019",1,latest update disabled voice recognition can not turn latest update disabled voice recognition back on and is greyed out on my onerous please update with a fix this,latest update disabled voice recognition. cannot turn latest update disabled voice recognition back on and is greyed out on my oneplus . please update with a fix. thks.,
625794,Google,Oratory Solution,"February 25, 2019",5,your if click any lick eg news after your screen black or one peter display not displayed news after screen rotated after show news same problem in your browser please solve this problem,your if click any lick eg news after your screen black or one pettern display not displayed news after screen rotated after show news same problem in your browser please solve this problem,
625795,Google,,"February 27, 2019",4,goole is a good way to get thing you need when you need goole i hope not appropriate aps thats not fine,google is a good way to get things you need when you need google i hope not approprate apps. thats not fine,
625796,Google,naveen kumar,"February 26, 2019",5,good super application more useful for all of them so kindly use this application this application we are easy to add so kindly installed this application right now and start using this application so,good super application more useful for all of them so kindly use this application this application we are easy to add so kindly installed this application right now and start useing this application so,
625797,Google,Thomas Bardy,"February 26, 2019",1,still far too many update which appear to be repetitive,still far too many updates which appear to be repetitive,
625798,Google,Litiyana Monique,"February 26, 2019",1,after updating my goole is not letting me access updating my goole,after updating my google is not letting me access updating my google,
625799,Google,,"February 25, 2019",5,nice to get live hockey score notification during nhl game help me keep track of my score of my favorite team,"nice to get live hockey scores notifcatioms during nhl games, help me keep track of my scores of my favorite teams",
625800,Google,,"February 26, 2019",1,cursor keep moving back a few space while typing a query in the search panevery annoyingly,cursor keeps moving back a few spaces while typing a query in the search pane.very annoyingly,
625801,Google,Paul Fisher,"February 25, 2019",1,amazing these application do not do anything even disabled people,amazing these application do not do anything even  disabled people!,
625802,Google,Musfiqur Rahman Emon,"February 27, 2019",5,nothing to say about it because goole is a part of our daily life,nothing to say about it because google is a part of our daily life,
625804,Google,Paco Castro,"February 27, 2019",1,new update is horrible white screen appears after search then i have to scroll through to get image,new update is horrible. white screen appears after search then i have to scroll through to get images.,
625805,Google,,"February 28, 2019",1,bored to death of repeated newsfeds that come back even when i say i uninterested,bored to death of repeated newsfeeds that come back even when i say i amuninterested.,
625806,Google,,"February 25, 2019",5,just wish i could make a phone call the phone keep telling me that there is no cell network help,just wish i could make a phone call! the phone keeps telling me that there is no cell network! help!,
625811,Google,,"February 26, 2019",5,it is the best,it is the best! ,
625812,Google,,"February 26, 2019",5,awesome too cool mel,"awesume, too cool. mel",
625816,Google,debbie reeves,"February 27, 2019",5,enjoying it better,enjoying it better !,
625817,Google,mbwii Kioko urbanus,"February 28, 2019",5,the best application ever,the best application ever,
625818,Google,,"February 25, 2019",5,really good at the time,really good at the time,
625820,Google,Ahmad_ Gamez,"February 27, 2019",5,nice application this is amazing,nice application this is amazing,
625830,Google,Edie L,"February 28, 2019",5,right now i am trying to update an old computer and can not remember my password and having problem getting my password to open,right now i am trying to update an old computer and cannot remember my password and having problems getting my password to open.,
625831,Google,Storm Ryder,"February 28, 2019",3,i did not ask for an android pie redesign thing i wanted dark mode i still want a dark themed goole and you did not deliver,"i did not ask for an android pie redesign thing. i wanted dark mode, i still want a dark themed google and you did not deliver.",
625832,Google,Ravi S,"February 28, 2019",1,play store is waste because when we are downloading some application play store will stop and say waiting for network even though the internet is turned on,"play store is waste because, when we are downloading some application play store will stop and says waiting for network (even though the internet is turned on)",
625833,Google,Marilyn P,"February 28, 2019",4,the february update will not download cleared cache and data the february update still doe not download and install update i was able to instal update and start over,"the february ,  update will not download. cleared cache and data, the february ,  update still does not download and install.  update i was able to uninstall updates and start over.",
625834,Google,Purvion Parker,"February 26, 2019",3,stop when i try to load gifs and doe not let me reopen the application for a while,stops when i try to load gifs and does not let me reopen the application for a while.,
625835,Google,Wolf Chen,"February 26, 2019",3,do i have to select and exclude every single language that i do not speak in the feed stop showing story in random foreign language,do i have to select and exclude every single language that i do not speak in the feed? stop showing stories in random foreign languages.,
625836,Google,Mohamed Hoque,"February 27, 2019",1,reminder are not showing up on wear o watch even though its selected and there no point raising this issue with goole help forum because its full of people with same issue and no solution,reminders are not showing up on wear os watch even though its selected and theres no point raising this issue with google help forums because its full of people with same issue and no solutions.,
625837,Google,,"February 26, 2019",5,its good enough to me because i get everything here and in which question i had doubt its clear everything love to goole from kritian,its good enough to me because i get everything here and in which question i had doubts its clears everything. love to google from kritika,
625841,Google,Deep Bose,"February 28, 2019",2,when ever i take a screenshot and use the scroll option to take the screenshot of the whole webster a screenshot doe not work but my scroll option work fine with other browser a screenshot just do not work with goole chrome and goole i want you guy to fix a screenshot immediately,when ever i take a screenshot and use the scroll option to take the screenshot of the whole website a screenshot does not work but my scroll option works fine with other browser a screenshot just do not work with google chrome and google i want you guys to fix a screenshot immediately,
625844,Google,Troy Thornton,"February 28, 2019",3,the application make it ludicrously difficult to download an image from search result and then make use of that image elsewhere for example a face-on post i end up having to share an image to me goole drive and then download an image to my phone from there,"the application makes it ludicrously difficult to download an image from search results and then make use of that image elsewhere (for example, a facebook post). i end up having to share an image to me google drive and then download an image to my phone from there.",
625846,Google,Christopher Burk,"February 28, 2019",1,every other update is breaking the goole assistant the voice match is broken on every other update,every other update is breaking the google assistant. the voice match is broken on every other update.,
625847,Google,Justin Cates,"February 26, 2019",2,locationbased reminder have not worked in month even bibby can figure this out come on,location-based reminders have not worked in months. even bixby can figure this out. come on!,
625848,Google,,"February 28, 2019",1,you guy need to set a reminder to fire the guy working on the reminder portion of the goole application oh wait you probably did and it just is not working just like the rest of our aps out here,"you guys need to set a reminder to fire the guys working on the reminders portion of the google application. oh wait, you probably did, and it just is not working, just like the rest of our apps out here!",
625852,Google,Noral Ledesma,"February 27, 2019",1,this application is a hoax no info on it to open an application for any service who want all this blah blah blah if one open an application its for a reason business usually or for a life happening a in an alarm clock to be awakened before a regular timewake too bad this is all you get nada,"this application is a hoax! no info on it to open an application for any service. who wants all this blah blah blah? if one opens an application its for a reason, business usually or for a life hapoening as in an alarm clock to be awakened before a regular time/wake. too bad this is all you get! nada!",
625854,Google,sopheak hean,"February 28, 2019",1,recently my goole assistant has stopped listening to hey goole command i tried everything by clearing cache flash system o and downgraded aspect all failed to do anything i can not enable voice match no mater what no mater has been working for like a whole year and suddenly stopped working,"recently my google assistant has stopped listening to ""hey google"" command. i tried everything by clearing cache, reflash system os and downgraded apps.etc. all failed to do anything. i cannot enable voice match no mattwr what. no mattwr has been working for like a whole year and suddenly stopped working.",
625855,Google,Кир Ёжиков,"February 27, 2019",1,ok goole i actually was trying to read an article that was suggested buy you on whatever you call this screen now story to read but quickly switched to messenger so my question is how can i return to an article that was suggested an article that was suggested is not on the list anymore and not in my browser tab there is nothing similar in my recent aps either that is awful disappointing ux,"ok, google. i actually was trying to read an article that was suggestet buy you on whatever you call this screen now (stories to read), but quickly swithed to messenger. so, my question is how can i return to an article that was suggestet? an article that was suggestet is not on the list anymore and not in my browser tab. there is nothing similar in my recent apps either. that is awful dissapointing ux.",
625861,Google,Ross Burdon,"February 27, 2019",3,can not reach goole at the moment is goole most usual response ol a an application goole is great upgrading though can cause huge headache the latest update no longer responds to ok goole since i did not train goole assist to recognise my voice retrograde advance abound before you upgrade consider uninstaling all prior upgrade to not do so might cause many of your core aps to fail lg grin,"'cannot reach google at the moment,' is google most usual response. ol as an application, google is great. upgrading, though, can cause huge headaches. the latest update no longer responds to ok google since i did not train google assist to recognise my voice. retrograde advances abound. before you upgrade, consider uninstalling all prior upgrades. to not do so might cause many of your core apps to fail. lg grin",
625872,Google,Ramkumar Singhtf,"February 26, 2019",4,please add qr code scanner,please add qr code scanner,
625873,Google,,"February 26, 2019",5,awesome save me a lot of time,awsome save me alot of time,
625874,Google,DEEPAK KUMAR BURNWAL,"February 26, 2019",5,all is well for easy to use any search any experience and more than of literature or without literature person,"all is well for easy to use any serches ,any experience and more than of litreture or without litreture person .",
625876,Google,Hannah Lee,"February 26, 2019",5,great application for using the internet,great application for using the internet.,
625877,Google,Ace Wong,"February 28, 2019",4,where is the chromecast button for goole chrome browser application,where is the chromecast button for google chrome browser application?,
625878,Google,Pemtha Longvah,"February 27, 2019",2,my voice match is not working anymore,my voice match is not working anymore,
625879,Google,Ramesh Patil,"February 27, 2019",1,after update ok goole not working voice setting all disabled,"after update, ok google not working. voice setting all disabled.",
625880,Google,,"February 26, 2019",2,would not install,would not install.,
625881,Google,Nieraj Dubey,"February 26, 2019",1,application crashed multiple time,application crashed multiple times,
625882,Google,Racquita Houston,"February 27, 2019",4,cd just why ssa,cd just why ssa,
625883,Google,,"February 22, 2019",5,wait is a merbolous application for search and get information,wow!it is a merbolous application for search and get information.,
625884,Google,Benny Nielsen,"February 25, 2019",1,has become slow and freezing,has become slow and freezing,
625886,Google,Pedro Rolfsen Ittner,"February 27, 2019",1,voice match not working it is prayed out and i can not turn it on,voice match not working. it is grayed out and i cannot turn it on.,
625887,Google,Lucas Farias,"February 25, 2019",1,goole assistant no function dese que actually a android,google assistant no funciona desde que actualic a android .,
625888,Google,,"February 27, 2019",5,it great to have a support,it great to have a support,
625889,Google,,"February 27, 2019",1,sad so z is zx can call zenga zenga,szzd so z is zzxz can call zynga zynga,
625890,Google,,"February 26, 2019",3,no need to install any time need update,no need to install any time need updates,
625891,Google,lLeeDavis mydogcody,"February 28, 2019",5,great bring up game,great . bring up games,
625892,Google,monica wallace,"February 26, 2019",5,i love this this can find anything,i love this this can find anything,
625893,Google,,"February 27, 2019",4,it doe not have goole wikipedia,it does not have google wikipedia,
625894,Google,,"February 27, 2019",5,this application help in everything,this application helps in everything,
625895,Google,Rosa Buruca,"February 25, 2019",5,excellent very helpful,"excellent, very helpful.",
625896,Google,wes,"February 27, 2019",4,it begin to lag a bit,it begins to lag a bit,
625897,Google,Chandrakant sonkambke,"February 26, 2019",5,is very right application,is very right application,
625899,Google,James Lin,"February 28, 2019",5,nt but sleeping b j kiss jimi,"n.t ,, but sleeping b j kiss, gimmi $ "",",
625901,Google,Richard Coldham,"February 26, 2019",4,used on pc laptop and cell phone,"used on pc, laptop and cell phone.",
625903,Google,Stacey Washington,"February 27, 2019",5,love asking goole question about any and everything so surprise what you can learn,love asking google question about any and everythings so surprise what you can learn.,
625904,Google,,"February 26, 2019",5,adithyan abhijith abhilash santa,adithyan abhijith abhilash sanitha,
625906,Google,Ly Pham,"February 26, 2019",5,kong hay nh cho sea,khong hay nhu cho sua,
625907,Google,alice bright,"February 28, 2019",5,the best box of cooky i have ever had i plan to purchase these cooky for friend and relative,the best box of cookies i have ever had. i plan to purchase these cookies for friends and relatives.,
625908,Google,Stephanie Rosenberg,"February 28, 2019",1,still no dark mode,still no dark mode.,
625909,Google,,"February 27, 2019",2,it show weather temp in fahrenheit instead of kelvin temp scale no air quality index,it shows weather temp in fahrenheit insted of kelvin temp. scale no air quality index,
625910,Google,Kerri Zell,"February 28, 2019",1,goole assistant not recognizing language,google assistant not recognizing language.,
625912,Google,Argel Cruz,"February 28, 2019",1,voice match doe not work,voice match does not work,
625914,Google,Clara Ramirez,"February 28, 2019",5,i could always find anything i need in goole that is my best friend,i could always find anything i need in google that is my best friend,
625916,Google,,"February 25, 2019",1,very poor doe not work most of the time,very poor. does not work most of the time.,
625917,Google,Travis Bunday,"February 25, 2019",3,its ok slow and waste of space mostly,its ok. slow and waste of space mostly.,
625919,Google,,"February 27, 2019",1,this suck can not get into account i think it has bug please fix,"this sucks, cannot get into accounts, i think it has bugs please fix!",
625920,Google,Takashi Kikuchi,"February 25, 2019",1,i do not understand why you can not install the update,i do not understand why you cannot install the update.,
625921,Google,Sylviia. animal stories Myhill,"February 27, 2019",5,hard for me but thanks to goole its back on,hard for me but thanks to google its back on,
625922,Google,,"February 26, 2019",2,got an error message on a software update,got an error message on a software update,
625925,Google,Mark Trapp,"February 25, 2019",5,first off i live anything goglethis application is wonderful so many possibility,"first off i live anything google,this application is wonderful so many possibilities.",
625927,Google,Tasos Papanik,"February 28, 2019",1,goole assistant stop working on my omi mi a,google assistant stop working on my xomi mi a,
625928,Google,David Uyabán,"February 28, 2019",1,i wish goole did not collect all my data and sold all my data to thir party i mean yeah we all have certain way of making money but whatever,"i wish google did not collect all my data and sold all my data to thir parties. i mean yeah, we all have certain ways of making money but. whatever",
625929,Google,Iris Cintron,"February 26, 2019",5,absolutely love using goole it is so helpful in so many way recently discovered a morning routine that i customized everything about my goole is awesome who need an phone,absolutely love using google. it is so helpful in so many ways! recently discovered a morning routine that i customized! everything about my google is awesome! who needs an iphone ,
625930,Google,Sachin Upade,"February 28, 2019",1,i am trying to access my goole assistant but my goole assistant but its required a language to access it required a language to access my goole assistant but its required a language to access it and i am also set the goole language but the option the option show on my screen is completely highlighting so i do not know what to do,i am trying to access my google assistant but my google assistant but its required a language to access it required a language to access my google assistant but its required a language to access it and i am also set the google language but the option the option shows on my screen is completely highlighting so i do not know what to do.,
625931,Google,,"February 28, 2019",1,voice match unlocks turn off after opening the phone work only once this issue is sudden and unclear to why and how to solve,voice match unlocks turns off after opening the phone. works only once. this issue is sudden and unclear to why and how to solve.,
625933,Google,Maggie Wildash,"February 27, 2019",3,ok sick of how often it and other aps are updated many are updated within day of previous update,o.k. sick of how often it and other apps are updated. many are updated within days of previous updates.,
625934,Google,,"February 25, 2019",5,goole is my go to search engine because goole get to within of my search parameter unlike yahoo which only get within to on goole best day,"google is my go to search engine because google gets to within % of my search parameters, unlike yahoo, which only gets within % to % on google best day.",
625935,Google,Sharon Goh,"February 25, 2019",5,goole say they are kindness helpful if you have any problem wth application fedback to they they will be kindness attend to they,google saffs they are kindness helpful if you have any promble wth application feelback to they they will be kinknesz attend to they.,
625937,Google,Marek Kędzierski,"February 27, 2019",1,unnecessary and disturbing notification only what i need is weather and this show me celsius degree when outside is,unnecessary and disturbing notifications. only what i need is weather and this shows me  celsius degrees when outside is.?,
625938,Google,SHOOTER RALPH,"February 25, 2019",1,keep updating then installing then error code what the heck,keeps updating then installing then error code  what the heck,
625939,Google,y Pherwani,"February 26, 2019",1,horrible application so many ad moment even open in english language,horrible application so many ads dosent even open in english language,
625940,Google,,"February 26, 2019",1,need to be cut down in size far too large i wish i could instal it,needs to be cut down in size. far too large. i wish i could uninstall it.,
625941,Google,sonia mclaughlin,"February 26, 2019",4,update to big please let it be possible to move to a sd card in other word to make it moveable too external storage please,"update to big! please let it be possible to move to a sd card in other words to make it moveable too external storage, please!",
625942,Google,,"February 25, 2019",1,with every new update goole is only getting worse do not take it kindly every new update goole is worse than dempster trump breaking the law,with every new update google is only getting worse do not take it kindly every new update google is worse than dumpster trump  breaking the law!,
