id,appTitle,userName,date,score,text,original_text,bug_report
628978,Google,Danielle Gill,"February 20, 2019",5,oh my god it is so good,oh my god it is so good,
628981,Google,,"February 20, 2019",5,this is very useful application and i more use very useful application any problem very useful application give me answer so i like very useful application,this is very useful application and i more use very useful application any problem very useful application give me answers so i like very useful application,
628979,Google,,"February 20, 2019",3,really helpful too much,really helpful too much,
629005,Google,Jayapretty Rabha,"February 19, 2019",5,i love this application because of all answer i get,i love this application because of all answer i gets,
629011,Google,,"February 19, 2019",5,love goole in all aps,love google in all apps,
629012,Google,,"February 19, 2019",1,jai hindu bandit shanahan,jai hindu baidik shanatan,
629013,Google,,"February 19, 2019",5,it was very cool,it was very cool,
629015,Google,technical tricks,"February 19, 2019",5,super soft k still you yjhgjbjb not kj james james joke km know jump km km know why,super soft kk still you yjhgjbjjb not kj james james joke km know jump km km know why,
629020,Google,,"February 19, 2019",1,wow i will kx kiss kiss kiss silk tolymetelsalmy,www i will kx kiss kiss kiss silk toolymetellsalmy,
629021,Google,,"February 19, 2019",3,goole since keep popping on,google assitce keeps popping on,
629024,Google,,"February 19, 2019",5,good sound and video qua,good sound and video qua,
629030,Google,,"February 19, 2019",1,this is not a safe site,this is not a safe site,
629031,Google,yogesh raj,"February 19, 2019",5,better this application i like better this application,better this application i like better this application,
629033,Google,thandeka faith,"February 19, 2019",5,the application is simple and enjoyable,the application is simple and enjoyable,
629045,Google,,"February 19, 2019",5,mrsundar pitch am in tamilnadu how are you,mr.sundar pitchi iam in tamilnadu how are you,
629051,Google,,"February 19, 2019",5,good and fantastic searching application all the best goole,good and fantastic serching application all the best google,
629058,Google,Paulina M,"February 18, 2019",4,sorry goole because i really do not like the password at all but i do like how you guy give a howl bunch of info,"sorry, google because i really do not like the passwords at all but i do like how you guys give a howl bunch of inof.",
629063,Google,saif ali,"February 18, 2019",5,the application need some upgrade like alex voice command,the application need some upgrades like alexa voice command.,
629065,Google,entertainment Nag world,"February 18, 2019",5,very very helpful goole,very very helpful google,
629066,Google,Mark Lee Martinez,"February 18, 2019",4,crash the launcher would just crash on my zenfone please help fix,crash the launcher would just crash on my zenfone. please help fix,
629093,Google,,"February 19, 2019",5,this is very smart application,this is very smart application,
629069,Google,Q4D Gaming,"February 19, 2019",1,it suck when i search for an image it will let me but when i press an image it will let me or scroll down for more an image it will let me will not let me and just freeze,"it sucks, when i search for an image it will let me but when i press an image it will let me or scroll down for more, an image it will let me will not let me and just freezes!",
629070,Google,,"February 19, 2019",3,loop kio uk bio,loop ukio uk bio,
629094,Google,,"February 19, 2019",5,kotapatana where isiwantoknow,kota.patana. where. is.i.want.to.know,
629103,Google,,"February 19, 2019",5,goole is the best,google is the best,
629105,Google,Stephen Childers,"February 19, 2019",1,can not check out papal account and i have been trying to get the acorn money for my business and a dodge charger and truck for my business loan and was given a loan but lost a loan from not getting the email on time,cannot check out paypal account and i have been trying to get the acorn money for my business and a dodge charger and truck for my business loan and was given a loan but lost a loan from not getting the emails on time,
629107,Google,,"February 19, 2019",5,laden salih purwati tempo kalimantan carbon indonesia,raden galih purwati gempol palimanan cirebon indonesia,
629111,Google,,"February 19, 2019",5,is the content of the application in english,is the content of the application in english,
629113,Google,Elizabeth Schalock,"February 19, 2019",5,use this application often,use this application often,
629112,Google,Mutu Syed,"February 19, 2019",3,bb it o jj n pto vote o,bb it o yyyjyyj n. pt.uoo vtotbb. o,
629121,Google,Thomas Ogembo,"February 19, 2019",5,john of god is lord internal god,john of god is lord enternal god,
629124,Google,Miraj Uddin Emon,"February 19, 2019",5,world number application for me,world number  application for me,
629125,Google,,"February 19, 2019",5,there is no other word for this,there is no other word for this,
629133,Google,alok deshpande,"February 19, 2019",5,godmahadiscom should allow payment of monthly energy bill a per this calculator different collection centrealso for different i ph residential load direct chart from unit to unit consumption versus bill in r are to be made available to consumer on bill in r registered hi site of mahadiscom to make convenient to all consumer and to avoid all problem and complaint of consumer due to na of regular meter reading to mahadiscompl arrange for nedfulthanks,"good.mahadiscom should allow payment of monthly energy bill as per this calculator,at different collection centre.also for different i ph residential load direct chart from unit to  unit consumption versus bill in rs are to be made available to consumer on bill in rs registered bhi site of ""mahadiscom""/"""", to make convinient to all consumer and to avoid all problems and complaints of conumers due to ""n.a. of regular meter reading"" to mahadiscom.pl arrange for needful.thanks.",
629138,Google,,"February 19, 2019",5,i mean goole what else need to be said,i mean.its google what else needs to be said,
629143,Google,Paranoid Mick,"February 19, 2019",1,over not being ablett use phone because goole need a secret update,over not being ableto use phone because google needs a secret update,
629145,Google,Simon Beierle,"February 19, 2019",2,n,"n, "";",
629149,Google,Amechi Oganyi,"February 19, 2019",5,i think it is de best,i think it is de best,
629150,Google,nerti una,"February 19, 2019",3,very cool but i can do anything with it house in albania goole now dint work,very cool but i can do anything with it couse in albania google now didnt work,
629158,Google,,"February 18, 2019",1,goole is the worse of all kind seriously frustrating and annoying while seeing pop-up ad simply uninstaled this trash because we do not want to see irritating ad couture is full of ad everywhere simply we are not gon na use any goole product goole is a moneyhankering company and us goole ad every second,google is the worsest of all kinds. seriously frustrating and annoying while seeing pop-up ads. simply uninstalled this trash. because we do not want to see irritating ads. youtube is full of ads everywhere. simply we are not gonna use any google products. google is a money-hankering company and uses google ads every second.,
629159,Google,,"February 18, 2019",3,p you ok o,p you ok oo,
629163,Google,Shivam Kumar,"February 18, 2019",5,very awesome in the world,very awesome in the world,
629164,Google,Kavitha Nagaraj,"February 18, 2019",5,super fast i can not live without goole i want more advance idea in goole,super fast. i cannot live without google. i want more advance ideas in google. .,
629171,Google,,"February 19, 2019",5,great aplicationvery helpful to me,"great application,very helpful to me",
629175,Google,,"February 19, 2019",5,can anyone rate goole,can anyone rate google?,
629181,Google,,"February 19, 2019",5,very good application,very good application.,
629186,Google,,"February 19, 2019",1,my internet very slow the way i use my phone,my internet very slow the way i use my phone.,
629190,Google,,"February 19, 2019",5,it is a superb application,it is a superb application ,
629199,Google,sherri t,"February 19, 2019",2,voice never seems to work an almost every other day there are update that never fix the issue,voice never seems to work an almosr every other day there are updates that never fix the issue.,
629201,Google,,"February 19, 2019",5,good but too large,good but too large,
629202,Google,,"February 19, 2019",5,v v v good,v v v good,
629203,Google,,"February 19, 2019",5,very very very nice,very very very nice. ,
629205,Google,karthick Thangaraj,"February 19, 2019",5,need additional feature in mobile calling call recording and video calling for moto z play,need additional features in mobile calling - call recording and video calling for moto z play,
629211,Google,Babu Raaj,"February 19, 2019",4,so far so good,so far so good,
629216,Google,,"February 19, 2019",5,is ap main basalt asahi hot hai,is aap main bahaut asani hoti hai,
629220,Google,,"February 19, 2019",5,good application v nice use full,good application v nice use full,
629225,Google,Lalani Sameer,"February 19, 2019",5,so very nice ok nice,so very nice ok nice,
629228,Google,,"February 19, 2019",1,en,", ,,,,,, en",
629235,Google,Rajakumar Singh,"February 19, 2019",5,thank you goole,thank you google.,
629237,Google,,"February 19, 2019",5,this ap is very useful to u i like this ap too much,this aap is very useful to us. i like this aap too much,
629240,Google,,"February 19, 2019",5,i like this application,i like this application,
629245,Google,,"February 19, 2019",5,i love everything about it,"i love everything about it,",
629248,Google,Nawaz Ahmed,"February 19, 2019",5,we will we get,we will we get,
629251,Google,Anisul haque Chowdhury,"February 19, 2019",5,very nice application i love it,very nice application .i love it .,
629252,Google,Prodip Borah,"February 19, 2019",5,amazing application,amazing application. !,
629254,Google,,"February 19, 2019",1,tha mala thalia paiva,otha oomala thaviya paiya,
629257,Google,,"February 19, 2019",5,best amongst all broker,best amongst all browers,
629264,Google,,"February 19, 2019",5,hope to be flash loading,hope to be flash loading,
629265,Google,,"February 19, 2019",5,i have not done anything yet,i have not done anything yet.,
629272,Google,,"February 19, 2019",1,atuser atuser atuser is a piece of f ken sh t application making people arrive late to there destination shot you in the munday ken head if you do not get away from atuser atuser atuser garbage low floor no sd card munday cher started toying with the individual personal lifestyle what kind of f king application is this,"atuser atuser atuser is a piece of f cken sh t application, making people arrive late to there destination. shot you in the muhdaf cken head if you do not get away from atuser atuser atuser! garbage! low  floor  no sd card muhdaf cker started toying with the individuals personal lifestyle! what kind of f cking application is this?",
629273,Google,Jacob Myers,"February 19, 2019",2,it doe not respond everytime i look something up or touch the image it doe not let me scroll up and down it only freeze,"it does not respond! everytime i look something up or touch the image, it does not let me scroll up and down! it only freezes!",
629277,Google,,"February 19, 2019",5,i like this application a lot,i like this application a lot! ,
629280,Google,,"February 19, 2019",5,oh my god nic,oh my god nic,
629279,Google,,"February 19, 2019",3,hey my goole can not load web site or page just sit there with the entire screen white please help,hey my google cannot load web sites or pages. just sit there with the entire screen white please help,
629281,Google,Fireredleo,"February 19, 2019",1,trash i do not need i and never like it i recommend using duckduckgo instead,"trash, i do not need i and never like it. i recomend using duckduckgo instead.",
629284,Google,,"February 19, 2019",3,goole is an application of international standard that meet every need of human desire and age,google is an application of international standard that meets every needs of human desires and ages !,
629291,Google,,"February 20, 2019",1,bad but good made life easy,bad but good made life easy,
629292,Google,Anna Lawrence,"February 20, 2019",5,goole is awesome i love goole so much you can do anythimgon goole,google is awesome. i love google so much you can do anythimgon google,
629295,Google,Farhaan malik,"February 20, 2019",5,good game g z good game good game, good game  zg               z  good game     good game ,
629303,Google,,"February 20, 2019",5,goch kiss essex greece is dew dis,gych kiss esdseees greece is dew diss,
629311,Google,Amir Azad,"February 20, 2019",5,the new version send more mass but is good application,the new version send more maseges but is good application,
629313,Google,udhaya kumar,"February 20, 2019",5,super super super super,super super super super,
629321,Google,,"February 18, 2019",5,very easy and good,very easy and good,
629329,Google,n g,"February 18, 2019",4,without infinity sign your keyboard is incomplete hope you can understand,without infinity sign your keyboard is incomplete hope you can understand,
629336,Google,Ruth Shamblin,"February 18, 2019",5,all aps that are goole all aps that are goole always have a,all apps that are google all apps that are google always have a  +,
629338,Google,nalin indika,"February 18, 2019",5,best of the best goole,best of the best google .,
629344,Google,,"February 19, 2019",5,very helpful full to the me first time doe not interested to goole s account so will ise the us of goole help u to studied time very interesting but romany badly site in situated in goole l rejected that s and you help to the math blow i think about goole,very helpful full to the me .first time does not interested to google s account .so will isee the uses of google. help us to studied time very. . interesting. but somany badly sites in situated in google. l rejected that s and you helps to the maths blog. i think about google,
629345,Google,Rule. Scrimgeour,"February 19, 2019",5,excellent no other word for it,excellent no other word for it,
629350,Google,Thomas Ventre,"February 19, 2019",5,great with chevy vehicle,great with chevy vehicles,
629356,Google,,"February 19, 2019",4,so far so good,so far so good,
629361,Google,,"February 19, 2019",5,i like this application,i like this application,
629366,Google,,"February 19, 2019",5,this goole aps make data very good and location and download this very good i wish my goole account u very very very mach good work and give me location very good and entered and very mach good for download and woking,this google apps makes data very good and location and download this very good i wish my google account us very very very mach good works and givd me location very good and enterbet and very mach good for downliad and woking,
629371,Google,Darlington Gweh,"February 19, 2019",5,voice assistance seems difficult to use thanks yet,voice assistance seems difficult to use. thanks yet,
629373,Google,,"February 19, 2019",5,best of best application,best of best application,
629377,Google,,"February 18, 2019",5,o dz,",o. dzz.",
629378,Google,Digital Music,"February 18, 2019",5,i love this application,i love this application,
629379,Google,,"February 18, 2019",5,i like it,i like it.,
629384,Google,,"February 18, 2019",5,it is very helpful for my learning or questioning experience,it is very helpful for my learning or questioning experience,
629389,Google,,"February 18, 2019",3,v bh l l cx,v bh l l cx,
629388,Google,,"February 18, 2019",5,awesome application thank you,awesome application. thank you.,
629396,Google,,"February 18, 2019",3,just waiting for my aps to open,just waiting for my aps to open,
629397,Google,Elmo Washburn,"February 18, 2019",5,good for for sachs and etc,good for for seachs and etc,
629402,Google,Srabon Borson,"February 19, 2019",5,this is good aps,this is good apps,
629398,Google,CM Online,"February 18, 2019",5,various important information about the today is world goole it is the answer use it guy so fantastic,"various important information about the today is world, google it is the answer . use it guys so fantastic.",
629406,Google,,"February 19, 2019",5,i love goole play,i love google play.,
629409,Google,,"February 19, 2019",5,its so very nice about using goole,its so verry nice about using google,
629411,Google,,"February 19, 2019",2,when i say something its like i am talking to no one i,when i say something its like i am talking to no one i.,
629412,Google,prosonzith tarafder,"February 19, 2019",5,i like it is,i like it is,
629413,Google,,"February 19, 2019",5,nice one for the news,nice one for the news.,
629414,Google,Sajid Alam,"February 19, 2019",5,device incomplete without this ap,device incomplete without this aap,
629420,Google,,"February 19, 2019",2,motif lal singh barkham,moti lal singh bairkhar,
629422,Google,,"February 19, 2019",1,boo it is more bad than chrome,boo it is more bad than chrome,
629423,Google,,"February 19, 2019",5,vary easy and fast,vary easy and fast,
629424,Google,Sudhir Katigar,"February 19, 2019",5,good no application,good no  application.,
629425,Google,DrRavikiran Goranal,"February 19, 2019",5,goole is my world,google is my world,
629426,Google,,"February 19, 2019",5,i love it thanks,i love it. thanks,
629430,Google,Vimal Tripathi,"February 19, 2019",5,internet exposure or good new user new experience for application,entornet exposure or good new user new experience for application,
629445,Google,,"February 19, 2019",5,good ape for use,good ape for use,
629441,Google,,"February 19, 2019",5,it is very useful in sciencefield and all other field it provide all type of knowledge,it is very useful in sciencefield and all other field it provide all types of knowlege,
629431,Google,Claudia Cuevas,"February 19, 2019",5,it is the bestest it is genius loving it,it is the bestest it is genius! loving it /,
629446,Google,,"February 19, 2019",5,great application helpfulalso,"great application, helpful,also",
629457,Google,Leroy Charles,"February 19, 2019",1,posh e owner this application take up too much data i have tried to remove this application to no avail everytime i delete the data for goole play svqs it come back i do not want this application i may have mb of data and want to load a mb application mb of data requires me to delete mb of aps to download a mb application was a big mistake it will not be on my next phone,"posh e owner. this application take up too much data. i have tried to remove this application, to no avail. everytime i delete the data for google play svcs., it comes back. i do not want/use this application. i may have  mbs of data and want to load a  mb application, mbs of data requires me to delete  mb of apps. to download a  mb application was a big mistake. it will not be on my next phone.",
629464,Google,,"February 19, 2019",5,i love this application,i love this application,
629453,Google,Md. Mainuddin Mia,"February 19, 2019",5,it is ok,it is ok.,
629469,Google,dev sharma,"February 19, 2019",5,very nice very good,very nice very good,
629477,Google,,"February 19, 2019",5,reliable and resourceful,reliable and resourceful.,
629480,Google,Aqeelbabuje Babujee,"February 19, 2019",4,good and quick goole engine nic work your distinction your work maize,good and quic google engine nic work your distination your work amaize.,
629485,Google,,"February 19, 2019",3,so beautiful and very easy,so beautiful and very easy,
629488,Google,Bunqwertyuiop Ly,"February 19, 2019",5,i wanted just a play game,i wanted just a play gamer,
629492,Google,,"February 19, 2019",1,fake notification are coming,fake notification are coming,
629494,Google,Saiful Islam,"February 19, 2019",1,its much time wanted update,its much time wanted update,
629499,Google,Manav Patel,"February 19, 2019",5,its the best browser,its the best browser,
629498,Google,,"February 19, 2019",5,one of the super application,one of the super application.,
629500,Google,ziad maimani,"February 19, 2019",5,best of the best,best of the best,
629503,Google,Christina warden,"February 19, 2019",5,a always goole is the best,as always google is the best,
629526,Google,,"February 18, 2019",3,good for such information,good for such information,
629527,Google,Nam Nguyenhuu,"February 18, 2019",5,rc v cc gtcvrcrvr v are gh tfvobtrfvofcrcv,rc v cc gtcvrcrvr v are gh tfvobttrrfvofcrcvv,
629528,Google,,"February 18, 2019",5,it good force of information,it good sorce of information,
629532,Google,Wai Hong,"February 18, 2019",4,so far so good,so far so good,
629538,Google,,"February 19, 2019",5,mai kay bolo mera pas koi word hi nh h mean very very very very very very very very good good good,mai kaya bolo mera pass koi word hi nhi h means very very very very very very very very good good good,
629539,Google,A Google User,"February 19, 2019",5,the smart part of today is smart phone love the assistant,the smart part of today is smart phone. love the assistant.,
629541,Google,,"February 19, 2019",2,goole is okay most of the time goole is assistance that made me give star when i watching couture or doing anything on my phone goole assistance keep popping up i tried multiple time to stop multiple time from popping up but multiple time happens every second of my day,google is okay most of the time google is assistance that made me give  stars . when i amwatching youtube or doing amything on my phone google assistance keeps popping up i tried multiple times to stop multiple times from popping up but multiple times happens every second of my day .,
629542,Google,Moon Afridi,"February 19, 2019",5,i just love it this application i give you star,i just love it this application i give you star ,
629544,Google,sudono teoefendi,"February 19, 2019",5,i give you because best for new world all people need something often your goole,i give you  bicause best for new world all people need something offen your google.,
629548,Google,,"February 19, 2019",1,why dose a few people get to choose for everyone elsethis is not morality,why dose a few people get to choose for everyone else.this is not morality.,
629553,Google,,"February 19, 2019",5,n you h a by bb,".n ="" !you h  a by bb*-",
629565,Google,barry blair,"February 19, 2019",5,best search engine available,best search engine available,
629562,Google,,"February 19, 2019",1,no network connection before completion of our package,no network connection. before completion of our package,
629568,Google,Samiul Alom,"February 19, 2019",5,tough i use chrome most still a good application to have,"tough i use chrome most, still a good application to have",
629569,Google,Paul Guilfoyle,"February 19, 2019",4,i like it i like it a lot,i like it. i like it a lot!,
629573,Google,Vinola Jeneliya,"February 19, 2019",5,easy to search anything good it is very useful,easy to search anything good it is very useful,
629574,Google,sibaprasad ratha,"February 19, 2019",5,it is really a helper,it is really a helper,
629576,Google,,"February 19, 2019",5,best search engine time kafi aha hot he,best search engine timepass kafi acha hota he,
629580,Google,,"February 19, 2019",5,it is a very good and trusted application with no search engine,it is a very good and trusted application with no. search engine.,
629596,Google,,"February 19, 2019",5,i like goole goole let me find a lot of information,i like google google let me find a lot of information,
629600,Google,,"February 19, 2019",5,best application please try best application,best application please try best application.,
629602,Google,vikas kashyap,"February 19, 2019",5,amazing application by goole,amazing application by google,
629603,Google,,"February 19, 2019",5,its very use full application i think,its very use full application i think,
629605,Google,Ashok Nain,"February 19, 2019",5,very helpful application for knowledge,very helpful application for knowledge .,
629609,Google,Angela H,"February 18, 2019",4,it is ok for now,it is ok for now,
629610,Google,RAJESH. LALCHOLA,"February 18, 2019",5,ill ill ill ill,ilu ilu ilu ilu,
629619,Google,abhijeet gurav,"February 18, 2019",5,great time with goole,great time with google,
629621,Google,,"February 18, 2019",5,i can not because t,i cannot because t,
629623,Google,James Calder,"February 18, 2019",3,good but should have night mode,good but should have night mode,
629625,Google,John Ray Laredo,"February 18, 2019",4,dm m b,dm. m. b,
629626,Google,,"February 18, 2019",4,recover my all account,recover my all accounts,
629630,Google,Ebene Osifo,"February 18, 2019",5,very descriptive and straight to the point,very descriptive and straight to the point.,
629632,Google,,"February 18, 2019",1,knife ilk ilk i i kim b,knife ilk ilk i i kim b,
629637,Google,,"February 20, 2019",5,we are looking l lp my,we are looking l lp my,
629648,Google,,"February 20, 2019",5,i like the application,i like the application,
629649,Google,Princess Priyanka,"February 20, 2019",4,the application crash suddenly,the application crashes suddenly,
629650,Google,,"February 20, 2019",5,ok very good application,ok verry good application,
629653,Google,Raja Villa,"February 20, 2019",5,goole is helping for u,google is helping for us,
629660,Google,Ajay Soni,"February 18, 2019",5,goole is everywhere once you own everything you need to be perfect and goole doe that,"google is everywhere, once you own everything you need to be perfect and google does that",
629669,Google,,"February 18, 2019",5,good application search anything,good application search anything,
629670,Google,,"February 18, 2019",5,it is really helpful for me and for my studylove my studylove so,it is really helpfull for me and for my study.love my study.love sooooooooo,
