id,appTitle,userName,date,score,text,original_text,bug_report
622178,Google,Keith Mickunas,"February 7, 2019",1,goole has chosen to pull spam from my mail spam folder and add goole to my feed with absolutely no way to remove goole absolutely amazing level of incompetence and disrespect for user also the decision to remove swiping away of story is mind boggling stupid,google has chosen to pull spam from my gmail spam folder and add google to my feed with absolutely no way to remove google. absolutely amazing level of incompetence and disrespect for users. also the decision to remove swiping away of stories is mind boggling stupid.,
622179,Google,Eddie S,"February 8, 2019",2,it seems like ever since the forced move to goole assistant the feature that functioned before with android auto like hand free call text text reply and general search stopped working no more hand free interaction while driving so it is back to pulling over to do anything plus side is that map and music still work but that is it update latest update fixed hand free search in android auto however hand free text is still messed up doe not understand correctly,"it seems like ever since the ""forced move"" to google assistant, the features that functioned before with android auto like hands free call, text, text reply, and general searches stopped working. no more hands free interaction while driving. so it is back to pulling over to do anything. plus side is that maps and music still work but that is it. *update //; latest update fixed hands free search in android auto; however hands free text is still messed up. does not understand correctly.",
622180,Google,Akash Abraham Mammen,"February 6, 2019",3,i recently switched to miami mi all other aps work fine except ok goole can not access voice match service can not retrain or use voice feature ok goole can not access voice match service say selected language u uk english not compatible,i recently switched to xiaomi mi. all other apps work fine except 'ok google' cannot access voice match service. cannot retrain or use voice feature. 'ok google' cannot access voice match service says selected language (us uk english) not compatible.,
622181,Google,Jennifer Trujillo,"February 8, 2019",1,i have uninstaled and installed the goole application i have even cleared my browsing data in chrome i just can not get the goole application to function right without freezing my entire search please fix the goole application everything started freezing and searching wrong information when i did my update i own a samsung galaxy s,"i have uninstalled and reinstalled the google application, i have even cleared my browsing data in chrome. i just cannot get the google application to function right without freezing my entire search. please fix the google application. everything started freezing and searching wrong information when i did my update. i own a samsung galaxy s.",
622185,Google,Sinn U1000,"February 12, 2019",1,the last update seems to be glitch when trying to search image the last update freeze for couple second and then the last update work again i for sure know this never happened before the last update please fix a soon a possible note stock rom,the last update seems to be glitchy. when trying to search images the last update freezes for couple seconds and then the last update works again. i for sure know this never happened before the last update. please fix as soon as possible. note  stock rom.,
622186,Google,rohan Pardeshi,"February 18, 2019",5,very helpful and easy to use,very helpful and easy to use !.,
622188,Google,,"February 15, 2019",5,easy to navigate love goole,easy to navigate love google,
622189,Google,Anannya Samanta,"February 16, 2019",5,nice i just satisfied by this application,nice. i just satisfied by this application,
622190,Google,Jason Miller,"February 15, 2019",4,like goole it a good application,like google it a good application.,
622191,Google,Shirley Rivas,"February 16, 2019",5,the best search engine,the best searches engine.,
622193,Google,Ashish Kumar Barua,"February 16, 2019",5,it is very effective application,it is very effective application.,
622194,Google,Emma Johnson,"February 16, 2019",5,i have had great experience,i have had great experiences,
622195,Google,jose castaneda,"February 18, 2019",5,love it i use it every day,love it. i use it every day.,
622197,Google,varguex damrogue,"February 18, 2019",4,very much ok and convenient,very much ok and convenient.,
622198,Google,,"February 18, 2019",5,good suck take so long to download make it work i pay enough,good sucks. takes so long to download make it work !i pay enough$$$$$$$,
622200,Google,,"February 18, 2019",5,its very nice application,its very nice application,
622203,Google,James Hall,"February 18, 2019",5,i like the new feature,i like the new features.,
622204,Google,Himanshu Gupta,"February 18, 2019",5,life is so easy with goole,life is so easy with google.,
622209,Google,sammy hamdan,"February 18, 2019",5,greatest application ever,greatest application ever!,
622210,Google,DHEERAJ KUMAR,"February 18, 2019",5,only one word say fantastic,"only one word say ""fantastic""",
622212,Google,Fallis Chad,"February 18, 2019",5,school for anyone is curiosity,school for anyone is curiosity.,
622213,Google,,"February 17, 2019",5,super silvery helpful,"super sir,very helpful",
622226,Google,pradip sherkar,"February 18, 2019",5,my goole play store not downloading aps still not downloading,my google play store not downloading apps. still not downloading.,
622227,Google,Eric Holt,"February 15, 2019",1,i will be removing myself from all goole product a soon i find a different platform to use,i will be removing myself from all google products as soon i find a different platform to use.,
622229,Google,Praveen naik,"February 10, 2019",4,asking update within a wekapart from no word,asking update within a week.apart from no word.,
622230,Google,steve closs,"February 10, 2019",1,getting pushy thinking about the rest of the go too instal,"getting pushyy, thinking about the rest of the googs too uninstall",
622231,Google,ËññøÇëñt Go vi nd,"February 11, 2019",5,i alike this application,i amlike this application,
622233,Google,,"February 17, 2019",5,tt has a lamp in the back and time for a lot to get the,tttt has a lamp in the back and time for a lot to get the,
622235,Google,Mike Angelo,"February 11, 2019",1,will not respond to my voice tried all troubleshooting,will not respond to my voice tried all troubleshooting,
622237,Google,Uddhav Farakte,"February 11, 2019",1,remove search bar from home screen android pie,remove search bar from home screen android pie.,
622239,Google,Gary Gallegos,"February 9, 2019",5,ok inert to use it more if you guy can show me how,"ok ,inerf to use it ,more if you ,guys can show me how",
622240,Google,Brain Less,"February 16, 2019",3,some improvement on the appearance,some improvements on the appearance,
622242,Google,,"February 15, 2019",5,like it application is super,like it application is super,
622244,Google,Buck McMichael,"February 8, 2019",5,get the job done,gets the job done,
622246,Google,sm nasim,"February 15, 2019",5,thanks to goole aps,thanks to google apps,
622247,Google,,"February 13, 2019",3,i like this aps,i like this apps,
622251,Google,,"February 11, 2019",3,i need to thank you,i need to thank you,
622254,Google,,"February 7, 2019",1,slow web page loadingintegrate slow web page with chrome,slow web page loading.integrate slow web page with chrome.,
622255,Google,,"February 18, 2019",5,so useful special on assignment when i do not understand that word,so useful specialy on assignments when i do not understand that word,
622258,Google,,"February 15, 2019",1,network connected hone k bad hi voice search kam nazi far aha,network connected hone k baad bhi voice search kam nahi kar raha,
622259,Google,Kemo Elsaeed,"February 17, 2019",4,every few day i get the update notification with the same version,every few days i get the update notification with the same version.,
622260,Google,Vicki Fry,"February 13, 2019",5,i need to check out my message please,i need to check out my message please,
622261,Google,,"February 13, 2019",5,score the game winning run or run on my device,score the game winning run or runs on my device,
622262,Google,Darren Lotter,"February 11, 2019",4,it is time for an update and it is taking forever it say download pending,it is time for an update and it is taking forever. it says download pending,
622263,Google,Pamela L,"February 15, 2019",4,ditto what others say about the color and amount of space taken,ditto what others say about the colors and amount of space taken,
622264,Google,G. MOHAN,"February 5, 2019",4,very good update easy to use always,"very good update, easy to use always. ",
622265,Google,Nadeem waqas Nadeem,"February 8, 2019",1,application sae kam nh kr rha ha,application sae kam nhi kr rha ha,
622308,Google,,"February 14, 2019",5,great job goole team,great job google team.,
622309,Google,Narsappa Dhoki,"February 16, 2019",5,narmada dhobi jai hind,narsappa dhoki jai hind,
622310,Google,,"February 16, 2019",1,not working with polo f,not working with poco f,
622312,Google,,"February 12, 2019",5,thank you goole is very helpful thank you,thank you. google is very helpful. thank you,
622313,Google,,"February 18, 2019",5,without goole life is waste,without google life is waste,
622314,Google,Abhamidzah A.Hamid,"February 17, 2019",1,unable to do auto translate,unable to do auto translate,
622315,Google,akimbo slice,"February 16, 2019",5,been using this forever way back since the eclair day good application,been using this forever way back since the eclair days. good application.,
622316,Google,Jennifer M. Fairchild,"February 16, 2019",5,the application deleted the application then download i think there is a second party on my phone,the application deleted the application then redownload. i think there is a second party on my phone.,
622317,Google,status of vv Venkatesh,"February 15, 2019",5,super application nic answering,superrrrrrrrr application nic answering,
622319,Google,Deven Nigare,"February 15, 2019",3,lot of battery consume,lots of battery consume,
622320,Google,gavaniel garcia,"February 16, 2019",3,to me user friendly to someone who is visually impaired mid partial sight,"to me, user friendly to someone who is visually impaired (mid partial sight).",
622322,Google,Marcus Bruce,"February 15, 2019",5,it has everything i need,it has everything i need,
622323,Google,pietru sant,"February 12, 2019",4,give me good information that i search,give me good information that i search,
622324,Google,,"February 16, 2019",5,game and application maker download internet browser and playstore with free please,game and application maker download internet broswer and playstore with free please,
622325,Google,,"February 17, 2019",5,absolutely amazing experience and personally i see myself and goole dealing with one another for a long time,absolutely amazing experience and personally i see myself and google dealing with one another for a long time,
622326,Google,Bryan Wooten,"February 17, 2019",1,ad pop up i do not want to keep seeing those it is irritating when watching movie,ad pop up i do not want to keep seeing those it is irritating when watching movies,
622327,Google,Mohit Maurya,"February 18, 2019",3,it never work perfect in online,it never works perfect in offline.,
622328,Google,,"February 16, 2019",5,nicam faisal cricket brother,nigam jaiswal cricket brother,
622329,Google,Marietta Jones,"February 18, 2019",5,it doe have ad that is not thing i want to see or interested in but the application is okay,"it does have ads that is not things i want to see or interested in, but the application is okay.",
622330,Google,Jyothish S V,"February 18, 2019",5,pull down to refresh no longer working after new update,pull down to refresh no longer working after new update,
622331,Google,,"February 18, 2019",2,slow on rainy day q,slow on rainy days q,
622332,Google,Richard Moore,"February 15, 2019",3,pie update and the assistant no longer work,pie update and the assistant no longer works.,
622333,Google,,"February 16, 2019",4,very good and fast search result,very good and fast search results,
622334,Google,connor mason,"February 18, 2019",4,its ok just take up so much storage its running a lot smoother now thanks,"its ok just takes up sooooo much storage, its running alot smoother now thanks",
622335,Google,,"February 18, 2019",4,its not loading the card,its not loading the cards.,
622336,Google,Sumit Kumar Pandey,"February 18, 2019",5,very very nice all thing are available on goole you can search anything,very very nice  all things are available on google you can search anything,
622337,Google,Joe M,"February 18, 2019",5,amazing work goole love amazing work goole still never been duped by goole and i can confidently say goole continues to get better and at a great pace thank you all again keep up great job to all involved,"amazing work google, love amazing work google! still never been duped by google and i can confidently say. google continues to get better and at a great pace. thank you all again!  keep up great job to all involved,$$$$$$$$$$$!",
622340,Google,Abhijith Pothina,"February 16, 2019",1,voice is bot getting recorded,voice is bot getting recorded,
622341,Google,Thamindu kavinda,"February 16, 2019",5,provide lot of informationwhole life embedded with this,provide lot of information.whole life embedded with this,
622342,Google,,"February 17, 2019",1,fed can track you by your goole location even when your goole location is off but not in airplane mode,feds can track you by your google location. even when your google location is off. but not in airplane mode,
622343,Google,Mudit Dikshit,"February 17, 2019",5,goole is always like a best friend that help you in every situation,google is always like a best friend that helps you in every situation,
622345,Google,Bob Hodgson,"February 13, 2019",1,new up date goole keep stopping,"new up date ,google keeps stopping ?",
622346,Google,Jose Rodriguez,"February 17, 2019",5,use it all the time,use it all the time.,
622347,Google,BJ Hutton,"February 15, 2019",5,perfect addition to the chrome browser for quick search striker is lounge couture,perfect! addition to the chrome browser for quick search. - stryker is lounge [youtube],
622348,Google,,"February 18, 2019",5,its a very useful application for android user i like its a very useful application for android user,its a very useful application for android users. i like its a very useful application for android users.,
622350,Google,,"February 13, 2019",5,i like this version,i like this version,
622352,Google,,"February 18, 2019",1,taking so so long to update took week,taking so so long to update took weeks,
622354,Google,,"February 16, 2019",1,after the update the update not working,after the update the update not working,
622355,Google,Dale Stennett,"February 16, 2019",1,not working now well do not,not working now . well do not,
622356,Google,M.k A.,"February 17, 2019",1,voice command not working,voice commands not working,
622357,Google,Juanita Alegria,"February 17, 2019",5,i need to open this application again,i need to open this application again.,
622358,Google,,"February 17, 2019",5,my on account on my on is feedback it on my of me optional,my oun accounts on my oun is feedback  it on my of me // (optional),
622359,Google,arjun singh,"February 16, 2019",5,fool of a new,fool of a new,
622360,Google,Abid Aabi,"February 15, 2019",5,wow its really work good,wow its realy work good,
622361,Google,Raj Pallut,"February 16, 2019",1,connection is very bad,connection is very bad,
622363,Google,,"February 16, 2019",2,hi m th tt,hi ms th tttttttttttttt,
622364,Google,,"February 14, 2019",5,everything lear for this application,everything lear for this application,
622366,Google,,"February 18, 2019",5,i like goole,i like google!,
622367,Google,Dwiki Fajar Ramadhan,"February 18, 2019",3,update lg aja bus,update lg aja busetttttt,
622368,Google,DJ ALL IN,"February 15, 2019",5,goole me please,google me please!,
622369,Google,Rakib Hassan,"February 15, 2019",4,can not install in mashmelo,cannot install in mashmello ..,
622370,Google,,"February 18, 2019",1,getting from bad to worse,getting from bad to worse,
622372,Google,Mykhailo Luhovyi,"February 18, 2019",4,please add ukrainian to goole assistant thanks,"please, add ukrainian to google assistant, thanks",
622373,Google,Md. Humayun Kabir,"February 18, 2019",4,reminder is set but do not notify,reminder is set but do not notify.,
622375,Google,,"February 18, 2019",5,i like using this application,i like using this application,
622378,Google,,"February 17, 2019",5,m liu i uh,m liu i  uhh,
622379,Google,Maria Glasscock,"February 17, 2019",1,goole is not updating corectualy,google is not updating correctually,
622380,Google,Michael Pandocchi,"February 17, 2019",4,just what i need,just what i need!,
622381,Google,Muhammad Saeed Anwer,"February 16, 2019",3,hanging after new update,hanging after new update,
622389,Google,Malcolm Tranberg,"February 16, 2019",5,only the best thanks guy,"only the best, thanks guys.",
622397,Google,1 dumb teen and a screenrecorder,"February 18, 2019",5,its goole its goole know what its goole is,its google. its google know what its google is.,
622410,Google,,"February 15, 2019",1,they not working,they not working.,
622417,Google,,"February 16, 2019",5,i like it more update for better,i like it! more update for better!,
622424,Google,Stacy Bradford,"February 16, 2019",5,i love this application,i love this application!,
622427,Google,Parameshwarananda puri,"February 18, 2019",4,it is very good application,it is very good application,
622428,Google,,"February 16, 2019",5,it is very useful,it is very useful.,
622430,Google,Dpranjan Ranjan,"February 15, 2019",5,very good application,very good application.,
622431,Google,Pavan Singh,"February 15, 2019",5,it is too good,it is too good,
622432,Google,,"February 16, 2019",5,helpful and easy to used,helpful and easy to used.,
622433,Google,Thái Võ Như,"February 15, 2019",1,where is my assistant,where is my assistant,
622434,Google,,"February 17, 2019",4,is very easy to use,is very easy to use.,
622443,Google,Terry Delia,"February 18, 2019",4,great just great,"great , just great !",
622445,Google,,"February 18, 2019",4,it is good and excellent to use,it is good and excellent to use,
622447,Google,,"February 18, 2019",5,it is a great tool,it is a great tool,
622449,Google,parvas rap,"February 18, 2019",5,it is really good,it is really good,
622453,Google,Romil Angelo Obrero,"February 18, 2019",5,it is so great,it is so great,
622455,Google,AnimeLover3365 /Lol!,"February 17, 2019",5,good for responding research,good for responding research.,
622456,Google,,"February 17, 2019",4,i like new version,i like new version.,
622457,Google,,"February 17, 2019",5,it is awesome application,it is awesome application!,
622458,Google,DIRGE DROP,"February 17, 2019",4,best and user friendly,best and user friendly,
622461,Google,Pr Ramesh,"February 16, 2019",5,my photo photo own foot,my photos photos own fotos,
622466,Google,,"February 18, 2019",5,loved it so much,loved it so much ,
622467,Google,,"February 18, 2019",5,it is a good application,it is a good application,
622469,Google,Keith Nebor,"February 18, 2019",1,warning do not update read review,warning do not update! read reviews!,
622470,Google,masha adam,"February 18, 2019",1,i have to update but inhaler problem i do not now whats happen,"i have to update but intaller problem, i do not now whats happen",
622471,Google,Greg J,"February 18, 2019",5,work a it should,works as it should ,
622477,Google,Umesh Vaidya,"February 18, 2019",5,it is amazing,it is amazing.,
622478,Google,Richard Voss,"February 18, 2019",1,continues to think i am in city i no longer live in i have tried everything suggested such a clear cache clear history clear cooky update location turn on location svqs with it unable to recognizing my true current location it is useless,"continues to think i am in city i no longer live in. i have tried everything suggested, such as clear cache, clear history, clear cookies, update location, turn on location svcs. with it unable to recognizng my true current location it is useless.",
622479,Google,,"February 18, 2019",1,can it stop popping up when i am using another application please,can it stop popping up when i am using another application please,
622481,Google,Bernie Wilson 66,"February 18, 2019",5,i mainly use it for access to my yahoo tattoo group and general web searching and couture and face-on,i mainly use it for access to my yahoo tattoo group and general web searching and youtube and facebook,
622483,Google,,"February 18, 2019",1,data kraken application not even providing a proper changeling can not be uninstaled,data kraken application not even providing a proper changelog. cannot be uninstalled.,
622484,Google,Scott G.,"February 18, 2019",5,what else would you expect,what else would you expect?!?,
622491,Google,,"February 18, 2019",3,is good to have someone who can make you happy when your are yr old brother and sister what are you doing now,"is good to have someone who can make you happy, when your are yrs old, brother and sister what are you doing now.",
622492,Google,,"February 18, 2019",1,when i search it show up please check you are internet connection even tough i did turned it on and i have to update it but my phone is storage all i ever wanted was to search something i want,"when i search, it shows up please check you are internet connection, even tough i did turned it on and i have to update it but my phone is storage  all i ever wanted was to search something i want",
622493,Google,Koyas Miah,"February 18, 2019",4,no option to get rid of the search bar,no option to get rid of the search bar,
622499,Google,,"February 18, 2019",5,the best assistant by far it will be interesting to see what goole has in mind a time go on thanks,the best assistant by far. it will be interesting to see what google has in mind as time goes on. thanks.,
622500,Google,up 2,"February 18, 2019",1,another core application containing forced ad stop the evil goole forced ad,another core application containing forced ads. stop the evil google forced ads!,
622505,Google,Lon Parrish,"February 18, 2019",4,i keep losing connection with internet what can i do to solve this problem,i keep losing connection with internet. what can i do to solve this problem?,
622508,Google,Gamer Probably,"February 18, 2019",5,very easy and comfortable to use has a compact and cozy feel when browsing and answer all my question it is perfect,"very easy and comfortable to use, has a compact and cozy feel when browsing and answers all my questions! it is perfect.",
622516,Google,Tommy Pratt,"February 18, 2019",5,to show advanced result,to show advanced results,
622517,Google,,"February 18, 2019",3,bug for a samsung,bug for a () samsung ,
622519,Google,pancho m,"February 18, 2019",5,the application is very helpful,the application is very helpful,
622521,Google,Zarah Martinez,"February 18, 2019",5,has everything you can imagine and need for daily us take awhile to post daily us,has everything you can imagine and need for daily uses! takes awhile to post daily uses.,
622523,Google,ArMaNi Skillz,"February 18, 2019",4,add a dark theme,add a dark theme,
622526,Google,Ilimezekhe Joyce,"February 18, 2019",5,great assistant on the go,great assistant on the go.,
622528,Google,Tom R,"February 18, 2019",1,every since these two new update everything keep freezing up on my phone i am about ready to throw my phone through the wall,every since these two new updates everything keeps freezing up on my phone i am about ready to throw my phone through the wall,
622529,Google,,"February 18, 2019",5,best assistance application ever seen,best assistance application ever seen,
622530,Google,Johnny Ezell Jr,"February 18, 2019",5,what happened since the latest update result have been so slow what did wheal do to it,what happened? since the latest update results have been sooooo slow. what did why'all do to it?,
622533,Google,,"February 18, 2019",4,its every help for place a what you need to know,its every help for place a what you need to know,
622535,Google,Karen Picard,"February 18, 2019",4,help when my mind is short on thinking too fast for an answer,helps when my mind is short on thinking tooo fast for an answe.,
622538,Google,Naresh Kumar Verma,"February 18, 2019",5,bf hdz zxvdbz hvk c,"xbf*f vhdz $z$xvdd,bzz"";$$$"",_,""+,"" , *hvz,,*,,, c",
622539,Google,,"February 18, 2019",3,life score in the world,life score in the world,
622540,Google,Sherry Mott,"February 18, 2019",5,its a hood application for news to keep up whats going on in the world new product its offer a lot of information,its a hood application for news to keep up whats going on in the world new products its offers a lot of information,
622543,Google,,"February 18, 2019",5,good game good game i i,good game good game i . . i,
622548,Google,Danny Roman,"February 18, 2019",5,new updated killed everything when i select something it force close,new updated killed everything when i select something it force closes,
622553,Google,Kiran shenoy,"February 17, 2019",5,application is not responding,application is not responding,
622569,Google,,"February 17, 2019",5,super application for searching anything,super application for searching anythig,
622574,Google,,"February 17, 2019",4,very good almost likely application,"very good , andmost likely application",
622579,Google,,"February 16, 2019",2,a rx kiss can,"a, rx kiss can",
622582,Google,Sdumo Emmanuel,"February 16, 2019",5,adult site dont connect can you connect please,adults sites dosnt connect can you connect please,
622586,Google,Muhammad Hanan,"February 16, 2019",5,i m young this,i m youing this,
