id,appTitle,userName,date,score,text,original_text,bug_report
626579,Google,,"February 26, 2019",4,very good guidance application,very good guidance application,
626580,Google,,"February 25, 2019",5,best search engine in the world,best search engine in the world,
626581,Google,,"February 19, 2019",1,excellent cultivar for small garden,execellent cultivars for small gardens,
626582,Google,Liz Rodriguez,"February 25, 2019",5,great nothing need to be said,great nothing needs to be said,
626583,Google,,"February 18, 2019",5,very nice thanks to goole,very nice thanks to google,
626584,Google,,"February 23, 2019",5,fast secure i am impressed,"fast, secure. i am impressed.",
626585,Google,,"February 24, 2019",5,best i have ever saw,best i haved ever saw,
626606,Google,VIKU SHARMA,"February 26, 2019",5,goole is a wold best application i love goole,google is a wold best application i love google,
626586,Google,technical india,"February 19, 2019",3,better than vivo browser,better than vivo browser,
626607,Google,Matthew Tsang,"February 25, 2019",1,my goole feed is blank and has nothing what is going on,my google feed is blank and has nothing. what is going on?,
626609,Google,Anju Bala,"February 27, 2019",5,very helpful application for everyone very nice application for me and everyone,very helpful application for everyone. very nice application for me and everyone ,
626610,Google,Harish Kumar,"February 27, 2019",4,kiss kiss c,"?,kiss, , ,? ,kiss c , ! ,,,,,, ,,,,,,,,",
626621,Google,Afzal Hossain,"February 25, 2019",5,very good application,very good application.,
626627,Google,,"February 25, 2019",5,this is the best application in the best application we will get all information location and every thing that we need thank you goole,this is the best application . in the best application we will get all information . location and every things that we need. thank you google. ,
626628,Google,Bàrry Evans,"February 25, 2019",5,not use it a lot but really easy to usemuch quicker than typing and instant response,"d'not use it a lot but really easy to use,much quicker than typing. and instant response.",
626629,Google,Durand Victor,"February 19, 2019",5,wow beautiful work impeccable integration transition user interface access to information customization and much more keep up the good work,"wow beautiful work , impeccable integration / transition , user interface , access to information , customization , and much more . keep up the good work !",
626630,Google,Lolit Regota,"February 28, 2019",5,please keep all my privacy or important matter specially picture my account identification etcthank you and god blessed u all always,please keep all my privacy or important matter specially pictures my accounts identification etc.thank you and god blessed us all always.,
626633,Google,DJ Starkey,"February 19, 2019",5,this u a great tool for many thing try this and i am sure you will like this,this us a great tool for many things. try this and i am sure you will like this.,
626634,Google,Christina J Martinez-Lopez,"February 23, 2019",5,i like having a go to application that you ask it for thing and you shall receive it,"i like having a go to application that you ask it for things, and you shall receive it!",
626635,Google,Travis Marsh,"February 21, 2019",5,would be nice to have a shortcut on the lock screen to swipe to bring up the camera compared to the double tap power button,would be nice to have a shortcut on the lock screen to swipe to bring up the camera compared to the double tap power button.,
626636,Google,Matt Carlson,"February 19, 2019",1,application has been freezing up and shutting down since update,application has been freezing up and shutting down since update,
626641,Google,ROBERT BATES,"February 19, 2019",5,its the best hand free n security protection by farm have to appreciate thanks goole your the best,its the best hands free n security protection by far.must have to appreciate! thanks google  your the best!,
626639,Google,,"February 28, 2019",5,you why i do not to update because you do not know my phone clogedwhen this phone lack of spacey so often wanted to update this goole,you why i do not to update because you do not know my phone clogged.when this phone lack of space.why so often wanted to update. this google,
626644,Google,,"February 25, 2019",1,why is it on my phone i have no update pressed on yet goole still update i allowing into this matter futher,why is it on my phone i have no updates pressed on. yet google still updates i amlooking into this matter futher,
626643,Google,quantum the hedgehog,"February 19, 2019",1,stop with the ad on my phone it is getting on my nerve,stop with the ads on my phone it is getting on my nerves ,
626645,Google,Jessica Stig,"February 25, 2019",2,what the deuce has happened to the image tab the deuce just freeze and then lock up the entire application,"what the deuce has happened to the ""images"" tab?! the deuce just freezes and then locks up the entire application!",
626646,Google,,"February 24, 2019",1,keep crashing after last update unusable on my phone i want to go bac to previous version,"keeps crashing after last update, unuseable on my phone . i want to go bac to previous version .",
626647,Google,suzwlht356,"February 18, 2019",3,too much confusion on where to access just normally to many add,too much confusion on where to access just normal.way to many adds,
626648,Google,,"February 25, 2019",2,i am not happy with your company i do not want to continue changing my password for you every day,"i am not happy with your company, i do not want to continue changing my password for you every day.",
626649,Google,Anuraag Banala,"February 25, 2019",1,image not opening waste application by goole worst change made by goole i stopped using goole i deleted such a waste application it is hard to go and copy the image goole is waste,images not opening waste application by google worst changes made by google i stopped using google i deleted such a waste application it is hard to go and copy the images google is waste,
626651,Google,Renee Smith,"February 23, 2019",3,normally i would give it a but every time i try to use goole it freeze on me and i have to close it out it is been happening for about week now but the application say i am up to date,normally i would give it a  but every time i try to use google it freezes on me and i have to close it out it is been happening for about  weeks now but the application says i am up to date,
626653,Google,Matthew Sullivan,"February 21, 2019",1,star until they fix hiding story in language kiss was working fine until a few update ago now no matter how many time i tell discover to ignore the other language it keep showing it extremely annoying," star until they fix hiding stories in language kiss. was working fine until a few updates ago, now no matter how many times i tell discover to ignore the other language it keeps showing it, extremely annoying.",
626654,Google,Johan Pretorius,"February 22, 2019",1,latest update extremely glitch freeze when viewing image on galaxy s,latest update extremely glitchy. freezes when viewing images on galaxy s,
626657,Google,Алевтина,"February 22, 2019",4,after last update i lost my gogleweather application icon and when try to search in goole and tap on weather goole stop responding,"after last update i lost my googleweather application icon, and when try to search in google and tap on weather, google stop responding",
626659,Google,Vatsal Desai,"February 19, 2019",2,application not optimised for novo tab plus,application not optimised for lenovo tab  plus.,
626658,Google,morgan santerre,"February 21, 2019",2,every time i try to search on image it crash but on goole chrome it doe not please fix this,"every time i try to search on images it crashes, but on google chrome it does not. please fix this",
626660,Google,Libby Clark,"February 18, 2019",1,i like goole search only you have had hack and gather too much info,i like google search only. you have had hacks and gather too much info.,
626661,Google,benjīe solmīa,"February 21, 2019",2,one of worst surfing site ever it hang up regularly that is why i am now using bing bye goole you can not download foot using goole i prefer interest face-on twitter over goole when downloading foot for research purpose,one of worst surfing sites ever! it hangs up regularly. that is why i am now using bing. bye google! you cannot download fotos using google. i prefer pinterest / facebook / twitter over google when downloading fotos for research purpose,
626663,Google,,"February 25, 2019",5,baht aha he goole,bahut acha he google,
626664,Google,Mohit Patiyal,"February 25, 2019",4,feed is not working anymore,feed is not working anymore,
626665,Google,Aashish Chandravanshi,"February 24, 2019",5,hashish ring,aashhish rlrg                       ,
626666,Google,Sherri Lance,"February 27, 2019",4,i have a galaxy s and my android user interface quit when i updated this a vpl day ago this is a real pain in the as please help,i have a galaxy s and my android user interface quit when i updated this a vpl days ago. this is a real pain in the ass. please help,
626667,Google,J A,"February 23, 2019",1,download out permission doe errant thing to piss me off,downloads w\out permission. does errant things to piss me off,
626668,Google,,"February 19, 2019",5,i am finally goglefied i love goglefied i am feeling more hip already thanks gogletarians it is gogleicious i better patent that new word goole please patent goglefied for me on february right on,"i am finally google-fied. i love google-fied, i am feeling more hip already. thanks googletarians. it is google-icious! i better patent that new word, google, please patent google-fied for me on february , . right on",
626669,Google,Aramoana Sinaumea,"February 20, 2019",4,only this aps i watch my news but my news is lost i do not know whoever the weather please can you help methane you,only this apps i watch my news but my news is lost i do not know why?even the weather please can you help me?thank you,
626670,Google,Dinesh kumar,"February 27, 2019",4,not able to update on my onerous error checked everything is good please help,not able to update on my oneplus  error . checked evrything is good please help,
626672,Google,Saurav Banerjee,"February 24, 2019",4,my goole application was not opening with my lock screen when i was open my with my voice command the goole was saying the voice command is not match at rai is lot of time any match my voice with them also but is not,my google application was not opening with my lock screen when i was open my with my voice command the google was saying the voice command is not match at rai is lots of time any match my voice with them also but is not,
626673,Google,swarup.k. dasgupta,"February 21, 2019",5,this is the most important and essential application for everybody even if you do not know the use of this application still this application bear a great role in your device this application is my most faithful and honest friend play a good role in my dealing with social medium thank you goole with my cordial blessing for your healthy existence and uniqueness in service,this is the most important and essential application for everybody. even if you do not know the use of this application still this application bears a great role in your device. this application is my most faithful and honest friend plays a good role in my dealings with social media. thank you google with my cordial blessings for your healthy existence and uniqueness in service.,
626674,Google,,"February 19, 2019",1,too much control and update going to get new phone with out goole i think out goole is giving out my info when i did not want out goole to,too much control and update going to get new phone with out google i think out google is giving out my info when i did not want out google to,
626675,Google,,"February 20, 2019",1,please help in my android mobile from day goole is not opening i cant open goole quick search has stopped appear all the time message time to feed back but t open goole quick search are not helping me please you help meow can i use goole again,"please help =in my android mobile from  days google is not opening. i can,t open google .quick search has stoped appear all the time.i message  time to feed back. but t open google .quick search are not helpning me. please you help me.how can i use google again.",
626676,Google,Pancake327,"February 20, 2019",1,i can not search for image when i search once it only load image i know there is more image cause it work on my tablet and when i search for something else it doe not even load anything at all,i cannot search for images when i search once it only loads  images i know there is more images cause it works on my tablet and when i search for something else it does not even load anything at all,
626677,Google,,"February 20, 2019",1,too bad after last updated version is good than new this new update is too lagging to load,toooo bad after last update.old version is good than new. this new update is too lagging to load,
626678,Google,Aaron Brown,"February 19, 2019",4,why doe the goole logo take up so much room the goole logo take up half my screen and i can only see one card make the goole logo smaller and you get star,why does the google logo take up so much room? the google logo takes up half my screen and i can only see one card. make the google logo smaller and you get  stars,
626679,Google,Who Knows,"February 21, 2019",1,just hate goole all together the fact that you have to hand over so much of your personal data make me sick,just hate google all together. the fact that you have to hand over so much of your personal data makes me sick.,
626680,Google,Kris VN,"February 20, 2019",4,since last update when i search for an image it doe not load all the way and freeze quite a bit only on image search it was fine before update,"since last update, when i search for an image, it does not load all the way, and freezes quite a bit. (only on image searches) it was fine before update",
626681,Google,J Reinhardt,"February 21, 2019",1,so annoying every time i play music on my phone the poxy assistant pop up and keep lowering the sound or withering the sound,"so annoying. every time i play music on my phone, the poxy assistant pops up and keeps lowering the sound or highering the sound.",
626682,Google,,"February 22, 2019",1,i l give star because recently i updated star and star keep on crashing after browsing for to min please fix star soon,i ll give  star because recently i updated star and star keeps on crashing after browsing for  to  mins. please fix star soon,
626683,Google,CharlieCastle,"February 18, 2019",2,very invasive no privacy even after i block wheal from every platform i still get ad for your service i do not want your ad stop spacing me,"very invasive , no privacy, even after i block why'all from every playform, i still get ads for your service, i do not want your ads, stop spamming me",
626684,Google,,"February 19, 2019",2,after last update my goole search freeze when i try to look at image please fix,"after last update my google search freezes when i try to look at images, please fix.",
626685,Google,,"February 23, 2019",2,why doe the application freeze when i search for image it did not happen before the newest update,why does the application freeze when i search for images? it did not happen before the newest update.,
626686,Google,Jasmine Baker,"February 20, 2019",2,after the update a few day ago the search page freeze all the time and take forever to load page if they even load,"after the update a few days ago the search page freezes all the time and takes forever to load pages, if they even load.",
626690,Google,Jason Shemonia,"February 20, 2019",1,when i go to goole search and click on image fee up and i have to restart my phone any and every time i click on a photo i want to see it completely freeze so yep you suck,when i go to google search and click on images.it feeezes up. and i have to restart my phone! any and every time i click on a photo i want to see it completely freezes so yep you suck,
626691,Google,Jiujitsusilencer Lee,"February 19, 2019",1,used to be great ran fast and smooth not anymore tho and whats with the constant update that seem to be completely and utterly useless,"used to be great, ran fast and smooth, not anymore tho. and whats with the constant updates that seem to be completely and utterly useless.",
626693,Google,Ephraim Fernandez,"February 21, 2019",1,please help me to play straight in endgame m silver hunter i have been experiencing game crash and layout in enchanted lairancient lair abusive and pop and etcthank you,"please help me to play straight in dnmgames m silver hunter, i have been experiencing game crash and log-out in enchanted lair,ancient lair, abysspve and pvp and etc.thank you,",
626694,Google,Steiny Gomez,"February 21, 2019",1,update is terrible pop ups at the bottom of the screen get in the way doe not allow me to scroll in page previously opened or open a new tab,"update is terrible. pop ups at the bottom of the screen get in the way. does not allow me to scroll in pages previously opened, or open a new tab.",
626695,Google,Dans S,"February 19, 2019",5,goole voice stopped working not working anymore after last updated on samsung galaxy note based lollipop,google voice stopped working not working anymore after last updated on samsung galaxy note  based lollipop .. .,
626696,Google,Subham Newar,"February 28, 2019",1,stop annoying add it pop up over every application even on the home screen even after i turn the home screen off this is very shameful act i can not even play game always annoying add pop up please fix it,stop annoying adds. it pops up over every application even on the home screen even after i turn the home screen off. this is very shameful act. i cannot even play games always annoying adds pops up. please fix it.,
626697,Google,DeRosset Myers,"February 24, 2019",2,the damn thing keep stalling especially when i try to do an image search i guess goole doe not give a damn about people whose phone can not go past marshmallow and do not want to buy new phone all the time i do not know who to be madder at goole or lg the maker of my phone so i will just say screw both of you,"the damn thing keeps stalling, especially when i try to do an image search! i guess google does not give a damn about people whose phones cannot go past marshmallow and do not want to buy new phones all the time! i do not know who to be madder at! google or lg (the maker of my phone), so i will just say ""screw both of you!""",
626698,Google,Nick Evans,"February 23, 2019",1,i can not open i since the recent update i can still use chrome but the goole application will not work the goole application just keep crashing,"i cannot open i since the recent update, i can still use chrome but the google application will not work. the google application just keeps crashing.",
626699,Google,,"February 26, 2019",1,far too many permission goole assistant will not work constant upgrade that do nothing but increase the size ot the application totally useless but can not be uninstaled really considering apple for my next device,"far too many permissions, google assistant will not work, constant upgrades that do nothing but increase the size ot the application. totally useless, but cannot be uninstalled. really considering apple for my next device.",
626700,Google,Betty Harty,"February 20, 2019",3,slippery slope on the voice recognition last few month have been not so good freezing up and closing down way too frequently used to be a lot better,slippery slope on the voice recognition . last few months have been not so good freezing up and closing down way too frequently. used to be a lot better.,
626701,Google,Mike Dyer,"February 26, 2019",2,slow application is slow application faster to do a goole search from a browser application and why doe this still hijack the home button long press to remind me that i choose to not activate assistant or the stupid search page content i choose to not activate those do not trigger any action on home button long press,"slow. application is slow. application faster to do a google search from a browser application. and why does this still hijack the home button long press to remind me that i choose to not activate assistant or the stupid search page content. i choose to not activate those, do not trigger any action on home button long press.",
626702,Google,Tom Monsanto,"February 20, 2019",2,disabled and aware stopped to pop-up enabling again bec i like to have bec on my home screen but will disable again when a garage of intrusive goole ad flood my home screen again,disabled and adware stopped to pop-up. enabling again bec i like to have bec on my home screen but will disable again when a barage of intrusive google ads flood my home screen again.,
626703,Google,Rohan Chauhan,"February 24, 2019",3,the application has been hanging up a lot lately i have had to force stop the application in order to make the application start working again,the application has been hanging up a lot lately. i have had to force stop the application in order to make the application start working again.,
626704,Google,Matthijs Hakfoort,"February 18, 2019",4,the new update dispenses with being able to swipe away story from the feed that i have read or am uninterested in this mean the feed now consists of a mix of read new and uninteresting story very bad ux if you ask me i am off looking for an alternative,"the new update dispenses with being able to swipe away stories from the feed that i have read or am uninterested in. this means the feed now consists of a mix of read, new and uninteresting stories. very bad ux, if you ask me. i am off looking for an alternative.",
626705,Google,I LOVE U WESLEY,"February 20, 2019",4,why all goole aps need a lot of phone memory space to install all goole aps why not goole developer make not goole developer le mamore useful and helpful to user i think not just the star aps useful and helpful for all user but it will be more user happy want to using only goole aps,"why all google apps need a lots of phone memory space to install all google apps.? why not google developers make not google developers less mb,more useful and helpful to users.? i think not just the  stars apps useful and helpful for all users but it will be more users happy want to using only google apps.",
626706,Google,Danno Nelson,"February 24, 2019",4,best search tool for anything needing answered le controversial or possibly in different web standard best result on modern information star for no full screen and force zoom like firebox and brave browser,best search tool for anything needing answered. less controversial or possibly in different web standards. best results on modern information.- star for no full screen and force zoom like firefox and brave browser.,
626708,Google,A Google User,"February 24, 2019",1,frustratingly buggy cause play store aps to be stuck at downloaded without installing cause notification to appear hour delayed widget not disappearing issue go away after removing all update clearing cache and restarting phone good news the goole application is poor coding is representative of the current state of goole so it may be on purpose,"frustratingly buggy. causes play store apps to be stuck at % downloaded without installing, causes notifications to appear + hours delayed, widgets not disappearing. issues go away after removing all updates, clearing cache and restarting phone. good news the google application is poor coding is representative of the current state of google, so it may be on purpose",
626709,Google,Mousumi Tripathy,"February 22, 2019",2,dear goole i am facing a problem right now i am trying to delete a link from my saving folder mousumi but a link is not deleting a link appear further and further after i press delete would you please pay attention to a link i am already irritated about a link help me deleting that one link from my saving folder,"dear google i am facing a problem right now. i am trying to delete a link from my saving folder ""mousumi"" but a link is not deleting a link appear further and further after i press delete. would you please pay attention to a link. i am already irritated about a link .help me deleting that one link from my saving folder",
626710,Google,Foxease,"February 23, 2019",1,for a while now search take forever and only the first few pic show up on image search and you can not click on the image so it make the application pretty useless,"for a while now, searches take forever and only the first few pics show up on image search and you cannot click on the images. so it makes the application pretty useless",
626712,Google,Kari Hart,"February 20, 2019",2,i am really sick of my goole image search freezing once i try to scroll down goole please fix this i teach english online and goole interferes when i can not show student a quick image to teach a concept,"i am really sick of my google image searches freezing once i try to scroll down. google, please fix this. i teach english online and google interferes when i cannot show students a quick image to teach a concept.",
626714,Google,Ani Mazema,"February 21, 2019",1,this application is bi gusting i adam only a kid and when i try to goole something inappropriate stuff come up and there are to many inappropriate add its like a dating webster all in one i hate goole,this application is bis gusting i amam only a kid and when i try to google something inappropriate stuff comes up and there are to many inappropriate adds its like a dating websites all in one i hate google,
