id,appTitle,userName,date,score,text,original_text,bug_report
566067,WeChat,Adam Petit,"April 5, 2019",1.0,application security need revision account was randomly restricted and the recovery process is trash,App security needs revision. Account was randomly restricted and the recovery process is trash.,
566069,WeChat,Hamdan Eka Marta,"April 5, 2019",1.0,stupid application,"stupid app,,",
566070,WeChat,vic nesh,"April 5, 2019",1.0,user can not control user application because this application have no privacy at all,"User can't control their app, because this app have No privacy at all",
566073,WeChat,Muhammad Irfan Anwar Khan,"April 5, 2019",3.0,my account was repeatedly blocked after some day and facing problem due to this repeatedly blocking of my account i have lost my many assignment,My account was rapeatedly blocked after some days and facing problem. Due to this repeatedly blocking of my account I have lost my many assignments.,
566074,WeChat,Liang fei Guo,"April 5, 2019",5.0,i will like this because my dad is in africa and i can chat my daddy now thanks what,I'll like this because my dad is in africa and i can chat my daddy now thanks wechat,
566075,WeChat,Desmond Jacobs,"April 5, 2019",1.0,i have not been able to get back into my account since my phone upgrade,I have not been able to get back into my account. Since my phone upgrade,
566077,WeChat,Megan Lata,"April 5, 2019",5.0,i live in india but my father go to china and this application help me to communicate my father,i live in india but my father goes to china and this app help me to communicate him,
566078,WeChat,blac. kush,"April 7, 2019",1.0,my what people nearby is not working even tho j have installed j again and set my location please help to fix this,my wechat people nearby is not working even tho j have installed it again and set my location. pls help to fix this,
566084,WeChat,sonam Lhamo,"April 7, 2019",5.0,i love to use this application,I love to use this app,
566085,WeChat,Liew Soon,"April 7, 2019",1.0,slow and delay notification after updateplease fix,slow and delay notification after update...pls fix,
566086,WeChat,mohammed suleman ali,"April 7, 2019",1.0,very bad performance now a day i am unable to use hotel and shake option i can not get my nation fund on shake option and hotel are not working a it was before i request you to solve my problem which am facing,"very bad performance now a days , i am unable to use bottels and shake option ,i cant get my nations frnds on shake option and bottels are not working as it was befor .. i request you to solve my problem which iam facing ..",
566088,WeChat,Jason Z,"April 7, 2019",4.0,please add option allowing led blinking notification when both what and system in do not disturb mode it use to work on the older version for android thank you,Please add options allowing LED Blinking Notifications when both WeChat and System in Do not Disturb mode. It use to work on the older version for Android 7. Thank you!,
566089,WeChat,Donny Jordan,"April 7, 2019",1.0,very difficult to register why must be have friend that already use what for six month,"very difficult to register, why must be have friend that already use wechat for six month",
566091,WeChat,Nikolay Bronskiy,"April 7, 2019",1.0,impossible to login or register useless support,impossible to login or register. useless support.,
566096,WeChat,Muhammad usman,"April 7, 2019",2.0,canon register on the application please help,icant register on the app plz help,
566101,WeChat,anaudy _112,"April 7, 2019",1.0,this application is the worst how are you supposed to log in this application impossible they just block you off the start i hate this application so much unable k my account and i will give star you have day or i will leave this like this and i will delete this application and not tell my friend about this application,THIS APP IS THE WORST HOW ARE YOU SUPPOSED TO LOG IN ITS IMPOSSIBLE 💔 THEY JUST BLOCK YOU OFF THE START I HATE THIS APP SO MUCH UNBLO K MY ACCOUNT AND I WILL GIVE 5 STARS YOU HAVE 3 DAYS OR I WILL LEAVE THIS LIKE THIS AND I WILL DELETE THE APP AND NOT TELL MY FRIENDS ABOUT THIS BAD APP!,
566103,WeChat,Chà Forrest,"April 7, 2019",1.0,my friend was blocked when my friend created my friend account and i can not help my friend her account was day old too,My friend was blocked when she created her account and I can't help her. (My account was 1 day old too),
566104,WeChat,Manaf psa,"April 7, 2019",4.0,dear team i can not able to login from my computer we chat,"Dear Team,  i cannot able to  login from my computer We chat",
566105,WeChat,shaheer ali,"April 7, 2019",5.0,is this good for any game,is this good for any game,
566108,WeChat,Geeta Chaurasiya,"April 7, 2019",5.0,i like that application,I like that app,
566115,WeChat,Ye Thwe,"April 7, 2019",5.0,ask i am very like this ask,က် ေနာ္ ့တကယ္ ႀကိဳက္ တဲ့ apk ပါ I'm very like this apk.,
566117,WeChat,Kaijian Law,"April 7, 2019",5.0,tremendous calling quality among duo skye and messenger its really a thanksgiving gift from china in order to tie people among several country up,"Tremendous callings quality among DUO, SKYPE and MESSENGER, its really a thanksgiving gift from CHINA in order to tie people among several countries up. 在一众软件中通话质量跟表现最均衡的, 对于分散在数个国家的家庭来说, 感谢微信让我们彼此相互连接.",
566125,WeChat,Muazam Shah Azan Khan,"April 6, 2019",3.0,tak raman awe main dah abu big grin bontang je,tak ramai awek main dah... aku bg 3 bintang je,
566126,WeChat,Amber Daniels,"April 6, 2019",1.0,do not bother needed this application to tutor foreign language student however i installed this application only for the account to be deemed suspicious so i uninstaled this application i hope i was not hacked and my identity stolen,"Don't bother!!! needed this app to tutor foreign language students.. however, I installed it, only for the account to be deemed ""suspicious"" so I uninstalled it. I hope I wasn't hacked and my identity stolen....",
566127,WeChat,Roger mejorado,"April 6, 2019",4.0,so col easy to use,so coll easy to use,
566131,WeChat,Ansar Ali,"April 6, 2019",5.0,its fine but in malaysia too much playboy bothered oh my god,its fine but in malaysia too much ladyboy bothered oh my god,
566133,WeChat,Janella Prudencio,"April 6, 2019",3.0,i update my application but all my message and sticker deleted now i try to download my previous sticker it can not already,I update my app but all my message and stickers deleted. Now i try to download my previous sticker it cant already!!,
566134,WeChat,tsering tashi,"April 6, 2019",1.0,how can i get rerun,how can I get werun ?,
566135,WeChat,Najibah Diani,"April 6, 2019",4.0,friendliest that had delete their account can not track easily please make some button can track who delete their acc this make my friendliest full and can not accept new friend,friendlist that had delete their account cant track easily.. please make some button can track who delete their acc. this make my friendlist full and cant accept new friend.,
566136,WeChat,yash ghag,"April 6, 2019",5.0,nice application i got ma love on dis application,Nice app I got ma luv on dis app♥♥,
566138,WeChat,Andrew Pang,"April 6, 2019",5.0,very useful better than messenger,Very useful better than messanger,
566139,WeChat,Devil's gang,"April 6, 2019",5.0,superb application but some bug are there please fix it by the way it is a good application it help me so much yo login in pub,superb app but some bugs are there pls fix it by the way it is a good app it help me so much yo login in pubg,
566143,WeChat,Maurice Traveler,"April 6, 2019",1.0,the application keep closing after the new update please fix the application,the App keep closing after the new update please fix it,
566144,WeChat,A Google User,"April 6, 2019",5.0,i do not think so,I dont think so,
566145,WeChat,Tor Faeren,"April 6, 2019",5.0,good application for chat with friend,Good app for chat with friends.,
566146,WeChat,DINESH KUMAR,"April 6, 2019",1.0,an application which has more fake account than original account worst application ever please take my advice and never download an application which has more fake account than,An app which has more fake accounts than  original account worst app ever please take my advice and never download it,
566150,WeChat,Jan Ahmed,"April 6, 2019",5.0,nice application for everyone i just love it,nice app for evryone i just lolve it,
566149,WeChat,Hafiz Said,"April 6, 2019",1.0,for some reason i can not you bottle any longer,for some. reason I can't you bottle any longer,
566153,WeChat,A Google User,"April 6, 2019",1.0,can not receive any notification can not sent message,cant receive any notification. cant sent message,
566157,WeChat,Mohammad Bernak,"April 6, 2019",1.0,i can not sing in,i cant sing in,
566158,WeChat,ali raza,"April 8, 2019",5.0,very satisfying aps the best aps,Very satisfying apps The best apps,
566160,WeChat,MAHMAD ELBABARY,"April 8, 2019",5.0,i just download it to pub mobile chinese,i just dawnload it to pubg mobile chines😊,
566163,WeChat,Kiran Pote,"April 8, 2019",1.0,the worst security thing i have ever seen the sign up to create an account is the worst,the worst security thing I've ever seen the sign up to create an account is the worst,
566166,WeChat,Mary Montaos,"April 8, 2019",5.0,not find my location,Not find my location,
566167,WeChat,Sophea Chin,"April 8, 2019",5.0,important for me,important for me.,
566169,WeChat,Roger Choi,"April 8, 2019",4.0,more function than others,More function than others.,
566170,WeChat,mahendra varman,"April 8, 2019",1.0,i am from india i can not even register waste of time to try who are not in chain,"I am from india..... I cannot even register. waste of time to try, who are not in chain...",
566171,WeChat,Walid Rabie,"April 8, 2019",1.0,to much required for password and verification code and doe not work,to much required for passwords and verification code and doesn't work,
566172,WeChat,Alma Tadiarca,"April 8, 2019",1.0,we chat do not no why too much slow to my phone,we chat don't no why too much slow to my phone,
566173,WeChat,b gibson,"April 8, 2019",2.0,the application itself int too bad but my issue is that my account has been blocked for suspicious activity suspected when all i have done is register registration was an overly complicated system too having to input your detail multiple time i can not get a friend who has had the application for month previous to confirm an help get my account unblocked a i have only gotten the application to contact family who have gone travelling in china and therefore all my friend are new unblock my account,"The app itself isnt too bad, but my issue is that my account has been blocked for ""suspicious activity suspected"" when all i have done is register. Registration was an overly complicated system too, having to input your details multiple times. I cant get a friend who has had the app for 6 months previous to confirm ans help get my acxount un-blocked as i have only gotten the app to contact family who have gone travelling in China and therefore all my friends are new. Unblock my account",
566175,WeChat,Gloria Mary,"April 8, 2019",1.0,totally rubbish can not work and keep banning people this application is total rubbish,totally rubbish can't work and keep banning people this app is total rubbish,
566177,WeChat,Suhail Fairooz,"April 8, 2019",1.0,its not working properly am not able to send message voice clipped even make a cauthen i send message an exclamation sign appears in red bagroundwhy doe this happens to mei tried after changing my handset tono progreshelp me what service for a better experience,its not working properly. ....am not able to send messages ...voice clip..and even make a call........when i send messages an exclamation sign appears in red baground.....why does this happens to me......i tried after changing my handset too...no progress....help me wechat service for a better experience,
566181,WeChat,Jelena B,"April 8, 2019",1.0,i have been trying to sign up for three day now it will not let me it is asking for me to type in the number of any other user how can i know this if i am creating the profile just now and when i did find the user to verify my profile the user will not let the user so there is no way to get in the application awful and unnecessary process i tried with another number and another number still will not let me get in,"I have been trying to sign up for three days now, it won't let me. It is asking for me to type in the number of any other user (how can I know this if I am creating the profile just now????) and when I did find the user to verify my profile it won't let them. So there is no way to get in the app. Awful and unnecessary process. I tried with another number and it still won't let me get in...",
566182,WeChat,Areqhan Omuyi,"April 8, 2019",1.0,stupid aplicationmy account get banned a soon a i sign upi would have rated the application star if i could,"stupid app,my acount gets banned as soon as i sign up,i would have rated the app 0star if i could",
566185,WeChat,surya pratap,"April 8, 2019",3.0,when send any picture to someone in chat the what will automatically restart,when send any picture to someone in chat the wechat will automatically restart.,
566186,WeChat,viesse italia,"April 8, 2019",5.0,easy and fast communication,easy and fast communication,
566189,WeChat,Jan Dufek,"April 8, 2019",1.0,tennent company led by idiot company led by incompetent customer care service useless people work at tennent just block what pay without notice so a said who work at tennent must be very low intelligence people no surprise,"Tencent, company led by idiots, company led by incompetent customer care service. Useless people work at Tencent, just block WeChat Pay without notice, so as said, who works at Tencent, must be very low intelligence people. No surprise.",
566193,WeChat,Minh Nguyen,"April 8, 2019",3.0,this is great but i have found a really huge problem this keep signing me out on the account of my account is suspicious please help me what,"This is great, but i have found a really huge problem. it keeps signing me out on the account of my account is ""suspicious"". PLease help me WeChat.",
566194,WeChat,Xiao Zhen Ong,"April 8, 2019",2.0,it will more better if add an search button at my moment it is very difficult and waste time to research something that i posted long time ago,It will more better if add an SEARCH button at MY MOMENT it's very difficult and waste time to research something that I posted long time ago,
566199,WeChat,Marianne Pua,"April 3, 2019",1.0,after recent update when trying to select photo to unload the photo in the album are not in order which make user difficult to find the photo they need,"After recent update, when trying to select photos to upload, the photos in the album are not in order, which makes users difficult to find the photo they need.",
566201,WeChat,G Senpai,"April 3, 2019",1.0,can not log in after i flashed a custom rom,Cant log in after I flashed a custom rom.,
566203,WeChat,xX JUGGERNAUT GAMING,"April 3, 2019",1.0,how do i have to complete friend verification if there is no friend on we chat,how do i have to complete friend verification if there is no friend on we chat,
566204,WeChat,Ani Chen,"April 3, 2019",3.0,infuriating that i can not use what pay unless i have chinese bank card,Infuriating that I can't use wechat pay unless I have chinese bank card.,
566206,WeChat,Mohamed Salih,"April 3, 2019",1.0,blocked for no reason at all what an awful application,Blocked for no reason at all! What an awful app 🤮,
566209,WeChat,Aidil Saifuddin,"April 3, 2019",1.0,why i can not to sign,why i cannot to signup,
566210,WeChat,fhrinczes erza,"April 3, 2019",3.0,the aps is okaybut i do not like when i started to open tit too long to download the contact took a minute,the apps is okay..but i don't like when i started to open it..its too long to download the contacts..it took a minutes..,
566211,WeChat,Dea,"April 3, 2019",1.0,can not even sign up,can't even sign up,
566212,WeChat,Behrooz Dante,"April 3, 2019",2.0,some time it do not send video and img so i should open vpn,"some time, it dont send videos and img, so i should open VPN.",
566213,WeChat,Thevesh Theva,"April 3, 2019",1.0,worst messenger application in the world i can see why china need to block other aps no one would use this trash otherwise difficult to makeverify an account you get signed unblocked for no reason and the interface look like the interface was made by a child,"Worst messenger app in the world. I can see why China needs to block other apps - no one would use this trash otherwise. Difficult to make/verify an account; you get signed out/blocked for no reason, and the interface looks like it was made by a child.",
566215,WeChat,Zik er,"April 3, 2019",1.0,hate the security system lose my account because need to unblock,hate the security system... lose my account because need to unblock,
566219,WeChat,Tri Fajar Maulana,"April 3, 2019",1.0,why i can not sign up whats happen,why i can't sign up..? whats happen?!,
566221,WeChat,Tensley Nesbitt,"April 3, 2019",5.0,work great just wish goole translate application connected to it,works great just wish Google Translate app connected to it,
566222,WeChat,Tarun Manchanda,"April 3, 2019",1.0,doe not work can not sign up in canada,"does not work, cannot aign up in canada",
566225,WeChat,Noman Ali Khan,"April 3, 2019",1.0,not open jpeg file,not open jpeg files,
566227,WeChat,Felipe Hiroshi,"April 3, 2019",5.0,the best application for chatting,the best app for chatting,
566229,WeChat,Pata Riszuan,"April 3, 2019",1.0,message in bottle can not use please fix message in bottle,Message in bottle cannot use. Please fix it,
566230,WeChat,Justin Grant,"April 3, 2019",1.0,locked me out paranoid chinese government i guess just trying to chat with a chinese friend,Locked me out. Paranoid Chinese government I guess. Just trying to chat with a Chinese friend!,
566232,WeChat,Ad Ziq,"April 3, 2019",2.0,the shake had way to many chinese people,The SHAKE had way to many Chinese people.,
566235,WeChat,Mei Bing Loo,"April 3, 2019",1.0,why now we must update the china bank card only can receive the money transfer by wechatpay from china a malaysian how to get the china bank card,Why now we must undate the China bank card only can receive the money transfer by WeChatPay from China? A Malaysian how to get the China bank card!?,
566236,WeChat,John Schmitz,"April 3, 2019",1.0,logging in is a huge pain and impossible i highly recommend any other application wish there was a no star option,Logging in is a huge pain and impossible I highly recommend any other app wish there was a no star option,
566237,WeChat,Inoxent Fawad khan,"April 3, 2019",5.0,its good application gor video chat and vice call i really appreciate this application,its good app gor vidio chat and viice call I really appreciate this app,
566238,WeChat,Reincarnated Sin,"April 4, 2019",1.0,a soon a i made my account my account was blocked asked for verification code but got nothingterible experience,as soon as I made my account it was blocked...I asked for verification code but got nothing....terrible experience,
566239,WeChat,Akmar Kassim,"April 4, 2019",4.0,whatever will happen please do not shutdown this aplicationserver coz i have some special memory store in here believe same go to anybody else let u still can connect to u acc till the end,"Whatever will happen plz dont shutdown this app/server, coz i have some special memories store in here,i believe same goes to anybody else... Let us still can connect to our acc till the end",
566240,WeChat,Scott Miles,"April 4, 2019",1.0,installed in an attempt to stop the daily barrage of unsolicited what sm code to my number i prefer not to give this application complete access to all file on my device a requested so i can not even get past the splash screen garbage,"installed in an attempt to stop the daily barrage of unsolicited wechat sms codes to my number. I prefer not to give this app complete access to all files on my device as requested, so i can't even get past the splash screen. Garbage.",
566243,WeChat,nurul ann93,"April 4, 2019",1.0,i can not log in why use friend verification and send code my id and password is correct how to send the verified my previous hanson can not use,"I can't log in.. Why use friend verification and send code. My id and password is correct.. How to send the verified, my previous hanfon can't use...",
566244,WeChat,Dragos Dontu,"April 4, 2019",1.0,your application suck how can you ask a new join to get a referral from somebody that you do not know and give a referral from somebody that you do not know your info right when you set up acc for first time also temp disabled acc right in the midle of initial set up,your app sucks ..how can u ask a new join to get a referral from somebody that u dont know .and give him your info right when u set up acc for first time .also temp disabled acc right in the midle of initial set up ....,
566247,WeChat,Kiara Patrice Oxley,"April 4, 2019",1.0,can not log in,can't log in,
566250,WeChat,Youtube Channel,"April 4, 2019",5.0,its future is well i love,its future is well . I love 😙😙😙😙😙😙😙😙,
566251,WeChat,Gaming Cookie Factory,"April 4, 2019",1.0,when i have the storage is running out thing the storage kepanyoing me by putting a what is not working due to low space and a what keep hoping up even if i press exit,"When i have the storage is running out thing it keep,anyoing me by putting a wechat is not working due to low space and it keep poping up even if i press exit",
566252,WeChat,HYDRA GAMING,"April 4, 2019",1.0,just the sign up process make me vomitdisgusting,just the sign up process makes me vomit...disgusting,
566255,WeChat,Zhirui Li,"April 4, 2019",1.0,after updating my phone to android q what go unavailable it just quit every time,"After updating my phone to Android Q, WeChat goes unavailable. It just quit every time...",
566258,WeChat,Anna Bhate,"April 4, 2019",2.0,log in expired what do you mean i have tried many time but still can not log in why you guy make this so complicated i am disappointed with what all inside is okay though,"log in expired what do you mean, i've tried many times but still can't log in. why you guys make this so complicated? i'm dissapointed with wechat, all inside is okay though.",
566259,WeChat,m s,"April 4, 2019",1.0,failed time and again to log back onto site waste of time if i can not access,Failed time and again to log back onto site.... Waste of time if I can't access.,
566260,WeChat,Muhd Zakwan,"April 4, 2019",1.0,can not receive message from people,Cannot receive messages from people,
566262,WeChat,Mshesh Soni,"April 4, 2019",3.0,good but i am never able to backup any message history,"Good, but, I am never able to backup any message history",
566264,WeChat,Andy Tan,"April 4, 2019",2.0,opo f can not set personal message tone,Oppo F9 cannot set personel message tone,
566266,WeChat,Felix Dissie,"April 4, 2019",4.0,is a good application and you can chat on a good application sand searching message,is a good app and you can chat on it sand searching messages,
566269,WeChat,Indunil Girihagama,"April 4, 2019",3.0,please add the message status like sent delivered seen,"Please add the message status, like sent, delivered, seen",
566271,WeChat,Boy Rowland,"April 4, 2019",5.0,i can not open after update,i can't open after update !,
566272,WeChat,J.S. G,"April 3, 2019",5.0,ascom application thank you for we chat,aswoom application Thank you for We Chat,
566274,WeChat,Life of AdayShae,"April 3, 2019",2.0,although anyone is allowed to download this application this is mainly for china based people i am talking from experience because of the problem i have using other aps like whatsit etc and what is basically a chinese application which make it difficult for other people around the world and that suck for foreigner who come to china to study like me who has to give the family issue to try downloading the application just to talk to the family issue or keep buying vpn shaking my head the struggle is real,Although anyone is allowed to download This app.... This is mainly for china based people. I'm talking from experience because of the problems i have using other apps like whatsapp etc and wechat is basically a chinese app which makes it difficult for other ppl around the world and thar sucks for foreigners who come to China to study like me who has to give the family issues to try downloading the app just to talk to them or keep buying vpn...... Smh.... The struggle is real!!,
566279,WeChat,Guru Jr,"April 5, 2019",1.0,instal option missing and too much of demand for memory with unknown function working in the background,uninstall options missing and too much of demand for memory with unknown functions working in the background,
566280,WeChat,Elsie Lin,"April 5, 2019",5.0,i love this application this application so great and a good community with this application this application so good,i love this app its so great and a good community with it its so Good,
566282,WeChat,Bibi Candy,"April 5, 2019",5.0,it was do amazing that also most every day i use it i love it,it was do amazing .That also most every day i use it. I love it,
566283,WeChat,Ze Chen,"April 5, 2019",5.0,working with android q beta now quick response,"Working with Android Q beta 2 now, quick response",
566284,WeChat,christy tc,"April 5, 2019",1.0,worst people nearby feature not working i can see everyone but no one can see me,Worst. People nearby features not working. I can see everyone but no one can see me.,
566285,WeChat,Macy Condeza,"April 5, 2019",5.0,very useful but now they do not see me in nearby,very useful but now they don't see me in nearby,
