id,appTitle,userName,date,score,text,original_text,bug_report
564044,WeChat,Nigel Mgodi,"April 30, 2019",1.0,can not sign up,cant sign up,
564045,WeChat,MarcellStar1 Gaming,"April 30, 2019",1.0,aplikasi control hp milk guy sibilant milk orang lain debut gas gun,aplikasi kontol! hp milik gua dibilang milik orang lain! jembut gak guna!,
564047,WeChat,Sanjay Naik,"April 30, 2019",1.0,worst application doe not logged worst application after signing up,worst app doesn't logged it after signing up,
564048,WeChat,Norbu Tseringg,"April 30, 2019",2.0,made in china not reliable at all,made in China.. not reliable at all..,
564050,WeChat,Faz Hafiz,"April 30, 2019",1.0,why my what bottle can not be used i not received any chat and throw any chat,why my wechat bottle cannot be used.. i cnnot received any chat and throw any chat,
564053,WeChat,sudipta mandal,"April 30, 2019",1.0,very very very very bad,very very very very bad,
564055,WeChat,wei anne,"April 30, 2019",1.0,account got banned without a valid reason suspicious activity and i could not urban account although i have like tried asking friend for help please fix,"account got banned without a valid reason ; ""suspicious activity"" . and I couldn't unban my account although I have like tried asking 4 friends for help. pls fix ://",
564056,WeChat,CM Lin,"April 30, 2019",3.0,on one rare occasion what suddenly frezeseven reinstallation can not solve theproblem,"On one rare occasion, wechat suddenly freezes。Even reinstallation cannot solve theproblem",
564059,WeChat,A Google User,"April 30, 2019",3.0,i amusing mi mixafter update to android no alert sound to set my what notification sound,"Im using Mi Mix,after update to android 8.0 no alert sound to set my wechat notification sound",
564060,WeChat,Technology Guru,"April 30, 2019",1.0,i am sending picture but she seeing duel picture how off displease help,I am sending 1 picture. But she seeing duel picture . How off this.plz help.,
564062,WeChat,hafiz akahbk,"April 30, 2019",1.0,you make return user feel horrible to use this aps again after year leave this aps it is a good chance to try this aps again but seem the application really not user friendly to welcome the application return user do research on how other application chat welcome other application return user i lost my interest to use this forever,"you make return user feel horrible to use this apps again. after 5 years leave the apps, it is a good chance to try it again. but seem the app really not user friendly to welcome its return user. do research on how other app chat welcome their return user. i lost my interest to use this FOREVER.",
564063,WeChat,Thần Huy,"April 30, 2019",2.0,sao by gi ko c chc ng churn tin big in tay by ad,sao bây giờ ko có chức năng chuyển tiền bằng vân tay vậy ad,
564068,WeChat,Zahir Hussain,"April 30, 2019",4.0,very good and useful when you chat with chinese people but one thing size of the application is too big,Very good and useful when you chat with Chinese people. But one thing... Size of the app is too big.,
564070,WeChat,"chris .,","April 30, 2019",1.0,unusable registration presumes security breach and lock out account recovery doe not work look like a sham application instal,unusable. Registration presumes 'security breach' and locks out. Account recovery doesn't work. Looks like a sham app. UNINSTALL,
564071,WeChat,Christopher Aziz,"April 30, 2019",1.0,can not set up account no recovery option,cant set up account. no recovery option,
564073,WeChat,usonghuang,"April 30, 2019",5.0,the best application for social and life,the best App for social and life,
564074,WeChat,Jack Uup,"April 30, 2019",1.0,always can not log in,always cant log in,
564077,WeChat,A Google User,"April 30, 2019",1.0,already two month i keep re install this what i still facing same problem i can see people nearby but the people nearby can not see me or greet me please help me to fix people,"Already two mnths i keep re install this wechat. i still facing same problem. i can see peole nearby , but the people nearby cannot see me or greet me. please help me to fix it.",
564078,WeChat,Xiaobao,"April 30, 2019",1.0,i have to give it more access to my phone let alone geographic limitation this version is way too much bigger than previous one,"I have to give it more access to my phone, let alone geographic limitations. this version is way too much bigger than previous ones.",
564079,WeChat,A Google User,"April 30, 2019",1.0,the worst application i would ever haveplease do not download tit is just a waste of your mobile data and time,The worst app I'd ever have.Pls do not download it.It is just a waste of your mobile data and time.,
564080,WeChat,zi yee,"April 30, 2019",1.0,update already lag serious,"Update alrdy, lag serious",
564082,WeChat,Chandan Middya,"April 30, 2019",1.0,world no barest application,world no 1 badest app,
564083,WeChat,Marek Kosmala,"April 30, 2019",1.0,unrealistic security check criterion,Unrealistic security check criteria.,
564089,WeChat,Thobekile Gwala Thobekile,"April 30, 2019",1.0,this application doe not work at all,this app doesn't work at all,
564092,WeChat,Arun Mudhartha,"April 30, 2019",2.0,punished due to frequent relocation and new phone number during period of unstable employment stopped trying since jan otherwise recommended for good value and ease of use,Punished due to frequent relocation and new phone numbers during period of unstable employment .. stopped trying since Jan 2019. Otherwise recommended for good value and ease of use.,
564093,WeChat,Lasitha Prabhash,"April 30, 2019",1.0,can not see notification for call and ims,can't see notifications for calla and IMs,
564098,WeChat,Honeygrace Estrafa,"April 30, 2019",5.0,i want this application,I want this app,
564101,WeChat,Sajju Shaikh. Sajju Shaikh,"April 29, 2019",4.0,good but need some change like opposite person seen our message or no that is our do not know and our should need to see opposite person online or online,Good but need some changes like opposite person seen our msg or no that's we don't know and we should need to see opposite person online or offline,
564102,WeChat,Bobby Cua,"April 29, 2019",1.0,do not make it complicated you fool keep on confirmation like a idiot you thought we remember who we friend daft application,Don't make it complicated u fooollll... Keep on confirmations like a idiot.. U thought we remember who our friend... Dafuq application,
564103,WeChat,Lung Vikernes,"April 29, 2019",1.0,this application suckcanot not sign up,This app suck...can't not sign up...,
564104,WeChat,Narinder Kumar,"April 29, 2019",1.0,it crashed while downloading,"It 'Crashed' while Downloading,.",
564105,WeChat,James Parco,"April 29, 2019",1.0,i just got back from using what but its not the same anymore you can not register without a help of a friend but its will not work so bad,I just got back from using wechat but its not the same anymore u cant register without a help of a friend but it wont work . so bad,
564112,WeChat,Donal Fitzpatrick,"April 29, 2019",1.0,set up account and immediately on first login account suspected of suspicious activity needed to verify using a friend already on what but i do not have anybody who us it useless uninstaled,"Set up account and immediately on first login account suspected of suspicious activity. Needed to verify using a friend already on WeChat but I don't have anybody who uses it. Useless, uninstalled.",
564113,WeChat,Metal100.2 Lee,"April 29, 2019",5.0,good application very good,good app.. very good,
564114,WeChat,Aikaw Rung,"April 29, 2019",5.0,great what is power useful in the world,Great! Wechat is power useful in the World.,
564118,WeChat,Carla Mont'Alvão,"April 29, 2019",5.0,o application quito mellor que o whatsit faz pagamentos transferncias tem gina personal etc,"O app é muito melhor que o WhatsApp. Faz pagamentos, transferências, tem página pessoal, etc.",
564119,WeChat,Rij Standoff2,"April 29, 2019",1.0,this application suck you can not even make a new account once you lost your account you can not make another,this app suck you cant even make a new account once you lost your account you cant make another,
564121,WeChat,Angelica Nacion,"April 29, 2019",1.0,i can not download it,I cant download it,
564125,WeChat,Nahom Geletta,"April 29, 2019",5.0,i love it,I love it!,
564126,WeChat,Joseph Joseph,"April 29, 2019",1.0,this application is a complete mess how can you ask someone else in my location to verify me what if i am new in my location who thought of this difficult to imagine why can not i verify my account through other mean we are used to if not that my client who is in china requested for this would have uninstaled not that my client who is in china requested for this fast,"This App is a Complete Mess. How can you ask someone else in my location to verify me. What if I'm new in my location, who thought of this, difficult to imagine. Why can't I verify my account through other means we're used to... If not that my client who's in china requested for this. Would have Uninstalled it fast..",
564129,WeChat,Bonnie Jones,"April 29, 2019",1.0,useless i was blocked for no reason after only a few hour now i can not communicate with my son in china,Useless. I was blocked for no reason after only a few hours. Now I can not communicate with my son in China.,
564130,WeChat,Sujata Pawar,"April 29, 2019",4.0,best video call quality,best video call quality,
564131,WeChat,julius leonard,"April 29, 2019",3.0,i need a new vision of what,i need a new vision of WeChat,
564132,WeChat,Mokammel Hossain,"April 29, 2019",3.0,photo and others document are not found after few day,Photos & others documents are not found after few days.,
564135,WeChat,Mishal Khalid,"April 29, 2019",1.0,application is not getting downloaded what is the issue doe not show any error or something but installation stop every time,"App is not getting downloaded, what's the issue?? Doesn't show any error or something, but installation stops every time.",
564137,WeChat,Akakandelwa Akakandelwa,"April 29, 2019",1.0,i do not know why i can not sine up for chart,i dont know why i cant sine up for wechart,
564143,WeChat,Yapyeshi Dorjee,"April 29, 2019",5.0,yes i like this what ap,yes i like this wechat aap,
564145,WeChat,bill schulze,"April 29, 2019",1.0,not at all worth the trouble can not get any help,Not at all worth the trouble can't get any help,
564147,WeChat,Xglaive Ir,"April 29, 2019",1.0,i can not login with my correct account email and password it is just need security verification i do not need that i just want to login to my account,"i can't login with my correct account email and password, it's just need security verification !!! I DON'T NEED THAT I JUST WANT TO LOGIN TO MY ACCOUNT!!!!!",
564149,WeChat,Mohd Tahir,"April 29, 2019",1.0,the worst application in my life,the worst app in my life,
564151,WeChat,Daniella Brown,"April 29, 2019",5.0,is very helpful to me i recommended it to everyone,is very helpful to me i recomended it to everyone,
564154,WeChat,Arminda da Silva,"April 29, 2019",1.0,i tried to sign up for what but what asks for a friend but i do not know other people who are on what what do i do,"I tried to sign up for WeChat but it asks for a ""friend"" but I don't know other people who are on WeChat... what do I do??",
564155,WeChat,sitezque 6969,"April 29, 2019",1.0,susan mau log in,susah mau log in,
564157,WeChat,daniel conarroe,"April 29, 2019",5.0,great application use daily in the world,great app use daily in the world,
564160,WeChat,Aaryn Taylor,"April 30, 2019",1.0,worst messaging application ever created minute to set up dint work apparently i amazed used worst messaging application before garbage full of everything useless and nothing useful,"worst messaging app ever created. 15 minutes to set up, didnt work, apparently im banned. used the app before, garbage. . full of everything useless and nothing usefull.",
564162,WeChat,Danish Syahmi,"April 30, 2019",1.0,f off i got a new phone and my old phone has broke i can not login my account on my new phone boz of security that kind of look so stupid and i need verification from my friend and i do not even understand that until now i still can not login on my new phone by the way goodbye what and hi to whatsit bitch,F offf I got a new phone and my old phone has broke! I can't login my account on my new phone bcoz of security that kinda look so stupid and i need verification from my friend and I dont even understand that Until now i still cannot login on my new phone btw goodbye wechat and hi to whatsapp btch!,
564165,WeChat,Saroj Ray,"April 30, 2019",1.0,why unable to sent photo even in good network fix even in good network quickly other wise my company will impose penalty on me,WHY UNABLE TO SENT PHOTOS EVEN IN GOOD NETWORK... FIX IT QUICKLY... OTHER WISE MY COMPANY WILL IMPOSE PENALTY ON ME...,
564170,WeChat,CJ Re,"April 30, 2019",1.0,immediately flagged a a suspicious account got this application to talk to my daughter overseas this application asked for my contact to find others who use what i said no account flagged no thanks bye,"immediately flagged as a suspicious account. got this app to talk to my daughter overseas. it asked for my contacts to ""find others who use wechat"". i said no. account flagged. no thanks, bye",
564172,WeChat,Aamir Khan,"April 30, 2019",5.0,url problem very show speed on pic unloading time,pic.uploading problem. very sholw speed on pic uploading time,
564173,WeChat,MaMuN kHaN,"April 30, 2019",5.0,best aps for communication,Best apps for Communication,
564175,WeChat,Neriza Sindingan,"April 30, 2019",5.0,its very easy to use,its very easy to use,
564178,WeChat,Claire and Matt Johnson,"April 30, 2019",1.0,say it report suspicious activity and i see i arnot anyone with this issue easiest way to deal with people in china,says it reports suspicious activity and I see im not only.one with this issue. easiest way to deal with people in China!!!!!,
564180,WeChat,paras nayal,"April 30, 2019",1.0,i just signed up today and got blocked instantly without even logging in never gon na use this application again,I just signed up today and got blocked instantly without even logging in. Never gonna use this app again.,
564182,WeChat,fvsdgfdsg gfdsdfgdfs,"April 30, 2019",1.0,tracking by chinese government,tracking by Chinese government,
564187,WeChat,Ku Jennifer,"April 30, 2019",2.0,when i call with friend why i can not meanwhile play others game,when i call with friend why i cant Meanwhile play others games,
564188,WeChat,Angelo cleo Pardillo,"April 30, 2019",1.0,keep on blocking me,keeps on blocking me,
564189,WeChat,Nima Thai,"April 30, 2019",1.0,female people is nearby is not showingwhy,👵 female people's nearby is not showing.why?,
564195,WeChat,Marco Jallorina,"April 30, 2019",1.0,it doe not send the verification code or it take so long to send a verification code and it keep saying about a friend,it doesn't send the verification code or it takes so long to send a verification code and it keeps saying about a friend,
564196,WeChat,Alex Wire,"April 30, 2019",5.0,i love this application,i love this app,
564203,WeChat,Yug Dharma Kirtaniyas,"April 30, 2019",1.0,calling between friend is bad experience it sound like robot very bad application,calling between friends is bad experience it sounds like robots very bad app,
564205,WeChat,D4ngr_Duk3,"April 28, 2019",1.0,try set up account for first time blocked due to suspicious use batch account creation what b is this useless application,Try set up account for first time. Blocked due to suspicious use/ batch account creation. What BS is this. Useless App,
564209,WeChat,Anne Masiglat,"April 28, 2019",1.0,i uninstaled bec bec asking to much esp the proof of address i send bec my employment contract address a bec stated but still rejected their asking for proof of billing now i asked my employer if i can borrow the bill my employer said my employer chat is scam too much asking about the address why my employer do not recognise my employment contract the address why they do not recognise my employment contract was written my employer even passport at may hongkong i would i send to my employer chat but still rejected very disgusting this application not like tag my hk i would ok now,I uninstalled bec they asking to much esp. The proof of address. I send them my employment Contract address as they stated but still rejected me.their asking for proof of billing. Now I asked my employer if I can borrow the bills they said we chat is scam. Too much asking about the address why they don't recognise my employment Contract it was written their my address. Even passport at may hongkong I'd i send to we chat but still rejected. Very disgusting this app. Not like TNG MY HK I'D OK NOW,
564210,WeChat,Arlene Besa,"April 28, 2019",2.0,my profile are invisible if i on my nearby i do not know why i on my nearby hour but no message i receive and no message i receive invisible to others even shaking no message i receive no response i receive is there something wrong about my account i twice to instal no message i receive and even change my password but still my profile is invisible,my profile are invisible if i on my nearby. i dont know why? i on my nearby 24 hours but no message i recieve. and its invisible to others. even shaking it no response i recieve. is theres something wrong about my account? i twice to uninstall it and even change my password. but still my profile is invisible.,
564212,WeChat,Jean Irish Cosip,"April 28, 2019",2.0,i just send a picture to a friend after that i can not send message anymore i logged out my account now i can not login anymore,I just send a picture to a friend after that i can't send messages anymore. I logged out my account. Now I can't login anymore,
564211,WeChat,Nikhil Gupta,"April 28, 2019",1.0,recently been blocked of using the application the reason for blocking is unknown and the procedure to get unblocked is not practical my account has been blocked for over month and have complained what authority for action but have not got any positive reply what has been working worst for the past year do not install the application,recently been blocked of using the app. The reason for blocking is unknown and the procedure to get unblocked is not practical. My account has been blocked for over 6 months and have complained wechat authorities for action but haven't got any positive replies. wechat has been working worst for the past 1 year. Don't install this app.,
564220,WeChat,freakinempty,"April 28, 2019",1.0,too difficult to recover my old account and to create new account uninstaled from my phone i would give star if i can,"Too difficult to recover my old account, and to create new account. Uninstalled from my phone. I would give 0 star if I can.",
564221,WeChat,Wajiha Javaid,"April 28, 2019",1.0,take too much time to downloading and instalment,take too much time to downloading and installment,
564225,WeChat,Daniel Santos,"April 28, 2019",1.0,took me over min and several sm confirmation code to finally be able to sign in when asking to create a password they do not ask to input a second time so probability of creating the wrong password is high when trying to sign in through a sm code they show you a screen to type in the code you have not received yet and you have to figure out the green send button in front of the space to input a sm code is not ment for you to send the code a sm code is meant for they to send you the sm with a sm code,"Took me over 10 min and several SMS confirmation codes to finally be able to sign in. When asking to create a password they don't ask to input a second time so probability of creating the wrong password is high. When trying to sign in through a SMS code, they show you a screen to type in the code you haven't received yet, and you have to figure out the green ""send"" button in front of the space to input the code is not ment for you to send the code, it's meant for them to send you the SMS with it",
564226,WeChat,גיא אברהם,"April 28, 2019",1.0,after application update to v can not see text box and cent type lg grin hebrew,After app update to v 7 Cant see text box and cent type (lg g6 hebrew),
564228,WeChat,Asad Khan,"April 28, 2019",4.0,its best application which is only can use in china without vpnalong with cry and all other goole not working in china,its best application which is only can use in china without VPN...along with QQ and all other google not working in china,
564229,WeChat,Piyush Sevak,"April 28, 2019",1.0,i am not able to send message after new update it is worst feeling to use this application now,i am not able to send messages after new update it's worst feeling to use this app now,
564230,WeChat,Jayaprithivirajan D,"April 28, 2019",5.0,what is unique no need to compare with other aps,"WeChat is unique , no need to compare with other apps .",
564231,WeChat,Manish V,"April 28, 2019",1.0,my account got blocked a soon a i signed up when i took the option of help from friend the top never got sent to my friend sad one of the most unreliable application would not not recommended at all and uninstaled,"My account got blocked as soon as I signed up. When I took the option of help from friend, the OTP never got sent to my friend. sad. One of the most Unreliable app. wouldn't not recommended at all and uninstalled.",
564234,WeChat,Marisol Santibañez Espinoza,"April 28, 2019",1.0,i installed the application just to talk to someone in china for a job and i was blocked hour after i signed in i do not use any illegal software nor android emulator nor fake gps nothing of that kind,"I installed the app just to talk to someone in China for a job and I was blocked 48 hours after I signed in. I don't use any illegal software nor android emulators nor fake GPS, nothing of that kind!!",
564235,WeChat,adda mafty,"April 28, 2019",1.0,what do you mean my id and password are wrong i can not religion my acc bring back my acc and you did not send the email at all,What do you mean my id and password are wrong? I can't relogin my acc ! Bring back my acc and you didn't send the email at all !,
564237,WeChat,B Kohl,"April 28, 2019",1.0,account blocked for apparent suspicious activity bull unable to unblock and unable to cancel would rate star if possible uninstaled,"Account blocked for apparent ""suspicious activity"".. Bull💩. Unable to unblock and unable to cancel.. Would rate 0 stars if possible. Uninstalled 👎",
564238,WeChat,Hendrick Masoga,"April 28, 2019",5.0,we chat its good and cheap i would to use its forever,we chat its good and cheap i would to use it forever,
564240,WeChat,M Amin,"April 28, 2019",5.0,so good application for video chat,so good app for video chat,
564245,WeChat,Snhidayah Jeff,"April 28, 2019",1.0,i can not sign up,I can't sign up,
564246,WeChat,Conylim Yichien,"April 28, 2019",5.0,i love this application,I love this app,
564250,WeChat,Faith Ben,"April 28, 2019",5.0,actually the best application in have ever used nice one what and what pay,actually the best application in have ever used ... nice one wechat and wechat pay,
564251,WeChat,Qiankun Wang,"April 28, 2019",1.0,no dark mode too bad,no dark mode. too bad,
564252,WeChat,lenhel rismal,"April 28, 2019",1.0,hello i can not sign in and i felt conscious coz myacount been hack by someone i do not know please help me or contact me soon,Hello I can't sign in and I felt Coustious coz my.account been hack by someone idk pls help me or contact me soon,
564254,WeChat,Farhan Iqbal,"April 28, 2019",1.0,well i wanted to use this application again but can not log back in into my account that has a suspicious activity on my account i saw that my old review is from so my old review is few year old since then i was not log in into my account but why what itself suspicious to me that i try to log back in into my account it doe not make any sense,"Well.. I wanted to use this app again but can't log back in into my account that has ""a suspicious activity"" on my account. I saw that my old review is from 2014 so it's few years old since then I was not log in into my account but why WeChat itself suspicious to me that I try to log back in into my account? It doesn't make any sense..",
564255,WeChat,A Google User,"April 28, 2019",1.0,the update keep looping back is there something wrong with this application after download is finished the update go back and start downloading again and again,"the update keeps looping back, is there something wrong with this app? after download is finished it goes back and starts downloading again and again...",
564256,WeChat,FRANK DZOKPE,"April 28, 2019",4.0,i am new person,I'm new person,
564260,WeChat,Ray Elms,"April 28, 2019",1.0,this application was working very well on my android phone but then this application selfdeleted and the phone crash if i try to deinstall,This app was working very well on my Android 6.0 phone. But then it self-deleted and the phone crashes if I try to reinstall.,
564261,WeChat,Ice〤Mohit YT,"April 28, 2019",1.0,very much worst application,very much worst 👎👎👎👎👎👎app,
564262,WeChat,Alex Ngo,"April 28, 2019",1.0,can not cancelled account,can't cancelled account,
