index,Unnamed: 0,Bug_report,appTitle,bug_report,comment,date,id,original_text,score,text,userName,Unnamed: 12,Unnamed: 13
11085,11085,1,Maps,,"['map', 'operation', 'instruction', 'be', 'clear', 'earth', 'wizard', 'program', 'unload', 'photo', 'be', 'fast', 'convenient', 'be', 'difficult', 'slow', 'look', 'already', 'unload', 'photo', 'delete', 'photo', 'even', 'inconvenient', 'be', 'delete', 'photo', 'photo', 'still', 'exist', 'not', 'delete']",2019-02-25,615980," this map operation instruction is very clear. in the ""earth wizard"" program, uploading photos is fast and very convenient, but it is very difficult and very slow to looking for the ""already uploaded photos"" and deleting photos. even more inconvenient is that after deleting some photos, some photos still exist and cannot be deleted.",3,this map operation instruction is very clear in the earth wizard program unloading photo is fast and very convenient but it is very difficult and very slow to looking for the already unloaded photo and deleting photo even more inconvenient is that after deleting some photo some photo still exist and can not be deleted,JNY,,
11086,11086,1,Maps,,"['use', 'work', 'fine', 'reason', 'slow', 'be', 'impossible', 'use', 'dependable', 'not', 'anymore', 'try', 'everything', 'tired', 'spending', 'hour', 'end', 'figure', 'goole', 'set', 'use', 'goole', 'set', 'product', 'cut', 'loose', 'entirely']",2019-02-28,615983,"used to work fine. now for some reason. too slow, it is impossible to use. was dependable. not anymore. and i tried everything. i am tired of spending hours on end figuring out google settings and using google settings products. about to cut them loose entirely.",2,used to work fine now for some reason too slow it is impossible to use was dependable not anymore and i tried everything i am tired of spending hour on end figuring out goole setting and using goole setting product about to cut them loose entirely,,,
11087,11087,1,Maps,,"['gps', 'be', 'good', 'map', 'be', 'nice', 'gps', 'work', 'interface', 'be', 'bad', 'constantly', 'loose', 'touch', 'screen', 'even', 'zoom', 'wrong', 'click', 'icon', 'lucky', 'get', 'kick', 'back', 'text', 'direction', 'unlucky', 'screen', 'delete', 'have', 'redo', 'ability', 'get', 'original', 'back', 'already', 'board', 'bus']",2019-02-24,615982," because the gps is good, and the map is nice when the gps works. the interface is bad and i constantly loose where i am when i touch the screen, even to zoom wrong or click an icon on the map. if i am lucky i get kicked back to the text directions, if i am unlucky the screen deletes and i have to redo the seach with no ability to get the originals back if i already boarded a bus.",2,because the gps is good and the map is nice when the gps work the interface is bad and i constantly loose where i am when i touch the screen even to zoom wrong or click an icon on the map if i am lucky i get kicked back to the text direction if i am unlucky the screen deletes and i have to redo the each with no ability to get the original back if i already boarded a bus,Lara Thompson-Mason,,
11088,11088,1,Maps,,"['love', 'goole', 'map', 'lately', 'have', 'be', 'have', 'problem', 'doe', 'not', 'read', 'location', 'try', 'instal', 'deinstall', 'do', 'not', 'fix', 'problem', 'doe', 'not', 'read', 'location', 'try', 'clear', 'cache', 'datum', 'do', 'not', 'work', 'need', 'help', 'soon_possible', 'keep', 'get', 'lose']",2019-02-28,615984,"i love google maps but lately i have been having a problem it does not read my location. i tried to uninstall and reinstall it did not fix a problem it does not read my location, i tried to clear the cache and data and it did not work. i need some help as soon as possible i keep getting lost.",3,i love goole map but lately i have been having a problem it doe not read my location i tried to instal and deinstall it did not fix a problem it doe not read my location i tried to clear the cache and data and it did not work i need some help a soon a possible i keep getting lost,,,
11089,11089,1,Maps,,"['last', 'update', 'not', 'add', 'stop', 'able', 'see', 'route', 'option', 'do', 'know', 'last', 'trip', 'application', 'become', 'lie', 'be', 'not', 'working_properly', 'last', 'update', 'not', 'show', 'route', 'go', 'last', 'trip', 'be', 'be', 'not', 'detect', 'route']",2019-02-24,615985,after last update i cannot add stops or able to see other route options which i did know after the last trip . and application become laggy. it is not working properly after last update not showing any route or just one only and i am going on the last trip as before but it is like it is not detecting the routes.,1,after last update i can not add stop or able to see other route option which i did know after the last trip and application become lay it is not working properly after last update not showing any route or just one only and i am going on the last trip a before but it is like it is not detecting the route,aditya Patel,,
11092,11092,1,Maps,,"['take', 'lock', 'phone', 'not', 'open', 'ap', 'music', 'text', 'have', 'restart', 'phone', 'free', 'phone', 'super', 'frustrating', 'have', 'pull', 'reopen', 'navigation', 'order', 'direction']",2019-02-26,615988,takes over and locks up my phone. i cannot open the other apps like music or my text. i have to restart my phone to free my phone up. super frustrating because i have to pull over and then reopen my navigation and order up the directions again.,3,take over and lock up my phone i can not open the other aps like music or my text i have to restart my phone to free my phone up super frustrating because i have to pull over and then reopen my navigation and order up the direction again,sarah hultquist,,
11094,11094,1,Maps,,"['use', 'love', 'last', 'update', 'doe', 'not', 'accurate', 'tell', 'keep', 'say', 'search', 'gps', 'touch', 'location', 'say', 'be', 'perform', 'high', 'accuracy', 'travel', 'area', 'job', 'several', 'time', 'week', 'have', 'start', 'use', 'application']",2019-02-26,615991,"i used to love this but since the last update this does not accurate tell me where i am and keeps saying searching for gps. when i touch location this says this is perfirming with high accuracy. because of traveling around the area for my job several times a week, i have had to start using another application",1,i used to love this but since the last update this doe not accurate tell me where i am and keep saying searching for gps when i touch location this say this is performing with high accuracy because of traveling around the area for my job several time a week i have had to start using another application,Laurie Lewis,,
11095,11095,1,Maps,,"['be', 'show', 'travel', 'route', 'upside', 'sideways', 'travel', 'straight', 'hold', 'phone', 'upright', 'show', 'gps', 'arrow', 'go', 'leave', 'not', 'forwardeven', 'turn', 'phone', 'sideways', 'still', 'doe', 'not', 'work', 'frustrating', 'be', 'issue', 'note']",2019-02-26,615992,"why is it showing my traveling route upside and sideways? like if i am traveling straight and holding my phone upright, it shows the gps arrow going left not forward.even if i turn my phone sideways it still does not work! very frustrating and no, there is no issue with the note ",3,why is it showing my traveling route upside and sideways like if i am traveling straight and holding my phone upright it show the gps arrow going left not forwardeven if i turn my phone sideways it still doe not work very frustrating and no there is no issue with the note,F OWENS,,
11096,11096,1,Maps,,"['send', 'mile', 'course', 'trip', 'vega', 'get', 'lose', 'mountain', 'desert', 'multiple', 'storm', 'be', 'not', 'first', 'time', 'have', 'get', 'strand', 'due', 'application', 'be', 'last', 'even', 'come', 'reinstate', 'find', 'something', 'anything', 'else']",2019-02-22,615993,"sent me  miles off course from a trip to las vegas to get lost in the mountains, desert, and multiple storms. this is not the first time i have gotten stranded due to this application, but now it is the last. even if this comes pre-installed, d e l e t e and find something, anything else.",1,sent me mile off course from a trip to la vega to get lost in the mountain desert and multiple storm this is not the first time i have gotten stranded due to this application but now it is the last even if this come reinstated d e l e t e and find something anything else,Fr33 291r1t,,
11098,11098,1,Maps,,"['hate', 'update', 'everytime', 'update', 'map', 'slow', 'glitch', 'use', 'able', 'instal', 'update', 'try', 'map', 'not', 'work', 'delivery', 'driver', 'speed', 'be', 'good', 'asset']",2019-02-23,615995,"i hate these updates! everytime it updates maps slows down and glitches. i used to be able to uninstall updates now, when i try, maps will not work! i am a delivery driver and speed is my best asset!",2,i hate these update everytime it update map slows down and glitch i used to be able to instal update now when i try map will not work i am a delivery driver and speed is my best asset,Ken Ewald,,
11105,11105,1,Maps,,"['fix', 'point', 'show']",2019-02-20,616002,fix point no show,3,fix point no show,,,
11108,11108,1,Maps,,"['bad', 'not', 'stable']",2019-02-24,616005,bad not be stable,1,bad not be stable,Honey Bhagat,,
11109,11109,1,Maps,,"['not', 'work', 'update']",2019-02-21,616006,not working after the uldate,1,not working after the update,shaheen zulfiqar,,
11116,11116,1,Maps,,"['issue', 'sudden', 'application', 'last', 'couple', 'week', 'first', 'give', 'bad', 'direction', 'give', 'map', 'be', 'tell', 'destination', 'time', 'be', 'hour', 'half', 'hour', 'away', 'also', 'would', 'street', 'trip', 'say', 'minute', 'get', 'update', 'make', 'update', 'ruin', 'application', 'really', 'bad']",2019-02-23,616018,"issues all of a sudden with the application the last couple of weeks. first off, giving bad directions from what it should be given. and the map is very off. then it tells you are destination time is  hours and you are only a half hour away. also, i would be down the street from my trip and said  minutes to get there. whatever updates made, whatever updates ruined this application really bad.",2,issue all of a sudden with the application the last couple of week first off giving bad direction from what it should be given and the map is very off then it tell you are destination time is hour and you are only a half hour away also i would be down the street from my trip and said minute to get there whatever update made whatever update ruined this application really bad,Lona Rose,,
11118,11118,1,Maps,,"['application', 'be', 'malfunction', 'big', 'time']",2019-02-25,616017,the application is malfunctioning big time!,1,the application is malfunctioning big time,Greg Grant,,
11120,11120,1,Maps,,"['get', 'lose', 'use', 'application']",2019-02-21,616023,got lost using your application. bye,2,got lost using your application bye,Barb Stufflebeam,,
11124,11124,1,Maps,,"['constantly', 'show', 'notification', 'location', 'be', 'share', 'order', 'magnitude', 'last', 'update', 'also', 'local', 'be', 'mi', 'radius']",2019-02-22,616027,"constantly showing notifications that my location is shared. orders of magnitude more than the last update. also, my local is in a mi radius.",1,constantly showing notification that my location is shared order of magnitude more than the last update also my local is in a mi radius,Ryan Moody,,
11125,11125,1,Maps,,"['lately', 'not', 'able', 'find', 'location']",2019-02-22,616029,lately not able to find my location.,1,lately not able to find my location,Doneicia Reed,,
11131,11131,1,Maps,,"['get', 'big', 'update', 'not', 'instal']",2019-02-28,616036,getting too big to update and cannot uninstall,2,getting too big to update and can not instal,,,
11162,11162,1,Maps,,"['first', 'try', 'not', 'respond', 'good']",2019-02-25,616075,first try not responding. no good.,1,first try not responding no good,Allister McCabe,,
11173,11173,1,Maps,,"['location', 'doe', 'not', 'get', 'update', 'automatically', 'samsung_galaxy', 'kindly', 'look', 'issue', 'need', 'use', 'wife', 'galaxy', 'goole', 'map', 'work', 'well']",2019-02-23,616087,location does not get updated automatically in samsung galaxy s.kindly look into this issue.i need to use my wife galaxy on on which google maps works well,3,location doe not get updated automatically in samsung galaxy kindly look into this issue need to use my wife galaxy on on which goole map work well,,,
11174,11174,1,Maps,,"['everytime', 'use', 'application', 'matter', 'keep', 'lose', 'rare', 'occasion', 'doe', 'work', 'be', 'constantly', 'route']",2019-02-23,616089,everytime i use this application no matter where i am keeps losing its gps signal and on the rare occasion that its does work its is constantly rerouting.,1,everytime i use this application no matter where i am keep losing its gps signal and on the rare occasion that its doe work its is constantly re-routing,Michael Fortner,,
11176,11176,1,Maps,,"['hate', 'update', 'map', 'doe', 'not', 'have', 'north', 'icon', 'screen', 'while_driving', 'turn', 'map', 'screen', 'drive', 'south', 'floridaexcept', 'really', 'go', 'canada', 'canada', 'doe', 'not', 'show', 'north', 'north', 'anymore', 'use', 'like', 'application', 'go', 'place', 'hate', 'canada', 'bad', 'update']",2019-02-22,616091,"i hate your updated maps. it does not have the north icon on the screen, so while you are driving you can turn the map screen and then you can drive south towards florida.except really you are going towards canada, because canada does not show north as north anymore. used to like this application for going places, now i hate canada. bad update.",1,i hate your updated map it doe not have the north icon on the screen so while you are driving you can turn the map screen and then you can drive south towards floridaexcept really you are going towards canada because canada doe not show north a north anymore used to like this application for going place now i hate canada bad update,Ryan Byers,,
11177,11177,1,Maps,,"['map', 'be', 'slow', 'inaccurate', 'send', 'world', 'instead', 'short', 'route']",2019-02-26,616092,maps is slow its innacurate and its sends you all around the world instead of shortest route,1,map is slow its inaccurate and its sends you all around the world instead of shortest route,Ken Huitt,,
11178,11178,1,Maps,,"['open', 'map', 'do', 'not', 'show', 'street', 'be', 'blanket', 'show', 'location', 'be', 'do', 'not', 'know', 'happen', 'use', 'map', 'everyday', 'reason', 'get', 'update', 'matt', 'go', 'blank', 'say', 'still', 'see', 'location', 'blue', 'marker']",2019-02-28,616093,when i open the map it do not show no streets it is all blank.it just shows my location that is it. i do not know what happened i use maps everyday and for some reason when they got updated matt just went blank but like i said you can still see my location blue marker,1,when i open the map it do not show no street it is all blanket just show my location that is it i do not know what happened i use map everyday and for some reason when they got updated matt just went blank but like i said you can still see my location blue marker,Anthony Sandoval,,
11179,11179,1,Maps,,"['tell', 'be', 'show', 'bug', 'massage', 'whenever', 'go', 'navigate', 'option', 'show', 'even', 'instal', 'instal', 'application', 'kindly', 'solve', 'issue', 'fast', 'completely', 'depend', 'goole', 'map', 'navigation']",2019-02-28,616094,please tell why there is showing bug massage whenever i go for navigate option.its shows same even after uninstall and installing the application again. kindly solve the issue fast as i completely depend on google maps for navigation,2,please tell why there is showing bug massage whenever i go for navigate option show same even after instal and installing the application again kindly solve the issue fast a i completely depend on goole map for navigation,ARIJIT SEN,,
11183,11183,1,Maps,,"['motorcycle', 'bike', 'mode', 'be', 'disappear', 'already', 'update', 'problem', 'not', 'solve', 'yet']",2019-02-20,616098,motorcycle and bike mode is dissapear. already updated but the problem not solved yet.,3,motorcycle and bike mode is disappear already updated but the problem not solved yet,Anton Januar,,
11184,11184,1,Maps,,"['disappointed', 'new', 'update', 'doe', 'not', 'allow', 'copy', 'address', 'send', 'someone']",2019-02-24,616099,very disappointed with the new update does not allow me to copy the address to send to someone,1,very disappointed with the new update doe not allow me to copy the address to send to someone,Brian Narciso,,
11185,11185,1,Maps,,"['disgust', 'happen', 'late', 'android', 'update', 'application', 'crash', 'time', 'lose', 'gps_signal', 'time', 'use', 'application', 'multiple', 'time', 'day', 'rely', 'multiple', 'time', 'day', 'not', 'anymore']",2019-02-27,616101,disgusted what happened? latest android update has this application crashing all the time and loses my gps signal all the time. i use the application multiple times a day and rely on multiple times a day. not anymore.,1,disgusted what happened latest android update has this application crashing all the time and loses my gps signal all the time i use the application multiple time a day and rely on multiple time a day not anymore,Jocelyn Milliman,,
11186,11186,1,Maps,,"['use', 'application', 'daily', 'work', 'courier', 'application', 'need', 'bring_back', 'route', 'option', 'quick', 'button', 'toll', 'ferry', 'remove', 'application', 'update', 'unknown', 'reason', 'great', 'application']",2019-02-26,616103,"i use this application daily for work as a courier, and like this application but you need to bring back the route options quick button for tolls and ferry. you removed this application  updates ago for some unknown reason. other than that, great application.",3,i use this application daily for work a a courier and like this application but you need to bring back the route option quick button for toll and ferry you removed this application update ago for some unknown reason other than that great application,Salance86,,
11187,11187,1,Maps,,"['not', 'link', 'account', 'not', 'link', 'account', 'link', 'account', 'section', 'say', 'link', 'account', 'fail', 'help', 'solve']",2019-02-21,616104,"cannot link accounts i cannot link my two accounts. the 'linked accounts' section only says, ""no linked accounts"" but fails to (help me) solve that.",2,can not link account i can not link my two account the linked account section only say no linked account but fails to help me solve that,Ayush Vora,,
11190,11190,1,Maps,,"['suck', 'not', 'set', 'home', 'work', 'location', 'set', 'web', 'history', 'be', 'goole', 'force', 'let', 'goole', 'snoop', 'browse']",2019-02-26,616107,"sucks, cannot set home or work location again with out setting web history to on. this is google forcing you to let google snoop your browsing.",1,suck can not set home or work location again with out setting web history to on this is goole forcing you to let goole snoop your browsing,,,
11191,11191,1,Maps,,"['trouble', 'use', 'goole', 'map', 'work', 'turn', 'right', 'side', 'place', 'map', 'show', 'left', 'rotation', 'be', 'not', 'working_properly', 'goole', 'map', 'mobile', 'rotation', 'be', 'improve', 'map', 'amusing', 'goole', 'map', 'day', 'weak', 'thank']",2019-02-24,616108,very trouble i am using google map for my work. ex i will turn right side my place but map was showing left . ! rotation is not working properly google maps. my mobile rotation is ok.! plzz improve maps . i amusing google map / days for a weak. thank you,1,very trouble i am using goole map for my work ex i will turn right side my place but map was showing left rotation is not working properly goole map my mobile rotation is ok plc improve map i amusing goole map day for a weak thank you,KOKKIRI RAJU,,
11192,11192,1,Maps,,"['application', 'use', 'great', 'not', 'do', 'anything', 'application', 'open', 'application', 'zoom', 'in', 'not', 'get', 'direction', 'anywhere', 'change', 'view', 'satellite', 'basically', 'use', 'feature', 'please_fix']",2019-02-21,616109,"this application used to be great, but now i cannot do anything within this application except open the application and zoom in and out. i cannot get directions to anywhere; change view to satellite, etc.; or basically use any other feature! please fix!",1,this application used to be great but now i can not do anything within this application except open the application and zoom in and out i can not get direction to anywhere change view to satellite etc or basically use any other feature please fix,Angela Donaldson,,
11193,11193,1,Maps,,"['happen', 'compass', 'north', 'button', 'drive', 'map', 'trucker', 'really', 'use', 'thing', 'know', 'yous', 'remove', 'thing']",2019-02-22,616110,"what happened to the compass north button on the drive map? us truckers were really using that thing, you know, until yous removed that thing. ",2,what happened to the compass north button on the drive map u trucker were really using that thing you know until yous removed that thing,Michael Washington,,
11196,11196,1,Maps,,"['happen', 'time', 'leave', 'function', 'map', 'have', 'enable', 'option', 'set', 'map', 'access', 'live', 'location', 'calendar', 'never', 'get', 'message', 'tell', 'leave', 'get', 'destination', 'helpful', 'get', 'appointment', 'time', 'place', 'need', 'great', 'function', 'seem', 'go', 'tell', 'get', 'work', 'galaxy', 'put', 'back', 'application']",2019-02-24,616114,"what happened to the time to leave function in maps? i have it enabled in the option settings and maps has access to my live location and my calendar, but i never get a message telling me when to leave to get to my destinations. this was so helpful in getting me to my appointments on time or any place i needed to be; was such a great function and it seems to be gone. please tell me how to get it to work on my galaxy s or please put it back into the application!",1,what happened to the time to leave function in map i have it enabled in the option setting and map has access to my live location and my calendar but i never get a message telling me when to leave to get to my destination this was so helpful in getting me to my appointment on time or any place i needed to be was such a great function and it seems to be gone please tell me how to get it to work on my galaxy s or please put it back into the application,Mike C,,
11199,11199,1,Maps,,"['frustrating', 'stop', 'work', 'middle', 'trip', 'frustrating']",2019-02-26,616117,frustrating it just stop working in the middle of the trip very frustrating,1,frustrating it just stop working in the middle of the trip very frustrating,mokantane madisha,,
11200,11200,1,Maps,,"['night', 'time', 'do', 'not', 'show', 'right', 'navigation', 'bad', 'bad', 'bad']",2019-02-24,616118,night time do not show right navigation bad bad bad,1,night time do not show right navigation bad bad bad,rahul bhargav,,
11202,11202,1,Maps,,"['error', 'message', 'lose', 'use', 'android_auto']",2019-02-26,616121,error message that gps signal lost when using android auto.,1,error message that gps signal lost when using android auto,Erinn Degnan,,
11203,11203,1,Maps,,"['keep', 'push', 'circle', 'clue', 'intent', 'be']",2019-02-27,616122,kept pushing me in circles had no clue what the intent is,1,kept pushing me in circle had no clue what the intent is,sathvik guruprasad,,
11204,11204,1,Maps,,"['terrible', 'application', 'slow', 'crash', 'lot', 'major', 'bug', 'fix']",2019-02-26,616123,terrible application! slow and crashes a lot! major bugs to fix ,2,terrible application slow and crash a lot major bug to fix,Pete M,,
11205,11205,1,Maps,,"['navigation', 'doe', 'not', 'work', 'blue', 'tooth', 'device']",2019-02-26,616124,navigation does not work with my blue tooth devices,4,navigation doe not work with my blue tooth device,Xavier Lau,,
11206,11206,1,Maps,,"['navigation', 'indication', 'be', 'not', 'working_properly']",2019-02-26,616125,now navigation indication is not working properly like before.,1,now navigation indication is not working properly like before,Rahul Das,,
11207,11207,1,Maps,,"['doe', 'not', 'know', 'north', 'south', 'arse']",2019-02-23,616126,does not know north and south from its arse,1,doe not know north and south from its arse,,,
11210,11210,1,Maps,,"['blue_dot', 'location', 'be', 'wrong', 'blue_dot', 'location', 'be', 'show', 'random', 'place', 'never', 'be', 'life', 'please_fix', 'issue']",2019-02-21,616131,"the blue dot location is all wrong, the blue dot location is showing some random place where i never been in my life like i am there. please fix this issue!",1,the blue dot location is all wrong the blue dot location is showing some random place where i never been in my life like i am there please fix this issue,Steven Adriann,,
11212,11212,1,Maps,,"['bad', 'application', 'mi', 'exam', 'false', 'location']",2019-02-21,616130,worst application i mis my exam due to false location,1,worst application i mi my exam due to false location,,,
11213,11213,1,Maps,,"['pain', 'update', 'instal', 'update', 'get', 'update', 'work']",2019-02-26,616132,pain in the a** update i had to uninstall the update just to get ** update to work,1,pain in the a update i had to instal the update just to get update to work,Evan Barnhouse,,
11214,11214,1,Maps,,"['super', 'slow', 'sometimes', 'drive', 'location', 'location', 'load']",2019-02-21,616133,super slow sometimes i drive to the location before the location loads,2,super slow sometimes i drive to the location before the location load,Jamie Zwicky,,
11215,11215,1,Maps,,"['useless', 'painfully', 'slow', 'go', 'unresponsive', 'long', 'period', 'usually', 'crash']",2019-02-26,616134,"useless. painfully slow, goes unresponsive for long periods, usually crashes.",1,useless painfully slow go unresponsive for long period usually crash,,,
