index,Unnamed: 0,Bug_report,appTitle,bug_report,comment,date,id,original_text,score,text,userName,Unnamed: 12,Unnamed: 13
8930,8930,1,Maps,,"['start', 'january', 'not', 'use', 'aps', 'everytime', 'open', 'application', 'search', 'address', 'application', 'stop', 'suck', 'man']",2019-02-03,611547,"start from january  until now, i cannot use this apps, everytime i open this application and search from some address this application has stop. it sucks man.",1,start from january until now i can not use this aps everytime i open this application and search from some address this application has stop it suck man,Agung Wicaksono,,
8934,8934,1,Maps,,"['last', 'update', 'be', 'really', 'not', 'good']",2019-02-01,611554,the last update it is really not good,1,the last update it is really not good,Sam Samir,,
8935,8935,1,Maps,,"['direction', 'indicator', 'be', 'miss', 'have', 'unonstal', 'recent', 'update', 'get', 'direction', 'indicator', 'back']",2019-02-01,611555,the direction indicator is now missing. i have to unonstall recent updates to get the direction indicator back. please fix,2,the direction indicator is now missing i have to unonstal recent update to get the direction indicator back please fix,A Google User,,
8939,8939,1,Maps,,"['longer', 'able', 'add', 'multiple', 'stop', 'last', 'update', 'fix', 'get', 'five_star']",2019-02-05,611559,"no longer able to add multiple stops after last update. fix it, and it gets five stars.",3,no longer able to add multiple stop after last update fix it and it get five star,Car Wash Adam Cooper,,
8941,8941,1,Maps,,"['give', 'application', 'star', 'new', 'update', 'break', 'multiple', 'stop', 'direction', 'feature']",2019-02-03,611561,i gave this application only three stars because this new update has broken the the multiple stop direction features.,3,i gave this application only three star because this new update has broken the the multiple stop direction feature,Cexc Shalet,,
8943,8943,1,Maps,,"['lay', 'phone', 'get', 'stuck', 'map', 'bad', 'older_version', 'good', 'hate', 'bad', 'older_version', 'not', 'expect', 'goole']",2019-02-05,611564,laging nd my phone gets stuck nly for maps. worst older version was good . i hate worst older version. not expcted this from google .,1,laying nd my phone get stuck only for map worst older version was good i hate worst older version not expected this from goole,vijay kumar,,
8944,8944,1,Maps,,"['ability', 'plan', 'route', 'add', 'multiple', 'stop', 'be', 'switch', 'really', 'bad', 'unable', 'type', 'additional', 'location', 'text', 'box']",2019-02-02,611565,the ability to plan a route and add multiple stops is glitching really bad. i am unable to type in the additional location text box.,3,the ability to plan a route and add multiple stop is switching really bad i am unable to type in the additional location text box,Mark Kruckeberg,,
8947,8947,1,Maps,,"['update', 'information', 'bar', 'bottom', 'be', 'stick', 'night_mode', 'even', 'set', 'day', 'mode', 'have', 'try', 'automatic', 'fix']",2019-02-03,611568,"since the update, my information bar at the bottom is stuck on night mode and even in settings i am on day mode and i have tried automatic. fix this.",1,since the update my information bar at the bottom is stuck on night mode and even in setting i am on day mode and i have tried automatic fix this,Bill Sierer,,
8948,8948,1,Maps,,"['garbage', 'application', 'be', 'not', 'even', 'worth', 'free', 'time', 'garbage', 'application', 'give', 'bad', 'possible', 'route', 'drive', 'circle', 'reason']",2019-02-05,611571,this garbage ass application is not even worth being free. most times this garbage ass application gives me the worst possible route and me driving in circles for no reason.,1,this garbage as application is not even worth being free most time this garbage as application give me the worst possible route and me driving in circle for no reason,Mitch C,,
8949,8949,1,Maps,,"['love', 'new', 'update', 'seem', 'add', 'stop', 'doe', 'not', 'allow', 'put', 'stop', 'address', 'ini', 'click', 'click', 'click', 'hold', 'need', 'fix']",2019-02-04,611572,"love the new update, but now it seems when you add a stop it does not allow you to put that stop address in.i just click click and click hold and click.nothing.this needs fixed.",3,love the new update but now it seems when you add a stop it doe not allow you to put that stop address ini just click click and click hold and clicknothingthis need fixed,Bradley Harding,,
8950,8950,1,Maps,,"['update', 'application', 'be', 'be', 'absolute', 'failure', 'application', 'continuously', 'search', 'gps', 'unhelpful', 'say', 'have', 'arrive', 'eventually', 'find', 'way', 'freak', 'self', 'bad', 'application', 'ever']",2019-02-03,611573,"since i updated the application, it is been an absolute failure! the application continuously searches for gps and veru unhelpful. only for to say i have arrived when i eventually find my way by my freaking self! worst application ever! ",1,since i updated the application it is been an absolute failure the application continuously search for gps and very unhelpful only for to say i have arrived when i eventually find my way by my freaking self worst application ever,Zuwairat Asekome,,
8953,8953,1,Maps,,"['recently', 'application', 'be', 'become', 'bad', 'give', 'direction']",2019-02-09,611577,recently the application is becoming very bad in giving directions,3,recently the application is becoming very bad in giving direction,MOHAN TANWAR,,
8954,8954,1,Maps,,"['application', 'be', 'entirely', 'useless', 'application', 'always', 'give', 'false', 'location', 'suppose', 'find', 'way', 'application', 'not', 'even', 'find']",2019-02-17,611578,"this application is entirely useless! this application always gives me a false location, how am i supposed to find my way with an application that cannot even find me?!",1,this application is entirely useless this application always give me a false location how am i supposed to find my way with an application that can not even find me,Tynan Osborne,,
8957,8957,1,Maps,,"['be', 'show', 'wrong', 'location', 'different', 'city', 'be', 'show', 'different', 'city']",2019-02-11,611581,it is showing wrong location i am in different city and it is showing different city,3,it is showing wrong location i am in different city and it is showing different city,DKD 100,,
8958,8958,1,Maps,,"['sometime', 'show', 'long', 'distance', 'wrong', 'route']",2019-02-09,611582,sometime it show long distance and wrong route,2,sometime it show long distance and wrong route,,,
8959,8959,1,Maps,,"['not', 'good', 'navigation', 'location', 'right', 'ati']",2019-02-09,611583,not good navigation loction right nhi ati,1,not good navigation location right nh ati,Naveen kumar Mimroth,,
8960,8960,1,Maps,,"['blue_dot', 'be', 'wrong', 'wrong', 'pointbefore', 'good', 'new', 'update', 'think', 'be', 'not', 'working_properly']",2019-02-09,611588,the blue dot is wrong wrong point.before was good now new update i think is not working properly,1,the blue dot is wrong wrong pointbefore was good now new update i think is not working properly,Ijaz Ali Khan,,
8961,8961,1,Maps,,"['be', 'not', 'optimize', 'phone', 'small', 'screen', 'ram']",2019-02-17,611585,it is not optimized for phone with small screen and ram,2,it is not optimized for phone with small screen and ram,Leg Bail,,
8963,8963,1,Maps,,"['get', 'lose', 'update']",2019-02-11,611591,gps getting lost again and again after this update,4,gps getting lost again and again after this update,Sourabh Choudhary,,
8965,8965,1,Maps,,"['always', 'lag', 'minute']",2019-02-13,611590,always lagging behind ten to fifteen minutes.,2,always lagging behind ten to fifteen minute,Srinivas Vedanthi,,
8966,8966,1,Maps,,"['not', 'working_properly', 'sen', 'last', 'day']",2019-02-16,611592,not working properly seens last  day,2,not working properly sen last day,Ganesh Bankar,,
8968,8968,1,Maps,,"['not', 'see', 'map', 'plea', 'fix']",2019-02-09,611594,cannot see maps pleas fix gs,1,can not see map plea fix g,lets talk Boost,,
8971,8971,1,Maps,,"['not', 'good', 'location', 'application', 'update', 'aethis', 'be', 'not', 'good']",2019-02-18,611597,not good location this application please ri update this appthis is not good,1,not good location this application please ri update this aethis is not good,Razi Siddiqui,,
8975,8975,1,Maps,,"['struggle', 'load', 'sometimes', 'flop', 'half', 'way', 'journey']",2019-02-14,611601,struggling to load. sometimes flop in half way of journey,1,struggling to load sometimes flop in half way of journey,,,
8979,8979,1,Maps,,"['commute', 'feature', 'stopped_working']",2019-02-08,611608,the commute feature has stopped working for me.,4,the commute feature has stopped working for me,snehil pandey,,
8980,8980,1,Maps,,"['problem', 'solve', 'instal', 'install']",2019-02-14,611606,"problems solved, uninstall and install again.",4,problem solved instal and install again,Kura Kura,,
8981,8981,1,Maps,,"['use', 'commute', 'button', 'everyday', 'navigate', 'workhouse', 'commute', 'button', 'not', 'work']",2019-02-13,611607,i was using the commute button everyday to navigate to work/home now the commute button not working,1,i was using the commute button everyday to navigate to workhouse now the commute button not working,Omar Al-Tamimi,,
8983,8983,1,Maps,,"['problem', 'red', 'be', 'fix', 'work']",2019-02-07,611610,the problem with redmi  is fixed and now working.,4,the problem with red is fixed and now working,Nikolas Karampelas,,
8984,8984,1,Maps,,"['crash', 'open', 'android']",2019-02-12,611613,crashes on opening htc one m android ,1,crash on opening etc one m android,darren lewis,,
8990,8990,1,Maps,,"['do', 'not', 'like']",2019-02-11,611618,i do not like,1,i do not like,Raghu Ram,,
9002,9002,1,Maps,,"['have', 'be', 'use', 'goole', 'map', 'long', 'day', 'be', 'lag', 'much', 'try', 'improve', 'performance']",2019-02-03,611657,i have been using google maps since very long. but now a days it is lagging very much. please try to improve performance.,2,i have been using goole map since very long but now a day it is lagging very much please try to improve performance,juhil kamothi,,
9003,9003,1,Maps,,"['not', 'come', 'doe', 'not', 'connect', 'keep', 'ask', 'shut', 'work', 'shut', 'connection', 'wife']",2019-02-06,611658,well not come on! does not connect keeps asking for me to shut off so it can work. shut down my connection to wifi ,2,well not come on doe not connect keep asking for me to shut off so it can work shut down my connection to wife,Regina Myler,,
9004,9004,1,Maps,,"['bad', 'update', 'not', 'functional', 'driver', 'go', 'granite', 'use', 'wave', 'friendsdriver']",2019-02-06,611659,"bad after update, not too functional to driver gojek or grabbike. i am using waze now. so all my friends(driver).",1,bad after update not too functional to driver gone or granite i am using wave now so all my friendsdriver,abdul rohim,,
9006,9006,1,Maps,,"['not', 'give', 'remove', 'switch', 'view', 'change', 'be', 'complete', 'nonsense']",2019-02-04,611661,cannot give five because you removed the d/d switch from map/direction/navigation views. such change is a complete nonsense.,3,can not give five because you removed the dd switch from mapdirectionavigation view such change is a complete nonsense,Antonio Quarta,,
9007,9007,1,Maps,,"['time', 'be', 'update', 'something', 'be', 'bad', 'try', 'add', 'stop', 'not', 'type', 'box']",2019-02-04,611662,every time there is an update something is worse. when trying to add a stop you cannot type in the box now.,1,every time there is an update something is worse when trying to add a stop you can not type in the box now,Stephen Nawrocki,,
9008,9008,1,Maps,,"['not', 'remove', 'view', 'want', 'flat', 'map']",2019-02-02,611663,i cannot remove the -d view! i just want a flat map!,1,i can not remove the d view i just want a flat map,,,
9009,9009,1,Maps,,"['not', 'work', 'professional', 'recently', 'go', 'not', 'respond', 'second', 'previously', 'issue']",2019-02-01,611665,not working in redmi note  professional recently. goes to not responding after  to  seconds. previously there were no issues.,1,not working in red note professional recently go to not responding after to second previously there were no issue,Siva Bala,,
9010,9010,1,Maps,,"['late', 'update', 'have', 'hard', 'time', 'add', 'stop', 'freeze', 'point', 'do', 'stop', 'time']",2019-02-02,611666,with the latest update. i have a hard time adding stops. it freezes at that point and can only do one stop at a time,3,with the latest update i have a hard time adding stop it freeze at that point and can only do one stop at a time,Emmy h,,
9013,9013,1,Maps,,"['have', 'be', 'face', 'issue', 'map', 'show', 'direction', 'phone', 'wrongly', 'help', 'resolve', 'issue']",2019-02-03,611669,i have been facing some issues. map shows direction of my phone wrongly. please help me to resolve this issue.,3,i have been facing some issue map show direction of my phone wrongly please help me to resolve this issue,Arunraj Maria,,
9014,9014,1,Maps,,"['good', 'navigation', 'add', 'content', 'be', 'terrible', 'elaborate', 'be', 'try', 'add', 'miss', 'place', 'month', 'still', 'not', 'get', 'update', 'new', 'eatery', 'airport', 'example', 'even', 'add', 'new', 'eatery', 'airport', 'example', 'pic', 'sad', 'part', 'be', 'tomato', 'add', 'new', 'eatery', 'airport', 'example', 'unload', 'image', 'review', 'never', 'show', 'pic', 'respective', 'location', 'somewhat', 'defeat', 'purpose', 'add', 'content', 'goole', 'map', 'assume', 'new', 'eatery', 'airport', 'example', 'bug', 'current', 'release', 'resolve', 'soon']",2019-02-05,611670,"good for navigation, but adding content is terrible. to elaborate, () been trying to add missing places for over a month and a still not getting updated (i.e. the new eateries at bangalore airport for example - even added (i.e. the new eateries at bangalore airport for example - with pics / sad part is zomato has added (i.e. the new eateries at bangalore airport for example -) () uploading images of reviews never show up in the pics of the respective location - somewhat defeats the purpose of adding content to google maps. i am assuming (i.e. the new eateries at bangalore airport for example - a bug with the current release and will be resolved soon.",2,good for navigation but adding content is terrible to elaborate been trying to add missing place for over a month and a still not getting updated ie the new eatery at bangalore airport for example even added ie the new eatery at bangalore airport for example with pic sad part is tomato has added ie the new eatery at bangalore airport for example unloading image of review never show up in the pic of the respective location somewhat defeat the purpose of adding content to goole map i am assuming ie the new eatery at bangalore airport for example a bug with the current release and will be resolved soon,Peter Paul,,
9015,9015,1,Maps,,"['update', 'ruin', 'update', 'be', 'arrow', 'head', 'thank', 'reply', 'be', 'problem', 'try', 'ask', 'navigating', 'arrow', 'be', 'nowhere', 'find']",2019-02-02,611671,"update ruined update. where is the arrow.? where am i heading?  (thanks for replying but, it is the problem i am trying to ask. when navigating the arrow is nowhere to be found.",1,update ruined update where is the arrow where am i heading thanks for replying but it is the problem i am trying to ask when navigating the arrow is nowhere to be found,Amelia SH,,
9016,9016,1,Maps,,"['eta', 'be', 'inaccurate', 'not', 'seem', 'add', 'extra', 'stop', 'anymore', 'box', 'pop', 'not', 'input', 'location']",2019-02-05,611672,the eta is inaccurate and i cannot seem to add an extra stop anymore. the box pops up but i cannot input any location.,2,the eta is inaccurate and i can not seem to add an extra stop anymore the box pop up but i can not input any location,Tragedy Tempo,,
9017,9017,1,Maps,,"['use', 'application', 'today', 'great', 'have', 'press', 'got', 'application', 'time', 'set', 'destination', 'be', 'not', 'great', 'hate', 'application', 'never', 'do', 'application', 'not', 'do', 'application', 'use', 'application', 'navigation']",2019-02-03,611674,using this application before today was great now that i have to press got this application every time i set a destination is not great i hate this application never had to do this application before and will not do this application again i will ne using another application for my navigation from now on,1,using this application before today was great now that i have to press got this application every time i set a destination is not great i hate this application never had to do this application before and will not do this application again i will ne using another application for my navigation from now on,,,
9019,9019,1,Maps,,"['new', 'update', 'be', 'horrible']",2019-02-16,611678,new update is horrible!,1,new update is horrible,Terry-Ellen. McCarthy,,
9021,9021,1,Maps,,"['not', 'clear', 'show', 'long', 'distance', 'street', 'car', 'not', 'go']",2019-02-16,611680,not clear and showing long distance and streets in which car cannot go,1,not clear and showing long distance and street in which car can not go,Sathiya Krishna,,
9022,9022,1,Maps,,"['not', 'show', 'lower', 'even', 'front', 'house']",2019-02-16,611682,cannot you show lower even down to the front of a house?,4,can not you show lower even down to the front of a house,Deborah Wright,,
9023,9023,1,Maps,,"['not', 'work', 'professional']",2019-02-10,611683,its not working in my mi note  professional,5,its not working in my mi note professional,jony sharma,,
9025,9025,1,Maps,,"['application', 'not', 'update', 'right', 'closed', 'road', 'not', 'yet', 'update']",2019-02-11,611685,"application not updated right, some closed roads not yet updated",4,application not updated right some closed road not yet updated,,,
9028,9028,1,Maps,,"['commute', 'option', 'be', 'not', 'work', 'version', 'please_fix', 'thank']",2019-02-16,611688,"hello, commute option is not working with version  .., please fix it, thanks.",4,hello commute option is not working with version please fix it thanks,Sunil Raina,,
9029,9029,1,Maps,,"['map', 'not', 'respond', 'error']",2019-02-05,611689,map not responding error,1,map not responding error,gurcharan singh,,
9030,9030,1,Maps,,"['bad', 'update', 'ever']",2019-02-06,611690,worst update ever!,1,worst update ever,,,
9031,9031,1,Maps,,"['doe', 'not', 'update', 'bus', 'be', 'late', 'not']",2019-02-08,611691,does not update if the bus is late or not,1,doe not update if the bus is late or not,Be,,
9037,9037,1,Maps,,"['application', 'doe', 'not', 'display', 'designate', 'walk', 'cycling', 'trail']",2019-02-07,611699,"this application does not display designated walking, cycling trails",1,this application doe not display designated walking cycling trail,Phil Biggs,,
9038,9038,1,Maps,,"['screen', 'not', 'rotate', 'roadeverytime', 'change']",2019-02-13,611700,screen not rotete as per road.everytime its change to down.,1,screen not rotate a per roadeverytime its change to down,Dheeraj Singh Rawat,,
9052,9052,1,Maps,,"['use', 'navigator', 'follow', 'direction', 'application', 'have', 'hang', 'system', 'garage', 'map', 'be', 'not', 'respond', 'mean', 'useless', 'application', 'think']",2019-02-06,611753,when i can use it nagivator for following direction this application have hang and system ganrate a sms map is not risponding menas useless application i think,1,when i can use it navigator for following direction this application have hang and system garage a sm map is not responding mean useless application i think,charanjeet singh,,
9053,9053,1,Maps,,"['crash', 'frequently', 'professional']",2019-02-08,611754,crash frequently on mi note  professional,2,crash frequently on mi note professional,Krishna Singh,,
9057,9057,1,Maps,,"['unable', 'add', 'stop', 'please_fix']",2019-02-03,611759,unable to add stop please fix this,1,unable to add stop please fix this,Arun Kumar,,
9059,9059,1,Maps,,"['application', 'sto', 'respondingnew', 'update', 'be', 'totally', 'pathetic']",2019-02-05,611761,application stoo responding.new uodate is totally pathetic,1,application sto respondingnew update is totally pathetic,Meenakshi Mediratta,,
9060,9060,1,Maps,,"['application', 'keep_crashing', 'while_navigate', 'update']",2019-02-04,611762,the application keeps crashing while navigating in this update,1,the application keep crashing while navigating in this update,vismay kawli,,
9061,9061,1,Maps,,"['navigation', 'not', 'work', 'select', 'route', 'start', 'navigation', 'be', 'stick', 'crash']",2019-02-05,611763,navigation not working. when select route and start navigation it is stuck and than crashed.,2,navigation not working when select route and start navigation it is stuck and than crashed,NEERAJ DHAMELIYA,,
9062,9062,1,Maps,,"['try', 'add', 'stop', 'enter', 'location']",2019-02-04,611764,when trying to add stops can enter the location.,1,when trying to add stop can enter the location,Surya AS,,
9064,9064,1,Maps,,"['not', 'stable', 'everytime', 'start', 'not', 'respond']",2019-02-02,611766,not stable. everytime starting not responding.,1,not stable everytime starting not responding,,,
9065,9065,1,Maps,,"['not', 'working_properly', 'bad', 'opinion']",2019-02-03,611767,not working properly. very bad opinion,1,not working properly very bad opinion,,,
9066,9066,1,Maps,,"['note', 'work', 'always', 'say', 'not', 'respond']",2019-02-03,611768,note working. always say not reponding.,1,note working always say not responding,Sandip Patel,,
9067,9067,1,Maps,,"['crash', 'number', 'time', 'last', 'week']",2019-02-02,611770,crashed a number of times since last week,1,crashed a number of time since last week,shivendra guha,,
9068,9068,1,Maps,,"['not', 'work', 'phone', 'anytime', 'problemgogle', 'map', 'not', 'respond', 'be', 'work', 'good', 'be', 'not', 'work', 'goole', 'map', 'connect', 's', 'application', 'location', 'not', 'workingplz', 'reply', 'issue']",2019-02-05,611771,why not working in my phone anytime problem.google map not responding. before is work good .now is not working google map connect by whats application location not working.plzz reply what issue.,4,why not working in my phone anytime problemgogle map not responding before is work good now is not working goole map connect by whats application location not workingplz reply what issue,salman khan,,
9069,9069,1,Maps,,"['open', 'goole', 'map', 'goole', 'map', 'be', 'automatically', 'hang', 'goole', 'map', 'be', 'not', 'respond', 'still', 'map', 'be', 'worst', 'earlier', 'map', 'be', 'awesome', 'not', 'lot', 'time', 'uninstale', 'application', 'instal', 'use']",2019-02-03,611772,when i open this google maps. this google maps is automatically hanging. this google maps is not responding. still this map is very worst. earlier this map is awesome. but not now. lots of times i uninstalled this application and reinstalled. but no use.,1,when i open this goole map this goole map is automatically hanging this goole map is not responding still this map is very worst earlier this map is awesome but not now lot of time i uninstaled this application and installed but no use,KADHER KTM,,
9074,9074,1,Maps,,"['have', 'issue', 'not', 'respond', 'application', 'new', 'update', 'auto', 'restart', 'phone']",2019-02-07,611782,having issue of not responding application since new update. and due to auto restart the phone.,2,having issue of not responding application since new update and due to auto restart the phone,Dharmesh Dhamecha,,
9076,9076,1,Maps,,"['always', 'show', 'map', 'not', 'respond']",2019-02-07,611784,always shows maps not responding.,1,always show map not responding,Raj Veer,,
9078,9078,1,Maps,,"['bad', 'map', 'not', 'support', 'mi']",2019-02-06,611788,worst map not supporting this mi why,1,worst map not supporting this mi why,gogoi dimpi,,
9091,9091,1,Maps,,"['not', 'prefect', 'location']",2019-02-10,611812,not prefect my location,1,not prefect my location,Shahnavaz Kureshi,,
9094,9094,1,Maps,,"['do', 'delete', 'not']",2019-02-09,611818,how do you delete it i cannot,1,how do you delete it i can not,Martin Malcolm,,
9097,9097,1,Maps,,"['do', 'not', 'get', 'direction', 'navigation']",2019-02-15,611826,i do not get directions navigation,1,i do not get direction navigation,,,
9099,9099,1,Maps,,"['terrible', 'direction', 'route']",2019-02-09,611828,terrible directions and routes,1,terrible direction and route,Josh Novosad,,
9100,9100,1,Maps,,"['sometime', 'crazy', 'aps', 'sometime', 'route', 'crazy', 'road', 'dead', 'end', 'time', 'be', 'good']",2019-02-14,611832,sometime crazy apps. sometime re route to crazy road or dead end. some times it is good.,2,sometime crazy aps sometime re route to crazy road or dead end some time it is good,Errham Zafry,,
9104,9104,1,Maps,,"['application', 'int', 'work', 'get', 'decline', 'message', 'time', 'go', 'use', 'decline', 'message']",2019-02-14,611834,application isnt working i get decline message every time i go to use decline message,2,application int working i get decline message every time i go to use decline message,,,
9105,9105,1,Maps,,"['doe', 'not', 'show', 'road']",2019-02-12,611837,does not show any roads,1,doe not show any road,chandra sekhar Rao,,
9106,9106,1,Maps,,"['navigation', 'be', 'not', 'active']",2019-02-09,611835,navigation is not active,1,navigation is not active,Vinodan. P,,
9108,9108,1,Maps,,"['application', 'be', 'slow']",2019-02-13,611838,the application is too slow,3,the application is too slow,Martina Leonardi,,
9112,9112,1,Maps,,"['hardly', 'work', 'anymore']",2019-02-07,611846,its hardly works anymore,1,its hardly work anymore,Lord Scott,,
