index,Unnamed: 0,Bug_report,appTitle,bug_report,comment,date,id,original_text,score,text,userName,Unnamed: 12,Unnamed: 13
10320,10320,1,Maps,,"['love', 'goole', 'map', 'be', 'not', 'work', 'last', 'update', 'search', 'destiny', 'calculate', 'route', 'choose', 'navigate', 'application', 'shut']",2019-02-04,614965,"i love google maps but it is not working since the last update! i can search for a destiny and calculate the route, but when i choose ""navigate"" the application just shuts down!",1,i love goole map but it is not working since the last update i can search for a destiny and calculate the route but when i choose navigate the application just shuts down,Elena Ni,,
10321,10321,1,Maps,,"['new', 'update', 'application', 'crash', 'time', 'use', 'red', 'professional', 'also', 'try', 'android_auto', 'still', 'android_auto', 'be', 'crash', 'mew', 'update', 'suck', 'resolve', 'issue']",2019-02-04,614966,"this new update application crashes every time, i am using on redmi  professional, i had also tried with android auto but still android auto is crash, this mew update sucks for me, please resolve this issue",1,this new update application crash every time i am using on red professional i had also tried with android auto but still android auto is crash this mew update suck for me please resolve this issue,Ishan Patel,,
10322,10322,1,Maps,,"['everytime', 'application', 'make', 'confused', 'application', 'not', 'work', 'well', 'application', 'show', 'leave', 'right', 'right', 'left', 'road', 'june', 'block', 'close', 'application', 'even', 'show', 'route', 'travel', 'travel', 'agency', 'owner', 'do', 'not', 'recommend', 'application', 'travel', 'business', 'purpose', 'thank']",2019-02-04,614967,everytime this application makes me confused and this application not working well. this application shows left as right and right as left. the roads in pune which are blocked or closed this application even shows me them as an route to travel. being an travel agency owner i do not recommend this application for travel business purpose. thanks,1,everytime this application make me confused and this application not working well this application show left a right and right a left the road in june which are blocked or closed this application even show me them a an route to travel being an travel agency owner i do not recommend this application for travel business purpose thanks,AVINASH143 143143,,
10324,10324,1,Maps,,"['application', 'be', 'extremely', 'slow', 'application', 'take', 'minute', 'fully', 'load', 'try', 'search', 'location', 'business', 'take', 'ridiculous', 'amount', 'time']",2019-02-02,614969,this application is extremely slow. this application can take over a minute to fully load and trying to search for locations and businesses takes a rediculous amount of time.,1,this application is extremely slow this application can take over a minute to fully load and trying to search for location and business take a ridiculous amount of time,Brandon Dutcher,,
10325,10325,1,Maps,,"['update', 'application', 'get', 'unresponsive', 'navigation', 'have', 'try', 'everything', 'clear', 'cachedata', 'restart', 'device', 'clear', 'history', 'have', 'send', 'crash', 'report', 'solution', 'be', 'bug', 'update', 'version', 'rectify', 'update', 'thank']",2019-02-01,614970,"the updated application gets unresponsive on navigation. have tried everything like cleared cache/data, restarted the device, cleared history and have sent crash report as well. no solution. there is some bug in the updated version. please rectify and update. thank you",1,the updated application get unresponsive on navigation have tried everything like cleared cachedata restarted the device cleared history and have sent crash report a well no solution there is some bug in the updated version please rectify and update thank you,manni singh,,
10344,10344,1,Maps,,"['application', 'be', 'show', 'wrong', 'location', 'not', 'show', 'direction']",2019-02-06,615003,application is showing wrong location and not showing directions,1,application is showing wrong location and not showing direction,Gowtham Gowda,,
10345,10345,1,Maps,,"['give', 'bug', 'issue', 'resolve', 'bug', 'issue']",2019-02-06,615004,giving bug issue in map.please resolve bug issue,2,giving bug issue in please resolve bug issue,,,
10346,10346,1,Maps,,"['super', 'slow', 'galaxy', 'edge']",2019-02-05,615006,super slow (galaxy s edge),2,super slow galaxy s edge,,,
10347,10347,1,Maps,,"['application', 'often', 'crash', 'not', 'respond']",2019-02-05,615007,"this application oftenly crash, not responding",2,this application often crash not responding,Keyasa Nugroho,,
10348,10348,1,Maps,,"['waste', 'not', 'show', 'exact_location']",2019-02-01,615009,waste not showing exact location ,1,waste not showing exact location,tharun nandhika,,
10350,10350,1,Maps,,"['goole', 'map', 'be', 'not', 'working_properly', 'goole', 'map', 'be', 'not', 'respond']",2019-02-02,615011,google map is not working properly google map is not responding,2,goole map is not working properly goole map is not responding,,,
10352,10352,1,Maps,,"['location', 'be', 'show', 'different', 'place', 'dint', 'visit', 'day', 'resolve', 'location']",2019-02-01,615013,my location is showing at one different place where i didnt visit there since few days can you please resolve my location.,1,my location is showing at one different place where i dint visit there since few day can you please resolve my location,sandeep karri,,
10355,10355,1,Maps,,"['bug', 'not', 'allow', 'add', 'trip', 'destination', 'not', 'enter', 'text', 'new', 'text', 'box', 'fix']",2019-02-02,615016,bug will not allow me to add another trip / destination. i cannot enter text in the new text box. fix this!,1,bug will not allow me to add another trip destination i can not enter text in the new text box fix this,Jonsin,,
10357,10357,1,Maps,,"['lose', 'signal', 'move', 'alwayslost', 'route', 'solve', 'gps_signal', 'problem']",2019-02-06,615018,gps signal lost every singal move .i alwayslost my route .please solve gps signal problem,1,gps signal lost every signal move i alwayslost my route please solve gps signal problem,Salman446 Khan,,
10358,10358,1,Maps,,"['not', 'able', 'update', 'ap', 'download', 'update', 'error', 'occur']",2019-02-09,615019,"i am not able to update this aap after downloading the update, an error occurs again and again .",3,i am not able to update this ap after downloading the update an error occurs again and again,Hitender Kumar,,
10359,10359,1,Maps,,"['map', 'be', 'not', 'working_properly', 'mi', 'phone', 'use', 'note_professional']",2019-02-06,615020,why map is not working properly in mi phone like i am using note  professional.,1,why map is not working properly in mi phone like i am using note professional,Haseeb Khan,,
10361,10361,1,Maps,,"['last', 'day', 'show', 'wrong', 'route', 'frustrate', 'application']",2019-02-02,615022,from last  days showing only wrong routes. frustrated with this application,1,from last day showing only wrong route frustrated with this application,SHAIK SARFARAZ,,
10362,10362,1,Maps,,"['ever', 'recent', 'update', 'map', 'work']",2019-02-05,615024,ever since the most recent update maps doesnt work at all!,1,ever since the most recent update map doe work at all,,,
10363,10363,1,Maps,,"['bad', 'performance', 'help', 'many', 'time', 'get', 'automatically', 'close']",2019-02-05,615025,very bad performance please help many times it get automatically closed,1,very bad performance please help many time it get automatically closed,SURAJ GUPTA,,
10364,10364,1,Maps,,"['keep_crashe', 'professional', 'even', 'multiple', 'reboot']",2019-02-05,615026,"it keeps crashing in redmi note  professional, even after multiple reboot.",1,it keep crashing in red note professional even after multiple reboot,Nagaraja Poojari,,
10365,10365,1,Maps,,"['application', 'keep', 'hang', 'ever', 'ask', 'direction', 'application', 'doe', 'not', 'give', 'direction']",2019-02-03,615027,my application keep hanging when ever i ask for directions my application does not give directions,1,my application keep hanging when ever i ask for direction my application doe not give direction,Amarshi Bohare,,
10367,10367,1,Maps,,"['navigation', 'issue', 'navigator', 'stop', 'work', 'regularly', 'soon', 'switch', 'map', 'navigator']",2019-02-03,615029,"navigation issues, navigator stops working regularly as soon as i switch from maps to navigator",2,navigation issue navigator stop working regularly a soon a i switch from map to navigator,harsha2585,,
10370,10370,1,Maps,,"['last', 'update', 'be', 'bad', 'bad', 'not', 'navigate', 'place', 'application', 'stop', 'time']",2019-02-01,615032,last update is bad bad i cannot navigate to any place application stopping every time,1,last update is bad bad i can not navigate to any place application stopping every time,mustafa musleh,,
10372,10372,1,Maps,,"['map', 'send', 'circle', 'send', 'everywhere', 'later', 'try', 'show', 'parent', 'bad', 'application', 'be', 'application', 'do', 'not', 'have', 'record', 'putting', 'adresyou', 'have', 'trouble', 'shout', 'aps', 'new', 'update', 'see', 'bug', 'system', 'see', 'application', 'would', 'screw', 'way', 'update', 'instaledso', 'be', 'forth', 'time', 'happen', 'want', 'response', 'apology', 'sloppy', 'work', 'maybe', 'give', 'star']",2019-02-07,615034,"your maps sent me in circles and sent me to everywhere, later on when i was trying to show my parents how bad this application is, this application did not have a record of me putting in the address.you should have trouble shooted the apps new updates to see if there was any bugs in the system or to see if the application would screw up in any way with the updates being installed.so this is the forth time this has happened and i want a response or an apology for this sloppy work, then maybe i will give you three stars or more.",1,your map sent me in circle and sent me to everywhere later on when i was trying to show my parent how bad this application is this application did not have a record of me putting in the adresyou should have trouble shouted the aps new update to see if there was any bug in the system or to see if the application would screw up in any way with the update being instaledso this is the forth time this has happened and i want a response or an apology for this sloppy work then maybe i will give you three star or more,minecraft _fal,,
10373,10373,1,Maps,,"['hang', 'not', 'respond', 'red', 'professional', 'please', 'help']",2019-02-06,615035,hangs and not responding on redmi  professional please help me out,5,hang and not responding on red professional please help me out,anoop raj,,
10374,10374,1,Maps,,"['map', 'not', 'work', 'stopedvery', 'bad', 'continue', 'problem']",2019-02-06,615036,map not working. stopped.very very very very very bad. continue same probelm,1,map not working stopedvery very very very very bad continue same problem,ajay dev rajpan3,,
10375,10375,1,Maps,,"['go', 'map', 'nearly', 'get', 'kiledthis', 'application', 'be', 'garbage']",2019-02-09,615037,thak you goole maps for nearly getting us killed.this application is garbage.,1,that you gone map for nearly getting u kiledthis application is garbage,Jenna Wall-uh-ver,,
10376,10376,1,Maps,,"['update', 'map', 'be', 'not', 'good', 'update', 'map', 'not', 'show', 'location', 'accurately', 'navigation']",2019-02-03,615039,updated maps is not good updated maps not showing location accurately and navigation tooo,1,updated map is not good updated map not showing location accurately and navigation too,yagnesh yagnesh,,
10377,10377,1,Maps,,"['much', 'lag', 'while_navigating', 'be', 'not', 'move', 'even', 'start', 'tripobserve', 'last', 'update', 'be', 'not', 'happy', 'user', 'help', 'even', 'start', 'tripobserve', 'last', 'update']",2019-02-01,615040,"so much of lag while navigating,it is not just moving even if i starts any trip.!observed the same from last update.it is not a happy user experience.kindly help on even if i starts any trip.!observed the same from last update.it.",1,so much of lag while navigating is not just moving even if i start any tripobserved the same from last update is not a happy user experiencekindly help on even if i start any tripobserved the same from last update,,,
10379,10379,1,Maps,,"['have', 'issue', 'use', 'online', 'map', 'application', 'freeze', 'tap', 'start', 'online', 'map']",2019-02-05,615042,having an issue while using offline map. application freezes when tapping start offline map.,2,having an issue while using online map application freeze when tapping start online map,Shariful Islam Sagor,,
10380,10380,1,Maps,,"['much', 'crash', 'not', 'able', 'surfacing', 'issue', 'last', 'update']",2019-02-05,615043,"too much crashing , not able to use,facing this issue from last update",1,too much crashing not able to surfacing this issue from last update,azhar ar,,
10381,10381,1,Maps,,"['suddenly', 'update', 'map', 'suddenly', 'stopped_working']",2019-02-04,615045,suddenly after an update maps has suddenly stopped working,1,suddenly after an update map has suddenly stopped working,Priyanka Nayak,,
10382,10382,1,Maps,,"['last', 'update', 'professional', 'leaf', 'map', 'stick', 'everytime']",2019-02-04,615048,last update in redmi note  professional leaves the map stuck everytime,1,last update in red note professional leaf the map stuck everytime,Bennet Chacko Mathew,,
10384,10384,1,Maps,,"['still', 'map', 'not', 'work', 'have', 'reset', 'phone', 'reboot', 'multiple', 'time', 'select', 'destination', 'automatically', 'get', 'hang']",2019-02-04,615047,"hi still maps not working, i have reset my phone , reboot multiples times but again after selecting destination it automatically got hang",1,hi still map not working i have reset my phone reboot multiple time but again after selecting destination it automatically got hang,VISHAL RAO,,
10385,10385,1,Maps,,"['new', 'update', 'be', 'not', 'much', 'helpful', 'early', 'new', 'update', 'not', 'show', 'exact_location']",2019-02-05,615049,the new update is not much helpfull as erlier . the new update will not show the exact location where we are.,3,the new update is not much helpful a earlier the new update will not show the exact location where we are,Shubham Teli,,
10386,10386,1,Maps,,"['doe', 'not', 'worth', 'excellent', 'show', 'time', 'delay', 'option']",2019-02-02,615050,does not worth excellent ! showing with time delay. no options for a to b.,3,doe not worth excellent showing with time delay no option for a to b,Umer Farook,,
10387,10387,1,Maps,,"['bad', 'experience', 'nothing', 'be', 'work', 'travel', 'km', 'wrong', 'showing']",2019-02-03,615051,very worst experience nothing is working and i travel more and more km for wronv sbowinb,1,very worst experience nothing is working and i travel more and more km for wrong showing,PA1 PANDA,,
10389,10389,1,Maps,,"['bad', 'useless', 'insanely', 'inaccurate', 'map', 'grotesquely', 'incompetent', 'routing']",2019-02-01,615053,worse than useless. insanely inaccurate maps and grotesquely incompetent routeing,1,worse than useless insanely inaccurate map and grotesquely incompetent routing,,,
10391,10391,1,Maps,,"['cause', 'many', 'trouble', 'drive', 'be', 'not', 'accurate']",2019-02-01,615055,it causes many trubles to me when driving because it is not accurate.,1,it cause many trouble to me when driving because it is not accurate,grandaizer KSA,,
10392,10392,1,Maps,,"['add', 'stop', 'be', 'not', 'work', 'not', 'type', 'field', 'avid', 'user', 'particular', 'feature', 'do', 'lot', 'drive', 'work', 'please_fix', 'soon_possible']",2019-02-05,615056,the 'add a stop' is not working! you can not type in the field. i am an avid user of this particular feature because i do a lot of driving for work! please fix as soon as possible,4,the add a stop is not working you can not type in the field i am an avid user of this particular feature because i do a lot of driving for work please fix a soon a possible,Malinda NL,,
10394,10394,1,Maps,,"['star', 'older_version', 'hate', 'remove', 'keep', 'map', 'face', 'north', 'button', 'main', 'navigation', 'map', 'usually', 'switch', 'complicated', 'road', 'junction', 'better', 'understand', 'turn', 'especially', 'gps', 'lag', 'have', 'open', 'navigation', 'menu', 'scroll', 'way', 'find', 'switch', 'while_driving', 'people', 'not', 'use', 'search', 'button', 'type', 'people', 'search', 'people', 'drive', 'think', 'replace', 'search', 'button', 'face', 'north', 'button']",2019-02-02,615058," star for older version. i hate that they remove the 'keep map facing north' button from the main navigation map. i usually switch between it in complicated road junctions to better understand where i should turn to, especially when the gps lags. now i have to open the navigation menu and scroll way down to find that switch, all while i am driving? people will not use the search button and type what people are searching when people are driving. so i think you should replace the search button with the face north button.",3,star for older version i hate that they remove the keep map facing north button from the main navigation map i usually switch between it in complicated road junction to better understand where i should turn to especially when the gps lag now i have to open the navigation menu and scroll way down to find that switch all while i am driving people will not use the search button and type what people are searching when people are driving so i think you should replace the search button with the face north button,jeffrey kordius,,
10395,10395,1,Maps,,"['happen', 'good', 'map', 'application', 'constantly', 'use', 'would', 'prefer', 'aps', 'feature', 'ease', 'use', 'recent', 'update', 'make', 'unusable', 'hang', 'download', 'application', 'use', 'map', 'work', 'soon_possible', 'hate', 'use', 'application']",2019-02-01,615059,"what happened? this was like the best map application that i constantly use or would prefer over other apps because of this features and ease of use. but the recent update made this unusable, this just hangs up. i had to download another application since i use maps for work. please fix as soon as possible. (i hate using the other application)",2,what happened this was like the best map application that i constantly use or would prefer over other aps because of this feature and ease of use but the recent update made this unusable this just hang up i had to download another application since i use map for work please fix a soon a possible i hate using the other application,Viktor Inno,,
10396,10396,1,Maps,,"['update', 'update', 'description', 'provide', 'update', 'already', 'do', 'one', 'today', 'be', 'wrong']",2019-02-10,615060,"updated  days ago, now another update with the same description provided for the update already done. and another one today! what is wrong?",1,updated day ago now another update with the same description provided for the update already done and another one today what is wrong,Dietrich Vivier,,
10398,10398,1,Maps,,"['week', 'goole', 'map', 'phone', 'keep_stopping', 'press', 'navigate', 'show', 'not', 'respond', 'page', 'often', 'have', 'try', 'everything', 'side', 'solve', 'use', 'have', 'report', 'problem', 'several', 'time', 'response', 'team', 'help', 'solve', 'issue']",2019-02-06,615062,from few weeks google maps in my phone keeps stopping once i press navigate. it shows not responding page very often. i have tried everything from my side to solve this but no use. i have reported this problem several times but no response from the team. please help me solve this issue.,1,from few week goole map in my phone keep stopping once i press navigate it show not responding page very often i have tried everything from my side to solve this but no use i have reported this problem several time but no response from the team please help me solve this issue,PUNITH K R,,
10399,10399,1,Maps,,"['truly', 'sorry', 'application', 'stop', 'edit', 'address', 'say', 'do', 'not', 'mean', 'also', 'add', 'trip', 'option', 'stopped_working', 'entirely']",2019-02-06,615063,"truly sorry application. stop editing my addresses. if i say , i do not mean - etc. also, why has the add a trip option stopped working entirely?",1,truly sorry application stop editing my address if i say i do not mean etc also why has the add a trip option stopped working entirely,Matt Massey,,
10401,10401,1,Maps,,"['know', 'city', 'application', 'be', 'not', 'smart', 'application', 'mostly', 'calculate', 'strange', 'route', 'far', 'longer', 'indirect', 'compare', 'human', 'would', 'decide', 'also', 'street', 'build', 'still', 'doe', 'not', 'show', 'map', 'shame', 'use', 'like', 'goole', 'turn', 'like', 'goole', 'evil', 'be', 'different', 'story', 'altogether']",2019-02-08,615067,"i know my city well and this application is not very smart at all. this application mostly calculates strange routes, far longer and indirect compared to what a human would decide upon. also, my street was built  years ago and still does not show on maps. what a shame. i used to like google, turns out to like google are evil. but that is a different story altogether.",1,i know my city well and this application is not very smart at all this application mostly calculates strange route far longer and indirect compared to what a human would decide upon also my street was built year ago and still doe not show on map what a shame i used to like goole turn out to like goole are evil but that is a different story altogether,,,
10402,10402,1,Maps,,"['rubbish', 'use', 'good', 'getting_worse', 'update', 'notification', 'keep', 'pop', 'cover', 'map', 'start', 'navigation', 'not', 'disable', 'ridiculous', 'route', 'always', 'lead', 'busy', 'route', 'tell', 'make', 'impossible', 'youturn']",2019-02-02,615065,"rubbish! used to be good but getting worse after each updates. notifications keep popping up and covering the map when starting the navigation, but cannot be disable. ridiculous routes, always lead me to the busiest routes then tell me to make impossible you-turns.",1,rubbish used to be good but getting worse after each update notification keep popping up and covering the map when starting the navigation but can not be disable ridiculous route always lead me to the busiest route then tell me to make impossible youturns,Ivan Wu,,
10403,10403,1,Maps,,"['never', 'point', 'right', 'direction', 'fact', 'often', 'tell', 'go', 'exact', 'opposite', 'direction', 'destination', 'attempt', 'use', 'subway', 'list', 'wrong', 'train', 'fail', 'mention', 'stop', 'train', 'other', 'use', 'stop', 'train', 'other', 'always', 'late', 'edit', 'last', 'update', 'map', 'be', 'not', 'even', 'visible', 'anymore', 'blank', 'screen', 'goole', 'map', 'map']",2019-02-04,615066,"it never has me pointed in the right direction. in fact, it often tells me to go the exact opposite direction of my destination! when attempting to use the subway, it lists the wrong trains and fails to mention that there are more stops on some trains than others! using there are more stops on some trains than others, i am always very late! edit since this last update, the map is not even visible anymore. just a blank screen. now you are google maps without any maps?",1,it never has me pointed in the right direction in fact it often tell me to go the exact opposite direction of my destination when attempting to use the subway it list the wrong train and fails to mention that there are more stop on some train than others using there are more stop on some train than others i am always very late edit since this last update the map is not even visible anymore just a blank screen now you are goole map without any map,Silversorcerer,,
10404,10404,1,Maps,,"['be', 'wrong', 'application', 'application', 'be', 'get', 'stick', 'againwhenever', 'try', 'fine', 'place', 'set', 'destination', 'application', 'hang', 'show', 'application', 'be', 'not', 'respond', 'solve', 'issue', 'would', 'rate', 'issue', 'star']",2019-02-04,615068,"what is wrong with the application? the application is getting stuck again and again,whenever i try to fine any place or set destination my application hangs and shows application is not responding! please solve this issue and i would rate this issue with  stars again",1,what is wrong with the application the application is getting stuck again and againwhenever i try to fine any place or set destination my application hang and show application is not responding please solve this issue and i would rate this issue with star again,divya agarwal,,
10405,10405,1,Maps,,"['horrible', 'update', 'navigation', 'be', 'get', 'lag', 'phone', 'not', 'able', 'use', 'navigation', 'phone', 'not', 'go', 'place', 'alone', 'do', 'not', 'know', 'route', 'pathetic']",2019-02-04,615069,horrible after update. the navigation is getting lagged on my phone. i am not able to use navigation on my phone. cannot go to any places alone if i do not know the routes. pathetic!,1,horrible after update the navigation is getting lagged on my phone i am not able to use navigation on my phone can not go to any place alone if i do not know the route pathetic,Arun Raju,,
