index,Unnamed: 0,Bug_report,appTitle,bug_report,comment,date,id,original_text,score,text,userName,Unnamed: 12,Unnamed: 13
8302,8302,1,Maps,,"['update', 'issue', 'be', 'fix', 'thank', 'great', 'application', 'use', 'great', 'application', 'daily', 'online', 'mode', 'could', 'tweed', 'bit', 'even_though', 'keep', 'download', 'map', 'update', 'great', 'application', 'still', 'require', 'go', 'online', 'find', 'place', 'go', 'online', 'fantastic', 'application', 'late', 'update', 'be', 'not', 'work', 'soon', 'open', 'map', 'late', 'update', 'shut', 'fantastic', 'application', 'return', 'home_screen', 'instal', 'late', 'update', 'instal', 'update', 'work', 'perfectly', 'love', 'instal', 'update', 'new', 'update', 'please_fix']",2019-02-11,610331,"update issue has been fixed, thank you! great application and i use great application daily. just the offline mode could be tweeked a bit even though i keep my downloaded maps updated great application still requires me to go online to find a place then go offline again. other than that, a fantastic application. this latest update is not working, as soon as i open maps this latest update shuts other than that, a fantastic application down and i am returned to home screen. if i uninstall this latest update i uninstall the update works perfectly and i love i uninstall the update. just this new update please fix ver ..",5,update issue has been fixed thank you great application and i use great application daily just the online mode could be tweed a bit even though i keep my downloaded map updated great application still requires me to go online to find a place then go online again other than that a fantastic application this latest update is not working a soon a i open map this latest update shuts other than that a fantastic application down and i am returned to home screen if i instal this latest update i instal the update work perfectly and i love i instal the update just this new update please fix ver,Raman Baaliah,,
8303,8303,1,Maps,,"['remove', 'option', 'quickly', 'orient', 'map', 'north', 'option', 'quickly', 'orient', 'map', 'north', 'be', 'bury', 'option', 'use', 'application', 'dozen', 'time', 'day', 'navigate', 'work', 'orient', 'north', 'demand', 'something', 'use', 'nearly', 'time', 'use', 'application', 'way', 'do', 'exactly', 'seem', 'intend', 'finding', 'bearing', 'phone', 'not', 'orient', 'enough', 'know', 'way', 'move', 'thus', 'prevent', 'auto', 'orientation', 'properly', 'line', 'save', 'dozen', 'minute', 'day', 'hour', 'week', 'fix']",2019-02-12,610332,"they removed the option to quickly orient the map north. now the option to quickly orient the map north is buried in the options. i use this application dozens of times a day to navigate for work, and orienting north on demand was something i used nearly every time i used the application, as a way to do exactly what it seemed to be intended for, finding bearings when my phone was not oriented enough to know which way it was moving, thus preventing the auto orientation from properly lining up. this saved me dozens of minutes a day, and hours a week. fix",1,they removed the option to quickly orient the map north now the option to quickly orient the map north is buried in the option i use this application dozen of time a day to navigate for work and orienting north on demand was something i used nearly every time i used the application a a way to do exactly what it seemed to be intended for finding bearing when my phone was not oriented enough to know which way it was moving thus preventing the auto orientation from properly lining up this saved me dozen of minute a day and hour a week fix,Mitchell Ensley,,
8305,8305,1,Maps,,"['tideline', 'doe', 'not', 'work', 'hawes', 'professional', 'even', 'use', 'navigation', 'follow', 'route', 'phone', 'be', 'gps', 'definitely', 'know', 'doe', 'not', 'get', 'record', 'have', 'location', 'sharingtimeline', 'set', 'turn', 'also', 'give', 'option', 'select', 'method', 'public_transport', 'bus', 'train', 'prefer', 'method', 'doe', 'not', 'achieve', 'travel', 'specific', 'agencytransport', 'provider', 'would', 'really', 'useful', 'citymaper', 'doe', 'thing']",2019-02-11,610333,"timeline does not work with huawei p professional. even if i use navigation and follow a route, so my phone is gps definitely knows where i am, it just does not get recorded. i have all location sharing/timeline settings turned on. also please give us the option of selecting only one method of public transport ie bus or train? 'preferred method' does not achieve this. travel via a specific 'agency'/transport provider would be really useful too. citymapper does both of these things.",1,tideline doe not work with hawes p professional even if i use navigation and follow a route so my phone is gps definitely know where i am it just doe not get recorded i have all location sharingtimeline setting turned on also please give u the option of selecting only one method of public transport ie bus or train preferred method doe not achieve this travel via a specific agencytransport provider would be really useful too citymaper doe both of these thing,Claire Wilkinson,,
8306,8306,1,Maps,,"['use', 'provide', 'star', 'review', 'map', 'late', 'be', 'do', 'thing', 'be', 'really', 'get', 'nerve', 'get', 'feature', 'be', 'identify', 'have', 'be', 'ask', 'review', 'say', 'place', 'map', 'get', 'wrong', 'sometimes', 'be', 'cool', 'wrong', 'even', 'give', 'option', 'say', 'have', 'not', 'be', 'be', 'not', 'cool', 'be', 'map', 'repeatedly', 'ask', 'review', 'place', 'have', 'repeatedly', 'tell', 'wrong', 'have', 'not', 'be', 'fix', 'rating', 'improve']",2019-02-09,610338,"i used to provide a -star review for maps, but of late, it is doing one thing that is really getting on my nerves. i get that one of the features is to identify where i have been, and then ask me to review said place. maps gets this wrong sometimes, and that is cool too. this wrong even gives you the option to say ""i have not been there"". but what is not cool is maps repeatedly asking for reviews of places i have repeatedly told this wrong i have not been to. fix this, and the rating improves again.",2,i used to provide a star review for map but of late it is doing one thing that is really getting on my nerve i get that one of the feature is to identify where i have been and then ask me to review said place map get this wrong sometimes and that is cool too this wrong even give you the option to say i have not been there but what is not cool is map repeatedly asking for review of place i have repeatedly told this wrong i have not been to fix this and the rating improves again,A Google User,,
8307,8307,1,Maps,,"['galaxy', 'go', 'completely', 'mute', 'listening', 'music', 'samsung', 'music', 'application', 'connection', 'car', 'stereo', 'navigating', 'use', 'goole', 'map', 'sometimes', 'get', 'sound', 'back', 'hold', 'volume', 'nav', 'voice', 'be', 'speak', 'usually', 'have', 'exit', 'samsung', 'music', 'application', 'entirely', 'nobody', 'seem', 'know', 'fix']",2019-02-12,610335,"my galaxy s+ will go completely mute when listening to music through the samsung music application through the aux connection to my car stereo, and navigating using google maps. i can sometimes get sound back by holding volume up if the nav voice is speaking, but usually i have to exit the samsung music application entirely. nobody seems to know how to fix this.",1,my galaxy s will go completely mute when listening to music through the samsung music application through the aux connection to my car stereo and navigating using goole map i can sometimes get sound back by holding volume up if the nav voice is speaking but usually i have to exit the samsung music application entirely nobody seems to know how to fix this,Alex Musa,,
8308,8308,1,Maps,,"['soon', 'open', 'application', 'application', 'show', 'blue_dot', 'location', 'cone', 'show', 'heading', 'application', 'know', 'way', 'face', 'get', 'walk', 'direction', 'show', 'right', 'away', 'direction', 'face', 'drive', 'mode', 'not', 'show', 'direction', 'head', 'block', 'be', 'design', 'choice', 'application', 'be', 'hide', 'head', 'info', 'point', 'need', 'application', 'poorly', 'do']",2019-02-11,610340,"as soon as i open the application, the application shows the blue dot of my location and a cone showing my heading. so the application knows which way i am facing. if i get walking directions, same it shows *right away* which direction i am facing. but in drive mode, it *will not* show the direction i am heading until after about  blocks. this is a design choice. the application is hiding my heading info at the point where i need the application most. very poorly done.",1,a soon a i open the application the application show the blue dot of my location and a cone showing my heading so the application know which way i am facing if i get walking direction same it show right away which direction i am facing but in drive mode it will not show the direction i am heading until after about block this is a design choice the application is hiding my heading info at the point where i need the application most very poorly done,A Google User,,
8309,8309,1,Maps,,"['while_driving', 'route', 'be', 'fix', 'route', 'doe', 'not', 'show', 'alternate', 'route', 'be', 'big', 'problem', 'mumbaiwhem', 'take', 'alternate', 'route', 'route', 'keep', 'ask', 'take', 'turn', 'have', 'go', 'back', 'select', 'destination', 'show', 'correct', 'one', 'recently', 'also', 'note', 'show', 'farth', 'road', 'take', 'journey', 'be', 'way', 'could', 'give', 'feedback', 'application', 'route', 'lack', 'function', 'rest', 'be', 'ok']",2019-02-10,610337,while driving once the route is fixed the route does not show the alternate route which is a big problem here in mumbai.whem i am taking the alternate route the route keeps asking to take you turn again and again .i have to go back select the destination again and then shows the correct one. recently also noted that its showing the farthest roads to take journey. there is no way we couls give feedback kn the application since the route lacks function . rest is ok,3,while driving once the route is fixed the route doe not show the alternate route which is a big problem here in mumbaiwhem i am taking the alternate route the route keep asking to take you turn again and again i have to go back select the destination again and then show the correct one recently also noted that its showing the farthest road to take journey there is no way we could give feedback kn the application since the route lack function rest is ok,Sumit Hegde,,
8310,8310,1,Maps,,"['huge', 'fan', 'goole', 'map', 'like', 'application', 'use', 'application', 'half', 'decade', 'goole', 'map', 'impressively', 'smart', 'route', 'accurate', 'effective', 'unfortunately', 'update', 'goole', 'map', 'somewhere', 'end', 'perspective', 'goole', 'map', 'completely', 'change', 'perspective', 'goole', 'map', 'bad', 'update', 'ever', 'start', 'use', 'goole', 'map', 'perspective', 'goole', 'map', 'become', 'unreliable', 'wrong', 'route', 'perspective', 'goole', 'map', 'way', 'suck', 'walk', 'please_fix', 'issue', 'thank']",2019-02-13,610339,"i am a huge fan of google maps. i liked this application and using this application for more than half decade. google maps was impressively smart at suggesting/indicating routes (accurate and effective)! unfortunately, after updated google maps (somewhere around end of ) my perspective on google maps was completely changed. my perspective on google maps was worst update ever since i started using google maps. my perspective on google maps became unreliably wrong at suggesting/indicating routes! my perspective on google maps way more sucks when walking! please fix the issues! thanks!",1,i am a huge fan of goole map i liked this application and using this application for more than half decade goole map was impressively smart at sugestingindicating route accurate and effective unfortunately after updated goole map somewhere around end of my perspective on goole map was completely changed my perspective on goole map was worst update ever since i started using goole map my perspective on goole map became unreliable wrong at sugestingindicating route my perspective on goole map way more suck when walking please fix the issue thanks,Infini T,,
8312,8312,1,Maps,,"['use', 'like', 'application', 'ever', 'application', 'get', 'lose', 'hate', 'glad', 'actually', 'have', 'good', 'sense', 'direction', 'would', 'be', 'strand', 'update', 'get', 'lose', 'goole', 'map', 'crappy', 'direction', 'enter', 'everything', 'possible', 'address', 'city', 'state', 'zip', 'application', 'still', 'manage', 'get', 'lose', 'update', 'route', 'especially', 'la', 'vega', 'nv', 'be', 'mad', 'construction', 'go', 'lot', 'confusion']",2019-02-15,610342,"i used to like this application but ever since this application got me lost, i hate. i am so glad that i actually have a good sense of direction or i would had been stranded. update! i got lost. again, because or google maps crappy directions. i entered everything possible, the address, city, state, and zip and this application still managed to get me lost! please update your routes especially in las vegas nv, there is mad construction going on and a lot of confusion",1,i used to like this application but ever since this application got me lost i hate i am so glad that i actually have a good sense of direction or i would had been stranded update i got lost again because or goole map crappy direction i entered everything possible the address city state and zip and this application still managed to get me lost please update your route especially in la vega nv there is mad construction going on and a lot of confusion,Crystal Olumba,,
8314,8314,1,Maps,,"['use', 'great', 'gps', 'navigation', 'application', 'tell', 'wrong_direction', 'turn', 'thruway', 'field', 'oncome', 'traffic', 'seriously', 'need', 'fix', 'glitch', 'believe', 'start', 'new', 'update', 'not', 'be', 'long', 'couple', 'week', 'maybe']",2019-02-14,610344,"this used to be a great gps navigation application. now this tells me wrong directions and to turn off the thruway into a field or towards oncoming traffic. seriously need to fix the glitches. believe this started after the new update, has not been long a couple of weeks maybe at most",2,this used to be a great gps navigation application now this tell me wrong direction and to turn off the thruway into a field or towards oncoming traffic seriously need to fix the glitch believe this started after the new update has not been long a couple of week maybe at most,Cassie Majecki,,
8318,8318,1,Maps,,"['use', 'application', 'rarely', 'always', 'prefer', 'wave', 'application', 'be', 'much', 'accurate', 'stable', 'time', 'brief', 'couple', 'drawback', 'goole', 'map', 'take', 'minimum', 'minute', 'show', 'exact', 'route', 'wave', 'be', 'fast', 'time', 'goole', 'map', 'take', 'garage', 'actual', 'destination', 'back', 'side', 'home', 'normally', 'not', 'front', 'door', 'goole', 'map', 'not', 'provide', 'accurate', 'route', 'private', 'road', 'road', 'parking', 'lot', 'shopping', 'mall']",2019-02-09,610349,"i am using this application very rarely. i am always preferring waze, this application is much accurate and stable all the times. i can brief couple of drawbacks of google maps. . it will take minimum  minutes to show the exact route (waze is too fast) .most of the times google maps take us to garage of the actual destination ( back side of homes normally) not to front door. . google maps cannot provide accurate route on private road or roads inside any parking lot / shopping malls",2,i am using this application very rarely i am always preferring wave this application is much accurate and stable all the time i can brief couple of drawback of goole map it will take minimum minute to show the exact route wave is too fast most of the time goole map take u to garage of the actual destination back side of home normally not to front door goole map can not provide accurate route on private road or road inside any parking lot shopping mall,Byju PV,,
8319,8319,1,Maps,,"['update', 'compass', 'be', 'finally', 'well', 'work', 'application', 'not', 'able', 'tell', 'navigation', 'direction', 'navigation', 'application', 'be', 'unacceptable', 'have', 'navigate', 'layer', 'deep', 'keep', 'map', 'north', 'be', 'not', 'appropriate', 'option', 'also', 'be', 'frequently', 'temporarily', 'lose', 'direction', 'navigation', 'please_fix', 'issue']",2019-02-07,610350,"since update, compass disappeared--what is up with that was finally a well working application. not being able to tell navigation direction in a navigation application is unacceptable. having to navigate three layers deep to keep the map with north up is not an appropriate option. also, has been frequently temporarily ""losing"" its direction during navigation. please fix the issues.",3,since update compass disapearedwhat is up with that was finally a well working application not being able to tell navigation direction in a navigation application is unacceptable having to navigate three layer deep to keep the map with north up is not an appropriate option also has been frequently temporarily losing its direction during navigation please fix the issue,Jason Brookman,,
8320,8320,1,Maps,,"['would', 'give', 'application', 'negative', 'star', 'could', 'rely', 'application', 'get', 'big', 'trouble', 'car', 'turn', 'non', 'existent', 'road', 'drive', 'bad', 'traffic', 'take', 'long', 'time', 'consume', 'route', 'get', 'place', 'use', 'bus', 'route', 'take', 'bus', 'leave', 'minute', 'wait', 'hour', 'bus', 'come', 'minute', 'well', 'direct', 'wait', 'bus', 'place', 'bus', 'come']",2019-02-17,610351,"i would give this application negative stars if i could. if you rely on this application to get around, you are in big trouble. in a car it has me turning down non existent roads, driving through the worst traffic, and taking the longest, most time consuming routes to get places. using bus routes it has me taking buses that left  minutes ago and waiting for hours on a bus that comes every  minutes as well as directing me to wait for buses in places no buses come!",1,i would give this application negative star if i could if you rely on this application to get around you are in big trouble in a car it has me turning down non existent road driving through the worst traffic and taking the longest most time consuming route to get place using bus route it has me taking bus that left minute ago and waiting for hour on a bus that come every minute a well a directing me to wait for bus in place no bus come,Dale Parker,,
8321,8321,1,Maps,,"['terrible', 'update', 'long', 'view', 'bus', 'route', 'map', 'instead', 'show', 'list', 'street', 'stop', 'visual', 'person', 'nee', 'map', 'know', 'street', 'neighbourhood', 'shopping', 'center']",2019-02-08,610352,terrible update i can no longer view the bus route on the map instead it will now only show me a list of all the streets the stops are at! i am a visual person i need the map so i know what streets are neighborhoods and which are shopping centers ),1,terrible update i can no longer view the bus route on the map instead it will now only show me a list of all the street the stop are at i am a visual person i need the map so i know what street are neighbourhood and which are shopping center,Marcy D.,,
8322,8322,1,Maps,,"['update', 'time', 'open', 'application', 'show', 'incorrect', 'location', 'cab', 'aggregate', 'use', 'pickup', 'drop', 'pinning', 'base', 'twitt', 'numerous', 'feedback', 'blue_dot', 'issue', 'have', 'be', 'submit', 'location', 'accuracy', 'doe', 'not', 'improve', 'moreover', 'be', 'direct', 'email', 'would', 'goole', 'goglemap', 'approach', 'screenshot', 'satellite', 'view', 'issue', 'convey', 'actual', 'satellite', 'imagery', 'do', 'easily']",2019-02-10,610353,"after every update and each time i open this application , it shows incorrect location. cab aggregators use the pick-up and drop pinning based on this. on twitter and numerous feedbacks through blue dot issues have been submitted but the location accuracy does not improve. moreover , there is no direct email id of google or google-maps and all ; that can be approached with the screenshots of the satellite view so that the issue can be conveyed. through the actual satellite imagery, this can be done easily.",2,after every update and each time i open this application it show incorrect location cab aggregate use the pickup and drop pinning based on this on twitter and numerous feedback through blue dot issue have been submitted but the location accuracy doe not improve moreover there is no direct email id of goole or goglemaps and all that can be approached with the screenshots of the satellite view so that the issue can be conveyed through the actual satellite imagery this can be done easily,,,
8323,8323,1,Maps,,"['good', 'last', 'month', 'have', 'problem', 'start', 'navigation', 'while', 'have', 'rotate', 'mobile', 'view', 'navigate', 'properly', 'someone', 'say', 'shake', 'mobile', 'fine', 'nothing', 'happen', 'guy', 'fix', 'issue']",2019-02-13,610354,"its good but from last  months, i am having problem that when i start navigation, after a while i have to rotate my mobile again and again to view navigate properly. someone said that shake my mobile, it will be fine but nothing happened. can you guys fix this issue.",3,its good but from last month i am having problem that when i start navigation after a while i have to rotate my mobile again and again to view navigate properly someone said that shake my mobile it will be fine but nothing happened can you guy fix this issue,Xaibi Aslam,,
8326,8326,1,Maps,,"['load', 'rubbish', 'motorcycle', 'option', 'australia', 'yet', 'motorcycle', 'option', 'australia', 'help', 'section', 'mention', 'help', 'section', 'be', 'completely', 'wrong', 'not', 'drag', 'change', 'route', 'drag', 'change', 'pc', 'send', 'pc', 'phone', 'pc', 'send', 'route', 'modification', 'pretty', 'much', 'useless', 'planning', 'motorcycle', 'ride']",2019-02-05,610357,"what a load of rubbish. no motorcycle option in australia. yet no motorcycle option in australia help section mentions their help section and is completely wrong. cannot drag a change to your route. when i drag a change on my pc and send my pc to my phone, my pc sends your route without the modifications. pretty much useless for planning a motorcycle ride.",2,what a load of rubbish no motorcycle option in australia yet no motorcycle option in australia help section mention their help section and is completely wrong can not drag a change to your route when i drag a change on my pc and send my pc to my phone my pc sends your route without the modification pretty much useless for planning a motorcycle ride,Alan Lovett,,
8327,8327,1,Maps,,"['not', 'mark', 'place', 'dislike', 'exclude', 'future', 'search', 'keep', 'change', 'default', 'view', 'public_transport', 'road', 'traffic', 'not', 'see', 'review', 'character', 'length', 'scroll', 'review', 'find', 'review', 'be', 'nightmare', 'unstable', 'crashed', 'show', 'star', 'city']",2019-02-16,610358,cannot mark places i dislike and exclude them from future searches. keeps changing my default view from public transport to road traffic. i cannot see whih one of my reviews are below  character length. scrolling through + reviews to find my reviews is a nightmare. unstable and crashed when you show  stars in a city.,1,can not mark place i dislike and exclude them from future search keep changing my default view from public transport to road traffic i can not see which one of my review are below character length scrolling through review to find my review is a nightmare unstable and crashed when you show star in a city,,,
8328,8328,1,Maps,,"['horribly', 'lie', 'unresponsive', 'application', 'be', 'useful', 'application', 'work', 'time', 'use', 'application', 'be', 'spend', 'wait', 'application', 'work', 'regularly', 'take', 'minute', 'load', 'place', 'direction', 'even', 'good', 'internet', 'issue', 'multiple', 'phone', 'have', 'use', 'application', 'issue', 'multiple', 'phone', 'have', 'use', 'worsened', 'year']",2019-02-11,610359,"horribly laggy and unresponsive. the application is very useful, when the application works. most of the time i am using the application is spent waiting for the application to work. regularly takes minutes to load a place or directions, even with good internet. has the same issue on multiple phones i have used the application on, and the same issue on multiple phones i have used it on has only worsened over the years.",1,horribly lay and unresponsive the application is very useful when the application work most of the time i am using the application is spent waiting for the application to work regularly take minute to load a place or direction even with good internet has the same issue on multiple phone i have used the application on and the same issue on multiple phone i have used it on has only worsened over the year,,,
8345,8345,1,Maps,,"['map', 'long', 'rotate', 'follow', 'direction', 'make', 'map', 'confuse', 'dangerous', 'map', 'hard', 'time', 'figure', 'often', 'start', 'block', 'mile', 'actually', 'also', 'constantly', 'route', 'sit', 'long', 'light', 'be', 'often', 'seattle']",2019-02-09,610486,"the map no longer rotates to follow your direction, making the map confusing and dangerous. the map has a hard time figuring out where i am, often starting me out blocks or miles from where i actually am. also constantly reroutes when i sit too long at a light, which is often in seattle.",1,the map no longer rotates to follow your direction making the map confusing and dangerous the map has a hard time figuring out where i am often starting me out block or mile from where i actually am also constantly route when i sit too long at a light which is often in seattle,Jodi Bonner,,
